Address,Amount,CPF ID,City,City Names,Contributor,County Names,Date,Datetime,Employer,Occupation,Principal Officer,Recipient,Record Type Description,Record Type ID,Source Description,State,Tender Type Description,Tender Type ID,UUID,Zip,Zip Codes,Matching Names
63 Holden Street,70.0,16045,New Bedford,New Bedford,"Cotter, Christopher",Bristol County,8/19/2015,2015-08-19,City of New Bedford,Police Officer,,"Abreu, Ian",Individual,201,8/19/15 Deposit Report,MA,Check,1,f2c79c4a-f333-57e5-817d-266eaa600e34,02740,02740,Ian Abreu
86 Campbell St,100.0,16045,New Bedford,New Bedford,"Fernandes, Joshua",Bristol County,9/29/2015,2015-09-29,New Bedford Police Dept.,Police Officer,,"Abreu, Ian",Individual,201,9/29/15 Deposit Report,MA,Check,1,1c85246b-8b52-5dde-b2c2-a15c6c2bb07b,02740,02740,Ian Abreu
36 Barker St,100.0,16045,North Dartmouth,North Dartmouth,"Taveira, Carlos",Bristol County,10/28/2016,2016-10-28,City of New Bedford,Police Detective,,"Abreu, Ian",Individual,201,10/28/16 Deposit Report,MA,Check,1,9b24ea0b-b22f-5ea5-bba4-e8f6e2293106,02747,02747,Ian Abreu
61 Durfee St,100.0,16045,New Bedford,New Bedford,"Hogan, Timothy",Bristol County,10/30/2016,2016-10-30,City of New Bedford,Police Officer,,"Abreu, Ian",Individual,201,10/30/16 Deposit Report,MA,Check,1,d8d72684-9cc5-5a8e-aa1e-28f9799a63e6,02740,02740,Ian Abreu
61 Durfee Street,60.0,16045,New Bedford,New Bedford,"Hogan, Timothy",Bristol County,5/8/2017,2017-05-08,City of New Bedford,Police Officer,,"Abreu, Ian",Individual,201,5/8/17 Deposit Report,MA,Check,1,b7d3aa4d-f3b2-5143-b346-82ded728c852,02740,02740,Ian Abreu
61 Durfee St,100.0,16045,New Bedford,New Bedford,"Hogan, Timothy",Bristol County,10/19/2017,2017-10-19,City of New Bedford,Police Officer,,"Abreu, Ian",Individual,201,10/19/17 Deposit Report,MA,Check,1,bc889007-8b55-5dfa-b2fc-aa7054199199,02740,02740,Ian Abreu
15 Templeton St,100.0,16045,New Bedford,New Bedford,"Fisher, Leanne & Earl",Bristol County,10/23/2017,2017-10-23,New Bedford Police Dept.,Police Officer,,"Abreu, Ian",Individual,201,10/23/17 Deposit Report,MA,Cash,6,7fbb8bc2-f084-5373-ad05-ba0d18537829,02740,02740,Ian Abreu
61 Durfee St,80.0,16045,New Bedford,New Bedford,"Hogan, Timothy",Bristol County,3/26/2018,2018-03-26,City of New Bedford,Police Officer,,"Abreu, Ian",Individual,201,3/26/18 Deposit Report,MA,Check,1,04e5eb8c-0d3e-5b7e-940a-83ac72fcc283,02740,02740,Ian Abreu
244 Leonard St.,40.0,16045,Acushnet,Acushnet,"Roderigues, Matthew",Bristol County,5/10/2019,2019-05-10,City of New Bedford,Police Officer,,"Abreu, Ian",Individual,201,5/10/19 Deposit Report,MA,Cash,6,71e86148-7331-5b58-8d3f-491998a21d8d,02743,02743,Ian Abreu
61 Durfee Street,50.0,16045,New Bedford,New Bedford,"Hogan, Timothy",Bristol County,5/20/2019,2019-05-20,City of New Bedford,Police Officer,,"Abreu, Ian",Individual,201,5/20/19 Deposit Report,MA,Cash,6,5cc71952-a73d-5d94-909b-022f857eca8d,02740,02740,Ian Abreu
61 Durfee Street,50.0,16045,New Bedford,New Bedford,"Hogan, Timothy",Bristol County,9/7/2019,2019-09-07,City of New Bedford,Police Officer,,"Abreu, Ian",Individual,201,9/7/19 Deposit Report,MA,Check,1,f6d320ba-11b9-59cf-b7d0-0920d7289aa7,02740,02740,Ian Abreu
93 Fort Street,50.0,16045,Fairhaven,Fairhaven,"Hunt, Timothy",Bristol County,10/24/2016,2016-10-24,MSP,Trooper,,"Abreu, Ian",Individual,201,10/24/16 Deposit Report,MA,Check,1,f8d8d11c-96e9-5041-9629-a5bd0b76159b,02719,02719,Ian Abreu
1299 Page Blvd.,200.0,12878,Springfield,Springfield,IBPO Local 364,Hampden County,8/22/2012,2012-08-22,,Police Union,,"Albano, Michael J.",Individual,201,8/22/12 Deposit Report,MA,Check,1,ba6a3a19-372f-5974-a1a0-6dbb7c720d3d,01104,01104,Michael Albano
38 Winthrop Street,100.0,12878,Charlestown,Charlestown,"Garvey, Robert",Suffolk County,8/15/2016,2016-08-15,Hampshire County Sheriff's Office,Sheriff,,"Albano, Michael J.",Individual,201,8/15/16 Deposit Report,MA,Check,1,02d8fe03-fd4f-53a8-a0f6-e68b5314e590,02129,02129,Michael Albano
98 Phontine Drive,200.0,15968,Lowell,Lowell,"Martinez, Jose O",Middlesex County,9/15/2015,2015-09-15,Lawrence Police Dept.,Police Officer,,"Alvarez-Rodriguez, Nilka",Individual,201,9/15/15 Deposit Report,MA,Check,1,1ed25c98-8418-5eb3-808b-f06ac7540a36,01850,01850,Nilka Alvarez-Rodriguez
526 Beach St,250.0,15264,Revere,Revere,"Campbell, Robert",Suffolk County,3/22/2010,2010-03-22,City of Revere,Aux Police Chief,,"Ambrosino, Thomas G.",Individual,201,2010 Year-end report (MUN),MA,Not Specified,0,1c75e533-e634-56b7-a036-f02c1b11b782,02151,02151,Thomas Ambrosino
5 Joseph Rd,100.0,15264,Revere,Revere,"Colannino, Roy & Mary",Suffolk County,4/5/2010,2010-04-05,Retired,Retired Police Officer,,"Ambrosino, Thomas G.",Individual,201,2010 Year-end report (MUN),MA,Not Specified,0,0a1769c2-e8f5-58a7-b667-83760fb15fa9,02151,02151,Thomas Ambrosino
46 Ledge St,250.0,15264,Lynnfield,Lynnfield,"Reardon, Terence",Essex County,4/14/2010,2010-04-14,City of Revere,Police Officer,,"Ambrosino, Thomas G.",Individual,201,2010 Year-end report (MUN),MA,Not Specified,0,496db8d7-f00b-5c66-85b1-7191eb3ebe20,01940,01940,Thomas Ambrosino
215 Newell Rd.,100.0,16449,Holden,Holden,"Evangelidis, Lewis",Worcester County,6/8/2016,2016-06-08,Commonwealth of Massachusetts,Sheriff-Worcester County,,"Ardinger, Thomas F.",Individual,201,2016 Pre-primary Report (ND),MA,,0,36a2a965-679b-5db1-8659-84c4bad2656a,01520,01520,Thomas Ardinger
89 Collette St.,200.0,11119,New Bedford,New Bedford,"Ledo, Dennis",Bristol County,6/14/2011,2011-06-14,City of New Bedford,Police Officer,,"Cabral, Antonio F. D.",Individual,201,2011 Pre-primary Report (MUN),MA,Not Specified,0,baedc349-d8b8-5485-a3b7-30a3c3355540,02746,02746,Antonio Cabral
89 Collette St.,100.0,11119,New Bedford,New Bedford,"Ledo, Dennis",Bristol County,7/29/2011,2011-07-29,City of New Bedford,Police Officer,,"Cabral, Antonio F. D.",Individual,201,2011 Pre-primary Report (MUN),MA,Not Specified,0,a00de884-ea57-536a-b459-e453c250cfb9,02746,02746,Antonio Cabral
1109 Walnut Plain Road,100.0,11119,Rochester,Rochester,"Sousa, Adelino",Plymouth County,7/29/2011,2011-07-29,City of New Bedford,Police Officer,,"Cabral, Antonio F. D.",Individual,201,2011 Pre-primary Report (MUN),MA,Not Specified,0,9896e152-e2a0-5b02-9ab7-2037cebdb052,02770,02770,Antonio Cabral
1109 Walnut Palin Road,325.0,11119,Rochester,Rochester,"Sousa, Adelino",Plymouth County,9/24/2011,2011-09-24,City of New Bedford,Police Officer,,"Cabral, Antonio F. D.",Individual,201,2011 Pre-election Report (MUN),MA,Not Specified,0,216f4d07-e2a1-5b08-bc51-a10af2740c0f,02770,02770,Antonio Cabral
86 Campbell Street,100.0,11119,New Bedford,New Bedford,"Fernandes, Joshua",Bristol County,10/23/2011,2011-10-23,New Bedford Police Department,Police Officer,,"Cabral, Antonio F. D.",Individual,201,2011 Year-end report (MUN),MA,Not Specified,0,2f56a0cb-a853-5d0c-bec7-d2c1ef6c2904,02740,02740,Antonio Cabral
89 Collette St.,100.0,11119,New Bedford,New Bedford,"Ledo, Dennis",Bristol County,10/26/2011,2011-10-26,City of New Bedford,Police Officer,,"Cabral, Antonio F. D.",Individual,201,2011 Year-end report (MUN),MA,Not Specified,0,03d7dba4-f349-5919-8e5e-b26f80e15466,02746,02746,Antonio Cabral
36 Barker Street,150.0,11119,Dartmouth,North Dartmouth,"Taveira, Carlos",Bristol County,5/25/2014,2014-05-25,New Bedford Police Department,Police Officer,,"Cabral, Antonio F. D.",Individual,201,2014 Pre-primary Report (ND),MA,Not Specified,0,133b2f18-218d-5cf9-909a-97b8257b84f7,02747,02747,Antonio Cabral
86 Campbell Street,100.0,11119,New Bedford,New Bedford,"Fernandes, Joshua",Bristol County,4/11/2017,2017-04-11,New Bedford Police Department,Police Officer,,"Cabral, Antonio F. D.",Individual,201,2017 Mid-Year Report (ND),MA,,0,43b51a6c-90ef-50d4-b5cb-d3c3d84335b8,02740,02740,Antonio Cabral
24 Forest Drive ,250.0,11119,Holden,Holden,"Daly, Andrew",Worcester County,4/6/2016,2016-04-06,State Police Association of Massachusetts,Treasurer/Director,,"Cabral, Antonio F. D.",Individual,201,2016 Pre-primary Report (ND),MA,,0,6fea85c5-a818-5b83-8016-7ad38772d0bf,01520,01520,Antonio Cabral
3 Edwards Road,250.0,11119,Braintree ,Braintree,"Hunter, Edward",Norfolk County,4/6/2016,2016-04-06,State Police Association of Massachusetts,Board of Director,,"Cabral, Antonio F. D.",Individual,201,2016 Pre-primary Report (ND),MA,,0,6e7a6a01-1d84-5616-8aff-33f28f0f900e,02184,02184,Antonio Cabral
16 Rosemont Road,200.0,11119,Worcester,Worcester,"Pullman, Dana",Worcester County,4/6/2016,2016-04-06,State Police Association of Massachusetts,President,,"Cabral, Antonio F. D.",Individual,201,2016 Pre-primary Report (ND),MA,,0,23a21a64-06c1-5e60-9421-b0b5a07b43a5,01605,01605,Antonio Cabral
16 Rosemont Road,200.0,11119,Worcester,Worcester,"Pullman, Dana",Worcester County,4/5/2017,2017-04-05,State Police Association of Massachusetts,President,,"Cabral, Antonio F. D.",Individual,201,2017 Mid-Year Report (ND),MA,,0,1b8a4a6a-3b33-55c3-ab4e-706486eeac31,01605,01605,Antonio Cabral
16 Rosemont Road,200.0,15815,Worcester,Worcester,"Pullman, Dana A.",Worcester County,9/20/2016,2016-09-20,Ma State Police,Trooper,,"Campanale, Kate D.",Individual,201,2016 Pre-election Report (ND),MA,,0,1df10568-2670-5f8e-940e-64826fc9a526,01605,01605,Kate Campanale
46 Juniper Lane,250.0,15815,Holden,Holden,"Brenner, Karl",Worcester County,9/21/2016,2016-09-21,Ma State Police,Trooper,,"Campanale, Kate D.",Individual,201,2016 Pre-election Report (ND),MA,,0,0bfd2f8b-0b3b-5b56-99ad-9e4cb5d9a01a,01520,01520,Kate Campanale
4 Braney Road,250.0,15815,Millbury,Millbury,"Gilbert, Jeffry",Worcester County,9/21/2016,2016-09-21,Ma State Police,Trooper,,"Campanale, Kate D.",Individual,201,2016 Pre-election Report (ND),MA,,0,e0c5dcc4-781e-545b-b6ed-30c8af75c994,01527,01527,Kate Campanale
172 Maple Street # 3,250.0,15815,Danvers,Danvers,"Lynch, Mark S.",Essex County,10/1/2016,2016-10-01,Ma State Police,Trooper,,"Campanale, Kate D.",Individual,201,2016 Pre-election Report (ND),MA,,0,57020e07-872e-5aa6-976e-837bd4bc369f,01923,01923,Kate Campanale
24 Forest Drive,500.0,15815,Holden,Holden,"Daly, Andrew J.",Worcester County,9/20/2016,2016-09-20,Ma State Police,Sergeant,,"Campanale, Kate D.",Individual,201,2016 Pre-election Report (ND),MA,,0,f1053921-4e91-5b55-bff0-5c963683f05e,01520,01520,Kate Campanale
4 Mount Pleasant Avenue,100.0,15815,Leicester,Leicester,"Wolanski, Richard D",Worcester County,10/30/2017,2017-10-30,State Police,Retired,,"Campanale, Kate D.",Individual,201,2017 Year-end Report (ND),MA,,0,27d167ca-170d-58e3-8f88-21a2d9392837,01524,01524,Kate Campanale
10 Danforth Court,25.0,14466,Haverhill,Haverhill,"Lavigne, Katherine",Essex County,9/27/2010,2010-09-27,City of Methuen,Police Officer,,"Campbell, Linda Dean",Individual,201,2010 Pre-election Report (ND),MA,Not Specified,0,32c8dec4-4911-5b06-bf18-10a839b5afa1,01832,01832,Linda Campbell
88 Crystal Street,100.0,14466,Haverhill,Haverhill,"Lavigne, Katherine",Essex County,9/24/2014,2014-09-24,City of Methuen,Police Officer,,"Campbell, Linda Dean",Individual,201,2014 Pre-election Report (ND),MA,Not Specified,0,836dd4e1-149f-5bb9-9a23-ef2a539112ca,01832,01832,Linda Campbell
183 Butternut Lane,250.0,14466,Methuen,Methuen,"Burke, Kevin",Essex County,10/9/2014,2014-10-09,City of Methuen,Police Officer,,"Campbell, Linda Dean",Individual,201,2014 Pre-election Report (ND),MA,Not Specified,0,39a4d416-0cdf-5045-a417-99fa4e31e52e,01844,01844,Linda Campbell
10 Danforth Court,25.0,14466,Haverhill,Haverhill,"Lavigne, Katherine",Essex County,10/24/2014,2014-10-24,City of Methuen,Police Officer,,"Campbell, Linda Dean",Individual,201,2014 Year-end Report (ND),MA,Not Specified,0,ca6387dd-5f14-5cc1-9dab-01975154f19a,01832,01832,Linda Campbell
9 Jefferson Rd,50.0,14466,Methuen,Methuen,"Korn, Frank",Essex County,10/29/2014,2014-10-29,Methuen,Police Officer,,"Campbell, Linda Dean",Individual,201,2014 Year-end Report (ND),MA,Not Specified,0,2f4e52f4-5512-52e5-86bb-56e5b320a3ba,01844,01844,Linda Campbell
C/o 90 Hampshire Street,50.0,14466,Methuen,Methuen,"Solomon, Joseph",Essex County,10/12/2016,2016-10-12,City of  Methuen,Police Chief,,"Campbell, Linda Dean",Individual,201,2016 Pre-election Report (ND),MA,,0,e5efce3f-8be6-5560-a03d-82b9203c4273,01844,01844,Linda Campbell
79 West Street,100.0,14466,Methuen,Methuen,"Kamal, Joseph",Essex County,2/25/2019,2019-02-25,"North Andover, Ma",Police Officer,,"Campbell, Linda Dean",Individual,201,2019 Mid-Year Report,MA,Not Specified,0,d1c39fee-5d00-54ec-afe9-ae1797a0731f,01844,01844,Linda Campbell
20 Woodbine Road,75.0,14781,Marshfield,Marshfield,"Battis, William",Plymouth County,3/27/2010,2010-03-27,"Town of Marshfield, MA",Police officer,,"Cantwell, James M.",Individual,201,2010 Pre-primary Report (ND),MA,Not Specified,0,a3c96867-beac-5fff-8a27-15bc23830f33,02050,02050,James Cantwell
234 Gannett Ave.,100.0,14781,Scituate,Scituate,"Stewart, Brian",Plymouth County,12/15/2011,2011-12-15,"Scituate, MA",Police Chief,,"Cantwell, James M.",Individual,201,2011 Year-end Report (ND),MA,Not Specified,0,a7a321e9-58f7-5d19-9a84-ad580ded9954,02066,02066,James Cantwell
58 Carolina Trl,25.0,14781,Marshfield,Marshfield,"O'Donnell, James",Plymouth County,2/24/2012,2012-02-24,Wrentham District Court,Retired State Police Prosecutor,,"Cantwell, James M.",Individual,201,2012 Pre-primary Report (ND),MA,Not Specified,0,c4965f7e-4f72-54a7-ba83-3057bd80b6c5,02050,02050,James Cantwell
20 Woodbine Road,50.0,14781,Marshfield,Marshfield,"Battis, William",Plymouth County,2/26/2012,2012-02-26,"Town of Marshfield, MA",Police officer,,"Cantwell, James M.",Individual,201,2012 Pre-primary Report (ND),MA,Not Specified,0,4629cb90-9a52-5a7f-980e-955e92364d34,02050,02050,James Cantwell
58 Carolina Trl,20.0,14781,Marshfield,Marshfield,"O'Donnell, James",Plymouth County,6/18/2012,2012-06-18,Wrentham District Court,Retired State Police Prosecutor,,"Cantwell, James M.",Individual,201,2012 Pre-primary Report (ND),MA,Not Specified,0,fa97269b-45a1-5b6d-8c6f-40638683b839,02050,02050,James Cantwell
234 Gannett Ave.,50.0,14781,Scituate,Scituate,"Stewart, Brian",Plymouth County,6/22/2012,2012-06-22,"Scituate, MA",Police Chief,,"Cantwell, James M.",Individual,201,2012 Pre-primary Report (ND),MA,Not Specified,0,9389affd-9964-59f9-a9f5-ab8d1fec2a13,02066,02066,James Cantwell
58 Carolina Trl,20.0,14781,Marshfield,Marshfield,"O'Donnell, James",Plymouth County,10/9/2012,2012-10-09,Wrentham District Court,Retired State Police Prosecutor,,"Cantwell, James M.",Individual,201,2012 Pre-election Report (ND),MA,Not Specified,0,8fcfc04c-dba2-5603-b3ff-4407c74e9228,02050,02050,James Cantwell
58 Carolina Trl,5.0,14781,Marshfield,Marshfield,"O'Donnell, James",Plymouth County,10/25/2012,2012-10-25,Wrentham District Court,Retired State Police Prosecutor,,"Cantwell, James M.",Individual,201,2012 Year-end Report (ND),MA,Not Specified,0,5c8ec910-f81e-5515-bd4b-6ec70a536032,02050,02050,James Cantwell
802 Mariners Hill Drive,10.0,14781,Marshfield,Marshfield,"O'Donnell, James",Plymouth County,6/27/2013,2013-06-27,Wrentham District Court,Retired State Police Prosecutor,,"Cantwell, James M.",Individual,201,2013 Mid-Year Report (ND),MA,Not Specified,0,983e793f-f275-52e5-b889-113846eefec2,02050,02050,James Cantwell
802 Mariners Hill Drive,10.0,14781,Marshfield,Marshfield,"O'Donnell, James",Plymouth County,2/28/2014,2014-02-28,Wrentham District Court,Retired State Police Prosecutor,,"Cantwell, James M.",Individual,201,2014 Pre-primary Report (ND),MA,Not Specified,0,4e4ac1da-cdef-5515-826d-7c24b161152a,02050,02050,James Cantwell
802 Mariners Hill Drive,20.0,14781,Marshfield,Marshfield,"O'Donnell, James",Plymouth County,8/22/2014,2014-08-22,Wrentham District Court,Retired State Police Prosecutor,,"Cantwell, James M.",Individual,201,2014 Pre-primary Report (ND),MA,Not Specified,0,52b2826e-433b-50aa-a537-352e807cda9c,02050,02050,James Cantwell
234 Gannett Rd,100.0,14781,Scituate,Scituate,"Stewart, Brian",Plymouth County,6/23/2015,2015-06-23,"Scituate, MA",Retired Police Chief,,"Cantwell, James M.",Individual,201,2015 Mid-Year Report (ND),MA,,0,9a56d1cf-f866-5e27-8dc4-f987ed05d7c5,02066,02066,James Cantwell
802 Mariners Hill Drive,10.0,14781,Marshfield,Marshfield,"O'donnell, James",Plymouth County,12/26/2015,2015-12-26,Wrentham District Court,Retired State Police Prosecutor,,"Cantwell, James M.",Individual,201,2015 Year-end Report (ND),MA,,0,ac9d8e20-71dc-51cf-9b73-4b3300857654,02050,02050,James Cantwell
234 Gannett Rd.,50.0,14781,Scituate,Scituate,"Stewart, Brian",Plymouth County,4/10/2016,2016-04-10,"Scituate, MA",Retired Police Chief,,"Cantwell, James M.",Individual,201,2016 Pre-primary Report (ND),MA,,0,87fead0a-0074-568d-b95b-59b14416e3e5,02066,02066,James Cantwell
234 Gannett Ave.,50.0,14781,Scituate,Scituate,"Stewart, Brian",Plymouth County,9/15/2016,2016-09-15,"Scituate, MA",Retired Police Chief,,"Cantwell, James M.",Individual,201,2016 Pre-election Report (ND),MA,,0,0f5152dd-e42b-5684-8d24-4586a930806c,02066,02066,James Cantwell
16 Turner Street,200.0,15123,Quincy,Quincy,"Jacobs, Walter",Norfolk County,5/5/2011,2011-05-05,University of Massachusetts,Police Officer,,"Chan, Tackey",Individual,201,2011 Mid-Year Report (ND),MA,Not Specified,0,d8a4b7de-4ed8-5488-aa9b-8990cd1c3f93,02169,02169,Tackey Chan
16 Turner Street,200.0,15123,Quincy,Quincy,"Jacobs, Walter",Norfolk County,3/27/2012,2012-03-27,University of Massachusetts,Police Officer,,"Chan, Tackey",Individual,201,2012 Pre-primary Report (ND),MA,Not Specified,0,56bf3b5f-fac7-55cd-a4e7-4d96e419b44e,02169,02169,Tackey Chan
227 West Street,200.0,15123,Quincy,Quincy,"Rosenthal, Daniel",Norfolk County,3/25/2014,2014-03-25,Revere Police Department,Police Officer,,"Chan, Tackey",Individual,201,2014 Pre-primary Report (ND),MA,Not Specified,0,0744e6c0-ce59-5b4d-a33e-d8b629145bd0,02169,02169,Tackey Chan
16 Rosemont Road,200.0,15123,Worcester,Worcester,"Pullman, Dana",Worcester County,10/18/2014,2014-10-18,Massachusetts State Police,State Trooper,,"Chan, Tackey",Individual,201,2014 Year-end Report (ND),MA,Not Specified,0,527eb146-4373-5a1e-958c-3a1c44826a11,01605,01605,Tackey Chan
16 Rosemont Road,200.0,15123,Worcester,Worcester,"Pullman, Dana",Worcester County,4/5/2017,2017-04-05,Massachusetts State Police,State Trooper,,"Chan, Tackey",Individual,201,2017 Mid-Year Report (ND),MA,,0,0fad1960-73cd-5045-acf1-15f231430f70,01605,01605,Tackey Chan
50 Newton Avenue,200.0,15123,Quincy,Quincy,"Mui, Kenneth",Norfolk County,5/18/2017,2017-05-18,Cambridge Police,Lieutenant,,"Chan, Tackey",Individual,201,2017 Mid-Year Report (ND),MA,,0,fd84bc29-5706-5ebc-b3d8-5ad0872bde49,02170,02170,Tackey Chan
27 ferriter St,100.0,17482,Quincy ,Quincy,"Dever, Brendan",Norfolk County,5/5/2020,2020-05-05,City of Boston,Boston Police,,"Charbonnier, Cameron",Individual,201,5/5/20 Deposit Report,MA,Credit Card,3,b12f32ab-228e-587c-b631-6f6373d9338d,02169,02169,Cameron Charbonnier
1 hill top St,500.0,17482,Dorchester ,Dorchester Center,"gillis, Scott",Suffolk County,5/5/2020,2020-05-05,City of Boston ,Police ,,"Charbonnier, Cameron",Individual,201,5/5/20 Deposit Report,MA,Credit Card,3,27c5f14c-4d58-5d53-acf1-970291feaf62,02124,02124,Cameron Charbonnier
25 Amesbury St,100.0,17482,Boston,West Roxbury,"O’Brien, Jerry",Suffolk County,5/5/2020,2020-05-05,City of Boston ,Police Officer ,,"Charbonnier, Cameron",Individual,201,5/5/20 Deposit Report,MA,Credit Card,3,692766db-5f83-5893-aec0-f264ab840cf5,02132-4209,02132,Cameron Charbonnier
538 E Fourth St,500.0,17482,Boston ,Boston,"Cotter, Winifred",Suffolk County,5/31/2020,2020-05-31,City of Boston,Police,,"Charbonnier, Cameron",Individual,201,5/31/20 Deposit Report,MA,Check,1,72103d07-2406-5276-b67c-4e3b0b173a8a,02127,02127,Cameron Charbonnier
117 AUGUSTUS Ave,100.0,17482,Roslindale,Roslindale,"Dodd, Steven",Suffolk County,5/31/2020,2020-05-31,Police Officer ,Boston Police Department ,,"Charbonnier, Cameron",Individual,201,5/31/20 Deposit Report,MA,Check,1,6850894b-1b07-5b6f-9ab6-ebacb31ec784,02131,02131,Cameron Charbonnier
83 Van Winkle St Unit 3,150.0,17482,Dorchester,Dorchester Center,"English, Emily",Suffolk County,5/31/2020,2020-05-31,City of Boston,Police Officer ,,"Charbonnier, Cameron",Individual,201,5/31/20 Deposit Report,MA,Check,1,4b5d9b24-daf3-5d9b-b83a-81055d52d3d2,02124,02124,Cameron Charbonnier
41 Sheppard Ave,100.0,17482,Braintree ,Braintree,"McGinn, Frank",Norfolk County,5/31/2020,2020-05-31,,Retired State Police,,"Charbonnier, Cameron",Individual,201,5/31/20 Deposit Report,MA,Check,1,8be7bc0a-0e97-577a-87aa-70d5eacebf83,02184,02184,Cameron Charbonnier
5 Beale St,500.0,17482,Dorchester ,Dorchester,"Ball, Richard",Suffolk County,5/5/2020,2020-05-05,Comm of Mass,Law Enforcement ,,"Charbonnier, Cameron",Individual,201,5/5/20 Deposit Report,MA,Credit Card,3,509e8fd3-b777-500a-9fea-da276dba0e07,02122,02122,Cameron Charbonnier
4 Preachers Path,100.0,17482,Marshfield ,Marshfield,"Brown, Michael",Plymouth County,5/5/2020,2020-05-05,City of Boston ,Law Enforcement ,,"Charbonnier, Cameron",Individual,201,5/5/20 Deposit Report,MA,Credit Card,3,8a64956f-b474-5486-9a27-467e26f62d8c,02050,02050,Cameron Charbonnier
14 Antwerp St,500.0,17482,Milton,Milton,"Miskell, Andrew",Norfolk County,5/5/2020,2020-05-05,Boston Police Dept,Detective,,"Charbonnier, Cameron",Individual,201,5/5/20 Deposit Report,MA,Credit Card,3,bf78fa8f-2936-5ecf-99a5-8ca6ed944664,02186,02186,Cameron Charbonnier
64 granite Ave,200.0,17482,Dorchester Center,Dorchester Center,"Swain, Sandra",Suffolk County,5/5/2020,2020-05-05,City of  Boston,Detective,,"Charbonnier, Cameron",Individual,201,5/5/20 Deposit Report,MA,Credit Card,3,783c5ee4-4596-5644-9874-4c99789ad51d,02124,02124,Cameron Charbonnier
753 W Chestnut St,100.0,17437,Brockton,Brockton,"Coulanges, Franck",Plymouth County,3/2/2020,2020-03-02,Brockton,Law Enforcement Officer,,"Civil, Tamisha",Individual,201,3/2/20 Deposit Report,MA,Other,5,f6d95f72-739b-5474-aa86-6fcd655dc1d9,02301,02301,Tamisha Civil
55 Chalmers St.,500.0,15740,Springfield,Springfield,"Collins, Christopher E.",Hampden County,12/23/2013,2013-12-23,City of Springfield,Police Officer,,"Collins, Jr., Edward W.",Individual,201,2013 Year-end Report (ND),MA,Not Specified,0,90b83c26-32e5-5d60-968b-97fbbd1b6ba6,01109,01109,Jr. Collins
H K Davis Road,100.0,14437,Charlton,Charlton,"Matte, David",Worcester County,4/21/2014,2014-04-21,Commonwealth of Ma,Trooper,,"Comtois II, Stephen J.",Individual,201,2014 Pre-primary Report (ND),MA,Not Specified,0,1070e31a-4d5b-5bf2-b81c-2f59d9005b86,01507,01507,II Comtois
41 Colchester St,250.0,13681,Boston,Hyde Park,"Brown, Mike",Suffolk County,3/4/2011,2011-03-04,BPD,Police Officer,,"Consalvo, Rob",Individual,201,3/4/11 Deposit Report,MA,Check,1,655dba48-455e-5216-92c6-b00d1a5fae7f,02136,02136,Rob Consalvo
23 CONISTON RD,200.0,13681,BOSTON,Roslindale,"BROOKS, MARTIN J",Suffolk County,6/8/2011,2011-06-08,CITY OF BOSTON,POLICE OFFICER,,"Consalvo, Rob",Individual,201,6/8/11 Deposit Report,MA,Check,1,fbbb08c9-5969-55cc-b1e4-26d1beedaa9b,021311516,02131,Rob Consalvo
53 SUMMIT ST,500.0,13681,BOSTON,Hyde Park,"BARRETT, DANA",Suffolk County,8/16/2011,2011-08-16,BPD,POLICE OFFICER,,"Consalvo, Rob",Individual,201,8/16/11 Deposit Report,MA,Check,1,9063eb14-177e-5c5d-94e5-e6da1202dfa2,021364044,02136,Rob Consalvo
13 PARK STREET UNIT 7,200.0,13681,BOSTON,Dorchester,"DINEEN, JOHN J",Suffolk County,8/16/2011,2011-08-16,CITY OF BOSTON,POLICE OFFICER,,"Consalvo, Rob",Individual,201,8/16/11 Deposit Report,MA,Check,1,69825f4b-6419-595f-9228-a192d1545760,02122,02122,Rob Consalvo
8 NORTON ST,500.0,13681,BOSTON,Hyde Park,"MEDINA, RICHARD L",Suffolk County,8/16/2011,2011-08-16,CITY OF BOSTON,POLICE OFF,,"Consalvo, Rob",Individual,201,8/16/11 Deposit Report,MA,Check,1,9ef0a9f9-7fc8-5ecf-bae8-b93b108ebfe8,021361415,02136,Rob Consalvo
10 GARTH RD 1,500.0,13681,BOSTON,West Roxbury,"FOLEY, THOMAS J",Suffolk County,10/4/2011,2011-10-04,CITY OF BOSTON,POLICE OFFICER,,"Consalvo, Rob",Individual,201,10/4/11 Deposit Report,MA,Check,1,a5706948-f4f1-573b-bda2-117713a62209,021321802,02132,Rob Consalvo
60 CLIFTONDALE ST,125.0,13681,BOSTON,Roslindale,"SWEENEY, STEVEN M",Suffolk County,10/6/2011,2011-10-06,BPD,POLICE LIEUTENANT,,"Consalvo, Rob",Individual,201,10/6/11 Deposit Report,MA,Check,1,1c528d46-80a7-5394-90df-1f80b1ee2e13,021313538,02131,Rob Consalvo
95 RUSSETT RD,200.0,13681,BOSTON,West Roxbury,"KENNEALLY, JAMES B",Suffolk County,12/28/2011,2011-12-28,CITY OF BOSTON,POLICE OFFICER,,"Consalvo, Rob",Individual,201,12/28/11 Deposit Report,MA,Check,1,2c765f78-f913-5d6f-a76b-b04032ee3bcc,021321435,02132,Rob Consalvo
10 CLIFFORD ST,200.0,13681,BOSTON,Hyde Park,"KNECHT, WILLIAM G",Suffolk County,2/29/2012,2012-02-29,BOMB TECHNICIAN,BOSTON POLICE DEPT.,,"Consalvo, Rob",Individual,201,2/29/12 Deposit Report,MA,Check,1,c8e44490-82ce-57a3-9ab2-466a5f3c1387,021362402,02136,Rob Consalvo
56 METROPOLITAN AVE 2,200.0,13681,BOSTON,Roslindale,"WELLS, JOSEPH D",Suffolk County,5/4/2012,2012-05-04,BOSTON PUBLIC HEALTH COMMISSION,SPECIAL POLICE OFFICER,,"Consalvo, Rob",Individual,201,5/4/12 Deposit Report,MA,Check,1,4ca17764-b2eb-5fbd-97a8-a0dc8bdf3d04,021314120,02131,Rob Consalvo
23 CONISTON RD,100.0,13681,BOSTON,Roslindale,"BROOKS, MARTIN J",Suffolk County,6/21/2012,2012-06-21,CITY OF BOSTON,POLICE OFFICER,,"Consalvo, Rob",Individual,201,6/21/12 Deposit Report,MA,Check,1,d7effedd-ab75-5b7b-a2d4-09c78056da88,021311516,02131,Rob Consalvo
60 CLIFTONDALE ST,50.0,13681,BOSTON,Roslindale,"SWEENEY, STEVEN M",Suffolk County,6/21/2012,2012-06-21,BPD,POLICE LIEUTENANT,,"Consalvo, Rob",Individual,201,6/21/12 Deposit Report,MA,Check,1,82faac53-6fc6-5603-996e-876a371dbde2,021313538,02131,Rob Consalvo
114 READVILLE ST,100.0,13681,BOSTON,Hyde Park,"RUIZ, JOSE A",Suffolk County,6/29/2012,2012-06-29,BPD,POLICE OFFICER,,"Consalvo, Rob",Individual,201,6/29/12 Deposit Report,MA,Check,1,e34c20e9-4cf5-5b58-bff0-c8941c9f0dfc,021362049,02136,Rob Consalvo
10 GARTH RD 1,500.0,13681,BOSTON,West Roxbury,"FOLEY, THOMAS J",Suffolk County,9/28/2012,2012-09-28,CITY OF BOSTON,POLICE OFFICER,,"Consalvo, Rob",Individual,201,9/28/12 Deposit Report,MA,Check,1,af0669e8-132c-5759-a1af-d4ed69012207,021321802,02132,Rob Consalvo
8 NORTON ST,250.0,13681,BOSTON,Hyde Park,"MEDINA, RICHARD L",Suffolk County,10/4/2012,2012-10-04,CITY OF BOSTON,POLICE OFF,,"Consalvo, Rob",Individual,201,10/4/12 Deposit Report,MA,Check,1,0d1975b1-f4d2-5b00-b099-6cca717d22ac,021361415,02136,Rob Consalvo
201 WELD STREET,250.0,13681,WEST ROXBURY,West Roxbury,"KENNEALLY, JAMES B",Suffolk County,10/29/2012,2012-10-29,CITY OF BOSTON,POLICE OFFICER,,"Consalvo, Rob",Individual,201,10/29/12 Deposit Report,MA,Check,1,141c557f-996c-51d6-b12f-e29d6ef0eb49,02132,02132,Rob Consalvo
10 GARTH RD 1,500.0,13681,BOSTON,West Roxbury,"FOLEY, THOMAS J",Suffolk County,2/22/2013,2013-02-22,CITY OF BOSTON,POLICE OFFICER,,"Consalvo, Rob",Individual,201,2/22/13 Deposit Report,MA,Check,1,f69ca153-965f-5ce6-987b-79db5bbfeb00,021321802,02132,Rob Consalvo
41 COLCHESTER ST,500.0,13681,BOSTON,Hyde Park,"BROWN, MICHAEL A",Suffolk County,3/7/2013,2013-03-07,CITY OF BOSTON,POLICE OFFICER,,"Consalvo, Rob",Individual,201,3/7/13 Deposit Report,MA,Check,1,1671dcc1-3ec2-5d18-add1-cf4ddb430c96,021362338,02136,Rob Consalvo
22 GWINNETT ST,350.0,13681,HYDE PARK,Hyde Park,"MOCCIA, JAMES B",Suffolk County,3/7/2013,2013-03-07,CITY OF BOSTON,POLICE OFFICER,,"Consalvo, Rob",Individual,201,3/7/13 Deposit Report,MA,Check,1,7bdd5629-39b0-5239-b766-590e9c964da5,02136,02136,Rob Consalvo
136 CHILD ST 1,250.0,13681,BOSTON,Hyde Park,"ONEILL, MARY ANN",Suffolk County,3/7/2013,2013-03-07,CITY OF BOSTON,POLICE OFFICER,,"Consalvo, Rob",Individual,201,3/7/13 Deposit Report,MA,Check,1,2f790a98-a956-5b0f-8f47-3c64f3be8297,021361717,02136,Rob Consalvo
20 KNOLL STREET,500.0,13681,ROSLINDALE,Roslindale,"CONLEY, MATTHEW M",Suffolk County,4/5/2013,2013-04-05,BPD,POLICE OFFICER,,"Consalvo, Rob",Individual,201,4/5/13 Deposit Report,MA,Check,1,62cb58dd-b786-562d-8dfc-364404214dbb,02131,02131,Rob Consalvo
60 CLIFTONDALE ST,300.0,13681,ROSLINDALE,Roslindale,"SWEENEY, STEVEN M",Suffolk County,4/5/2013,2013-04-05,BPD,POLICE LIEUTENANT,,"Consalvo, Rob",Individual,201,4/5/13 Deposit Report,MA,Credit Card,3,392dc5d6-695a-5362-98cb-bb3f1908eeb6,02131,02131,Rob Consalvo
53 SUMMIT ST,500.0,13681,BOSTON,Hyde Park,"BARRETT, DANA",Suffolk County,5/8/2013,2013-05-08,BPD,POLICE OFFICER,,"Consalvo, Rob",Individual,201,5/8/13 Deposit Report,MA,Check,1,754ff745-0b8a-5ee0-ba6f-c994c7de0309,021364044,02136,Rob Consalvo
16 SAINT BRENDAN RD,500.0,13681,BOSTON,Dorchester Center,"YOUNG, JOSEPH M",Suffolk County,5/17/2013,2013-05-17,City of Boston,POLICE OFF,,"Consalvo, Rob",Individual,201,5/17/13 Deposit Report,MA,Check,1,e24b109a-402e-5265-8468-721f1978a6f4,021245813,02124,Rob Consalvo
60 CLIFTONDALE ST,25.0,13681,ROSLINDALE,Roslindale,"SWEENEY, STEVEN M",Suffolk County,5/20/2013,2013-05-20,BPD,POLICE LIEUTENANT,,"Consalvo, Rob",Individual,201,5/20/13 Deposit Report,MA,Check,1,e021d5a6-4042-503e-af38-b531fea9a717,02131,02131,Rob Consalvo
30 PINEFIELD RD,200.0,13681,BOSTON,Hyde Park,"MCELMOYLE, KEVIN M",Suffolk County,5/22/2013,2013-05-22,BOSTON POLICE DEPT.,POLICE OFFICER,,"Consalvo, Rob",Individual,201,5/22/13 Deposit Report,MA,Check,1,530fea1e-31d9-5be6-ae1f-d8667739c974,021361926,02136,Rob Consalvo
19 MANION RD,200.0,13681,BOSTON,Hyde Park,"MURPHY, MICHAEL P",Suffolk County,6/4/2013,2013-06-04,CITY OF BOSTON,POLICE OFFICER,,"Consalvo, Rob",Individual,201,6/4/13 Deposit Report,MA,Check,1,c72ba5dc-6f63-519e-a2d9-5f43b94da437,021363833,02136,Rob Consalvo
201 WELD STREET,250.0,13681,WEST ROXBURY,West Roxbury,"KENNEALLY, JAMES B",Suffolk County,6/11/2013,2013-06-11,CITY OF BOSTON,POLICE OFFICER,,"Consalvo, Rob",Individual,201,6/11/13 Deposit Report,MA,Credit Card,3,892de6c4-584f-593b-a5ab-31e16f8c6156,02132,02132,Rob Consalvo
23 CONISTON RD,250.0,13681,BOSTON,Roslindale,"BROOKS, MARTIN J",Suffolk County,6/19/2013,2013-06-19,CITY OF BOSTON,POLICE OFFICER,,"Consalvo, Rob",Individual,201,6/19/13 Deposit Report,MA,Check,1,b5749811-2391-50b3-a28e-3ebc64a43cb4,021311516,02131,Rob Consalvo
30 PINEFIELD RD,200.0,13681,BOSTON,Hyde Park,"MCELMOYLE, KEVIN M",Suffolk County,6/24/2013,2013-06-24,BOSTON POLICE DEPT.,POLICE OFFICER,,"Consalvo, Rob",Individual,201,6/24/13 Deposit Report,MA,Check,1,320418dc-4d22-50de-87af-d6c3d38e54cf,021361926,02136,Rob Consalvo
171 WOMPATUCK RD,250.0,13681,HINGHAM,Hingham,"SMIGLIANI, STEVE",Plymouth County,6/25/2013,2013-06-25,CITY OF BOSTON,POLICE OFFICER,,"Consalvo, Rob",Individual,201,6/25/13 Deposit Report,MA,Credit Card,3,81a0dc24-bac9-5b1f-8e0c-eb0958f7a73b,02043,02043,Rob Consalvo
129 BALCOLM STREET,250.0,13681,MANSFIELD,Mansfield,"KRAFT, MARTIN B.",Bristol County,6/28/2013,2013-06-28,CITY OF BOSTON,POLICE OFFICER,,"Consalvo, Rob",Individual,201,6/28/13 Deposit Report,MA,Check,1,af1dae3c-12da-5303-970d-479146aaf003,02048,02048,Rob Consalvo
12 STURGES ROAD,300.0,13681,WEST ROXBURY,West Roxbury,"SHEA, MATTHEW",Suffolk County,7/1/2013,2013-07-01,BOSTON POLICE DEPT.,POLICE OFFICER,,"Consalvo, Rob",Individual,201,7/1/13 Deposit Report,MA,Credit Card,3,4d902e57-806d-5549-888d-59cd875fde2d,02132,02132,Rob Consalvo
49 HOMESTEAD AVENUE,500.0,13681,WEYMOUTH,Weymouth,"CICCOLO, STEVEN",Norfolk County,7/2/2013,2013-07-02,BOSTON POLICE DEPARTMENT,POLICE OFFICER,,"Consalvo, Rob",Individual,201,7/2/13 Deposit Report,MA,Check,1,de76edd2-df83-5b69-8d78-2ef207b6f84f,02188,02188,Rob Consalvo
13 PARK STREET UNIT 7,500.0,13681,BOSTON,Dorchester,"DINEEN, JOHN J",Suffolk County,7/2/2013,2013-07-02,CITY OF BOSTON,POLICE OFFICER,,"Consalvo, Rob",Individual,201,7/2/13 Deposit Report,MA,Check,1,457ab919-2253-5efc-b3e1-68be84dc9fbb,02122,02122,Rob Consalvo
124 CHITTICK RD,250.0,13681,BOSTON,Hyde Park,"TALBOT, MICHAEL G",Suffolk County,7/2/2013,2013-07-02,CITY OF BOSTON,POLICE OFFICER,,"Consalvo, Rob",Individual,201,7/2/13 Deposit Report,MA,Check,1,ddda0461-87f9-5714-a2d2-95d5d798d7c8,021363346,02136,Rob Consalvo
23 ALABAMA ST,150.0,13681,BOSTON,Mattapan,"CAISEY, DONALD O",Suffolk County,7/12/2013,2013-07-12,CITY OF BOSTON,POLICE OFFICER,,"Consalvo, Rob",Individual,201,7/12/13 Deposit Report,MA,Check,1,e2970c09-3c52-5b49-85c8-49a57efef3b0,021261488,02126,Rob Consalvo
10 CLIFFORD ST,200.0,13681,BOSTON,Hyde Park,"KNECHT, WILLIAM G",Suffolk County,7/24/2013,2013-07-24,BOMB TECHNICIAN,BOSTON POLICE DEPT.,,"Consalvo, Rob",Individual,201,7/24/13 Deposit Report,MA,Check,1,9d11ff42-3fa8-5bb7-9788-e17c888cfcd5,021362402,02136,Rob Consalvo
136 CHILD ST 1,250.0,13681,BOSTON,Hyde Park,"ONEILL, MARY ANN",Suffolk County,7/30/2013,2013-07-30,CITY OF BOSTON,POLICE OFFICER,,"Consalvo, Rob",Individual,201,7/30/13 Deposit Report,MA,Credit Card,3,6c39ff14-9d58-597f-9361-dca877535617,021361717,02136,Rob Consalvo
24 STANBRO ST,200.0,13681,BOSTON,Hyde Park,"CARTY, THOMAS J",Suffolk County,8/6/2013,2013-08-06,COB,POLICE OFFICER,,"Consalvo, Rob",Individual,201,8/6/13 Deposit Report,MA,Check,1,c97a480a-81b5-576b-9576-533587230809,021362352,02136,Rob Consalvo
129 BALCOLM STREET,100.0,13681,MANSFIELD,Mansfield,"KRAFT, MARTIN B.",Bristol County,8/21/2013,2013-08-21,CITY OF BOSTON,POLICE OFFICER,,"Consalvo, Rob",Individual,201,8/21/13 Deposit Report,MA,Credit Card,3,47451421-67fd-59e4-a17b-81f96acd68e1,02048,02048,Rob Consalvo
131 MAPLE STREET,500.0,13681,WEST ROXBURY,West Roxbury,"LABELLE, BRET",Suffolk County,8/21/2013,2013-08-21,BPD,POLICE OFFICER,,"Consalvo, Rob",Individual,201,8/21/13 Deposit Report,MA,Credit Card,3,a8966a25-7ddb-5fa8-8ea8-90a42e105122,02132,02132,Rob Consalvo
201 WELD STREET,250.0,13681,WEST ROXBURY,West Roxbury,"KENNEALLY, JAMES B",Suffolk County,8/27/2013,2013-08-27,CITY OF BOSTON,POLICE OFFICER,,"Consalvo, Rob",Individual,201,8/27/13 Deposit Report,MA,Check,1,e9666941-ea75-5ccb-9f0e-9bedf9e8bcd1,02132,02132,Rob Consalvo
23 CONISTON RD,100.0,13681,BOSTON,Roslindale,"BROOKS, MARTIN J",Suffolk County,8/29/2013,2013-08-29,CITY OF BOSTON,POLICE OFFICER,,"Consalvo, Rob",Individual,201,8/29/13 Deposit Report,MA,Check,1,cebfacf2-077a-5504-baef-999d9ab7e2b4,021311516,02131,Rob Consalvo
171 WOMPATUCK RD,100.0,13681,HINGHAM,Hingham,"SMIGLIANI, STEVE",Plymouth County,9/5/2013,2013-09-05,CITY OF BOSTON,POLICE OFFICER,,"Consalvo, Rob",Individual,201,9/5/13 Deposit Report,MA,Credit Card,3,ffebc239-52d5-54df-99cb-66ad5ec20203,02043,02043,Rob Consalvo
20 Knoll Street,500.0,13681,Boston,Roslindale,"Conley, Matthew",Suffolk County,1/3/2014,2014-01-03,City of Boston,Police Officer,,"Consalvo, Rob",Individual,201,1/3/14 Deposit Report,MA,Check,1,8f60b717-67c6-58f4-a830-d473a3c99685,02131,02131,Rob Consalvo
23 Coniston Road,250.0,13681,Boston,Roslindale,"Brooks, Martin",Suffolk County,1/10/2014,2014-01-10,City of Boston,Police Officer,,"Consalvo, Rob",Individual,201,1/10/14 Deposit Report,MA,Check,1,75216f3a-7a93-5521-b0b9-52a90a3faf3d,02131,02131,Rob Consalvo
10 Garth Road,500.0,13681,Boston,West Roxbury,"Foley, Thomas",Suffolk County,3/20/2014,2014-03-20,Boston Police Department,Police Officer,,"Consalvo, Rob",Individual,201,3/20/14 Deposit Report,MA,Check,1,5b26f70a-5527-5a8d-b234-61629748f8d2,02132,02132,Rob Consalvo
44 PERHAM ST,400.0,13681,BOSTON,West Roxbury,"CECIL, JEFFREY C",Suffolk County,8/30/2013,2013-08-30,BPD,DETECTIVE,,"Consalvo, Rob",Individual,201,8/30/13 Deposit Report,MA,Check,1,12c7ce0a-9737-5a2d-9d92-5c3a1d86b194,021323254,02132,Rob Consalvo
16 Saint Brendan Road,200.0,13681,Boston,Dorchester Center,"Young, Joseph",Suffolk County,3/3/2014,2014-03-03,Boston Police Department,Detective,,"Consalvo, Rob",Individual,201,3/3/14 Deposit Report,MA,Check,1,2b645b85-4ea8-5eb3-b3ef-1b6e0cbdd7e3,02124,02124,Rob Consalvo
21 SOLARIS RD,100.0,13681,BOSTON,Hyde Park,"DIMARE, JR, DOMINIC M",Suffolk County,8/27/2013,2013-08-27,BOSTON POLICE DEPT.,PROGRAMMER,,"Consalvo, Rob",Individual,201,8/27/13 Deposit Report,MA,Check,1,8af078ed-3aa6-59da-b3ac-882c80cab410,021361423,02136,Rob Consalvo
1052 South Street Apt 2,200.0,15066,Roslindale,Roslindale,"Kenneally, John",Suffolk County,4/29/2010,2010-04-29,City of Boston,Police Officer,,"Coppinger, Edward F.",Individual,201,2010 Pre-primary Report (ND),MA,Not Specified,0,389e4079-bbb4-57af-bd80-537252e8a3bc,02131,02131,Edward Coppinger
7 Robin Road,200.0,15066,West Roxbury,West Roxbury,"Boulger, Michael",Suffolk County,7/28/2010,2010-07-28,City of Boston,Police Officer,,"Coppinger, Edward F.",Individual,201,2010 Pre-primary Report (ND),MA,Not Specified,0,e40b0083-3062-5489-b976-b79431b1d880,02132,02132,Edward Coppinger
40 Cotuit Street,200.0,15066,West Roxbury,West Roxbury,"Daly, Charles",Suffolk County,8/1/2010,2010-08-01,City of Boston,Police Officer,,"Coppinger, Edward F.",Individual,201,2010 Pre-primary Report (ND),MA,Not Specified,0,7bf11ca2-708f-5bbe-86df-37693b8d2551,02132,02132,Edward Coppinger
4 President Road,200.0,15066,West Roxbury,West Roxbury,"LaCroix, James",Suffolk County,8/29/2010,2010-08-29,City of Boston,Police Officer,,"Coppinger, Edward F.",Individual,201,2010 Pre-election Report (ND),MA,Not Specified,0,101c25be-ed34-5cdd-9cb5-c5a2ce6fb668,02132,02132,Edward Coppinger
7 Robin Road,100.0,15066,West Roxbury,West Roxbury,"Boulger, Michael",Suffolk County,8/31/2010,2010-08-31,City of Boston,Police Officer,,"Coppinger, Edward F.",Individual,201,2010 Pre-election Report (ND),MA,Not Specified,0,dac0d660-b455-57fe-a491-1181195fef8a,02132,02132,Edward Coppinger
4 President Road,100.0,15066,West Roxbury,West Roxbury,"LaCroix, James",Suffolk County,2/10/2011,2011-02-10,City of Boston,Police Officer,,"Coppinger, Edward F.",Individual,201,2011 Mid-Year Report (ND),MA,Not Specified,0,d68ae8d8-9ae1-512f-897a-a7d352a0e087,02132,02132,Edward Coppinger
113 Vogel Street,200.0,15066,West Roxbury,West Roxbury,"Coppinger, Joseph",Suffolk County,4/19/2012,2012-04-19,City of Boston,Police Officer,,"Coppinger, Edward F.",Individual,201,2012 Pre-primary Report (ND),MA,Not Specified,0,ca249591-2d2c-531a-b01c-23afcb942502,02132,02132,Edward Coppinger
4 President Road,100.0,15066,West Roxbury,West Roxbury,"LaCroix, James",Suffolk County,4/19/2012,2012-04-19,City of Boston,Police Officer,,"Coppinger, Edward F.",Individual,201,2012 Pre-primary Report (ND),MA,Not Specified,0,cb9ea223-119d-5a33-ae9c-c6cda526e4f2,02132,02132,Edward Coppinger
56 Metropolitan Avenue,200.0,15066,Roslindale,Roslindale,"Wells, Joseph",Suffolk County,4/21/2012,2012-04-21,Longwood Security Services,Police Officer,,"Coppinger, Edward F.",Individual,201,2012 Pre-primary Report (ND),MA,Not Specified,0,ff2bf1aa-d157-5fed-905b-42d649fd6640,02131,02131,Edward Coppinger
40 Cotuit Street,100.0,15066,West Roxbury,West Roxbury,"Daly, Charles",Suffolk County,2/3/2013,2013-02-03,City of Boston,Police Officer,,"Coppinger, Edward F.",Individual,201,2013 Mid-Year Report (ND),MA,Not Specified,0,7f214046-3051-5915-85c2-b636c482d20f,02132,02132,Edward Coppinger
113 Vogel Street,100.0,15066,West Roxbury,West Roxbury,"Coppinger, Joseph",Suffolk County,2/7/2013,2013-02-07,City of Boston,Police Officer,,"Coppinger, Edward F.",Individual,201,2013 Mid-Year Report (ND),MA,Not Specified,0,d6d17f81-fe08-514a-8aa1-6f3bb5ddfbd4,02132,02132,Edward Coppinger
173 Belgrade Ave,250.0,15066,Roslindale,Roslindale,"Giannopoulos, Anastasios",Suffolk County,2/18/2014,2014-02-18,Boston University,Police Officer,,"Coppinger, Edward F.",Individual,201,2014 Pre-primary Report (ND),MA,Not Specified,0,56a54185-024a-5926-a1ff-026f169ccded,02131,02131,Edward Coppinger
4 President Road,200.0,15066,West Roxbury,West Roxbury,"LaCroix, James",Suffolk County,2/19/2014,2014-02-19,City of Boston,Police Officer,,"Coppinger, Edward F.",Individual,201,2014 Pre-primary Report (ND),MA,Not Specified,0,28b24927-53b9-5624-b4c7-00c1bdec9986,02132,02132,Edward Coppinger
7 Robin Road,500.0,15066,West Roxbury,West Roxbury,"Boulger, Michael",Suffolk County,5/1/2014,2014-05-01,City of Boston,Police Officer,,"Coppinger, Edward F.",Individual,201,2014 Pre-primary Report (ND),MA,Not Specified,0,18be1b80-d7a3-569a-b2c3-b685989b3162,02132,02132,Edward Coppinger
113 Vogel Street,100.0,15066,West Roxbury,West Roxbury,"Coppinger, Joseph",Suffolk County,5/1/2014,2014-05-01,City of Boston,Police Officer,,"Coppinger, Edward F.",Individual,201,2014 Pre-primary Report (ND),MA,Not Specified,0,3375bdf8-b5e9-5dbc-9dd5-c41f14d369bb,02132,02132,Edward Coppinger
3 Searle Road,250.0,15066,West Roxbury,West Roxbury,"Cullity, James",Suffolk County,5/1/2014,2014-05-01,Boston Police,Police Officer,,"Coppinger, Edward F.",Individual,201,2014 Pre-primary Report (ND),MA,Not Specified,0,2d65373e-9057-590c-96d1-fb6a86358fb5,02132,02132,Edward Coppinger
6 Courtney Road,200.0,15066,West Roxbury,West Roxbury,"Curtin, Christopher",Suffolk County,5/1/2014,2014-05-01,Boston Police,Police Officer,,"Coppinger, Edward F.",Individual,201,2014 Pre-primary Report (ND),MA,Not Specified,0,834fb42a-6283-56e1-8c6d-27b8f87df4bd,02132,02132,Edward Coppinger
4 President Road,200.0,15066,West Roxbury,West Roxbury,"LaCroix, James",Suffolk County,1/29/2015,2015-01-29,City of Boston,Police Officer,,"Coppinger, Edward F.",Individual,201,2015 Mid-Year Report (ND),MA,,0,36ba47e7-332a-5b6b-baea-cb761eb601bf,02132,02132,Edward Coppinger
40 Cotuit Street,100.0,15066,West Roxbury,West Roxbury,"Daly, Charles",Suffolk County,11/15/2015,2015-11-15,City of Boston,Police Officer,,"Coppinger, Edward F.",Individual,201,2015 Year-end Report (ND),MA,,0,d0e3911c-8c1f-5a55-abff-7114a2076d04,02132,02132,Edward Coppinger
3 Searle Road,100.0,15066,West Roxbury,West Roxbury,"Cullity, James",Suffolk County,11/19/2015,2015-11-19,Boston Police,Police Officer,,"Coppinger, Edward F.",Individual,201,2015 Year-end Report (ND),MA,,0,4a93fe6e-573f-57d1-8ed6-974108dcf082,02132,02132,Edward Coppinger
6 Courtney Road,100.0,15066,West Roxbury,West Roxbury,"Curtin, Christopher",Suffolk County,11/19/2015,2015-11-19,Boston Police,Police Officer,,"Coppinger, Edward F.",Individual,201,2015 Year-end Report (ND),MA,,0,8b1663b9-e9a4-5912-a2c6-bfa66cf93d1a,02132,02132,Edward Coppinger
"19 Schaefer Ave, Apt 1",100.0,15066,Westwood,Westwood,"Kenneally, John",Norfolk County,11/19/2015,2015-11-19,City of Boston,Police Officer,,"Coppinger, Edward F.",Individual,201,2015 Year-end Report (ND),MA,,0,79d3fdcc-5439-5456-9f0b-fdf727e0f657,02090,02090,Edward Coppinger
113 Vogel Street,100.0,15066,West Roxbury,West Roxbury,"Coppinger, Joseph",Suffolk County,11/20/2015,2015-11-20,City of Boston,Police Officer,,"Coppinger, Edward F.",Individual,201,2015 Year-end Report (ND),MA,,0,a060d64e-9570-5edc-bfde-551f3a53fdb8,02132,02132,Edward Coppinger
4 President Road,200.0,15066,West Roxbury,West Roxbury,"LaCroix, James",Suffolk County,4/28/2016,2016-04-28,City of Boston,Police Officer,,"Coppinger, Edward F.",Individual,201,2016 Pre-primary Report (ND),MA,,0,c584ce29-1b86-5695-a1df-25fbbd9a8238,02132,02132,Edward Coppinger
7 Tobin Road,200.0,15066,West Roxbury,West Roxbury,"Boulger, Michael",Suffolk County,5/5/2016,2016-05-05,City of Boston,Police Officer,,"Coppinger, Edward F.",Individual,201,2016 Pre-primary Report (ND),MA,,0,a177efba-adc7-5123-9e20-b92a5b77df91,02132,02132,Edward Coppinger
6 Courtney Road,200.0,15066,West Roxbury,West Roxbury,"Curtin, Christopher",Suffolk County,5/5/2016,2016-05-05,Boston Police,Police Officer,,"Coppinger, Edward F.",Individual,201,2016 Pre-primary Report (ND),MA,,0,b7c7d560-c73c-57ce-a098-5c6d710e0e4c,02132,02132,Edward Coppinger
113 Vogel Street,200.0,15066,West Roxbury,West Roxbury,"Coppinger, Joseph",Suffolk County,11/2/2016,2016-11-02,City of Boston,Police Officer,,"Coppinger, Edward F.",Individual,201,2016 Year-end Report (ND),MA,,0,4564460f-35c9-56be-88b2-ad5f42ffd62a,02132,02132,Edward Coppinger
4 President Road,250.0,15066,West Roxbury,West Roxbury,"LaCroix, James",Suffolk County,11/2/2016,2016-11-02,City of Boston,Police Officer,,"Coppinger, Edward F.",Individual,201,2016 Year-end Report (ND),MA,,0,45958cc6-b247-509e-b083-88e89f5da33e,02132,02132,Edward Coppinger
97 Maplewood Street,500.0,15066,West Roxbury,West Roxbury,"Giannopoulos, Anastasios",Suffolk County,11/16/2016,2016-11-16,Boston University,Police Officer,,"Coppinger, Edward F.",Individual,201,2016 Year-end Report (ND),MA,,0,8aec7c77-8f90-50e7-9476-0713e82e0927,02132,02132,Edward Coppinger
"19 Schaefer Ave, Apt 1",100.0,15066,Westwood,Westwood,"Kenneally, John",Norfolk County,1/2/2017,2017-01-02,City of Boston,Police Officer,,"Coppinger, Edward F.",Individual,201,2017 Mid-Year Report (ND),MA,,0,4e4c416b-b452-50fb-a688-a40c21b35656,02090,02090,Edward Coppinger
4 President Road,150.0,15066,West Roxbury,West Roxbury,"LaCroix, James",Suffolk County,5/23/2017,2017-05-23,City of Boston,Police Officer,,"Coppinger, Edward F.",Individual,201,2017 Mid-Year Report (ND),MA,,0,28c59096-8a03-5820-adcd-18685847acb7,02132,02132,Edward Coppinger
113 Vogel Street,200.0,15066,West Roxbury,West Roxbury,"Coppinger, Joseph",Suffolk County,6/1/2017,2017-06-01,City of Boston,Police Officer,,"Coppinger, Edward F.",Individual,201,2017 Mid-Year Report (ND),MA,,0,25bea0e9-f63d-57f9-bd03-c8edd7664899,02132,02132,Edward Coppinger
40 Cotuit Street,100.0,15066,West Roxbury,West Roxbury,"Daly, Charles",Suffolk County,6/10/2017,2017-06-10,City of Boston,Police Officer,,"Coppinger, Edward F.",Individual,201,2017 Mid-Year Report (ND),MA,,0,e5291131-a020-57ba-9737-54ecf9dfad8a,02132,02132,Edward Coppinger
4 President Road,150.0,15066,West Roxbury,West Roxbury,"LaCroix, James",Suffolk County,2/14/2018,2018-02-14,City of Boston,Police Officer,,"Coppinger, Edward F.",Individual,201,2018 Pre-primary Report (ND),MA,,0,fa1ba258-d078-533e-b65c-c0da2d583912,02132,02132,Edward Coppinger
4 President Road,150.0,15066,West Roxbury,West Roxbury,"LaCroix, James",Suffolk County,5/10/2018,2018-05-10,City of Boston,Police Officer,,"Coppinger, Edward F.",Individual,201,2018 Pre-primary Report (ND),MA,,0,1203a288-4f5c-5774-9f87-5ba3d8e0a754,02132,02132,Edward Coppinger
71 Sanborn Ave,250.0,15066,West Roxbury,West Roxbury,"Mcmanus, Brian",Suffolk County,5/10/2018,2018-05-10,City of Boston,Police Office,,"Coppinger, Edward F.",Individual,201,2018 Pre-primary Report (ND),MA,,0,aa9e1751-1067-562a-b8d3-2fcf08186338,02132,02132,Edward Coppinger
16 Gilfeather Lane,500.0,15066,Kingston,Kingston,"Slattery, John",Plymouth County,5/15/2018,2018-05-15,Ma State Police,Police Officer,,"Coppinger, Edward F.",Individual,201,2018 Pre-primary Report (ND),MA,,0,e0e0118d-2a31-5ada-b94b-270a6058256f,02364,02364,Edward Coppinger
6 Courtney Road,200.0,15066,West Roxbury,West Roxbury,"Curtin, Christopher",Suffolk County,5/24/2018,2018-05-24,Boston Police,Police Officer,,"Coppinger, Edward F.",Individual,201,2018 Pre-primary Report (ND),MA,,0,1445182b-921d-5116-8348-7ec3e3df3aa2,02132,02132,Edward Coppinger
25 Amesbury Street,200.0,15066,West Roxbury,West Roxbury,"O'brien, Jerry",Suffolk County,5/24/2018,2018-05-24,Boston Police Dept,Police Office,,"Coppinger, Edward F.",Individual,201,2018 Pre-primary Report (ND),MA,,0,5dff32fb-1455-5b65-ae2b-d4fc86011711,02132,02132,Edward Coppinger
25 Amesbury Street,200.0,15066,West Roxbury,West Roxbury,"O'brien, Jerry",Suffolk County,3/26/2019,2019-03-26,Boston Police Dept,Police Office,,"Coppinger, Edward F.",Individual,201,2019 Mid-Year Report,MA,Not Specified,0,4c1ef7bc-c914-55b3-9036-d9b2894423cd,02132,02132,Edward Coppinger
113 Vogel Street,200.0,15066,West Roxbury,West Roxbury,"Coppinger, Joseph",Suffolk County,6/20/2019,2019-06-20,Boston Police Department,Police Office ,,"Coppinger, Edward F.",Individual,201,2019 Mid-Year Report,MA,Not Specified,0,8029fa0b-a549-5047-b411-7ab823b5a717,02132,02132,Edward Coppinger
12 Rutlegdge Road,500.0,15066,West Roxbury,West Roxbury,"Horan, Timothy",Suffolk County,6/20/2019,2019-06-20,City of Boston,Police Officer,,"Coppinger, Edward F.",Individual,201,2019 Mid-Year Report,MA,Not Specified,0,221632b2-55b6-5c9e-b0cc-0a04834023fc,02132,02132,Edward Coppinger
69 Studley Road,200.0,14535,Hyannis,Hyannis,"Baxter, Sr., Benjamin",Barnstable County,6/14/2016,2016-06-14,Barnstable PD,Police Sergeant,,"Crocker, Jr., William L.",Individual,201,2016 Pre-primary Report (ND),MA,,0,bd47f997-0b82-5be2-8d88-2ac1d0c37a15,02601,02601,Jr. Crocker
127 Main Street,100.0,14535,Sandwich,Sandwich,"Perry, Jeffrey",Barnstable County,6/14/2016,2016-06-14,Barnstable County Sheriff's Office,Special Sheriff,,"Crocker, Jr., William L.",Individual,201,2016 Pre-primary Report (ND),MA,,0,2f8b31f0-8fea-5063-b79b-c8a6a15127da,02563,02563,Jr. Crocker
20 Hudson Street,250.0,14535,Falmouth,Falmouth,"Cummings,, James",Barnstable County,6/18/2016,2016-06-18,Barnstable County Sheriff's Office,Sheriff,,"Crocker, Jr., William L.",Individual,201,2016 Pre-primary Report (ND),MA,,0,f012590b-bee6-53c3-a62e-3b99f83b5d23,02540,02540,Jr. Crocker
127 Main Street,50.0,14535,Sandwich,Sandwich,"Perry, Jeffrey",Barnstable County,7/25/2016,2016-07-25,Barnstable County Sheriff's Office,Special Sheriff,,"Crocker, Jr., William L.",Individual,201,2016 Pre-primary Report (ND),MA,,0,60cbca3b-3c7c-5cf6-a444-13fdeac36aee,02563,02563,Jr. Crocker
127 Main Street,50.0,14535,Sandwich,Sandwich,"Perry, Jeffrey",Barnstable County,8/17/2016,2016-08-17,Barnstable County Sheriff's Office,Special Sheriff,,"Crocker, Jr., William L.",Individual,201,2016 Pre-primary Report (ND),MA,,0,22ee8030-9783-5ffe-9e27-c59ecc68115d,02563,02563,Jr. Crocker
20 Hudson Street,100.0,14535,Falmouth,Falmouth,"Cummings,, James",Barnstable County,9/30/2016,2016-09-30,Barnstable County Sheriff's Office,Sheriff,,"Crocker, Jr., William L.",Individual,201,2016 Pre-election Report (ND),MA,,0,8987feba-e307-59d6-a1bf-6fbfe211a94b,02540,02540,Jr. Crocker
127 Main Street,100.0,14535,Sandwich,Sandwich,"Perry, Jeffrey",Barnstable County,9/30/2016,2016-09-30,Barnstable County Sheriff's Office,Special Sheriff,,"Crocker, Jr., William L.",Individual,201,2016 Pre-election Report (ND),MA,,0,8615a40d-1c24-57f2-acb7-18b90b81f3b8,02563,02563,Jr. Crocker
127 Main Street,100.0,14535,Sandwich,Sandwich,"Perry, Jeffrey",Barnstable County,2/10/2017,2017-02-10,Barnstable County Sheriff's Office,Special Sheriff,,"Crocker, Jr., William L.",Individual,201,2017 Mid-Year Report (ND),MA,,0,92b9bee9-eabf-5f35-84a5-063984b8852a,02563,02563,Jr. Crocker
127 Main Street,50.0,14535,Sandwich,Sandwich,"Perry, Jeffrey",Barnstable County,6/15/2017,2017-06-15,Barnstable County Sheriff's Office,Special Sheriff,,"Crocker, Jr., William L.",Individual,201,2017 Mid-Year Report (ND),MA,,0,04f83fca-1f1c-586c-8d7f-06e4a13a3d28,02563,02563,Jr. Crocker
20 Hudson Street,100.0,14535,Falmouth,Falmouth,"Cummings, James",Barnstable County,8/22/2017,2017-08-22,Barnstable County Sheriff's Office,Sheriff,,"Crocker, Jr., William L.",Individual,201,2017 Year-end Report (ND),MA,,0,5576edfe-4fdf-5b6c-8b8c-2faf7b311c16,02540,02540,Jr. Crocker
127 Main Street,75.0,14535,Sandwich,Sandwich,"Perry, Jeffrey",Barnstable County,8/22/2017,2017-08-22,Barnstable County Sheriff's Office,Special Sheriff,,"Crocker, Jr., William L.",Individual,201,2017 Year-end Report (ND),MA,,0,61e62c59-ba5a-5920-930b-f5c586b5cd3e,02563,02563,Jr. Crocker
127 Main Street,50.0,14535,Sandwich,Sandwich,"Perry, Jeffrey",Barnstable County,5/8/2018,2018-05-08,Barnstable County Sheriff's Office,Special Sheriff,,"Crocker, Jr., William L.",Individual,201,2018 Pre-primary Report (ND),MA,,0,7798d5a4-8668-5207-9a0e-e639bba91ffc,02563,02563,Jr. Crocker
20 Hudson Street,100.0,14535,Falmouth,Falmouth,"Cummings, James",Barnstable County,8/14/2018,2018-08-14,Barnstable County Sheriff's Office,Sheriff,,"Crocker, Jr., William L.",Individual,201,2018 Pre-primary Report (ND),MA,,0,b6481f2e-ff3a-5dcf-b3a9-a37f1327b723,02540,02540,Jr. Crocker
127 Main Street,50.0,14535,Sandwich,Sandwich,"Perry, Jeffrey",Barnstable County,8/14/2018,2018-08-14,Barnstable County Sheriff's Office,Special Sheriff,,"Crocker, Jr., William L.",Individual,201,2018 Pre-primary Report (ND),MA,,0,ea3aac56-207f-5ff5-8b25-a1bbf64a85b9,02563,02563,Jr. Crocker
20 Hudson Street,100.0,14535,Falmouth,Falmouth,"Cummings, James",Barnstable County,10/13/2018,2018-10-13,Barnstable County Sheriff's Office,Sheriff,,"Crocker, William L.",Individual,201,2018 Pre-Election Report,MA,Not Specified,0,d1f4976d-0633-510c-a4fc-8cff1db4b07e,02540,02540,William Crocker
127 Main Street,100.0,14535,Sandwich,Sandwich,"Perry, Jeffrey",Barnstable County,10/13/2018,2018-10-13,Barnstable County Sheriff's Office,Special Sheriff,,"Crocker, William L.",Individual,201,2018 Pre-Election Report,MA,Not Specified,0,5aaaf60c-3dd0-501e-9c7b-5918d0c1182e,02563,02563,William Crocker
127 Main Street,50.0,14535,Sandwich,Sandwich,"Perry, Jeffrey",Barnstable County,7/25/2019,2019-07-25,Barnstable County Sheriff's Office,Special Sheriff,,"Crocker, William L.",Individual,201,2019 Year-end Report,MA,Not Specified,0,a71f002d-3e73-5724-b948-ef6fc3e7321d,02563,02563,William Crocker
50 Sheep Meadoww Road,50.0,14535,West Barnstable,West Barnstable,"Sweeney, John",Barnstable County,3/8/2016,2016-03-08,Barnstable Police Department,Sargent,,"Crocker, Jr., William L.",Individual,201,2016 Pre-primary Report (ND),MA,,0,e88694fc-bbfe-564b-8043-373ff4d6c7df,02668,02668,Jr. Crocker
50 Sheep Meadoww Road,50.0,14535,West Barnstable,West Barnstable,"Sweeney, John",Barnstable County,7/15/2016,2016-07-15,Barnstable Police Department,Sargent,,"Crocker, Jr., William L.",Individual,201,2016 Pre-primary Report (ND),MA,,0,0a73b9f4-a57a-55a4-ba2e-ea002c901319,02668,02668,Jr. Crocker
50 Sheep Meadoww Road,50.0,14535,West Barnstable,West Barnstable,"Sweeney, John",Barnstable County,10/12/2016,2016-10-12,Barnstable Police Department,Sargent,,"Crocker, Jr., William L.",Individual,201,2016 Pre-election Report (ND),MA,,0,faa7e096-a6dc-5f9f-a994-86ff944fc913,02668,02668,Jr. Crocker
50 Sheep Meadoww Road,50.0,14535,West Barnstable,West Barnstable,"Sweeney, John",Barnstable County,6/12/2017,2017-06-12,Barnstable Police Department,Sargent,,"Crocker, Jr., William L.",Individual,201,2017 Mid-Year Report (ND),MA,,0,1d7d57c2-bb72-5f1a-9e00-3119bc8699ba,02668,02668,Jr. Crocker
50 Sheep Meadoww Road,50.0,14535,West Barnstable,West Barnstable,"Sweeney, John",Barnstable County,8/22/2017,2017-08-22,Barnstable Police Department,Sargent,,"Crocker, Jr., William L.",Individual,201,2017 Year-end Report (ND),MA,,0,a34ad452-eb79-5c2f-8094-293746da2341,02668,02668,Jr. Crocker
50 Sheep Meadoww Road,50.0,14535,West Barnstable,West Barnstable,"Sweeney, John",Barnstable County,12/2/2017,2017-12-02,Barnstable Police Department,Sargent,,"Crocker, Jr., William L.",Individual,201,2017 Year-end Report (ND),MA,,0,cfe5c95f-d63c-5825-bd42-2e77462e1fad,02668,02668,Jr. Crocker
50 Sheep Meadoww Road,50.0,14535,West Barnstable,West Barnstable,"Sweeney, John",Barnstable County,5/8/2018,2018-05-08,Barnstable Police Department,Sargent,,"Crocker, Jr., William L.",Individual,201,2018 Pre-primary Report (ND),MA,,0,af3cdad5-5053-55dc-a19b-471abf5e84ba,02668,02668,Jr. Crocker
5 Summer Street,125.0,15444,Mattapoisett,Mattapoisett,"Machado, James M.",Plymouth County,10/5/2015,2015-10-05,Massachusetts Police Association,Legislative Agent,,"Cronin, Claire ",Individual,201,2015 Year-end Report (ND),MA,,0,8884f2c3-a7a6-55bf-a1fe-b3b2c6bc42a7,02739,02739,Claire Cronin
240 Lewis Circle,100.0,12023,Punta Gorda,,"Desilva, Wayne",,4/9/2014,2014-04-09,,Law Enforcement,,"Cruz, John F.",Individual,201,2014 Pre-primary Report (ND),FL,Not Specified,0,45629a44-1d92-583d-b56b-8d860feb8b1a,33950,NA,John Cruz
120 Harvest Lane,50.0,12023,Bridgewater,Bridgewater,"Thaxter, Kenneth",Plymouth County,4/9/2014,2014-04-09,,Law Enforcement,,"Cruz, John F.",Individual,201,2014 Pre-primary Report (ND),MA,Not Specified,0,5fcdeb07-c7fe-5789-b9f8-ec73d79f6baa,02324,02324,John Cruz
1980 South Street,100.0,12023,Bridgewater,Bridgewater,"Bryant, Kenneth",Plymouth County,6/26/2014,2014-06-26,,Law Enforcement,,"Cruz, John F.",Individual,201,2014 Pre-primary Report (ND),MA,Not Specified,0,4b79d47d-9753-50df-998b-08e173486948,02324,02324,John Cruz
25 Boxwood Lane,100.0,12023,Bridgewater,Bridgewater,"Caprenito, William",Plymouth County,6/26/2014,2014-06-26,,Law Enforcement,,"Cruz, John F.",Individual,201,2014 Pre-primary Report (ND),MA,Not Specified,0,08eb6c15-d239-569a-a5fe-62ab30c8e3ca,02324,02324,John Cruz
PO Box 168,100.0,12023,West Bridgewater,West Bridgewater,"Bunker, Michael",Plymouth County,8/30/2014,2014-08-30,,Law enforcement,,"Cruz, John F.",Individual,201,2014 Pre-election Report (ND),MA,Not Specified,0,dbf05f29-8251-51a3-9776-ce1eee6cabf2,02379,02379,John Cruz
1029 Ash Street,35.0,12023,Brockton,Brockton,"Crowley, John",Plymouth County,8/30/2014,2014-08-30,,Law Enforcement,,"Cruz, John F.",Individual,201,2014 Pre-election Report (ND),MA,Not Specified,0,46ca5bf7-db6b-54fb-b558-60fcc492ad9b,02301,02301,John Cruz
26 Ortolani Circle,50.0,12023,Kingston,Kingston,"McDonald, Joseph",Plymouth County,8/30/2014,2014-08-30,,Law Enforcement,,"Cruz, John F.",Individual,201,2014 Pre-election Report (ND),MA,Not Specified,0,d42013c1-d1a2-5b55-998f-0f18a1727e02,02364,02364,John Cruz
120 Harvest Lane,30.0,12023,Bridgewater,Bridgewater,"Thaxter, Ken",Plymouth County,8/30/2014,2014-08-30,,Law enforcement,,"Cruz, John F.",Individual,201,2014 Pre-election Report (ND),MA,Not Specified,0,eed10ec6-0377-5e10-adab-e0504b3a07b6,02324,02324,John Cruz
45 Captain's Way,100.0,12023,East Bridgewater,East Bridgewater,"Clark, Donald",Plymouth County,10/7/2014,2014-10-07,,Law Enforcement,,"Cruz, John F.",Individual,201,2014 Pre-election Report (ND),MA,Not Specified,0,3537ded6-9686-5d25-8a1c-6be599d17982,02333,02333,John Cruz
118 Piermont St,50.0,12023,Quincy,Quincy,"Hallisey, John",Norfolk County,10/7/2014,2014-10-07,,Law Enforcement,,"Cruz, John F.",Individual,201,2014 Pre-election Report (ND),MA,Not Specified,0,6d6f860b-6aa7-59c6-b8d6-41282588ca73,02170,02170,John Cruz
4 Gordon St,50.0,12023,Brockton,Brockton,"Carpenter, William ",Plymouth County,10/17/2014,2014-10-17,,Law Enforcement,,"Cruz, John F.",Individual,201,2014 Pre-election Report (ND),MA,Not Specified,0,398501c9-a81a-51cd-b350-ea350073cf9e,02301,02301,John Cruz
26 Ortolani Circle,100.0,12023,Kingston,Kingston,"McDonald Jr, Joseph",Plymouth County,4/9/2014,2014-04-09,,Sheriff,,"Cruz, John F.",Individual,201,2014 Pre-primary Report (ND),MA,Not Specified,0,b8f3674d-e112-5bc1-93d0-30f9c2004be2,02364,02364,John Cruz
9 Crockett Ave,200.0,15621,Boston,Dorchester Center,"Broderik, Jr., John",Suffolk County,5/7/2013,2013-05-07,Boston,Police Officer,,"Cullinane, Dan",Individual,201,2013 Mid-Year Report (ND),MA,Not Specified,0,74f8083d-4b4a-5167-807a-bed69ba6cd52,02124,02124,Dan Cullinane
177 Milton St,200.0,15621,Boston,Dorchester Center,"Flaherty, Patrick",Suffolk County,6/1/2013,2013-06-01,Boston,Police Officer,,"Cullinane, Dan",Individual,201,2013 Mid-Year Report (ND),MA,Not Specified,0,ff82232d-7a1a-55d2-8f04-71a73ee72797,02124,02124,Dan Cullinane
16 Saint Brendan Rd,250.0,15621,Boston,Dorchester Center,"Young, Joseph",Suffolk County,7/30/2013,2013-07-30,Boston Police Department,Police Officer,,"Cullinane, Dan",Individual,201,2013 Pre-election Report (Special) (ND),MA,Not Specified,0,efed8396-38f9-544c-9093-ad3d93a2b5e9,02124,02124,Dan Cullinane
9 Crockett Ave,500.0,15621,Boston,Dorchester Center,"Broderick, John",Suffolk County,4/12/2014,2014-04-12,Boston,Police Officer,,"Cullinane, Dan",Individual,201,2014 Pre-primary Report (ND),MA,Not Specified,0,fcbc5e11-984a-5e33-9061-18f694f0e4ae,02124-5807,02124,Dan Cullinane
177 Milton St,100.0,15621,Dorchester,Dorchester Center,"Flaherty, Patrick",Suffolk County,5/28/2014,2014-05-28,Boston,Police Officer,,"Cullinane, Dan",Individual,201,2014 Pre-primary Report (ND),MA,Not Specified,0,ab0acb81-d552-5763-aa56-8e1fbcd5bee2,02124-5319,02124,Dan Cullinane
35 Lawley St,500.0,15621,Dorchester,Dorchester,"Flynn, Robert",Suffolk County,6/2/2014,2014-06-02,Boston Police Dept.,Police Officer,,"Cullinane, Dan",Individual,201,2014 Pre-primary Report (ND),MA,Not Specified,0,1f00594d-9692-561f-972d-c70e40e5cd19,02122-3607,02122,Dan Cullinane
16 Saint Brendan Rd,300.0,15621,Boston,Dorchester Center,"Young, Joseph",Suffolk County,8/18/2014,2014-08-18,Boston Police Department,Police Officer,,"Cullinane, Dan",Individual,201,2014 Pre-primary Report (ND),MA,Not Specified,0,b933361b-5350-57b9-aaa3-6b1ae1969932,02124-5813,02124,Dan Cullinane
98 Myrtlebank Ave,100.0,15621,Dorchester,Dorchester Center,"Woods, Lauren",Suffolk County,8/22/2014,2014-08-22,City of Boston,Police officer,,"Cullinane, Dan",Individual,201,2014 Pre-primary Report (ND),MA,Not Specified,0,a96cc9e8-2cc0-5523-a4a0-07cc1e52f61d,02124-5820,02124,Dan Cullinane
9 Crockett Ave,250.0,15621,Boston,,"Broderick, John",,12/19/2015,2015-12-19,Boston,Police Officer,,"Cullinane, Dan",Individual,201,2015 Year-end Report (ND),MA,,0,b0d893df-a030-51bb-a3aa-b61ad23e8c3d,02101,NA,Dan Cullinane
177 Milton Street,500.0,15621,Dorchester,Dorchester Center,"Flaherty, Patrick",Suffolk County,5/3/2017,2017-05-03,Boston Police Department,Police Officer,,"Cullinane, Dan",Individual,201,2017 Mid-Year Report,MA,Not Specified,0,1ac3e29a-d6d7-5db3-90a4-a1af4be5c929,02124,02124,Dan Cullinane
177 Milton Street,500.0,15621,Dorchester,Dorchester Center,"Flaherty, Patrick",Suffolk County,8/10/2018,2018-08-10,Boston Police Department,Police Officer,,"Cullinane, Dan",Individual,201,2018 Pre-Primary Report,MA,Not Specified,0,3a1d6029-1072-522f-807e-e8834647a826,02124,02124,Dan Cullinane
24 Elm Street,500.0,15621,Hanover,Hanover,"Bickerton, Dean",Plymouth County,8/28/2018,2018-08-28,City of Boston,Police Officer,,"Cullinane, Dan",Individual,201,2018 Pre-Election Report,MA,Not Specified,0,4e8405bd-1a9d-56c8-839c-decebf13e1ac,02339,02339,Dan Cullinane
177 Milton Street,500.0,15621,Dorchester,Dorchester Center,"Flaherty, Patrick",Suffolk County,6/25/2019,2019-06-25,Boston Police Department,Police Officer,,"Cullinane, Dan",Individual,201,2019 Mid-Year Report,MA,Not Specified,0,466d5abf-fc47-54c3-8c7e-645ff1cb83f0,02124,02124,Dan Cullinane
16 Saint Brendan Rd,500.0,15621,Boston,Dorchester Center,"Young, Joseph",Suffolk County,10/16/2019,2019-10-16,Boston Police Department,Police Officer,,"Cullinane, Dan",Individual,201,2019 Year-end Report,MA,Not Specified,0,54c6bfc9-526a-5dc0-ada5-e86fa8ddf97c,02124,02124,Dan Cullinane
24 Elm St,500.0,15621,Hanover,Hanover,"Bickerton, Dean",Plymouth County,11/19/2015,2015-11-19,City of Boston,Law Enforcement,,"Cullinane, Dan",Individual,201,2015 Year-end Report (ND),MA,,0,c3704916-fcea-5742-92f4-e2711777e33c,02339,02339,Dan Cullinane
24 Elm Street,200.0,15621,Hanover,Hanover,"Bickerton, Dean",Plymouth County,5/19/2016,2016-05-19,City of Boston,Law Enforcement,,"Cullinane, Dan",Individual,201,2016 Pre-primary Report (ND),MA,,0,a9be6c59-69f9-54ab-9666-8faa92eb745b,02339,02339,Dan Cullinane
9 Crockett Avenue,250.0,15621,Dorchester,Dorchester Center,"Broderick, John",Suffolk County,5/19/2016,2016-05-19,City of Boston,Law Enforcement,,"Cullinane, Dan",Individual,201,2016 Pre-primary Report (ND),MA,,0,5bd10169-f21a-52a3-8080-8ca87a161ff9,02124,02124,Dan Cullinane
Milton Street,250.0,15621,Dorchester,Dorchester Center,"Flaherty, Patrick",Suffolk County,5/23/2016,2016-05-23,City of Boston,Law Enforcement,,"Cullinane, Dan",Individual,201,2016 Pre-primary Report (ND),MA,,0,4d6fc66e-d445-5d64-affc-b36067af8a83,02124,02124,Dan Cullinane
63 Charlemont St,100.0,15621,Dorchester,Dorchester,"Murphy, Brendan",Suffolk County,5/28/2014,2014-05-28,Commonwealth of Mass,State Trooper,,"Cullinane, Dan",Individual,201,2014 Pre-primary Report (ND),MA,Not Specified,0,73e25966-57f7-521c-be8b-34408ccb54df,02122-2101,02122,Dan Cullinane
9 Brook St,500.0,15621,Bellingham,Bellingham,"Kearns, Paul",Norfolk County,7/16/2013,2013-07-16,"Bellingham Police, Fire, and EMS Supply LLC",Owner,,"Cullinane, Dan",Individual,201,2013 Pre-primary Report (Special) (ND),MA,Not Specified,0,238f0586-2b91-5de2-831d-570a954b6bd7,02019,02019,Dan Cullinane
56 Columbus Ave.,100.0,15177,Braintree,Braintree,"McDonough, Richard",Norfolk County,9/17/2012,2012-09-17,Norfolk County Sheriff's Office,Asst. Deputy Sheriff,,"Cusack, Mark James",Individual,201,2012 Pre-election Report (ND),MA,Not Specified,0,c50f368e-3251-583d-b59f-bb5f6ad3580c,02184,02184,Mark Cusack
56 Columbus Ave.,200.0,15177,Braintree,Braintree,"McDonough, Richard B.",Norfolk County,11/19/2013,2013-11-19,Norfolk County Sheriff's Office,Asst. Deputy Sheriff,,"Cusack, Mark James",Individual,201,2013 Year-end Report (ND),MA,Not Specified,0,a5a56a5d-adfe-59b1-84d0-1697101d983a,02184,02184,Mark Cusack
56 Columbus Ave.,200.0,15177,Braintree,Braintree,"McDonough, Richard B.",Norfolk County,4/14/2014,2014-04-14,Norfolk County Sheriff's Office,Asst. Deputy Sheriff,,"Cusack, Mark James",Individual,201,2014 Pre-primary Report (ND),MA,Not Specified,0,1e55ea2f-fe4b-59f8-95b0-d81ae08a7a5e,02184,02184,Mark Cusack
56 Columbus Ave.,200.0,15177,Braintree,Braintree,"McDonough, Richard B.",Norfolk County,11/11/2014,2014-11-11,Norfolk County Sheriff's Office,Asst. Deputy Sheriff,,"Cusack, Mark James",Individual,201,2014 Year-end Report (ND),MA,Not Specified,0,df687101-2218-55fb-a119-01cf19afaf98,02184,02184,Mark Cusack
56 Columbus Ave.,200.0,15177,Braintree,Braintree,"McDonough, Richard",Norfolk County,4/27/2015,2015-04-27,Norfolk County Sheriff's Office,Asst. Deputy Sheriff,,"Cusack, Mark James",Individual,201,2015 Mid-Year Report (ND),MA,,0,8248cccc-f8c6-507e-af48-d16044431524,02184,02184,Mark Cusack
56 Columbus Ave.,300.0,15177,Braintree,Braintree,"McDonough, Richard B.",Norfolk County,12/2/2015,2015-12-02,Norfolk County Sheriff's Office,Asst. Deputy Sheriff,,"Cusack, Mark James",Individual,201,2015 Year-end Report (ND),MA,,0,0cee1399-de19-52da-a2ea-84e8d2249877,02184,02184,Mark Cusack
56 Columbus Ave.,100.0,15177,Braintree,Braintree,"McDonough, Richard",Norfolk County,3/24/2016,2016-03-24,Norfolk County Sheriff's Office,Asst. Deputy Sheriff,,"Cusack, Mark James",Individual,201,2016 Pre-primary Report (ND),MA,,0,e65f9df4-2bc3-55fa-b0e8-04d8cb8fcfca,02184,02184,Mark Cusack
56 Columbus Ave.,500.0,15177,Braintree,Braintree,"McDonough, Richard B.",Norfolk County,5/23/2016,2016-05-23,Norfolk County Sheriff's Office,Asst. Deputy Sheriff,,"Cusack, Mark James",Individual,201,2016 Pre-primary Report (ND),MA,,0,55672dcc-34b8-5feb-a3c1-efcb7a16c424,02184,02184,Mark Cusack
56 Columbus Ave.,200.0,15177,Braintree,Braintree,"McDonough, Richard B.",Norfolk County,11/5/2016,2016-11-05,Norfolk County Sheriff's Office,Asst. Deputy Sheriff,,"Cusack, Mark James",Individual,201,2016 Year-end Report (ND),MA,,0,2bd91f7c-6222-5b41-be70-9db1a78abdcd,02184,02184,Mark Cusack
56 Columbus Ave.,500.0,15177,Braintree,Braintree,"McDonough, Richard",Norfolk County,4/13/2017,2017-04-13,Norfolk County Sheriff's Office,Asst. Deputy Sheriff,,"Cusack, Mark James",Individual,201,2017 Mid-Year Report (ND),MA,,0,4eb8a050-d2c0-59e8-a931-38fc9e7a8c07,02184,02184,Mark Cusack
56 Columbus Ave.,100.0,15177,Braintree,Braintree,"McDonough, Richard B.",Norfolk County,4/13/2017,2017-04-13,Norfolk County Sheriff's Office,Asst. Deputy Sheriff,,"Cusack, Mark James",Individual,201,2017 Mid-Year Report (ND),MA,,0,e4643962-3ebd-56e2-8518-dc35ab4c1b63,02184,02184,Mark Cusack
56 Columbus Ave.,500.0,15177,Braintree,Braintree,"McDonough, Richard B.",Norfolk County,12/21/2017,2017-12-21,Norfolk County Sheriff's Office,Asst. Deputy Sheriff,,"Cusack, Mark James",Individual,201,2017 Year-end Report (ND),MA,,0,30299be4-70c1-5ea5-bd4b-a070ebb39687,02184,02184,Mark Cusack
56 Columbus Ave.,200.0,15177,Braintree,Braintree,"McDonough, Richard B.",Norfolk County,3/26/2018,2018-03-26,Norfolk County Sheriff's Office,Asst. Deputy Sheriff,,"Cusack, Mark James",Individual,201,2018 Pre-primary Report (ND),MA,,0,f9a7b05e-f56e-5ca6-b729-e13b42c21af0,02184,02184,Mark Cusack
3 Edwards Rd,50.0,15177,Braintree,Braintree,"Hunter, Edward F.",Norfolk County,9/17/2012,2012-09-17,Commonwealth of Ma,State Trooper,,"Cusack, Mark James",Individual,201,2012 Pre-election Report (ND),MA,Not Specified,0,1e99779d-992d-519b-9840-2fa057f88514,02184,02184,Mark Cusack
3 Edwards Rd,50.0,15177,Braintree,Braintree,"Hunter, Edward F.",Norfolk County,11/29/2013,2013-11-29,Commonwealth of Ma,State Trooper,,"Cusack, Mark James",Individual,201,2013 Year-end Report (ND),MA,Not Specified,0,15a0cb88-c4dd-52b1-81de-17476cebcb1e,02184,02184,Mark Cusack
3 Edwards Rd,50.0,15177,Braintree,Braintree,"Hunter, Edward F.",Norfolk County,11/5/2016,2016-11-05,Commonwealth of Ma,State Trooper,,"Cusack, Mark James",Individual,201,2016 Year-end Report (ND),MA,,0,3dbeb378-fb46-5657-8d05-5a142509c003,02184,02184,Mark Cusack
45 Lakeview Ave,200.0,15177,Braintree,Braintree,"McCarthy, Robert",Norfolk County,12/21/2017,2017-12-21,Mass State Police,Sergeant,,"Cusack, Mark James",Individual,201,2017 Year-end Report (ND),MA,,0,cd766511-e9fd-5bab-a1f2-173ba7d1b1b7,02184,02184,Mark Cusack
25 Vine St,25.0,15012,Duxbury,Duxbury,"Bayramshian, Richard",Plymouth County,10/27/2011,2011-10-27,Town of Duxbury,Retired Police Officer,,"Cutler, Josh",Individual,201,2011 Year-end Report (ND),MA,Not Specified,0,0e859f0a-6e37-5332-aa11-5613863f3f0b,02332,02332,Josh Cutler
53 Applewood Drive,200.0,15481,Ludlow,Ludlow,"Mendes, Mark",Hampden County,5/31/2012,2012-05-31,Town of Ludlow,Police officer,,"DaCruz, John P.",Individual,201,5/31/12 Deposit Report,MA,Check,1,17732263-d8fc-523f-a20e-be14d73dd142,01056,01056,John DaCruz
8615 Thomas Mill Terrace,125.0,13736,Philadelphia,,"Bard, Branville",,12/19/2019,2019-12-19,City of Cambridge,Police Commissioner,,"Decker, Marjorie C.",Individual,201,2019 Year-end Report,PA,Not Specified,0,72907f69-7088-5e5f-a184-a36100316a9f,19128,NA,Marjorie Decker
10 Nevada Road,200.0,13736,Burlington,Burlington,"McEachern, Joanne",Middlesex County,5/24/2018,2018-05-24,City of Cambridge,Detective,,"Decker, Marjorie C.",Individual,201,2018 Pre-primary Report (ND),MA,,0,47eca504-c9fc-5ef6-8d8d-9d4f398aaab6,01803,01803,Marjorie Decker
1 Tanglewood Dr,250.0,11413,Saugus,Saugus,"Callahan, David",Essex County,4/13/2010,2010-04-13,City of Revere,Police Lt,,"DeLeo, Robert A.",Individual,201,2010 Pre-primary Report (ND),MA,Not Specified,0,f5ca38b3-72c0-5a31-a25c-a498c40143c0,01906-4453,01906,Robert DeLeo
47 Winthrop Pkwy,125.0,11413,Revere,Revere,"Crisafi, Mary",Suffolk County,4/13/2010,2010-04-13,Town of Winthrop,Police Officer,,"DeLeo, Robert A.",Individual,201,2010 Pre-primary Report (ND),MA,Not Specified,0,0251f256-3b5e-54b3-992b-1b3de6946315,02151-3727,02151,Robert DeLeo
2 Marina Dr,250.0,11413,Mattapoisett,Mattapoisett,"DeLeo, Joseph",Plymouth County,4/13/2010,2010-04-13,City of Revere,Police Officer,,"DeLeo, Robert A.",Individual,201,2010 Pre-primary Report (ND),MA,Not Specified,0,bdd7f288-9976-508b-957f-03faf0689ec0,02739-1732,02739,Robert DeLeo
1 Tanglewood Dr,150.0,11413,Saugus,Saugus,"Callahan, David",Essex County,10/15/2010,2010-10-15,City of Revere,Police Lt,,"DeLeo, Robert A.",Individual,201,2010 Pre-election Report (ND),MA,Not Specified,0,5ddbe533-957b-5b38-94bc-57b07ce437eb,01906-4453,01906,Robert DeLeo
2 Marina Dr,500.0,11413,Mattapoisett,Mattapoisett,"DeLeo, Joseph",Plymouth County,3/30/2011,2011-03-30,City of Revere,Police Officer,,"DeLeo, Robert A.",Individual,201,2011 Mid-Year Report (ND),MA,Not Specified,0,3a125b2c-6557-5efd-831e-251b527cfa41,02739-1732,02739,Robert DeLeo
26 Hampshire Rd,100.0,11413,Peabody,Peabody,"Giorgetti, Ronald",Essex County,4/2/2011,2011-04-02,Town of Saugus,Police Officer,,"DeLeo, Robert A.",Individual,201,2011 Mid-Year Report (ND),MA,Not Specified,0,9d6cf33d-56ff-582f-8b85-cc5b649ae34b,01960-2135,01960,Robert DeLeo
48 Temple Ave,50.0,11413,Winthrop,Winthrop,"Delehanty, Terence",Suffolk County,10/31/2011,2011-10-31,Town of Winthrop,Chief of Police,,"DeLeo, Robert A.",Individual,201,2011 Year-end Report (ND),MA,Not Specified,0,d7b43e8a-0a1b-5c15-8cf5-af288f9dfcca,02152-1019,02152,Robert DeLeo
47 Summit Ave,500.0,11413,Winthrop,Winthrop,"Scarpa , Frank ",Suffolk County,12/31/2014,2014-12-31,Town of Winthrop,Police Lt.,,"DeLeo, Robert A.",Individual,201,2014 Year-end Report (ND),MA,Not Specified,0,c0e2ff39-f238-5f5a-a5a7-e278295d666f,02152-1035,02152,Robert DeLeo
22 Beal St,125.0,11413,Winthrop,Winthrop,"Carter Jr., Robert M.",Suffolk County,4/7/2015,2015-04-07,Town of Winthrop,Police Officer,,"DeLeo, Robert A.",Individual,201,2015 Mid-Year Report (ND),MA,,0,c3a18fb5-1875-562e-abc9-0868273e3fc1,02152-2728,02152,Robert DeLeo
1 Tanglewood Dr,125.0,11413,Saugus,Saugus,"Callahan, David J.",Essex County,4/10/2015,2015-04-10,City of Revere,Police Lt,,"DeLeo, Robert A.",Individual,201,2015 Mid-Year Report (ND),MA,,0,ff326910-9e3f-5aa7-ab95-cbc1a03ee595,01906-4453,01906,Robert DeLeo
48 Temple Ave,125.0,11413,Winthrop,Winthrop,"Delehanty, Terence M.",Suffolk County,4/10/2015,2015-04-10,Town of Winthrop,Chief of Police,,"DeLeo, Robert A.",Individual,201,2015 Mid-Year Report (ND),MA,,0,c9f36a79-5bc7-5f5f-9987-ed2f6158cd2f,02152-1019,02152,Robert DeLeo
72 Morningside Dr,200.0,11413,Walpole,Walpole,"Gambon, Andrew",Norfolk County,4/30/2015,2015-04-30,City of Boston,Police Officer,,"DeLeo, Robert A.",Individual,201,2015 Mid-Year Report (ND),MA,,0,52407f69-edf1-59f4-9d3d-db8c574802e8,02081-3121,02081,Robert DeLeo
48 Temple Ave,100.0,11413,Winthrop,Winthrop,"Delehanty, Terence M.",Suffolk County,4/1/2016,2016-04-01,Town of Winthrop,Chief of Police,,"DeLeo, Robert A.",Individual,201,2016 Pre-primary Report (ND),MA,Not Specified,0,0524d64e-9a8f-5732-b851-5d912357bbc0,02152-1019,02152,Robert DeLeo
1 Tanglewood Dr,125.0,11413,Saugus,Saugus,"Callahan, David J.",Essex County,4/4/2016,2016-04-04,City of Revere,Police Officer,,"DeLeo, Robert A.",Individual,201,2016 Pre-primary Report (ND),MA,Not Specified,0,2c6ea9cc-bc9f-5b9a-b052-3755fad86839,01906-4453,01906,Robert DeLeo
22 Beal St,125.0,11413,Winthrop,Winthrop,"Carter Jr., Robert M.",Suffolk County,4/6/2016,2016-04-06,Town of Winthrop,Police Officer,,"DeLeo, Robert A.",Individual,201,2016 Pre-primary Report (ND),MA,Not Specified,0,9e203607-a4e8-55d2-a5b6-389e86f1613b,02152-2728,02152,Robert DeLeo
35 Saint Francis St,100.0,11413,Medford,Medford,"Raso, Richard J",Middlesex County,6/2/2016,2016-06-02,City of Medford,Police Officer,,"DeLeo, Robert A.",Individual,201,2016 Pre-primary Report (ND),MA,Not Specified,0,13bdef8c-3af6-5675-b4f4-62247903ade7,02155-1828,02155,Robert DeLeo
219 Lowell St,200.0,11413,Arlington,Arlington,"Smith, Robert G.",Middlesex County,6/14/2016,2016-06-14,Emerson College,Campus Police,,"DeLeo, Robert A.",Individual,201,2016 Pre-primary Report (ND),MA,Not Specified,0,42379a87-294c-5b47-bbe3-f112c15a2c6f,02474-2734,02474,Robert DeLeo
22 Beal St,125.0,11413,Winthrop,Winthrop,"Carter Jr., Robert M.",Suffolk County,3/20/2017,2017-03-20,Town of Winthrop,Police Officer,,"DeLeo, Robert A.",Individual,201,2017 Mid-Year Report (ND),MA,Not Specified,0,bc0abb3f-b993-5710-85cb-24f4885ff4a8,02152-2728,02152,Robert DeLeo
1 Tanglewood Dr,250.0,11413,Saugus,Saugus,"Callahan, David J.",Essex County,4/7/2017,2017-04-07,City of Revere,Police Lt,,"DeLeo, Robert A.",Individual,201,2017 Mid-Year Report (ND),MA,Not Specified,0,d87c64d0-6687-59dc-9f45-13f9a4f4d964,01906-4453,01906,Robert DeLeo
47 Winthrop Pkwy,100.0,11413,Revere,Revere,"Crisafi, Mary Ellen",Suffolk County,10/21/2017,2017-10-21,Town of Winthrop,Police Officer,,"DeLeo, Robert A.",Individual,201,2017 Year-end Report (ND),MA,Not Specified,0,8cedd027-e5b4-555d-9583-a5cbc5ae2fb9,02151-3727,02151,Robert DeLeo
2 Dunstan Rd,200.0,11413,Lynnfield,Lynnfield,"DiMella, Domenic",Essex County,11/14/2017,2017-11-14,Saugus Police Department,Police Chief,,"DeLeo, Robert A.",Individual,201,2017 Year-end Report (ND),MA,Not Specified,0,eca75672-f0c3-5fae-adb2-a22051c24666,01940-1327,01940,Robert DeLeo
47 Sheridan St,200.0,11413,Jamaica Plain,Jamaica Plain,"Calderone, Lawrence",Suffolk County,12/29/2017,2017-12-29,City of Boston,Police Officer,,"DeLeo, Robert A.",Individual,201,2017 Year-end Report (ND),MA,Not Specified,0,4ef55725-4c62-59c4-aa67-f624884634d9,02130-1822,02130,Robert DeLeo
22 Beal St,125.0,11413,Winthrop,Winthrop,"Carter Jr., Robert M.",Suffolk County,3/15/2018,2018-03-15,Town of Winthrop,Police Officer,,"DeLeo, Robert A.",Individual,201,2018 Pre-primary Report (ND),MA,Not Specified,0,a73c9326-11e7-58c2-a7c5-168871f3c8a8,02152-2728,02152,Robert DeLeo
47 Winthrop Pkwy,125.0,11413,Revere,Revere,"Crisafi, Mary Ellen",Suffolk County,10/19/2018,2018-10-19,Town of Winthrop,Police Officer,,"DeLeo, Robert A.",Individual,201,2018 Pre-election Report (ND),MA,Not Specified,0,3714b2fd-dbe8-5039-8344-ab241c8d1935,02151-3727,02151,Robert DeLeo
22 Beal St,125.0,11413,Winthrop,Winthrop,"Carter Jr., Robert M.",Suffolk County,3/25/2019,2019-03-25,Town of Winthrop,Police Officer,,"DeLeo, Robert A.",Individual,201,2019 Mid-Year Report (ND),MA,Not Specified,0,9e793ad5-b9bc-5daf-be46-eb0faf774035,02152-2728,02152,Robert DeLeo
219 Lowell St,125.0,11413,Arlington,Arlington,"Smith, Robert G.",Middlesex County,4/4/2019,2019-04-04,Emerson College,Campus Police,,"DeLeo, Robert A.",Individual,201,2019 Mid-Year Report (ND),MA,Not Specified,0,9b25b616-f807-59bd-9d56-1e6b0d0a558e,02474-2734,02474,Robert DeLeo
14 Ferry Lots Ln,300.0,11413,Salisbury,Salisbury,"Chaisson, Stephen",Essex County,4/30/2019,2019-04-30,Town of Newburyport,Police Officer,,"DeLeo, Robert A.",Individual,201,2019 Mid-Year Report (ND),MA,Not Specified,0,5ac7c742-db94-5ca0-b11f-ee1c54d13440,01952-2305,01952,Robert DeLeo
47 Winthrop Pkwy,100.0,11413,Revere,Revere,"Crisafi, Mary Ellen",Suffolk County,11/13/2019,2019-11-13,Town of Winthrop,Police Officer,,"DeLeo, Robert A.",Individual,201,2019 Year-end Report (ND),MA,Not Specified,0,4b4cbfeb-19ec-57d4-83d9-1454feb51b57,02151-3727,02151,Robert DeLeo
6 Cave Rock Rd,100.0,11413,Saugus,Saugus,"Brazis, Scott",Essex County,5/20/2010,2010-05-20,Middlesex Sheriff's Office,Deputy Sheriff,,"DeLeo, Robert A.",Individual,201,2010 Pre-primary Report (ND),MA,Not Specified,0,723ee85d-51f7-5e89-91ad-4db705b2b474,01906-1484,01906,Robert DeLeo
64 Neal Gate St,250.0,11413,Scituate,Scituate,"Nourse, Jeffrey",Plymouth County,5/20/2010,2010-05-20,Norfolk County Sheriff's Dept.,Deputy Sheriff,,"DeLeo, Robert A.",Individual,201,2010 Pre-primary Report (ND),MA,Not Specified,0,fe787e93-b738-5667-9a38-d2d869095586,02066-4429,02066,Robert DeLeo
56 Park Ave,250.0,11413,Winthrop,Winthrop,"Paige, Anthony",Suffolk County,5/20/2010,2010-05-20,Suffolk County Sheriff's Office,Deputy Sheriff,,"DeLeo, Robert A.",Individual,201,2010 Pre-primary Report (ND),MA,Not Specified,0,e9be1719-9f6d-5954-9e07-4bd7992cee21,02152-2558,02152,Robert DeLeo
56 Park Ave,125.0,11413,Winthrop,Winthrop,"Paige, Anthony",Suffolk County,4/14/2011,2011-04-14,Suffolk County Sheriff's Office,Deputy Sheriff,,"DeLeo, Robert A.",Individual,201,2011 Mid-Year Report (ND),MA,Not Specified,0,15470954-35b8-53fa-942f-9d85d2395488,02152-2558,02152,Robert DeLeo
219 Smith Neck Rd,250.0,11413,South Dartmouth,South Dartmouth,"Quinn, John",Bristol County,4/14/2011,2011-04-14,Commonwealth of MA,Bristol County Sheriff,,"DeLeo, Robert A.",Individual,201,2011 Mid-Year Report (ND),MA,Not Specified,0,6a7feddf-2cf0-5194-9439-d1ec89d26308,02748-1414,02748,Robert DeLeo
56 Park Ave,250.0,11413,Winthrop,Winthrop,"Paige, Anthony",Suffolk County,7/26/2011,2011-07-26,Suffolk County Sheriff's Office,Deputy Sheriff,,"DeLeo, Robert A.",Individual,201,2011 Year-end Report (ND),MA,Not Specified,0,42cd5e29-817a-518b-9fce-f9e08b366d91,02152-2558,02152,Robert DeLeo
56 Park Ave,250.0,11413,Winthrop,Winthrop,"Paige, Anthony",Suffolk County,5/16/2012,2012-05-16,Suffolk County Sheriff's Office,Deputy Sheriff,,"DeLeo, Robert A.",Individual,201,2012 Pre-primary Report (ND),MA,Not Specified,0,23b0168b-5966-5fee-9e8e-fc650d41a47b,02152-2558,02152,Robert DeLeo
56 Park Ave,250.0,11413,Winthrop,Winthrop,"Paige , Anthony D.",Suffolk County,6/13/2013,2013-06-13,Suffolk County Sheriff's Office,Deputy Sheriff,,"DeLeo, Robert A.",Individual,201,2013 Mid-Year Report (ND),MA,Not Specified,0,9334e3f5-e667-579a-8b53-cea052b0fd9e,02152-2558,02152,Robert DeLeo
106 Williams Ave,250.0,11413,Hyde Park,Hyde Park,"Tompkins , Steven W.",Suffolk County,12/17/2013,2013-12-17,Suffolk County,Sheriff,,"DeLeo, Robert A.",Individual,201,2013 Year-end Report (ND),MA,Not Specified,0,76df46ec-527f-57bb-8ec0-de8dc6b89c42,02136-3937,02136,Robert DeLeo
106 Williams Ave,250.0,11413,Hyde Park,Hyde Park,"Tompkins , Steven W.",Suffolk County,4/11/2014,2014-04-11,Suffolk County,Sheriff,,"DeLeo, Robert A.",Individual,201,2014 Pre-primary Report (ND),MA,Not Specified,0,06137ce8-a09e-5c7b-b80e-79f9c5259fff,02136-3937,02136,Robert DeLeo
158 Hathaway Rd,150.0,11413,North Dartmouth,North Dartmouth,"Hodgson, Thomas M.",Bristol County,4/7/2015,2015-04-07,Bristol County,Sheriff,,"DeLeo, Robert A.",Individual,201,2015 Mid-Year Report (ND),MA,,0,c8d12088-1b49-5160-aa3f-ff8f11e6dfda,02747-2717,02747,Robert DeLeo
64 Neal Gate St,1000.0,11413,Scituate,Scituate,"Nourse, Jeffrey J.",Plymouth County,10/27/2015,2015-10-27,Norfolk County Sheriff's Dept.,Deputy Sheriff,,"DeLeo, Robert A.",Individual,201,2015 Year-end Report (ND),MA,,0,ce422a45-bcce-5919-9d23-d094876451ef,02066-4429,02066,Robert DeLeo
106 Williams Ave,100.0,11413,Hyde Park,Hyde Park,"Tompkins, Steven W.",Suffolk County,1/14/2016,2016-01-14,Suffolk County,Sheriff,,"DeLeo, Robert A.",Individual,201,2016 Pre-primary Report (ND),MA,Not Specified,0,54a8a08b-fdfd-5a28-82ce-282d356b3904,02136-3937,02136,Robert DeLeo
158 Hathaway Rd,150.0,11413,North Dartmouth,North Dartmouth,"Hodgson, Thomas M.",Bristol County,3/25/2019,2019-03-25,Bristol County,Sheriff,,"DeLeo, Robert A.",Individual,201,2019 Mid-Year Report (ND),MA,Not Specified,0,d0f217ac-92df-5695-a7ac-8a9f52324260,02747-2717,02747,Robert DeLeo
24 Steeple St,150.0,11413,Revere,Revere,"Smith, Charles",Suffolk County,4/13/2010,2010-04-13,Commonwealth of MA,State Trooper,,"DeLeo, Robert A.",Individual,201,2010 Pre-primary Report (ND),MA,Not Specified,0,76db6c32-2931-5c6f-b52e-4b31cfbd88ba,02151-5626,02151,Robert DeLeo
150 Kendall Rd,250.0,11413,Tewksbury,Tewksbury,"Caron, Mark",Middlesex County,4/14/2010,2010-04-14,Commonwealth of MA,State Trooper,,"DeLeo, Robert A.",Individual,201,2010 Pre-primary Report (ND),MA,Not Specified,0,8d33e830-7790-53a6-9844-4e4cbabee926,01876-1360,01876,Robert DeLeo
10 Chandler Mill Rd,250.0,11413,Hanson,Hanson,"Crowley, Paul",Plymouth County,4/14/2010,2010-04-14,Commonwealth of MA,Trooper,,"DeLeo, Robert A.",Individual,201,2010 Pre-primary Report (ND),MA,Not Specified,0,12cdd07a-59aa-56b0-98ca-b17c2c8a8d78,02341-2047,02341,Robert DeLeo
"76 Sagamore Rd, # 3",250.0,11413,Worcester,Worcester,"Daly, Andrew",Worcester County,4/14/2010,2010-04-14,Commonwealth of MA,Trooper,,"DeLeo, Robert A.",Individual,201,2010 Pre-primary Report (ND),MA,Not Specified,0,9c1ee3c6-e96c-5380-96fa-5e64648cd1c9,01609-1724,01609,Robert DeLeo
214 Massapoag Rd,250.0,11413,Tyngsboro,Tyngsboro,"Demers, Julie",Middlesex County,4/14/2010,2010-04-14,SPAM,Trooper,,"DeLeo, Robert A.",Individual,201,2010 Pre-primary Report (ND),MA,Not Specified,0,48a1d5e4-309f-5d00-b3ee-0d01c173b68f,01879-2300,01879,Robert DeLeo
310 High St,250.0,11413,Hingham,Hingham,"Downing, Michael",Plymouth County,4/14/2010,2010-04-14,Commonwealth of MA,Trooper,,"DeLeo, Robert A.",Individual,201,2010 Pre-primary Report (ND),MA,Not Specified,0,6180fdba-fd25-5c52-8514-bf0e54105e8c,02043-3336,02043,Robert DeLeo
130 Rachael Ter,250.0,11413,Westfield,Westfield,"Gordon, Jeffrey",Hampden County,4/14/2010,2010-04-14,Commonwealth of MA,Trooper,,"DeLeo, Robert A.",Individual,201,2010 Pre-primary Report (ND),MA,Not Specified,0,d9f15f68-64c6-5a00-900b-42682735a37b,01085-1881,01085,Robert DeLeo
153 Aldrich St,250.0,11413,Roslindale,Roslindale,"Holland, Scott",Suffolk County,4/14/2010,2010-04-14,Commonwealth of MA,Trooper,,"DeLeo, Robert A.",Individual,201,2010 Pre-primary Report (ND),MA,Not Specified,0,d95662b2-3449-5f40-9123-0280af24318f,02131-2704,02131,Robert DeLeo
3 Edwards Rd,250.0,11413,Braintree,Braintree,"Hunter, Edward",Norfolk County,4/14/2010,2010-04-14,Mass State Police,State Trooper,,"DeLeo, Robert A.",Individual,201,2010 Pre-primary Report (ND),MA,Not Specified,0,1172c17f-47ea-50b3-bc54-5935318b0891,02184-1405,02184,Robert DeLeo
64 Christopher Rd,250.0,11413,Norwell,Norwell,"Kelley, Brian",Plymouth County,4/14/2010,2010-04-14,Commonwealth of MA,Trooper,,"DeLeo, Robert A.",Individual,201,2010 Pre-primary Report (ND),MA,Not Specified,0,675812a0-cbb1-5838-8bee-cbe6b5482944,02061-1802,02061,Robert DeLeo
80 Solar Ave,250.0,11413,Braintree,Braintree,"Pitts, Robert",Norfolk County,4/14/2010,2010-04-14,Commonwealth of MA,Trooper,,"DeLeo, Robert A.",Individual,201,2010 Pre-primary Report (ND),MA,Not Specified,0,a2a53900-e577-5b27-aa94-67b0aaeca1df,02184-6951,02184,Robert DeLeo
16 Rosemont Rd,250.0,11413,Worcester,Worcester,"Pullman, Dana",Worcester County,4/14/2010,2010-04-14,Commonwealth of MA,Trooper,,"DeLeo, Robert A.",Individual,201,2010 Pre-primary Report (ND),MA,Not Specified,0,9ee9f86f-5700-55e6-808c-d03a52c280e0,01605-1220,01605,Robert DeLeo
91 Downey St,250.0,11413,Hopkinton,Hopkinton,"Babbin, Timothy",Middlesex County,6/22/2011,2011-06-22,Commonwealth of MA,Trooper,,"DeLeo, Robert A.",Individual,201,2011 Mid-Year Report (ND),MA,Not Specified,0,54cad750-9a59-5afd-bd62-5ee12f163a3d,01748-2702,01748,Robert DeLeo
27 Buttaro Rd,250.0,11413,Woburn,Woburn,"Beckwith, Robert",Middlesex County,6/22/2011,2011-06-22,Commonwealth of MA,Trooper,,"DeLeo, Robert A.",Individual,201,2011 Mid-Year Report (ND),MA,Not Specified,0,5b99763a-1592-5f4e-b71a-9f5f4da92734,01801-3619,01801,Robert DeLeo
"28 Chesett Ln, PO Box 2231",200.0,11413,Attleboro,Attleboro,"Brown, Richard",Bristol County,6/22/2011,2011-06-22,Commonwealth of MA,Trooper,,"DeLeo, Robert A.",Individual,201,2011 Mid-Year Report (ND),MA,Not Specified,0,66c14fee-0d95-5a15-b96c-aad7b4690132,02703-1567,02703,Robert DeLeo
150 Kendall Rd,250.0,11413,Tewksbury,Tewksbury,"Caron, Mark",Middlesex County,6/22/2011,2011-06-22,Commonwealth of MA,State Trooper,,"DeLeo, Robert A.",Individual,201,2011 Mid-Year Report (ND),MA,Not Specified,0,0750877d-902d-5974-8bd5-17d56d8fe809,01876-1360,01876,Robert DeLeo
10 Chandler Mill Rd,250.0,11413,Hanson,Hanson,"Crowley, Paul",Plymouth County,6/22/2011,2011-06-22,Commonwealth of MA,Trooper,,"DeLeo, Robert A.",Individual,201,2011 Mid-Year Report (ND),MA,Not Specified,0,c8a721b8-b187-5eea-9274-c9d986cbab4b,02341-2047,02341,Robert DeLeo
"76 Sagamore Rd, # 3",250.0,11413,Worcester,Worcester,"Daly, Andrew",Worcester County,6/22/2011,2011-06-22,Commonwealth of MA,Trooper,,"DeLeo, Robert A.",Individual,201,2011 Mid-Year Report (ND),MA,Not Specified,0,848a245d-0184-5984-8373-4441303dc3c3,01609-1724,01609,Robert DeLeo
310 High St,250.0,11413,Hingham,Hingham,"Downing, Michael",Plymouth County,6/22/2011,2011-06-22,Commonwealth of MA,Trooper,,"DeLeo, Robert A.",Individual,201,2011 Mid-Year Report (ND),MA,Not Specified,0,60f6c0eb-fef0-562d-bb58-fc450dbe6746,02043-3336,02043,Robert DeLeo
153 Aldrich St,150.0,11413,Roslindale,Roslindale,"Holland, Scott",Suffolk County,6/22/2011,2011-06-22,Commonwealth of MA,Trooper,,"DeLeo, Robert A.",Individual,201,2011 Mid-Year Report (ND),MA,Not Specified,0,2e2ee62d-2d3d-506c-9e16-c1362650683a,02131-2704,02131,Robert DeLeo
3 Edwards Rd,250.0,11413,Braintree,Braintree,"Hunter, Edward",Norfolk County,6/22/2011,2011-06-22,Commonwealth of MA,State Trooper,,"DeLeo, Robert A.",Individual,201,2011 Mid-Year Report (ND),MA,Not Specified,0,41157935-efdd-5424-85fd-9b634f3a605f,02184-1405,02184,Robert DeLeo
8 Williams St,250.0,11413,North Easton,North Easton,"Joyce, Justin",Bristol County,6/22/2011,2011-06-22,Commonwealth of MA,State Trooper,,"DeLeo, Robert A.",Individual,201,2011 Mid-Year Report (ND),MA,Not Specified,0,9501e626-ebcc-56bf-a765-05976c3a9738,02356-1529,02356,Robert DeLeo
64 Christopher Rd,250.0,11413,Norwell,Norwell,"Kelley, Brian",Plymouth County,6/22/2011,2011-06-22,Commonwealth of MA,Trooper,,"DeLeo, Robert A.",Individual,201,2011 Mid-Year Report (ND),MA,Not Specified,0,dcc8fe17-6ffe-5088-9790-add9d2500a7d,02061-1802,02061,Robert DeLeo
16 Rosemont Rd,250.0,11413,Worcester,Worcester,"Pullman, Dana",Worcester County,6/22/2011,2011-06-22,Commonwealth of MA,Trooper,,"DeLeo, Robert A.",Individual,201,2011 Mid-Year Report (ND),MA,Not Specified,0,ec00ac2c-34da-5e5a-9982-7327091f468f,01605-1220,01605,Robert DeLeo
214 Massapoag Rd,250.0,11413,Tyngsboro,Tyngsboro,"Demers, Julie",Middlesex County,10/5/2011,2011-10-05,Commonwealth of MA,Trooper,,"DeLeo, Robert A.",Individual,201,2011 Year-end Report (ND),MA,Not Specified,0,78269a1c-71c2-55a9-ba88-4ebcea770d3a,01879-2300,01879,Robert DeLeo
91 Downey St,200.0,11413,Hopkinton,Hopkinton,"Babbin, Timothy",Middlesex County,8/27/2012,2012-08-27,Commonwealth of MA,Trooper,,"DeLeo, Robert A.",Individual,201,2012 Pre-election Report (ND),MA,Not Specified,0,835b7655-0ae2-549d-b24d-a3e9e9304ac1,01748-2702,01748,Robert DeLeo
27 Buttaro Rd,200.0,11413,Woburn,Woburn,"Beckwith, Robert",Middlesex County,8/27/2012,2012-08-27,Commonwealth of MA,Trooper,,"DeLeo, Robert A.",Individual,201,2012 Pre-election Report (ND),MA,Not Specified,0,9ba85155-57dc-5b34-8ac5-1c704634fe0c,01801-3619,01801,Robert DeLeo
"28 Chesett Ln, PO Box 2231",200.0,11413,Attleboro,Attleboro,"Brown, Richard",Bristol County,8/27/2012,2012-08-27,Commonwealth of MA,Trooper,,"DeLeo, Robert A.",Individual,201,2012 Pre-election Report (ND),MA,Not Specified,0,b552596e-2241-5360-8b1a-6209cf93e6db,02703-1567,02703,Robert DeLeo
10 Chandler Mill Rd,200.0,11413,Hanson,Hanson,"Crowley, Paul",Plymouth County,8/27/2012,2012-08-27,Commonwealth of MA,Trooper,,"DeLeo, Robert A.",Individual,201,2012 Pre-election Report (ND),MA,Not Specified,0,8423c8fb-6e7e-5ef3-9f26-eadc2b47c6df,02341-2047,02341,Robert DeLeo
"76 Sagamore Rd, # 3",200.0,11413,Worcester,Worcester,"Daly, Andrew",Worcester County,8/27/2012,2012-08-27,Commonwealth of MA,Trooper,,"DeLeo, Robert A.",Individual,201,2012 Pre-election Report (ND),MA,Not Specified,0,8ab06957-d4c3-5aee-b77b-7f26a5851a3e,01609-1724,01609,Robert DeLeo
214 Massapoag Rd,200.0,11413,Tyngsboro,Tyngsboro,"Demers, Julie",Middlesex County,8/27/2012,2012-08-27,Commonwealth of MA,Trooper,,"DeLeo, Robert A.",Individual,201,2012 Pre-election Report (ND),MA,Not Specified,0,f62d5044-4c68-5226-afd1-2cae2f584a91,01879-2300,01879,Robert DeLeo
153 Aldrich St,200.0,11413,Roslindale,Roslindale,"Holland, Scott",Suffolk County,8/27/2012,2012-08-27,Commonwealth of MA,Trooper,,"DeLeo, Robert A.",Individual,201,2012 Pre-election Report (ND),MA,Not Specified,0,d86a5ceb-7ad4-5e2f-83a3-b2eec2807454,02131-2704,02131,Robert DeLeo
3 Edwards Rd,200.0,11413,Braintree,Braintree,"Hunter, Edward",Norfolk County,8/27/2012,2012-08-27,Commonwealth of MA,State Trooper,,"DeLeo, Robert A.",Individual,201,2012 Pre-election Report (ND),MA,Not Specified,0,8c9cc210-4b7e-5d45-898e-df18fd7298e5,02184-1405,02184,Robert DeLeo
40 Rosettas Way,200.0,11413,Bridgewater,Bridgewater,"Long, Richard",Plymouth County,8/27/2012,2012-08-27,Commonwealth of MA,State Trooper,,"DeLeo, Robert A.",Individual,201,2012 Pre-election Report (ND),MA,Not Specified,0,43ce9777-40dd-525c-a523-8eeb038939bf,02324-1549,02324,Robert DeLeo
16A Bristol Rd,200.0,11413,Peabody,Peabody,"Mullen, Kevin",Essex County,8/27/2012,2012-08-27,Commonwealth of MA,State Trooper,,"DeLeo, Robert A.",Individual,201,2012 Pre-election Report (ND),MA,Not Specified,0,a83975f1-98a1-5c73-8acf-7b3c9dda8d78,01960-3474,01960,Robert DeLeo
16 Rosemont Rd,200.0,11413,Worcester,Worcester,"Pullman, Dana",Worcester County,8/27/2012,2012-08-27,Commonwealth of MA,Trooper,,"DeLeo, Robert A.",Individual,201,2012 Pre-election Report (ND),MA,Not Specified,0,1618e1f6-548f-5d2e-921b-e607fbf1dbff,01605-1220,01605,Robert DeLeo
16A Bristol Rd,200.0,11413,Peabody,Peabody,"Mullen , Kevin J.",Essex County,3/26/2014,2014-03-26,Commonwealth of MA,State Trooper,,"DeLeo, Robert A.",Individual,201,2014 Pre-primary Report (ND),MA,Not Specified,0,24fdd048-69ee-53ed-885d-1e4a9a89b29e,01960-3474,01960,Robert DeLeo
PO Box 1012,250.0,11413,Hanson,Hanson,"Crowley , Paul C.",Plymouth County,7/1/2014,2014-07-01,Commonwealth of MA,Trooper,,"DeLeo, Robert A.",Individual,201,2014 Pre-primary Report (ND),MA,Not Specified,0,3e3f2916-45f2-53e4-8b8e-835eae71bee5,02341-6012,02341,Robert DeLeo
"76 Sagamore Rd, # 3",250.0,11413,Worcester,Worcester,"Daly , Andrew J.",Worcester County,7/1/2014,2014-07-01,Commonwealth of MA,Trooper,,"DeLeo, Robert A.",Individual,201,2014 Pre-primary Report (ND),MA,Not Specified,0,19070dfb-30ca-5002-946d-1f22a071c1f3,01609-1724,01609,Robert DeLeo
49 Olde Forge Rd,250.0,11413,Hanover,Hanover,"Gillespie , Timothy M",Plymouth County,7/1/2014,2014-07-01,Massachusetts State Police,Trooper,,"DeLeo, Robert A.",Individual,201,2014 Pre-primary Report (ND),MA,Not Specified,0,ddfda410-4f92-523d-bb8e-f9118c972a28,02339-2439,02339,Robert DeLeo
3 Edwards Rd,200.0,11413,Braintree,Braintree,"Hunter , Edward F.",Norfolk County,7/1/2014,2014-07-01,Commonwealth of MA,State Trooper,,"DeLeo, Robert A.",Individual,201,2014 Pre-primary Report (ND),MA,Not Specified,0,20724457-ab0f-5c23-b4b0-e16ae7fdb724,02184-1405,02184,Robert DeLeo
19 Plain St,250.0,11413,Franklin,Franklin,"Patterson , David A.",Norfolk County,7/1/2014,2014-07-01,Commonwealth of MA,Trooper,,"DeLeo, Robert A.",Individual,201,2014 Pre-primary Report (ND),MA,Not Specified,0,6f2a9b80-34db-5b9f-a1bf-62839874cb1a,02038-2626,02038,Robert DeLeo
16 Rosemont Rd,200.0,11413,Worcester,Worcester,"Pullman , Dana A.",Worcester County,7/1/2014,2014-07-01,Commonwealth of MA,Trooper,,"DeLeo, Robert A.",Individual,201,2014 Pre-primary Report (ND),MA,Not Specified,0,bcbd62cc-39e7-5c92-b1a0-aa1f3a2f2898,01605-1220,01605,Robert DeLeo
1 Tiffany Ave,250.0,11413,Worcester,Worcester,"Sullivan , Michael J.",Worcester County,7/1/2014,2014-07-01,Massachusetts State Police,Trooper,,"DeLeo, Robert A.",Individual,201,2014 Pre-primary Report (ND),MA,Not Specified,0,a1278a8e-488b-58c3-8baf-70c927136d74,01604-3247,01604,Robert DeLeo
55 Magnolia Way,250.0,11413,Canton,Canton,"Doherty, Denise",Norfolk County,4/30/2015,2015-04-30,The Commonwealth of Massachusetts,State Trooper,,"DeLeo, Robert A.",Individual,201,2015 Mid-Year Report (ND),MA,,0,e0b3d583-90ff-57ee-841a-d7e25e85e056,02021-1161,02021,Robert DeLeo
PO Box 132,200.0,11413,Georgetown,Georgetown,"Orlando, Nunzio S.",Essex County,6/30/2015,2015-06-30,The Commonwealth of Massachusetts,State Trooper,,"DeLeo, Robert A.",Individual,201,2015 Mid-Year Report (ND),MA,,0,b249eaec-3b95-5035-9929-902781156e6e,01833-0132,01833,Robert DeLeo
6 Evergreen Way,250.0,11413,Peabody,Peabody,"Schepis, Gary M.",Essex County,6/30/2015,2015-06-30,The Commonwealth of Massachusetts,State Trooper,,"DeLeo, Robert A.",Individual,201,2015 Mid-Year Report (ND),MA,,0,4f829cde-b5a9-5b22-8765-6da4cddf7ab5,01960-4934,01960,Robert DeLeo
16 Washington Ave,250.0,11413,Burlington,Burlington,"Tulipano, Michael",Middlesex County,6/30/2015,2015-06-30,The Commonwealth of Massachusetts,State Trooper,,"DeLeo, Robert A.",Individual,201,2015 Mid-Year Report (ND),MA,,0,6e44acaa-35d3-50f8-a199-d8f0e2d9ddd1,01803-3518,01803,Robert DeLeo
PO Box 1012,250.0,11413,Hanson,Hanson,"Crowley, Paul C.",Plymouth County,12/30/2015,2015-12-30,Commonwealth of MA,Trooper,,"DeLeo, Robert A.",Individual,201,2015 Year-end Report (ND),MA,,0,1177e268-3aeb-596a-846e-618bbb0f12c0,02341-6012,02341,Robert DeLeo
48 Belmont St,250.0,11413,Taunton,Taunton,"Fredette, Kevin J",Bristol County,12/30/2015,2015-12-30,The Commonwealth of Massachusetts,State Trooper,,"DeLeo, Robert A.",Individual,201,2015 Year-end Report (ND),MA,,0,683ad282-236c-5ad9-9563-bfb568e9ff98,02780-3127,02780,Robert DeLeo
3 Edwards Rd,500.0,11413,Braintree,Braintree,"Hunter, Edward F.",Norfolk County,12/30/2015,2015-12-30,Commonwealth of MA,State Trooper,,"DeLeo, Robert A.",Individual,201,2015 Year-end Report (ND),MA,,0,36d8e934-8523-5b63-8a9d-5722f9ee958c,02184-1405,02184,Robert DeLeo
19 Plain St,500.0,11413,Franklin,Franklin,"Patterson, David A.",Norfolk County,12/30/2015,2015-12-30,Commonwealth of MA,Trooper,,"DeLeo, Robert A.",Individual,201,2015 Year-end Report (ND),MA,,0,89aa5108-7105-5df1-8b90-757d6d0752c4,02038-2626,02038,Robert DeLeo
20 Lealand Peck Dr,250.0,11413,Wrentham,Wrentham,"Powell, Jr., Paul A",Norfolk County,12/30/2015,2015-12-30,The Commonwealth of Massachusetts,State Trooper,,"DeLeo, Robert A.",Individual,201,2015 Year-end Report (ND),MA,,0,033c8d9f-a6cc-51c1-a5a3-24a7a6942a6e,02093-1440,02093,Robert DeLeo
16 Rosemont Rd,200.0,11413,Worcester,Worcester,"Pullman, Dana A.",Worcester County,12/30/2015,2015-12-30,Commonwealth of MA,Trooper,,"DeLeo, Robert A.",Individual,201,2015 Year-end Report (ND),MA,,0,a48e51f7-483d-516b-a223-d6d3bba0ef3e,01605-1220,01605,Robert DeLeo
67 Rice Rd,250.0,11413,Boston,Boston,"Sullivan, Daniel J.",Suffolk County,4/5/2018,2018-04-05,Massachusetts State Police,Trooper,,"DeLeo, Robert A.",Individual,201,2018 Pre-primary Report (ND),MA,Not Specified,0,ebf82c22-2fa7-58ec-9a33-878701d38f2c,02110,02110,Robert DeLeo
46 Juniper Ln,500.0,11413,Holden,Holden,"Brenner, Karl",Worcester County,7/26/2018,2018-07-26,Commonwealth of MA,Trooper,,"DeLeo, Robert A.",Individual,201,2018 Pre-primary Report (ND),MA,Not Specified,0,b81fe959-c6f8-5197-bc80-75b1e0c57200,01520-2402,01520,Robert DeLeo
PO Box 1012,500.0,11413,Hanson,Hanson,"Crowley, Paul C.",Plymouth County,7/26/2018,2018-07-26,Commonwealth of MA,Trooper,,"DeLeo, Robert A.",Individual,201,2018 Pre-primary Report (ND),MA,Not Specified,0,4e72a3be-02f0-52c2-857e-4acfbe256573,02341-6012,02341,Robert DeLeo
"76 Sagamore Rd, # 3",500.0,11413,Worcester,Worcester,"Daly, Andrew J.",Worcester County,7/26/2018,2018-07-26,Commonwealth of MA,Trooper,,"DeLeo, Robert A.",Individual,201,2018 Pre-primary Report (ND),MA,Not Specified,0,a72a508f-7a56-521e-a3f2-c08d08a3bbdd,01609-1724,01609,Robert DeLeo
48 Belmont St,500.0,11413,Taunton,Taunton,"Fredette, Kevin J",Bristol County,7/26/2018,2018-07-26,The Commonwealth of Massachusetts,State Trooper,,"DeLeo, Robert A.",Individual,201,2018 Pre-primary Report (ND),MA,Not Specified,0,04772b4b-ad6c-5f34-afbc-142a28676b04,02780-3127,02780,Robert DeLeo
49 Olde Forge Rd,500.0,11413,Hanover,Hanover,"Gillespie, Timothy M",Plymouth County,7/26/2018,2018-07-26,Massachusetts State Police,Trooper,,"DeLeo, Robert A.",Individual,201,2018 Pre-primary Report (ND),MA,Not Specified,0,c7924142-2c80-5e2c-a5b1-54338a4177fc,02339-2439,02339,Robert DeLeo
3 Edwards Rd,500.0,11413,Braintree,Braintree,"Hunter, Edward F.",Norfolk County,7/26/2018,2018-07-26,Commonwealth of MA,State Trooper,,"DeLeo, Robert A.",Individual,201,2018 Pre-primary Report (ND),MA,Not Specified,0,e0c253dd-4def-5783-9d6f-7f65adc5614b,02184-1405,02184,Robert DeLeo
16 Rosemont Rd,200.0,11413,Worcester,Worcester,"Pullman, Dana A.",Worcester County,7/26/2018,2018-07-26,Commonwealth of MA,Trooper,,"DeLeo, Robert A.",Individual,201,2018 Pre-primary Report (ND),MA,Not Specified,0,c9d66e7c-489f-5505-9a1f-20a4190933ac,01605-1220,01605,Robert DeLeo
46 Ledge Rd,125.0,11413,Lynnfield,Lynnfield,"Reardon, Terence",Essex County,4/8/2010,2010-04-08,Revere Police Department,Chief,,"DeLeo, Robert A.",Individual,201,2010 Pre-primary Report (ND),MA,Not Specified,0,cffe5a8c-af5f-595f-a78f-d5df0541f61e,01940-1514,01940,Robert DeLeo
118 Warren Ave,50.0,11413,Chelsea,Chelsea,"Guido, James",Suffolk County,11/4/2010,2010-11-04,Revere Police,Captain,,"DeLeo, Robert A.",Individual,201,2010 Year-end Report (ND),MA,Not Specified,0,31a6b7d6-0801-5570-9251-b4f7286689d7,02150-2157,02150,Robert DeLeo
46 Ledge Rd,125.0,11413,Lynnfield,Lynnfield,"Reardon, Terence",Essex County,3/30/2011,2011-03-30,Revere Police Department,Chief,,"DeLeo, Robert A.",Individual,201,2011 Mid-Year Report (ND),MA,Not Specified,0,e8d4ceb7-31da-5f21-914c-94c524bf3af2,01940-1514,01940,Robert DeLeo
46 Ledge Rd,25.0,11413,Lynnfield,Lynnfield,"Reardon, Terence",Essex County,10/31/2011,2011-10-31,Revere Police Department,Chief,,"DeLeo, Robert A.",Individual,201,2011 Year-end Report (ND),MA,Not Specified,0,cd75f6e3-2e77-5a4e-b5a9-4910323c979c,01940-1514,01940,Robert DeLeo
110 Appletree Cir,200.0,15089,Bridgewater,Bridgewater,"Sargo, Wayne",Plymouth County,5/1/2010,2010-05-01,Brockton,Police Officer,,"D'Emilia, Angelo L.",Individual,201,2010 Pre-primary Report (ND),MA,Not Specified,0,b628adc5-d200-5d18-bdba-cbc4b3508a49,02324,02324,Angelo D'Emilia
110 Appletree Cir,150.0,15089,Bridgewater,Bridgewater,"Sargo, Wayne",Plymouth County,10/29/2010,2010-10-29,Brockton,Police Officer,,"D'Emilia, Angelo L.",Individual,201,2010 Year-end Report (ND),MA,Not Specified,0,e8b36f75-75bb-54b4-b16c-112e035bba48,02324,02324,Angelo D'Emilia
2 Canoe River Road,100.0,15089,South Easton,South Easton,"Rota, John",Bristol County,11/14/2011,2011-11-14,Commonwealth of Massachusetts,State Police Officer,,"D'Emilia, Angelo L.",Individual,201,2011 Year-end Report (ND),MA,Not Specified,0,da480d05-769d-54de-a1fb-3a67fb3097c4,02375,02375,Angelo D'Emilia
400 Britton Street,100.0,15089,Raynham,Raynham,"Shaw, Christopher",Bristol County,9/24/2014,2014-09-24,Town of Bridgewater,Police Officer,,"D'Emilia, Angelo L.",Individual,201,2014 Pre-election Report (ND),MA,Not Specified,0,4da04bad-a928-51f2-b0fe-819feb225bf2,02767,02767,Angelo D'Emilia
400 Britton Street,100.0,15089,Raynham,Raynham,"Shaw, Christopher",Bristol County,10/1/2015,2015-10-01,Town of Bridgewater,Police Officer,,"D'Emilia, Angelo L.",Individual,201,2015 Year-end Report (ND),MA,,0,5496e37e-b7fd-5d89-8c3f-716974a28e11,02767,02767,Angelo D'Emilia
35 Saint Francis St,1000.0,15089,Medford,Medford,"Raso, Richard",Middlesex County,9/30/2016,2016-09-30,City of Medford,Police Officer,,"D'Emilia, Angelo L.",Individual,201,2016 Pre-election Report (ND),MA,,0,b62c072d-b6f4-5886-89aa-b3b652585ca6,02155,02155,Angelo D'Emilia
400 Britton Street,100.0,15089,Raynham,Raynham,"Shaw, Christopher",Bristol County,9/30/2016,2016-09-30,Town of Bridgewater,Police Officer,,"D'Emilia, Angelo L.",Individual,201,2016 Pre-election Report (ND),MA,,0,3794ce1e-f150-576f-86bb-7403102bf900,02767,02767,Angelo D'Emilia
400 Britton Street,100.0,15089,Raynham,Raynham,"Shaw, Christopher",Bristol County,7/20/2018,2018-07-20,Town of Bridgewater,Police Officer,,"D'Emilia, Angelo L.",Individual,201,2018 Pre-primary Report (ND),MA,,0,1af319cb-8a41-5ce4-b141-b7b0e272f9bb,02767,02767,Angelo D'Emilia
400 Britton Street,250.0,15089,Raynham,Raynham,"Shaw, Christopher",Bristol County,7/27/2019,2019-07-27,Town of Bridgewater,Police Officer,,"D'Emilia, Angelo L.",Individual,201,2019 Year-end Report,MA,Not Specified,0,59c785a3-9030-5c27-b760-567ec892da25,02767,02767,Angelo D'Emilia
25 Boxwood Lane,250.0,15089,Bridgewater,Bridgewater,"Carpenito, William",Plymouth County,5/25/2012,2012-05-25,Plymouth County Sheriffs,Deputy Sheriff,,"D'Emilia, Angelo L.",Individual,201,2012 Pre-primary Report (ND),MA,Not Specified,0,e622f986-46c5-5923-8d03-a18f5ce7c64b,02324,02324,Angelo D'Emilia
25 Boxwood Lane,250.0,15089,Bridgewater,Bridgewater,"Carpenito, William",Plymouth County,11/15/2013,2013-11-15,Plymouth County Sheriffs,Deputy Sheriff,,"D'Emilia, Angelo L.",Individual,201,2013 Year-end Report (ND),MA,Not Specified,0,0a788555-201c-5f27-97a4-b1fff7cccfce,02324,02324,Angelo D'Emilia
25 Boxwood Lane,250.0,15089,Bridgewater,Bridgewater,"Carpenito, William",Plymouth County,9/30/2014,2014-09-30,Plymouth County Sheriffs,Deputy Sheriff,,"D'Emilia, Angelo L.",Individual,201,2014 Pre-election Report (ND),MA,Not Specified,0,15070ba2-ddcb-5684-aa0b-ca4dcc8dace5,02324,02324,Angelo D'Emilia
160 Comfort Street,100.0,15089,Bridgewater,Bridgewater,"Mulkern, Daniel",Plymouth County,10/10/2012,2012-10-10,Commonwealth of Massachusetts,State Trooper,,"D'Emilia, Angelo L.",Individual,201,2012 Pre-election Report (ND),MA,Not Specified,0,5e582e65-047b-5d75-97b4-c54fbe6fb478,02324,02324,Angelo D'Emilia
160 Comfort Street,100.0,15089,Bridgewater,Bridgewater,"Mulkern, Daniel",Plymouth County,3/4/2014,2014-03-04,Commonwealth of Massachusetts,State Trooper,,"D'Emilia, Angelo L.",Individual,201,2014 Pre-primary Report (ND),MA,Not Specified,0,4258fa56-e29b-5185-a8e5-c11a0ae974db,02324,02324,Angelo D'Emilia
270 Pleasant St,200.0,15089,Bridgewater,Bridgewater,"McGrath, Scott",Plymouth County,3/11/2014,2014-03-11,MA State Police,Trooper,,"D'Emilia, Angelo L.",Individual,201,2014 Pre-primary Report (ND),MA,Not Specified,0,17d20bac-6cbc-5673-b4f5-37e020b950f8,02324,02324,Angelo D'Emilia
270 Pleasant St,100.0,15089,Bridgewater,Bridgewater,"McGrath, Scott",Plymouth County,9/24/2014,2014-09-24,MA State Police,Trooper,,"D'Emilia, Angelo L.",Individual,201,2014 Pre-election Report (ND),MA,Not Specified,0,192e993c-4e01-52d1-bafe-9fc2634d60c0,02324,02324,Angelo D'Emilia
160 Comfort Street,200.0,15089,Bridgewater,Bridgewater,"Mulkern, Daniel",Plymouth County,9/30/2014,2014-09-30,Commonwealth of Massachusetts,State Trooper,,"D'Emilia, Angelo L.",Individual,201,2014 Pre-election Report (ND),MA,Not Specified,0,9a0de908-7252-506c-9622-9ceb05856ec7,02324,02324,Angelo D'Emilia
270 Pleasant St,200.0,15089,Bridgewater,Bridgewater,"McGrath, Scott",Plymouth County,12/10/2015,2015-12-10,MA State Police,Trooper,,"D'Emilia, Angelo L.",Individual,201,2015 Year-end Report (ND),MA,,0,c297a0a2-3e14-5e45-8a04-2be485a3760d,02324,02324,Angelo D'Emilia
270 Pleasant St,250.0,15089,Bridgewater,Bridgewater,"McGrath, Scott",Plymouth County,12/21/2016,2016-12-21,MA State Police,Trooper,,"D'Emilia, Angelo L.",Individual,201,2016 Year-end Report (ND),MA,,0,ad386f1e-8e1c-56c4-8fd6-78adb0ef9e91,02324,02324,Angelo D'Emilia
270 Pleasant St,250.0,15089,Bridgewater,Bridgewater,"McGrath, Scott",Plymouth County,12/28/2017,2017-12-28,Commonwealth of Ma State Police,Trooper,,"D'Emilia, Angelo L.",Individual,201,2017 Year-end Report (ND),MA,,0,cb0b71ab-156b-50c3-8cc6-2def1d96a035,02324,02324,Angelo D'Emilia
9 Corey Rd Apt 1,200.0,11853,Brookline,Brookline,"Barry, James M",Norfolk County,6/27/2012,2012-06-27,Boston Police Department,Police Officer,,"Dempsey, Brian S.",Individual,201,2012 Pre-primary Report (ND),MA,Not Specified,0,b17eb468-8fd1-59aa-983c-effb0877ba0e,02445,02445,Brian Dempsey
100 Hawthorn St,200.0,11853,New Bedford,New Bedford,"Morrissey, Matthew",Bristol County,3/30/2017,2017-03-30,Boston Police,Police Officer,,"Dempsey, Brian S.",Individual,201,2017 Mid-Year Report (ND),MA,Not Specified,0,0f6c32a3-0004-52fd-a8b7-0ba412c4196c,02740-3423,02740,Brian Dempsey
20 Hudson St,100.0,11853,Falmouth,Falmouth,"Cummings, James M",Barnstable County,3/20/2015,2015-03-20,Barnstable County Sheriffs Office,Sheriff,,"Dempsey, Brian S.",Individual,201,2015 Mid-Year Report (ND),MA,,0,f0687396-e73b-5776-879a-ed896f9520b4,02540-3610,02540,Brian Dempsey
52 Prospect St,200.0,11853,Rutland,Rutland,"Evangelidis, Lewis",Worcester County,5/22/2015,2015-05-22,Worcester County,Sheriff,,"Dempsey, Brian S.",Individual,201,2015 Mid-Year Report (ND),MA,,0,6676975c-e021-5496-ae0d-fe7c8d7afc51,01543-1225,01543,Brian Dempsey
20 Hudson St,200.0,11853,Falmouth,Falmouth,"Cummings, James M",Barnstable County,3/28/2017,2017-03-28,Barnstable County Sheriffs Office,Sheriff,,"Dempsey, Brian S.",Individual,201,2017 Mid-Year Report (ND),MA,Not Specified,0,62766bc0-edbc-5664-a4db-741dc4fabbae,02540-3610,02540,Brian Dempsey
16 Rosemont Rd,200.0,11853,Worcester,Worcester,"Pullman, Dana A",Worcester County,12/31/2013,2013-12-31,Commonwealth of Mass,State Trooper,,"Dempsey, Brian S.",Individual,201,2013 Year-end Report (ND),MA,Not Specified,0,23d733a1-727a-5df0-b7f0-c92e71e5b774,01605,01605,Brian Dempsey
16a Bristol Rd,200.0,11853,Peabody,Peabody,"Mullen, Kevin J",Essex County,3/11/2014,2014-03-11,Commonwealth of Mass,State Trooper,,"Dempsey, Brian S.",Individual,201,2014 Pre-primary Report (ND),MA,Not Specified,0,b3220661-b899-5842-ab5e-b3022f4f0e8a,01960,01960,Brian Dempsey
"10 Chandler Mill Rd, P.O. Box 1012",500.0,11853,Hanson,Hanson,"Crowley, Paul C",Plymouth County,5/24/2016,2016-05-24,State Police Association of MA,Trooper,,"Dempsey, Brian S.",Individual,201,2016 Pre-primary Report (ND),MA,Not Specified,0,0d26e6a0-43b0-5ff2-a8df-41a1d22e70fb,02341-2047,02341,Brian Dempsey
48 Belmont St,500.0,11853,Taunton,Taunton,"Fredette, Kevin J",Bristol County,5/24/2016,2016-05-24,State Police Association of MA,Trooper,,"Dempsey, Brian S.",Individual,201,2016 Pre-primary Report (ND),MA,Not Specified,0,7afe478a-328c-50f2-8be7-d8ecbdac70ff,02780-3127,02780,Brian Dempsey
4 Braney Rd,500.0,11853,Millbury,Millbury,"Gilbert, Jeffrey m",Worcester County,5/24/2016,2016-05-24,State Police Association of MA,trooper,,"Dempsey, Brian S.",Individual,201,2016 Pre-primary Report (ND),MA,Not Specified,0,71af983f-ddf8-5da4-8146-c75f6fda13cc,01527-3902,01527,Brian Dempsey
49 Olde Forge Rd,500.0,11853,Hanover,Hanover,"Gillespie, Timothy M",Plymouth County,5/24/2016,2016-05-24,State Police Association of MA,Trooper,,"Dempsey, Brian S.",Individual,201,2016 Pre-primary Report (ND),MA,Not Specified,0,00f7f193-8db6-5624-9b25-eef31fd0f9f2,02339-2439,02339,Brian Dempsey
5 Edwards Rd,1000.0,11853,Braintree,Braintree,"Hunter, Edward F",Norfolk County,5/24/2016,2016-05-24,State Police Association of MA,Trooper,,"Dempsey, Brian S.",Individual,201,2016 Pre-primary Report (ND),MA,Not Specified,0,226090fa-e8b8-5d9f-b597-e6448b95d68b,02184-1405,02184,Brian Dempsey
20 Lealand Peck Dr,500.0,11853,Wrentham,Wrentham,"Powell Jr, Paul A",Norfolk County,5/24/2016,2016-05-24,State Police Association of MA,Trooper,,"Dempsey, Brian S.",Individual,201,2016 Pre-primary Report (ND),MA,Not Specified,0,a2b0ffd0-05ae-54e8-bb28-ebd2b3198740,02093-1440,02093,Brian Dempsey
16 Rosemont Rd,200.0,11853,Worcester,Worcester,"Pullman, Dana A",Worcester County,5/24/2016,2016-05-24,State Police Association of MA,Trooper,,"Dempsey, Brian S.",Individual,201,2016 Pre-primary Report (ND),MA,Not Specified,0,4cd880c7-d3cc-5265-a4a8-dba054cd0f7b,01605-1220,01605,Brian Dempsey
1 Tiffany Ave,500.0,11853,Worcester,Worcester,"Sullivan, Michael J",Worcester County,5/24/2016,2016-05-24,State Police Association of MA,Trooper,,"Dempsey, Brian S.",Individual,201,2016 Pre-primary Report (ND),MA,Not Specified,0,4427f833-4cce-5549-9985-abd4b7bf8718,01604-3247,01604,Brian Dempsey
5 Summer St,200.0,11853,Mattapoisett,Mattapoisett,"Machado, James M",Plymouth County,3/8/2012,2012-03-08,Massachusetts Police Association,Executive Director,,"Dempsey, Brian S.",Individual,201,2012 Pre-primary Report (ND),MA,Not Specified,0,73f7315e-5d62-5f94-8425-31d4953d495c,02739,02739,Brian Dempsey
5 Summer St,200.0,11853,Mattapoisett,Mattapoisett,"Machado, James M",Plymouth County,3/6/2014,2014-03-06,Massachusetts Police Association,Director of Operations,,"Dempsey, Brian S.",Individual,201,2014 Pre-primary Report (ND),MA,Not Specified,0,e3d1da27-07e9-5a1c-ad42-7ba614460f63,02739,02739,Brian Dempsey
1131 N Broadway,100.0,11853,Haverhill,Haverhill,"Wrenn, Michael",Essex County,10/26/2015,2015-10-26,Haverhill Police Dept.,Sargent,,"Dempsey, Brian S.",Individual,201,2015 Year-end Report (ND),MA,,0,8e4494b0-a72e-5af9-b198-7ffb79a1aa3a,01832-1139,01832,Brian Dempsey
91 Downey St,500.0,11853,Hopkinton,Hopkinton,"Babbin, Timothy G",Middlesex County,5/24/2016,2016-05-24,State police Association of MA,Sergeant,,"Dempsey, Brian S.",Individual,201,2016 Pre-primary Report (ND),MA,Not Specified,0,abdedcbd-1372-5295-ae54-95857d865eed,01748-2702,01748,Brian Dempsey
46 Juniper Ln,500.0,11853,Holden,Holden,"Brenner, Karl",Worcester County,5/24/2016,2016-05-24,State Police Association of MA,Sergeant,,"Dempsey, Brian S.",Individual,201,2016 Pre-primary Report (ND),MA,Not Specified,0,88848801-029d-507b-8679-388206113ca7,01520-2402,01520,Brian Dempsey
24 Forest Dr,1000.0,11853,Holden,Holden,"Daly, Andrew J",Worcester County,5/24/2016,2016-05-24,State Police Association of MA,Sergeant,,"Dempsey, Brian S.",Individual,201,2016 Pre-primary Report (ND),MA,Not Specified,0,2c9ac682-21c0-56fe-b076-06861de9b5cb,01520-1609,01520,Brian Dempsey
153 Aldrich St,500.0,11853,Roslindale,Roslindale,"Holland, Scott M",Suffolk County,5/24/2016,2016-05-24,State Police Association of MA,Sergeant,,"Dempsey, Brian S.",Individual,201,2016 Pre-primary Report (ND),MA,Not Specified,0,f5b5dca7-4587-5c79-84ce-07b9364bc0ea,02131-2704,02131,Brian Dempsey
"172 Maple St, # 3",500.0,11853,Danvers,Danvers,"Lynch, Mark S",Essex County,5/24/2016,2016-05-24,State Police Association of MA,Sergeant,,"Dempsey, Brian S.",Individual,201,2016 Pre-primary Report (ND),MA,Not Specified,0,0a1e172f-deff-582f-b629-a6ea61f2526f,01923-2137,01923,Brian Dempsey
11 Beacon St,500.0,11853,Boston,Boston,"Patterson, David A",Suffolk County,5/24/2016,2016-05-24,State Police Association of MA,Sergeant,,"Dempsey, Brian S.",Individual,201,2016 Pre-primary Report (ND),MA,Not Specified,0,edd3e22a-0d62-56c0-9558-177c811c4d37,02108-3017,02108,Brian Dempsey
56 Naples Rd,200.0,11853,Haverhill,Haverhill,"Iannalfo, Stephen M",Essex County,5/9/2017,2017-05-09,Haverhill Police Department,Officer,,"Dempsey, Brian S.",Individual,201,2017 Mid-Year Report (ND),MA,Not Specified,0,a66436dd-147f-51f3-90d0-654ab623bc4c,01832-4410,01832,Brian Dempsey
1 Riverview Blvd. Bdg 7 #206,250.0,14593,Methuen,Methuen,"Nochnok, Robert",Essex County,4/12/2011,2011-04-12,Retired,Retired Police Li,,"Devers, Marcos A.",Individual,201,2011 Mid-Year Report (ND),MA,Not Specified,0,5848cb2b-f99a-5771-b79e-3207199a6fb6,01844,01844,Marcos Devers
66 Chase Rd,500.0,14593,Londonderry,,"Richard, Brooks",,2/4/2013,2013-02-04,City of Lawrence,Police officer,,"Devers, Marcos A.",Individual,201,2013 Mid-Year Report (ND),NH,Not Specified,0,df6b73c7-f704-5abe-a742-b0f6fbb1f155,,NA,Marcos Devers
1 Riverview Blvd Apt 7,500.0,14593,Methuen,Methuen,"Robert, Nochnuk",Essex County,2/4/2013,2013-02-04,City of Lawrence,Police officer,,"Devers, Marcos A.",Individual,201,2013 Mid-Year Report (ND),MA,Not Specified,0,a83da98d-ac2a-57a8-a598-452e79ed4c00,01844,01844,Marcos Devers
1 Riverview Blvd. Bdg 7 #206,500.0,14593,Methuen,Methuen,"Nochnok, Robert",Essex County,10/9/2014,2014-10-09,Retired,Retired Police Li,,"Devers, Marcos A.",Individual,201,2014 Pre-election Report (ND),MA,Not Specified,0,47425cba-c93e-5eb0-b442-f32d7782239f,01844,01844,Marcos Devers
1 Riverview Blvd. Bdg 7 #206,500.0,14593,Methuen,Methuen,"Nochnok, Robert",Essex County,9/8/2016,2016-09-08,Retired,Retired Police Li,,"Devers, Marcos A.",Individual,201,2016 Pre-election Report (ND),MA,Not Specified,0,40f0352f-051e-55e4-b00f-4e7c1fac94ce,01844,01844,Marcos Devers
1 Riverview Blvd. Bdg 7 #206,500.0,14593,Methuen,Methuen,"Nochnok, Robert",Essex County,8/31/2018,2018-08-31,Retired,Retired Police Li,,"Devers, Marcos A.",Individual,201,2018 Pre-Election Report,MA,Not Specified,0,003b1f9a-9ae4-5c21-9857-e1c015195dcb,01844,01844,Marcos Devers
17 Thorney Meadow Way,100.0,17212,Hanover,Hanover,"McLaughlin 2019, James",Plymouth County,1/7/2020,2020-01-07,Rockland Police Department,Police Officer,,"Dockter, Emmanuel J.",Individual,201,1/7/20 Deposit Report,MA,Credit Card,3,5e2e8a68-7034-5a68-834c-64f8fe329233,02339,02339,Emmanuel Dockter
24 Forest Drive,200.0,15637,Hudson,Hudson,"Daly, Andrew",Middlesex County,11/20/2017,2017-11-20,Ma State Police,Trooper,,"Donahue, Daniel M.",Individual,201,2017 Year-end Report (ND),MA,,0,32d9be37-3fbf-5489-bb2e-29a19e93eae8,01749,01749,Daniel Donahue
3 Edwards Road,200.0,15637,Braintree,Braintree,"Hunter, Edward",Norfolk County,11/20/2017,2017-11-20,Ma State Police,State Trooper,,"Donahue, Daniel M.",Individual,201,2017 Year-end Report (ND),MA,,0,46bbcf2d-27d4-5f1d-913d-905142e85725,02184,02184,Daniel Donahue
16 Rosemont Road,200.0,15637,Worcester,Worcester,"Pullman, Dana",Worcester County,12/1/2017,2017-12-01,State Police Association of Ma,State Trooper,,"Donahue, Daniel M.",Individual,201,2017 Year-end Report (ND),MA,,0,5f1d2db7-a742-5219-8a05-7748fca8642c,01605,01605,Daniel Donahue
81 Vincen Circle,200.0,15637,Worcester,Worcester,"Dandrea, Matthew",Worcester County,10/5/2016,2016-10-05,Worc Police,Sargent,,"Donahue, Daniel M.",Individual,201,2016 Pre-election Report (ND),MA,,0,f5b2c789-9daa-5127-b2f5-4c14a2352a59,01604,01604,Daniel Donahue
16 Kelsey Drive,100.0,15637,Worcester,Worcester,"Petrone, Anthony",Worcester County,10/5/2016,2016-10-05,Worc Police,Officer,,"Donahue, Daniel M.",Individual,201,2016 Pre-election Report (ND),MA,,0,7252dbad-eb18-5e22-a672-46d34c78aad3,01604,01604,Daniel Donahue
35 Saint Francis St,100.0,13651,Medford,Medford,"RASO, RICHARD J",Middlesex County,10/15/2015,2015-10-15,Medford Police Department,Police Officer,,"Donato, Paul J.",Individual,201,2015 Year-end Report (ND),MA,,0,09835f4c-c134-5d01-aef9-06936f2bc761,02155-1828,02155,Paul Donato
59 Maurice St,60.0,13651,Medford,Medford,"UPTON, PAUL J",Middlesex County,10/18/2015,2015-10-18,Police Officer,Somerville Police Dept.,,"Donato, Paul J.",Individual,201,2015 Year-end Report (ND),MA,,0,7d1d36e5-825f-579b-b6d7-60b8faf3aabc,02155-1116,02155,Paul Donato
35 Saint Francis St,100.0,13651,Medford,Medford,"RASO, RICHARD J",Middlesex County,4/7/2016,2016-04-07,Medford Police Department,Police Officer,,"Donato, Paul J.",Individual,201,2016 Pre-primary Report (ND),MA,Not Specified,0,5a87e191-b615-5420-8bb8-adfad51089bd,02155-1828,02155,Paul Donato
35 Saint Francis St,100.0,13651,Medford,Medford,"RASO, RICHARD J",Middlesex County,10/22/2016,2016-10-22,Medford Police Department,Police Officer,,"Donato, Paul J.",Individual,201,2016 Year-end Report (ND),MA,Not Specified,0,7fabe8fe-82b0-5334-859d-5e45dd7c4d55,02155-1828,02155,Paul Donato
35 Saint Francis St,200.0,13651,Medford,Medford,"RASO, RICHARD J",Middlesex County,5/4/2017,2017-05-04,Medford Police Department,Police Officer,,"Donato, Paul J.",Individual,201,2017 Mid-Year Report (ND),MA,Not Specified,0,2cc0cddf-febe-5dfd-8fe0-11080b2c1a4a,02155-1828,02155,Paul Donato
59 Maurice St,60.0,13651,Medford,Medford,"UPTON, PAUL J",Middlesex County,10/16/2017,2017-10-16,Police Officer,Somerville Police Dept.,,"Donato, Paul J.",Individual,201,2017 Year-end Report (ND),MA,Not Specified,0,965e15ad-9778-5626-9b74-671d78d08890,02155-1116,02155,Paul Donato
35 Saint Francis St,100.0,13651,Medford,Medford,"RASO, RICHARD J",Middlesex County,10/29/2017,2017-10-29,Medford Police Department,Police Officer,,"Donato, Paul J.",Individual,201,2017 Year-end Report (ND),MA,Not Specified,0,0725a7c4-3e7c-58e1-be66-2a5d0c3a29c8,02155-1828,02155,Paul Donato
59 Maurice St,60.0,13651,Medford,Medford,"UPTON, PAUL J",Middlesex County,9/19/2018,2018-09-19,Police Officer,Somerville Police Dept.,,"Donato, Paul J.",Individual,201,2018 Pre-election Report (Special) (ND),MA,Not Specified,0,1693eefb-9cf4-53ed-a381-a3777d9d2357,02155-1116,02155,Paul Donato
35 Saint Francis St,250.0,13651,Medford,Medford,"RASO, RICHARD J",Middlesex County,11/12/2018,2018-11-12,Medford Police Department,Police Officer,,"Donato, Paul J.",Individual,201,2018 Year-end Report (ND),MA,Not Specified,0,b429b578-7629-5de4-9a7f-243bcb66a7f3,02155-1828,02155,Paul Donato
59 Maurice St,70.0,13651,Medford,Medford,"UPTON, PAUL J",Middlesex County,11/1/2019,2019-11-01,Police Officer,Somerville Police Dept.,,"Donato, Paul J.",Individual,201,2019 Year-end Report (ND),MA,Not Specified,0,2a1d466f-4ab4-5da4-b0b9-b61ca39e5e00,02155-1116,02155,Paul Donato
3 Eastern Ave,200.0,13651,Stoneham,Stoneham,"CLEMENTE, BARRY",Middlesex County,4/4/2018,2018-04-04,Medford Police Department,Patrolman,,"Donato, Paul J.",Individual,201,2018 Pre-primary Report (ND),MA,Not Specified,0,8ac21422-bef8-5840-a3ac-93b27c5035e3,02180-1309,02180,Paul Donato
3 Eastern Ave,200.0,13651,Stoneham,Stoneham,"CLEMENTE, BARRY",Middlesex County,3/14/2019,2019-03-14,Medford Police Department,Patrolman,,"Donato, Paul J.",Individual,201,2019 Mid-Year Report (ND),MA,Not Specified,0,0952d10e-fa16-5a0c-84ed-2134b945185c,02180-1309,02180,Paul Donato
3 Eastern Ave,200.0,13651,Stoneham,Stoneham,"CLEMENTE, BARRY",Middlesex County,4/13/2020,2020-04-13,Medford Police Department,Patrolman,,"Donato, Paul J.",Individual,201,4/13/20 Deposit Report,MA,Check,1,ce1cf224-370a-5b26-8c24-66c4fb6dfc1c,02180-1309,02180,Paul Donato
24 Forest Dr,200.0,13651,Holden,Holden,"Daly, Andrew J",Worcester County,4/9/2015,2015-04-09,Massachusetts State Police,Trooper,,"Donato, Paul J.",Individual,201,2015 Mid-Year Report (ND),MA,,0,ec101070-4375-5e8c-9484-bec7f9361a6d,01520-1609,01520,Paul Donato
2 Edward Road,200.0,13651,Braintree,Braintree,"Hunter, Edward F",Norfolk County,4/9/2015,2015-04-09,Massachusetts State Police,Trooper,,"Donato, Paul J.",Individual,201,2015 Mid-Year Report (ND),MA,,0,ab9c5f65-2888-5051-bf6d-7b2ba8fd637a,02184-1406,02184,Paul Donato
16 Rosemont Rd,200.0,13651,Worcester,Worcester,"Pullman, Dana A",Worcester County,4/9/2015,2015-04-09,Massachusetts State Police,Trooper,,"Donato, Paul J.",Individual,201,2015 Mid-Year Report (ND),MA,,0,56aa87ee-91f4-577b-ad9a-d4b64f0c19a7,01605-1220,01605,Paul Donato
24 Forest Dr,300.0,13651,Holden,Holden,"Daly, Andrew J",Worcester County,4/25/2018,2018-04-25,Massachusetts State Police,Trooper,,"Donato, Paul J.",Individual,201,2018 Pre-primary Report (ND),MA,Not Specified,0,10c2661c-07d5-5941-8bdd-124bead8ed87,01520-1609,01520,Paul Donato
16 Rosemont Rd,200.0,13651,Worcester,Worcester,"Pullman, Dana A",Worcester County,4/25/2018,2018-04-25,Massachusetts State Police,Trooper,,"Donato, Paul J.",Individual,201,2018 Pre-primary Report (ND),MA,Not Specified,0,dbe0d120-32a4-5535-8c9f-6373ece3dbc6,01605-1220,01605,Paul Donato
140 M Street,250.0,16441,Boston,Boston,"Cheevers, Joseph",Suffolk County,8/9/2016,2016-08-09,Boston Police Department,Police Officer,,"Driscoll, Jr., William J.",Individual,201,2016 Pre-primary Report (ND),MA,,0,f59d671d-f295-55df-a54a-99233a3eae79,02127,02127,Jr. Driscoll
43 Denmark Avenue,100.0,16441,Milton,Milton,"Sexton, Thomas",Norfolk County,8/9/2016,2016-08-09,Boston Police Department,Police Officer,,"Driscoll, Jr., William J.",Individual,201,2016 Pre-primary Report (ND),MA,,0,b5950ac4-0cd5-5a53-a399-90097bfebc4c,02186,02186,Jr. Driscoll
140 M Street,200.0,16441,Boston,Boston,"Cheevers, Joe",Suffolk County,5/20/2017,2017-05-20,Boston Police Department,Police Officer,,"Driscoll, Jr., William J.",Individual,201,2017 Mid-Year Report (ND),MA,,0,5b19ef42-aef1-5474-9055-0b2841092b48,02127,02127,Jr. Driscoll
43 Denmark Avenue,100.0,16441,Milton,Milton,"Sexton, Thomas",Norfolk County,11/19/2019,2019-11-19,Boston Police Department,Police Officer,,"Driscoll, William J.",Individual,201,2019 Year-end Report,MA,Not Specified,0,3f63711a-ccdf-5c0d-b391-810d47bc73bf,02186,02186,William Driscoll
5 Summer Street,200.0,15820,Mattapoisett,Mattapoisett,"Machado, James",Plymouth County,11/1/2016,2016-11-01,Ma Police Association,Legislative Director,,"DuBois, Michelle Marie",Individual,201,2016 Year-end Report (ND),MA,,0,0cc2b1ab-5543-5400-b65d-9a86d814929d,02739,02739,Michelle DuBois
68 Cross Street,100.0,15820,Brockton,Brockton,"MacMillan, Caroline",Plymouth County,12/11/2019,2019-12-11,Brockton Police Dept.,Dispatch,,"DuBois, Michelle Marie",Individual,201,2019 Year-end Report,MA,Not Specified,0,eb3369b9-984f-54f8-a0c2-c9ce0d4a5486,02302,02302,Michelle DuBois
39 Settright Rd,250.0,15738,Deerfield,South Deerfield,"Martino, Anthony",Franklin County,3/7/2014,2014-03-07,State of MA,Police Officer,,"Edwards, Jonathan S.",Individual,201,3/7/14 Deposit Report,MA,Check,1,c05120dc-616a-557a-a182-9b97f42d08b5,01373,01373,Jonathan Edwards
61 Sherrin Street,100.0,16694,Hyde Park,Hyde Park,"Johns, Terence",Suffolk County,7/31/2017,2017-07-31,Harvard University PD,Patrol Officer,,"Elugardo, Nika Carlene",Individual,201,2017 Year-end Report (ND),MA,,0,0013d3ac-3d4a-56a6-91c3-32946f34908f,02136,02136,Nika Elugardo
29 Iroquis St.,25.0,15711,Worcester,Worcester,"Thomas, Nathan",Worcester County,12/12/2013,2013-12-12,Massachusetts State Police,State Trooper,,"Esteves, Eric",Individual,201,2013 Year-end Report (ND),MA,Not Specified,0,16cfd9dc-6037-5b12-864b-c225d8b6726d,01602,01602,Eric Esteves
24 Hollingsworth Street,100.0,15630,Boston,Mattapan,"Beckford Brewington, Cynthia",Suffolk County,4/23/2020,2020-04-23,City of Boston,Law Enforcement ,,"Everett, Stephanie",Individual,201,4/23/20 Deposit Report,MA,Credit Card,3,4f68d054-ff82-55cf-9b2b-9dea31cf8b0a,02126,02126,Stephanie Everett
137 Lewis Wharf,500.0,15630,Boston,Boston,"Sheriff Tompkins, Committee To Elect",Suffolk County,8/30/2016,2016-08-30,Commonwealth of Massachusetts,Sheriff,,"Everett, Stephanie L.",Individual,201,8/30/16 Deposit Report,MA,Check,1,400b22ac-ae8e-521e-8910-b1d4977d1a1c,02110,02110,Stephanie Everett
P.O. Box 634,250.0,16407,Edgartown,Edgartown,"McCormack, Michael",Dukes County,10/29/2016,2016-10-29,State of Massachusetts,Sheriff,,"Fernandes, Dylan",Individual,201,2016 Year-end Report (ND),MA,,0,fa42618c-79c4-571f-ae70-316140c9408b,02539,02539,Dylan Fernandes
Po Box 986,100.0,16407,Nantucket,Nantucket,"Perelman, James",Nantucket County,6/26/2017,2017-06-26,Nantucket,Sheriff,,"Fernandes, Dylan",Individual,201,2017 Mid-Year Report (ND),MA,,0,8ecb2968-b4be-5520-b6a7-8fd11a94b882,02554,02554,Dylan Fernandes
55 High Street,200.0,14472,Milford,Milford,"Tusino, Robert L.",Worcester County,6/11/2014,2014-06-11,Town of Milford,Police Officer,,"Fernandes, John V.",Individual,201,2014 Pre-primary Report (ND),MA,Not Specified,0,e6c8f7dc-be41-511b-b051-ccc0ebc995e9,01757,01757,John Fernandes
1452 Morgan Road,250.0,15158,West Springfield,West Springfield,"O'Brien, Daniel",Hampden County,6/16/2010,2010-06-16,Town Of West Springfield PD,Police Officer,,"Finn, Michael J.",Individual,201,2010 Pre-primary Report (ND),MA,Not Specified,0,a6b9ac13-42a2-5975-a24c-7d29f1d6d95c,01089,01089,Michael Finn
1452 Morgan Road,50.0,15158,West Springfield,West Springfield,"O'Brien, Daniel",Hampden County,10/3/2010,2010-10-03,Town Of West Springfield PD,Police Officer,,"Finn, Michael J.",Individual,201,2010 Pre-election Report (ND),MA,Not Specified,0,bddf26a1-e5e6-53e0-bfa4-0c977d25f6f9,01089,01089,Michael Finn
1452 Morgan Road,100.0,15158,West Springfield,West Springfield,"O'Brien, Daniel",Hampden County,5/5/2011,2011-05-05,Town Of West Springfield PD,Police Officer,,"Finn, Michael J.",Individual,201,2011 Mid-Year Report (ND),MA,Not Specified,0,8125f14e-c5a0-57f7-96ec-e787fef7964b,01089,01089,Michael Finn
1452 Morgan Road,100.0,15158,West Springfield,West Springfield,"O'Brien, Daniel",Hampden County,4/19/2012,2012-04-19,Town Of West Springfield PD,Police Officer,,"Finn, Michael J.",Individual,201,2012 Pre-primary Report (ND),MA,Not Specified,0,f7a15e99-e110-51e5-9015-071ded0ea773,01089,01089,Michael Finn
1452 Morgan Road,50.0,15158,West Springfield,West Springfield,"O'Brien, Daniel",Hampden County,10/4/2012,2012-10-04,Town Of West Springfield PD,Police Officer,,"Finn, Michael J.",Individual,201,2012 Pre-election Report (ND),MA,Not Specified,0,a17c87c4-4933-5e08-a417-b1a346cf43a1,01089,01089,Michael Finn
1452 Morgan Road,100.0,15158,West Springfield,West Springfield,"O'Brien, Daniel",Hampden County,4/23/2013,2013-04-23,Town Of West Springfield PD,Police Officer,,"Finn, Michael J.",Individual,201,2013 Mid-Year Report (ND),MA,Not Specified,0,a7f369b5-df66-5be3-8d48-2d58ecaa4856,01089,01089,Michael Finn
1452 Morgan Road,50.0,15158,West Springfield,West Springfield,"O'Brien, Daniel",Hampden County,10/23/2013,2013-10-23,Town Of West Springfield PD,Police Officer,,"Finn, Michael J.",Individual,201,2013 Year-end Report (ND),MA,Not Specified,0,0b5babca-b310-578b-851e-2497c1802773,01089,01089,Michael Finn
76 Hunters Green Cir,100.0,15158,Agawam,Agawam,"Ichton, Matthew",Hampden County,10/24/2013,2013-10-24,Hampden County,Sheriffs Dept,,"Finn, Michael J.",Individual,201,2013 Year-end Report (ND),MA,Not Specified,0,4d5277b9-0172-5ee8-80f4-49ea391b5a28,01001,01001,Michael Finn
16 Rosemont Rd,200.0,15158,Worcester,Worcester,"Pullman, Dana",Worcester County,10/18/2014,2014-10-18,Commonwealth of Mass,Station Trooper,,"Finn, Michael J.",Individual,201,2014 Year-end Report (ND),MA,Not Specified,0,a6d1fbd5-45b5-594c-b586-3cbcc6fccc4e,01605,01605,Michael Finn
24 Forrest Drive,200.0,15158,Holden,Holden,"Daly, Andrew",Worcester County,10/26/2015,2015-10-26,Commonwealth of Mass,Trooper,,"Finn, Michael J.",Individual,201,2015 Year-end report (MUN),MA,,0,42c1940c-f51e-5b70-add0-e4a0ca340321,01520,01520,Michael Finn
3 Edwards Rd,200.0,15158,Braintree,Braintree,"Hunter, Edward",Norfolk County,10/26/2015,2015-10-26,Commonwealth of Mass,Trooper,,"Finn, Michael J.",Individual,201,2015 Year-end report (MUN),MA,,0,a9b0b80f-859b-5e69-9f68-473375b8ccfd,02184,02184,Michael Finn
16 Rosemont Rd,200.0,15158,Worcester,Worcester,"Pullman, Dana",Worcester County,10/26/2015,2015-10-26,Commonwealth of Mass,Station Trooper,,"Finn, Michael J.",Individual,201,2015 Year-end report (MUN),MA,,0,f9a220a9-77f3-5cbd-b0df-55e9633a9b90,01605,01605,Michael Finn
214 Read St,250.0,13597,Fall River,Fall River,"Cullen, Charles J",Bristol County,7/27/2014,2014-07-27,City of Fall River,Deputy Police Chief,,"Fiola, Carole",Individual,201,2014 Pre-primary Report (ND),MA,,0,d10a6d2a-8485-53e8-989d-fc7898458411,02720,02720,Carole Fiola
5 Summer Street,200.0,13597,Mattapoisett,Mattapoisett,"Machado, James",Plymouth County,3/24/2015,2015-03-24,State Police Association of Ma,Director,,"Fiola, Carole",Individual,201,2015 Mid-Year Report (ND),MA,,0,1d2c095e-87df-5096-b55a-759c27bc3d96,02739,02739,Carole Fiola
214 Read St,250.0,13597,Fall River,Fall River,"Cullen, Charles J",Bristol County,3/21/2017,2017-03-21,Fall River Police,Deputy Chief,,"Fiola, Carole",Individual,201,2017 Mid-Year Report,MA,Not Specified,0,d4596854-893c-5ecf-9853-2233d9608396,02720,02720,Carole Fiola
214 Read St,250.0,13597,Fall River,Fall River,"Cullen, Charles J",Bristol County,2/11/2018,2018-02-11,Fall River Police,Deputy Chief,,"Fiola, Carole",Individual,201,2018 Pre-Primary Report,MA,Not Specified,0,6af72507-c082-58cf-beae-68e94e7f608d,02720,02720,Carole Fiola
214 Read St,250.0,13597,Fall River,Fall River,"Cullen, Charles",Bristol County,3/6/2019,2019-03-06,Fr Police Dept.,Deputy Chief,,"Fiola, Carole",Individual,201,2019 Mid-Year Report,MA,Not Specified,0,d699d90e-2e28-579e-92da-ad764ca70c01,02720,02720,Carole Fiola
214 Read St,250.0,13597,Fall River,Fall River,"Cullen, Charles",Bristol County,3/6/2020,2020-03-06,Fr Police Dept.,Deputy Chief,,"Fiola, Carole",Individual,201,3/6/20 Deposit Report,MA,Check,1,26c780bc-cb16-5e68-b659-5fe1a1aafced,02720,02720,Carole Fiola
3 Edwards Road,200.0,13110,Braintree,Braintree,"Hunter, Edward",Norfolk County,11/9/2017,2017-11-09,Comm of Mass,State Police,,"Frost, Paul K.",Individual,201,2017 Year-end Report (ND),MA,,0,d8ad9203-5ecc-5dc8-986e-2bc56ff74188,02184,02184,Paul Frost
11 Elizabeth Drive,100.0,13110,Auburn,Auburn,"Zona, Thomas",Worcester County,11/9/2017,2017-11-09,Comm of Massachusetts,State Police,,"Frost, Paul K.",Individual,201,2017 Year-end Report (ND),MA,,0,ca499837-72a0-5e4a-822e-e7445b1ef742,01501,01501,Paul Frost
10 Tiffany Circle,100.0,13110,Millbury,Millbury,"Coggans, Joseph",Worcester County,10/12/2016,2016-10-12,Worcester Sheriff's Office - Civil Process,Deputy Sheriff,,"Frost, Paul K.",Individual,201,2016 Pre-election Report (ND),MA,,0,81b5224f-dd95-54b9-b3d5-0cb676b541f5,01527,01527,Paul Frost
24 Forrest Drive,250.0,13110,Holden,Holden,"Daly, Andrew",Worcester County,12/4/2015,2015-12-04,Mass State Police,State Trooper,,"Frost, Paul K.",Individual,201,2015 Year-end Report (ND),MA,,0,61080f44-b383-5494-9821-69914f97d71c,01520,01520,Paul Frost
16 Rosemont Road,200.0,13110,Worcester,Worcester,"Pullman, Dana",Worcester County,12/15/2015,2015-12-15,Commonwealth of Massachusetts,State Trooper,,"Frost, Paul K.",Individual,201,2015 Year-end Report (ND),MA,,0,d399ff53-0916-5e8b-8af1-9958543924ec,01601,01601,Paul Frost
24 Forrest Drive,200.0,13110,Holden,Holden,"Daly, Andrew",Worcester County,11/9/2017,2017-11-09,Mass State Police,State Trooper,,"Frost, Paul K.",Individual,201,2017 Year-end Report (ND),MA,,0,d9620636-dc13-5353-8f83-b040b09bf440,01520,01520,Paul Frost
16 Rosemont Road,200.0,13110,Worcester,Worcester,"Pullman, Dana",Worcester County,11/9/2017,2017-11-09,Commonwealth of Massachusetts,State Trooper,,"Frost, Paul K.",Individual,201,2017 Year-end Report (ND),MA,,0,8b111318-932a-5976-aad2-b5b11320824b,01601,01601,Paul Frost
24 Lanark St,100.0,16876,Worcester,Worcester,"Consiglio, Angela",Worcester County,7/6/2018,2018-07-06,City of Worcester,Police Officer,,"Fullen, Paul John",Individual,201,2018 Pre-Primary Report,MA,Not Specified,0,7020a65a-f095-5431-b576-1ab31855c389,01603,01603,Paul Fullen
19 Winter Street,100.0,14763,Arlington,,"Corbett, Dennis",,5/8/2010,2010-05-08,Town of Arlington,Police Officer,,"Garballey, Sean",Individual,201,2010 Pre-primary Report (ND),MA,Not Specified,0,d4f6c8f9-ba82-5eda-bc54-f1df79be1993,02174,NA,Sean Garballey
12 Terrier Rd,150.0,14763,Medford,Medford,"Pedrini, Richard",Middlesex County,5/8/2010,2010-05-08,Town of Arlington,Police Officer,,"Garballey, Sean",Individual,201,2010 Pre-primary Report (ND),MA,Not Specified,0,54b7c631-5361-5da2-a161-b6f6461231a6,02155,02155,Sean Garballey
19 Winter Street,100.0,14763,Arlington,,"Corbett, Dennis",,6/9/2012,2012-06-09,Town of Arlington,Police Officer,,"Garballey, Sean",Individual,201,2012 Pre-primary Report (ND),MA,Not Specified,0,378a85c8-9ac4-5901-b44f-bda192e9f78a,02174,NA,Sean Garballey
19 Winter Street,200.0,14763,Arlington,,"Corbett, Dennis",,3/22/2014,2014-03-22,Town of Arlington,Police Officer,,"Garballey, Sean",Individual,201,2014 Pre-primary Report (ND),MA,Not Specified,0,474bf8bd-de07-55cb-b76e-6e626a993cf1,02174,NA,Sean Garballey
56 Donald Rd,100.0,14763,Burlington,Burlington,"Conroy, Steven",Middlesex County,10/13/2016,2016-10-13,Arlington Police Dept,Police Officer,,"Garballey, Sean",Individual,201,2016 Pre-Election Report,MA,Not Specified,0,df1533a7-d65f-598e-99cd-883f63257d49,01803,01803,Sean Garballey
27 Dexter St,200.0,14763,Dedham,Dedham,"Burke, John",Norfolk County,4/15/2017,2017-04-15,Regis College,Police Officer,,"Garballey, Sean",Individual,201,2017 Pre-Primary Report (Special),MA,Not Specified,0,18a883b8-8a25-51ef-8deb-c656c70b6990,02026,02026,Sean Garballey
19 Winter Street,300.0,14763,Arlington,,"Corbett, Dennis",,4/29/2017,2017-04-29,Town of Arlington,Police Officer,,"Garballey, Sean",Individual,201,2017 Pre-Primary Report (Special),MA,Not Specified,0,572ee752-812c-5990-b652-6f7e46ba9a80,02174,NA,Sean Garballey
6 Granton Park,200.0,14763,Arlington,,"Pedrini, Richard",,5/12/2017,2017-05-12,Arl Police Dept,Police Officer,,"Garballey, Sean",Individual,201,2017 Pre-Primary Report (Special),MA,Not Specified,0,3a75aa1b-bd18-57b7-8a2d-6366f0009c9e,02174,NA,Sean Garballey
48 Saville St. #1,100.0,14763,Cambridge,Cambridge,"Reardon Jr, Robert",Middlesex County,6/9/2017,2017-06-09,City of Cambridge,Police Officer,,"Garballey, Sean",Individual,201,2017 Pre-Primary Report (Special),MA,Not Specified,0,ffa29d0c-1fb9-59e8-9034-9cd484abf2e0,02138,02138,Sean Garballey
16 Rosemont Rd,200.0,14763,Worcester,Worcester,"Pullman, Dana",Worcester County,6/21/2017,2017-06-21,Commonwealth of Massachusetts,State Police,,"Garballey, Sean",Individual,201,2017 Pre-Election Report (Special),MA,Not Specified,0,d3e017b0-b71b-5dea-aadf-10037b2d60b6,01601,01601,Sean Garballey
19 Winter Street,100.0,14763,Arlington,,"Corbett, Dennis",,3/9/2018,2018-03-09,Town of Arlington,Police Officer,,"Garballey, Sean",Individual,201,2018 Pre-Primary Report,MA,Not Specified,0,748297a9-3f58-5add-a19c-a811116416cd,02174,NA,Sean Garballey
82 Milton St,100.0,14763,Arlington,Arlington,"Costa, John",Middlesex County,3/9/2018,2018-03-09,Town of Arlington,Police Officer,,"Garballey, Sean",Individual,201,2018 Pre-Primary Report,MA,Not Specified,0,07d3715c-5d1c-5945-862c-e11c31319cdd,02476,02476,Sean Garballey
Po Box 155,400.0,15057,North Quincy,Quincy,"Bellotti, Michael",Norfolk County,3/29/2018,2018-03-29,Norfolk County Sheriff's Office,Sheriff,,"Garlick, Denise",Individual,201,2018 Pre-Primary Report,MA,Not Specified,0,b979fe35-3236-581c-8079-516f8dc3ed6f,02171,02171,Denise Garlick
64 Neal Gate St,500.0,15057,Scituate,Scituate,"Nourse, Jeffrey",Plymouth County,3/29/2018,2018-03-29,Norfolk County Sheriff's Office,Deputy Sheriff,,"Garlick, Denise",Individual,201,2018 Pre-Primary Report,MA,Not Specified,0,c1966b87-1721-59a0-b492-eed4d0c9213b,02066,02066,Denise Garlick
Po Box 155,125.0,15057,North Quincy,Quincy,"Bellotti, Michael",Norfolk County,3/29/2019,2019-03-29,Norfolk County Sheriff's Office,Sheriff,,"Garlick, Denise",Individual,201,2019 Mid-Year Report,MA,Not Specified,0,6298004f-d7bc-5177-8004-4065da15c766,02171,02171,Denise Garlick
5 Summer Street,200.0,12563,Mattapoisett,Mattapoisett,"Machado, James",Plymouth County,6/23/2010,2010-06-23,Mass Police Association,Government Relations,,"Garry, Colleen M.",Individual,201,2010 Pre-primary Report (ND),MA,Not Specified,0,abe15b14-88b7-5662-b142-008455a21ce5,02739,02739,Colleen Garry
32 Abbey St,100.0,17410,Fairhaven,Fairhaven,"McConnell, Robert",Bristol County,2/18/2020,2020-02-18,Plymouth County Sheriff's Department,Deputy Sheriff,,"Gendreau, Evan C.",Individual,201,2/18/20 Deposit Report,MA,Check,1,3f5e4a14-c4d9-51ba-b98d-185594309d06,02719,02719,Evan Gendreau
115 West Meadow Road,100.0,12600,Lowell,Lowell,"O'Neill, Steven & Vicki",Middlesex County,6/24/2010,2010-06-24,City of Lowell,Police Officer,,"Golden Jr., Thomas A.",Individual,201,2010 Pre-primary Report (ND),MA,Not Specified,0,52c7be56-1e2a-512b-96e5-8ceee603879a,01854,01854,Jr. Golden
1235 Main Street,100.0,12600,Tewksbury,Tewksbury,"Biewener, James",Middlesex County,11/22/2011,2011-11-22,Town of Tewksbury,Police officer,,"Golden Jr., Thomas A.",Individual,201,2011 Year-end Report (ND),MA,Not Specified,0,1bf0007f-625a-5f48-8f30-0ce52afe5fd2,01876,01876,Jr. Golden
1235 Main Street,100.0,12600,Tewksbury,Tewksbury,"Biewener, James",Middlesex County,6/15/2012,2012-06-15,Town of Tewksbury,Police officer,,"Golden Jr., Thomas A.",Individual,201,2012 Pre-primary Report (ND),MA,Not Specified,0,275e7157-1447-5571-9c35-2e10640c3bc1,01876,01876,Jr. Golden
34 Corrine Dr,100.0,12600,Dracut,Dracut,"Jason, John",Middlesex County,6/15/2012,2012-06-15,Lowell Police,Police Officer,,"Golden Jr., Thomas A.",Individual,201,2012 Pre-primary Report (ND),MA,Not Specified,0,edbf49de-cd05-54d8-b816-bd339c273a82,01826,01826,Jr. Golden
1235 Main Street,100.0,12600,Tewksbury,Tewksbury,"Biewener, James",Middlesex County,6/20/2013,2013-06-20,Town of Tewksbury,Police officer,,"Golden Jr., Thomas A.",Individual,201,2013 Mid-Year Report (ND),MA,Not Specified,0,7e4b5be4-1430-5dab-aa9b-d65927243300,01876,01876,Jr. Golden
115 West Meadow Road,100.0,12600,Lowell,Lowell,"O'Neill, Steven & Vicki",Middlesex County,6/20/2013,2013-06-20,City of Lowell,Police Officer,,"Golden Jr., Thomas A.",Individual,201,2013 Mid-Year Report (ND),MA,Not Specified,0,3c6814a7-4818-507f-9eac-fcf02a4127fc,01854,01854,Jr. Golden
136 Farragut Street,250.0,12600,Dracut,Dracut,"Callahan, Brian",Middlesex County,3/27/2014,2014-03-27,City of Lowell,Police Officer,,"Golden Jr., Thomas A.",Individual,201,2014 Pre-primary Report (ND),MA,Not Specified,0,afb3789e-46ca-5379-abee-57ece36825f8,01826,01826,Jr. Golden
13 Stonegate Road,400.0,12600,Chelmsford,Chelmsford,"Fleming, Thomas",Middlesex County,3/27/2014,2014-03-27,City of Lowell,Police Officer,,"Golden Jr., Thomas A.",Individual,201,2014 Pre-primary Report (ND),MA,Not Specified,0,6cca6b4d-8892-518b-94fc-b4423524e299,01824,01824,Jr. Golden
115 West Meadow Road,100.0,12600,Lowell,Lowell,"O'Neill, Steven & Vicki",Middlesex County,3/27/2014,2014-03-27,City of Lowell,Police Officer,,"Golden Jr., Thomas A.",Individual,201,2014 Pre-primary Report (ND),MA,Not Specified,0,0b290b59-b35a-536e-9ff5-581eb7ec5afe,01854,01854,Jr. Golden
57 Main St,100.0,12600,Westford,Westford,"Sullivan, Kevin",Middlesex County,3/27/2014,2014-03-27,City of Lowell,Police Officer,,"Golden Jr., Thomas A.",Individual,201,2014 Pre-primary Report (ND),MA,Not Specified,0,66a593ec-96ba-59a5-8f8f-8354b4f3e471,01886,01886,Jr. Golden
1235 Main Street,100.0,12600,Tewksbury,Tewksbury,"Biewener, James",Middlesex County,5/28/2015,2015-05-28,Town of Tewksbury,Police Officer,,"Golden Jr., Thomas A.",Individual,201,2015 Mid-Year Report (ND),MA,,0,aeeac952-53e0-5780-8d41-d0f3a033ee9c,01876,01876,Jr. Golden
266 Pine St,100.0,12600,Lowell,Lowell,"Espinola, Joseph",Middlesex County,5/28/2015,2015-05-28,Lowell,Police Officer,,"Golden Jr., Thomas A.",Individual,201,2015 Mid-Year Report (ND),MA,,0,0f3ae437-00a0-5f39-91ac-4c3f62f9d144,01851,01851,Jr. Golden
67 Mt. Hope Street,100.0,12600,Lowell,Lowell,"Golden, Timothy",Middlesex County,5/28/2015,2015-05-28,City of Lowell,Police Officer,,"Golden Jr., Thomas A.",Individual,201,2015 Mid-Year Report (ND),MA,,0,db7ee1f8-a88b-594c-834c-fdca4aafe82f,01854,01854,Jr. Golden
64 Oliver Dr,150.0,12600,Dracut,Dracut,"Nobrega, Frank & Jessica",Middlesex County,5/28/2015,2015-05-28,City of Lowell,Police Officer,,"Golden Jr., Thomas A.",Individual,201,2015 Mid-Year Report (ND),MA,,0,cdf7c764-782a-5fc7-9bbe-825df5fc44fd,01826,01826,Jr. Golden
16 Lincoln Circle,250.0,12600,Andover,Andover,"Martin, James",Essex County,12/30/2015,2015-12-30,Mass State Police,State Police Officer,,"Golden Jr., Thomas A.",Individual,201,2015 Year-end Report (ND),MA,,0,c6e23060-7702-5cff-9921-a8e42ad03617,01810,01810,Jr. Golden
24 Forest Drive,250.0,12600,Holden,Holden,"Daly, Andrew",Worcester County,4/27/2017,2017-04-27,Comm of Massachusetts,Police Officer,,"Golden Jr., Thomas A.",Individual,201,2017 Mid-Year Report (ND),MA,,0,7c71290f-6826-5eae-b9cf-0f0dc1962683,01520,01520,Jr. Golden
3 Edwards Road,250.0,12600,Braintree,Braintree,"Hunter, Edward",Norfolk County,4/27/2017,2017-04-27,Comm of Massachusetts,Police Officer,,"Golden Jr., Thomas A.",Individual,201,2017 Mid-Year Report (ND),MA,,0,ac5b6a38-9d90-5b71-84b7-fcf295dd4910,02184,02184,Jr. Golden
24 Forest Drive,200.0,12600,Holden,Holden,"Daly, Andrew",Worcester County,5/23/2018,2018-05-23,Comm of Massachusetts,Police Officer,,"Golden Jr., Thomas A.",Individual,201,2018 Pre-Primary Report,MA,Not Specified,0,f2eb022c-761d-5f57-857f-0a1d1a78023f,01520,01520,Jr. Golden
3 Edwards Road,200.0,12600,Braintree,Braintree,"Hunter, Edward",Norfolk County,5/23/2018,2018-05-23,Comm of Massachusetts,Police Officer,,"Golden Jr., Thomas A.",Individual,201,2018 Pre-Primary Report,MA,Not Specified,0,04ec20aa-8d2f-5c37-a5c6-851408cf4609,02184,02184,Jr. Golden
28 Chard Street,500.0,12600,Tyngsborough,Tyngsboro,"Finneral, Christopher",Middlesex County,6/28/2018,2018-06-28,Lowell Police Department,Police Officer,,"Golden Jr., Thomas A.",Individual,201,2018 Pre-Primary Report,MA,Not Specified,0,ffc1e797-f747-511a-a0ed-dac2244eb078,01879,01879,Jr. Golden
17 Independence Dr,100.0,12600,Tynsgboro,,"Finn, Casey",,6/20/2019,2019-06-20,City of Lowell,Police Officer,,"Golden Jr., Thomas A.",Individual,201,2019 Mid-Year Report,MA,Not Specified,0,84cdd8e8-8bd5-57c8-8871-52d14e2c94c8,,NA,Jr. Golden
67 Mt. Hope Street,100.0,12600,Lowell,Lowell,"Golden, Timothy",Middlesex County,6/20/2019,2019-06-20,City of Lowell,Police Officer,,"Golden Jr., Thomas A.",Individual,201,2019 Mid-Year Report,MA,Not Specified,0,f751346e-c7e1-5549-852d-29006692d26d,01854,01854,Jr. Golden
28 Rindo Park,100.0,12600,Lowell,Lowell,"Moriarty, Dennis",Middlesex County,6/20/2019,2019-06-20,City of Lowell,Police Officer,,"Golden Jr., Thomas A.",Individual,201,2019 Mid-Year Report,MA,Not Specified,0,4e4601c6-0631-5186-ae9c-2c3585a98880,01851,01851,Jr. Golden
64 Oliver Dr,100.0,12600,Dracut,Dracut,"Nobrega, Frank & Jessica",Middlesex County,7/11/2019,2019-07-11,City of Lowell,Police Officer,,"Golden, Thomas A.",Individual,201,2019 Year-end Report,MA,Not Specified,0,84749ddc-327a-57f3-b88e-e9d6a92b9c9d,01826,01826,Thomas Golden
16 St Brendan Rd,200.0,12600,Dorchester,Dorchester Center,"Young, Joseph",Suffolk County,6/27/2018,2018-06-27,Boston Police Department,Detective,,"Golden Jr., Thomas A.",Individual,201,2018 Pre-Primary Report,MA,Not Specified,0,8a154eee-fd94-5842-be3b-51cd8ec177ef,02124,02124,Jr. Golden
28 Chesset Lane,100.0,12600,Attleboro,Attleboro,"Brown, Richard",Bristol County,12/10/2010,2010-12-10,State Police Association of Massachusetts,President,,"Golden Jr., Thomas A.",Individual,201,2010 Year-end Report (ND),MA,Not Specified,0,2653ce75-e672-5653-90c4-c10a9d547850,02703,02703,Jr. Golden
16 Rosemont Rd,100.0,12600,Worcester,Worcester,"Pullman, Dana",Worcester County,12/10/2010,2010-12-10,State Police Association of Massachusetts,Treasurer,,"Golden Jr., Thomas A.",Individual,201,2010 Year-end Report (ND),MA,Not Specified,0,7bccaa21-124e-5235-a872-175151756efc,01605,01605,Jr. Golden
16 Rosemont Rd,200.0,12600,Worcester,Worcester,"Pullman, Dana",Worcester County,12/31/2013,2013-12-31,State Police Association of Massachusetts,Treasurer,,"Golden Jr., Thomas A.",Individual,201,2013 Year-end Report (ND),MA,Not Specified,0,ddfb48c1-6946-5485-b6fb-986ddd8f12d5,01605,01605,Jr. Golden
10 Kearney Sy,100.0,12600,Lowell,Lowell,"Bodor, Leslie",Middlesex County,3/27/2014,2014-03-27,Mass State Police,Retired,,"Golden Jr., Thomas A.",Individual,201,2014 Pre-primary Report (ND),MA,Not Specified,0,84d4b460-f3bf-54c5-b1aa-5478b1622039,01852,01852,Jr. Golden
16 Rosemont Rd,200.0,12600,Worcester,Worcester,"Pullman, Dana",Worcester County,11/22/2014,2014-11-22,State Police Association of Massachusetts,Treasurer,,"Golden Jr., Thomas A.",Individual,201,2014 Year-end Report (ND),MA,Not Specified,0,0afbd3e0-0c74-5d06-8579-174e8b85fdad,01605,01605,Jr. Golden
10 Kearney Sy,100.0,12600,Lowell,Lowell,"Bodor, Leslie",Middlesex County,5/28/2015,2015-05-28,Mass State Police,Retired,,"Golden Jr., Thomas A.",Individual,201,2015 Mid-Year Report (ND),MA,,0,bd03ceec-0f88-5597-864e-623bdd95adf5,01852,01852,Jr. Golden
16 Rosemont Rd,200.0,12600,Worcester,Worcester,"Pullman, Dana",Worcester County,12/30/2015,2015-12-30,State Police Association of Massachusetts,Treasurer,,"Golden Jr., Thomas A.",Individual,201,2015 Year-end Report (ND),MA,,0,88c0b42a-3f26-5690-8f3f-a140717fe18c,01605,01605,Jr. Golden
16 Rosemont Rd,200.0,12600,Worcester,Worcester,"Pullman, Dana",Worcester County,4/27/2017,2017-04-27,State Police Association of Massachusetts,Treasurer,,"Golden Jr., Thomas A.",Individual,201,2017 Mid-Year Report (ND),MA,,0,c2e2b984-b226-5fd4-ae3b-83f234d024d9,01605,01605,Jr. Golden
10 Kearney Sy,40.0,12600,Lowell,Lowell,"Bodor, Leslie",Middlesex County,11/10/2018,2018-11-10,Mass State Police,Retired,,"Golden Jr., Thomas A.",Individual,201,2018 Year-end Report,MA,Not Specified,0,69d695be-3699-5be2-9c69-3c21d197dfba,01852,01852,Jr. Golden
520 High Street,50.0,17480,West Medford,West Medford,"Walsh, Teresa",Middlesex County,5/30/2020,2020-05-30,Commonwealth of Massachusetts,Environmental Police Officer,,"Gravellese, Joseph",Individual,201,5/30/20 Deposit Report,MA,Check,1,ab52008b-0d63-58ce-9fd7-e1bcfe9c2eb3,02156,02156,Joseph Gravellese
24 Forest Dr,100.0,13627,Holden,Holden,"Daly, Andrew J",Worcester County,7/12/2012,2012-07-12,Massachuestts,State Police Officer,,"Haddad, Patricia A.",Individual,201,2012 Pre-primary Report (ND),MA,Not Specified,0,09b04838-e3f0-567d-bdf5-abedf1b6f780,01520,01520,Patricia Haddad
99 Lynch Ave,150.0,13627,Somerset,Somerset,"McNeil, George",Bristol County,12/12/2019,2019-12-12,Somerset Police Dept.,Chief of Police,,"Haddad, Patricia A.",Individual,201,2019 Year-end Report,MA,Not Specified,0,2e8efc09-bcca-5cc2-bfe5-a6d9a5c53d5d,02726,02726,Patricia Haddad
14 Ferry Lots Ln,0.0,13627,Salisbury,Salisbury,"Chaisson, Stephen A",Essex County,12/28/2019,2019-12-28,Town of Newburyport,Police Officer,,"Haddad, Patricia A.",Individual,201,2019 Year-end Report,MA,Not Specified,0,12364297-ecd9-51bc-9a3b-532b7cbb62cb,01952,01952,Patricia Haddad
14 Ferry Lots Ln,250.0,13627,Salisbury,Salisbury,"Chaisson-2019 Contribution, Stephen A",Essex County,1/8/2020,2020-01-08,Town of Newburyport,Police Officer,,"Haddad, Patricia A.",Individual,201,1/8/20 Deposit Report,MA,Check,1,86d8174f-0af4-5593-b81c-7d44ae838d35,01952,01952,Patricia Haddad
5 Summer St,200.0,13627,Mattapoisett,Mattapoisett,"Machado, James M",Plymouth County,3/23/2012,2012-03-23,Mass Police Association,Executive Director,,"Haddad, Patricia A.",Individual,201,2012 Pre-primary Report (ND),MA,Not Specified,0,24ab1a94-12d1-58eb-a44a-348daa7bc6f0,02739,02739,Patricia Haddad
100 Disamar Rd,50.0,13627,Taunton,Taunton,"Corr, Peter H",Bristol County,8/9/2015,2015-08-09,Taunton Police Officer,Retired,,"Haddad, Patricia A.",Individual,201,2015 Year-end Report (ND),MA,,0,1ac0653f-a874-5a1e-a4c9-906a05a5df96,02780,02780,Patricia Haddad
100 Disamar Rd,25.0,13627,Taunton,Taunton,"Corr, Peter H",Bristol County,8/21/2016,2016-08-21,Taunton Police Officer,Retired,,"Haddad, Patricia A.",Individual,201,2016 Pre-primary Report (ND),MA,,0,56861a6e-4ebf-5e30-9b34-ae0bc2c80339,02780,02780,Patricia Haddad
235 Williams St,50.0,13627,Uxbridge,Uxbridge,"Moore, Richard T",Worcester County,4/16/2019,2019-04-16,Mass Police Association,Ex Director,,"Haddad, Patricia A.",Individual,201,2019 Mid-Year Report,MA,Not Specified,0,892cc525-3d41-543f-918c-b4b1874cd6bd,01569,01569,Patricia Haddad
22 Sparrow Way,25.0,16905,Raynham,Raynham,"Courcy, Paul",Bristol County,1/9/2020,2020-01-09,Commonwealth of Massachusetts,State Trooper,,"Haggerty, Richard M.",Individual,201,1/9/20 Deposit Report,MA,Credit Card,3,35f9e705-af5a-587d-abfa-a9de92458fad,02767,02767,Richard Haggerty
38 Alfred St,200.0,16905,Woburn,Woburn,"Duffy, Arthur",Middlesex County,2/21/2018,2018-02-21,Woburn Police Dept.,Administrator,,"Haggerty, Richard M.",Individual,201,2018 Pre-primary Report (ND),MA,,0,78cbce0f-d315-5a21-af79-328e947fe42b,01801,01801,Richard Haggerty
18 Turner St,1000.0,16908,Quincy,Quincy,"Jacobs, Walter",Norfolk County,3/2/2018,2018-03-02,Umass Boston,Police Captain,,"Hall, Deirdre",Individual,201,2018 Pre-Primary Report,MA,Not Specified,0,af4d19e0-85f2-5593-a653-3b4542e4bd73,02169,02169,Deirdre Hall
613 West Street,500.0,15777,Ludlow,Ludlow,"Belanger, David",Hampden County,6/13/2014,2014-06-13,"Ludlow Police Dept.,",Police Officer,,"Harrington, James P.",Individual,201,2014 Pre-primary Report (ND),MA,Not Specified,0,5a109e09-1661-5cef-be5e-5e57a2ee59ae,01056,01056,James Harrington
94 Warren Terrace,350.0,15777,Longmeadow,Longmeadow,"McBride, Phillip",Hampden County,5/6/2016,2016-05-06,Springfield Police Department,Police Officer,,"Harrington, James P.",Individual,201,2016 Pre-primary Report (ND),MA,,0,4ae84f4f-c50f-55f1-89c1-15fe87eb4e4f,01106,01106,James Harrington
66 Arthur Street,500.0,15777,Ludlow,Ludlow,"Vital, Manuel",Hampden County,1/23/2014,2014-01-23,Ludlow Police Department,Custodian,,"Harrington, James P.",Individual,201,2014 Pre-primary Report (ND),MA,Not Specified,0,96107eb0-ecdf-5e72-97ab-4ecba2f5d7cd,01056,01056,James Harrington
50 Arrow Trail,100.0,14990,Groton,Groton,"Reilly, John",Middlesex County,4/30/2019,2019-04-30,State Police Association of MA,State Police Officer,,"Harrington, Sheila C.",Individual,201,2019 Mid-Year Report,MA,Not Specified,0,8ebe7140-79d1-5490-8933-ab1c8156d017,01450,01450,Sheila Harrington
P.O. Box 7100,500.0,16310,Fitchburg,Fitchburg,"Carbone, Joe",Worcester County,5/25/2018,2018-05-25,City of Fitchburg,Retired Police Captain,,"Hay, Stephan",Individual,201,2018 Pre-Primary Report,MA,Not Specified,0,d9a2e817-0440-5b17-b738-97f5e64c6efd,01420,01420,Stephan Hay
P.O. Box 1445,500.0,16310,Fitchburg,Fitchburg,"Louney, Mark",Worcester County,5/30/2018,2018-05-30,Fitchburg Pd,Retired Police Captain,,"Hay, Stephan",Individual,201,2018 Pre-Primary Report,MA,Not Specified,0,0092497e-22a2-584d-b45b-72848ae8fc01,01420,01420,Stephan Hay
46 Mountain Ave,50.0,16310,Fitchburg,Fitchburg,"O'brien, Tim",Worcester County,6/11/2018,2018-06-11,Fitchburg Police Department,Retired,,"Hay, Stephan",Individual,201,2018 Pre-Primary Report,MA,Not Specified,0,7286024a-764d-5c8a-afef-0b9b77c40d69,01420,01420,Stephan Hay
45 Gunners Exchange Road,250.0,16458,Plymouth,Plymouth,"Vecchi, Scott",Plymouth County,7/12/2018,2018-07-12,Plymouth Police,Detective Sargeant,,"Hewins, Sarah G.",Individual,201,2018 Pre-Primary Report,MA,Not Specified,0,b3a7af39-dbed-56d1-9a43-e6b9838b65d2,02360,02360,Sarah Hewins
14 Juniper Street,200.0,12623,Ipswich,Ipswich,"Nikas, Paul",Essex County,5/29/2018,2018-05-29,Town of Ipswich,Police Chief,,"Hill, Bradford R.",Individual,201,2018 Pre-primary Report (ND),MA,Not Specified,0,06802973-32d8-5b74-bbfc-6907f9783238,01938,01938,Bradford Hill
31 Jeffrey's Neck Road,250.0,12623,Ipswich,Ipswich,"Dziadose, Peter",Essex County,6/8/2018,2018-06-08,Town of Ipswich,Detective,,"Hill, Bradford R.",Individual,201,2018 Pre-primary Report (ND),MA,Not Specified,0,f161ae13-3554-57ec-9d12-ce5fa30daf6c,01938,01938,Bradford Hill
31 Jeffrey's Neck Road,300.0,12623,Ipswich,Ipswich,"Dziadose, Peter",Essex County,9/25/2018,2018-09-25,Town of Ipswich,Detective,,"Hill, Bradford R.",Individual,201,2018 Pre-election Report (ND),MA,Not Specified,0,9cb486c8-1616-5b5b-abdb-5a3e850332ed,01938,01938,Bradford Hill
61 Maple Street,30.0,12623,Wenham,Wenham,"Harding, Carol L.",Essex County,10/7/2015,2015-10-07,State Police,Retired,,"Hill, Bradford R.",Individual,201,2015 Year-end Report (ND),MA,,0,0ede18a8-dc49-5798-9581-ab6e189e8396,01984,01984,Bradford Hill
61 Maple Street,25.0,12623,Wenham,Wenham,"Harding, Carol L.",Essex County,3/18/2016,2016-03-18,State Police,Retired,,"Hill, Bradford R.",Individual,201,2016 Pre-primary Report (ND),MA,,0,0ee37ce6-7341-5415-b0da-ed720c87bff9,01984,01984,Bradford Hill
61 Maple Street,30.0,12623,Wenham,Wenham,"Harding, Carol L.",Essex County,9/23/2018,2018-09-23,State Police,Retired,,"Hill, Bradford R.",Individual,201,2018 Pre-election Report (ND),MA,Not Specified,0,8aae4341-c6bc-53d2-8e77-8faac23e757b,01984,01984,Bradford Hill
56 Metropolitan Ave,250.0,10595,Roslindale,Roslindale,"Wells, Joseph",Suffolk County,4/21/2012,2012-04-21,Longwood Security,Special Police Officer,,"Honan, Kevin G.",Individual,201,2012 Pre-primary Report (ND),MA,Not Specified,0,0a741411-5910-5867-a834-d0f691d3ad6c,02131,02131,Kevin Honan
158 Hathaway Road,150.0,14265,North Dartmouth,North Dartmouth,"Hodgson, Thomas",Bristol County,7/16/2015,2015-07-16,Commonwealth of Massachusetts,Sheriff,,"Howitt, Steven",Individual,201,2015 Year-end Report (ND),MA,,0,8402a2dc-2f59-5964-81a3-266d2bf854e4,02747,02747,Steven Howitt
"11 Beacon Street, Ste 700",150.0,15721,Boston,Boston,"Gilbert, Kim M./Jeffrey",Suffolk County,12/26/2013,2013-12-26,State Trooper,State Police Assoc of MA,,"Hunt, Daniel J.",Individual,201,2013 Year-end Report (ND),MA,Not Specified,0,7448fc34-bdf8-524e-a880-0bd2ba3ec8d5,02108,02108,Daniel Hunt
"11 Beacon Street, Ste 700",500.0,15721,Boston,Boston,State Police Assoc of MA,Suffolk County,12/26/2013,2013-12-26,,State Police Assoc of MA,,"Hunt, Daniel J.",Union/Association,203,2013 Year-end Report (ND),MA,Not Specified,0,805c7949-4131-5757-a822-a405ce613267,02108,02108,Daniel Hunt
59 Rockne Ave,100.0,15721,Dorchester,Dorchester Center,"Smith, III, William",Suffolk County,1/23/2014,2014-01-23,Boston Police Department,Police Officer,,"Hunt, Daniel J.",Individual,201,2014 Pre-primary Report (Special) (ND),MA,Not Specified,0,5fe463ae-39a5-52de-ba5b-06ae20987074,02124,02124,Daniel Hunt
11 Narragansett Street,100.0,15721,Dorchester,Dorchester,"Johnson, Ward",Suffolk County,1/29/2014,2014-01-29,City of Boston,Boston Police Officer,,"Hunt, Daniel J.",Individual,201,2014 Pre-primary Report (Special) (ND),MA,Not Specified,0,6b3c534b-6e03-5b37-b171-a782b49cf9a8,02122,02122,Daniel Hunt
5 Narragansett Street,200.0,15721,Dorchester,Dorchester,"Maclean, Robert",Suffolk County,2/17/2014,2014-02-17,Boston Police Department,Police Officer,,"Hunt, Daniel J.",Individual,201,2014 Pre-election Report (Special) (ND),MA,Not Specified,0,358b5907-dc15-5e63-be40-9fd4309285f9,02122,02122,Daniel Hunt
221B Neponset Ave,100.0,15721,Dorchester,Dorchester,"Moore, Nicholas",Suffolk County,2/20/2014,2014-02-20,Boston Police Department,Police officer,,"Hunt, Daniel J.",Individual,201,2014 Pre-election Report (Special) (ND),MA,Not Specified,0,f2114bfd-353f-57be-b2d9-ad7b7490d0c0,02122,02122,Daniel Hunt
3 Searle Road,250.0,15721,West Roxbury,West Roxbury,"Cullity, James",Suffolk County,2/27/2014,2014-02-27,Boston Police Department,Police officer,,"Hunt, Daniel J.",Individual,201,2014 Pre-election Report (Special) (ND),MA,Not Specified,0,ca1527de-7d3d-582b-90ff-5ddfc63982cb,02132,02132,Daniel Hunt
98 Myrtlebank Ave,100.0,15721,Dorchester,Dorchester Center,"Woods, Lauren",Suffolk County,9/12/2015,2015-09-12,Boston Police Dept,Police Officer,,"Hunt, Daniel J.",Individual,201,2015 Year-end Report (ND),MA,,0,57510159-adb7-519a-8db6-c64bc202b373,02124,02124,Daniel Hunt
66 Athens Street,1000.0,15721,Boston,Boston,"Cunningham, Ryan",Suffolk County,11/1/2016,2016-11-01,Boston Police Dept,Police Officer * Reimb,,"Hunt, Daniel J.",Individual,201,2016 Year-end Report (ND),MA,,0,b2f3fcaa-2c25-5e54-a0d5-1871d217edfb,02127,02127,Daniel Hunt
66 Athens Street,1000.0,15721,Boston,Boston,"Cunningham, Ryan",Suffolk County,8/12/2017,2017-08-12,City of Boston,Police Officer,,"Hunt, Daniel J.",Individual,201,2017 Year-end Report (ND),MA,,0,49d52a03-8ef5-56be-ac63-1bdb0da6ece8,02127,02127,Daniel Hunt
"11 Beacon Street, Ste 700",500.0,15721,Boston,Boston,State Police Assoc of MA,Suffolk County,12/1/2017,2017-12-01,,State Police Assoc of MA,,"Hunt, Daniel J.",Union/Association,203,2017 Year-end Report (ND),MA,,0,36168b27-922d-5278-bab4-abe39d7ec136,02108,02108,Daniel Hunt
9 Crockett Ave,200.0,15721,Dorchester,Dorchester Center,"Broderick Jr, John",Suffolk County,12/31/2017,2017-12-31,City of Boston,Police Sergeant,,"Hunt, Daniel J.",Individual,201,2017 Year-end Report (ND),MA,,0,0013d207-a63c-5ff1-9d74-fdb75d348851,02124,02124,Daniel Hunt
47 Sheridan St,200.0,15721,Boston,Jamaica Plain,"Calderone, Lawrence J.",Suffolk County,12/31/2017,2017-12-31,City of Boston,Police Officer,,"Hunt, Daniel J.",Individual,201,2017 Year-end Report (ND),MA,,0,8c8a88bc-e423-5196-ade3-b6e6a0f712c3,02130,02130,Daniel Hunt
633 Ferry St,100.0,15721,Marshfield,Marshfield,"Lacolla, Roberto",Plymouth County,3/24/2019,2019-03-24,City of Boston,Police Officer,,"Hunt, Daniel J.",Individual,201,2019 Mid-Year Report,MA,Not Specified,0,d5bd12ac-c346-55c5-bf36-ee76bd993bfc,02050,02050,Daniel Hunt
49 King St,100.0,15721,Dorchester,Dorchester,"Leahy, Thomas",Suffolk County,11/19/2019,2019-11-19,Boston Police,Police Officer,,"Hunt, Daniel J.",Individual,201,2019 Year-end Report,MA,Not Specified,0,3f51e456-04ca-55d0-9a97-378512889144,02122,02122,Daniel Hunt
19 Boutwell St.,150.0,15721,Dorchester,Dorchester,"studley (2019 Contribution), john",Suffolk County,1/24/2020,2020-01-24,city of boston,police detective,,"Hunt, Daniel J.",Individual,201,1/24/20 Deposit Report,MA,Credit Card,3,1ce98e86-829f-5b51-9bbf-14a00591fa30,02122,02122,Daniel Hunt
14 Longmeadow Road,500.0,15721,Scituate,Scituate,"Moore, Nicholas",Plymouth County,1/21/2018,2018-01-21,Boston Police,Law Enforcement,,"Hunt, Daniel J.",Individual,201,2018 Pre-primary Report (ND),MA,Not Specified,0,c6626218-6a38-5789-bc23-f823a4011608,02066,02066,Daniel Hunt
14 Longmeadow Road,500.0,15721,Scituate,Scituate,"Moore, Nicholas",Plymouth County,2/8/2019,2019-02-08,City of Boston,Law Enforcement,,"Hunt, Daniel J.",Individual,201,2019 Mid-Year Report,MA,Not Specified,0,9a63d705-7138-5b4e-ab20-b963c6268bc5,02066,02066,Daniel Hunt
16 Saint Brendan Road,500.0,15721,Dorchester,Dorchester Center,"Young, Joseph M.",Suffolk County,12/11/2013,2013-12-11,Boston Police Department,Detective,,"Hunt, Daniel J.",Individual,201,2013 Year-end Report (ND),MA,Not Specified,0,7fd4114e-93bb-58c2-9b03-8886c145dd80,02124,02124,Daniel Hunt
16 Saint Brendan Road,250.0,15721,Dorchester,Dorchester Center,"Young, Joseph",Suffolk County,1/16/2014,2014-01-16,Boston Police Department,Detective,,"Hunt, Daniel J.",Individual,201,2014 Pre-primary Report (Special) (ND),MA,Not Specified,0,db111538-740e-526d-aab0-581a66399e8c,02124,02124,Daniel Hunt
19 Boutwell Street,200.0,15721,Dorchester,Dorchester,"Studley, John",Suffolk County,1/28/2014,2014-01-28,Boston Police Department,Detective,,"Hunt, Daniel J.",Individual,201,2014 Pre-primary Report (Special) (ND),MA,Not Specified,0,5ca6440c-d5cc-59ac-8757-fc562f3e01d9,02122,02122,Daniel Hunt
69 Minot Street,250.0,15721,Dorchester,Dorchester,"Griffin, Daniel",Suffolk County,2/21/2014,2014-02-21,Boston Police Department,Detective,,"Hunt, Daniel J.",Individual,201,2014 Pre-election Report (Special) (ND),MA,Not Specified,0,a6ea3710-c3f9-5f4a-b976-3ad0a0f3be38,02122,02122,Daniel Hunt
16 Saint Brendan Road,100.0,15721,Dorchester,Dorchester Center,"Young, Joseph",Suffolk County,2/21/2014,2014-02-21,Boston Police Department,Detective,,"Hunt, Daniel J.",Individual,201,2014 Pre-election Report (Special) (ND),MA,Not Specified,0,1b096d0a-28a6-54be-a252-a3a094b09589,02124,02124,Daniel Hunt
370 Beacon Street,500.0,15721,Boston,Boston,"Greene, Bernard",Suffolk County,2/27/2014,2014-02-27,Boston Police Department,Lieutenant Detective,,"Hunt, Daniel J.",Individual,201,2014 Pre-election Report (Special) (ND),MA,Not Specified,0,547dd54f-1e64-5120-93ed-2d2d9c1a54fd,02116,02116,Daniel Hunt
221B Neponset Ave,40.0,15721,Dorchester,Dorchester,"Moore, Nicholas",Suffolk County,4/21/2015,2015-04-21,Boston Police Dept,Detective,,"Hunt, Daniel J.",Individual,201,2015 Mid-Year Report (ND),MA,,0,941b010f-f048-54f7-a7f9-90e439206bca,02122,02122,Daniel Hunt
221B Neponset Ave,40.0,15721,Dorchester,Dorchester,"Moore, Nicholas",Suffolk County,5/20/2015,2015-05-20,Boston Police Dept,Detective,,"Hunt, Daniel J.",Individual,201,2015 Mid-Year Report (ND),MA,,0,f25ec57c-00be-5c4c-915f-e731517b542c,02122,02122,Daniel Hunt
221B Neponset Ave,40.0,15721,Dorchester,Dorchester,"Moore, Nicholas",Suffolk County,6/25/2015,2015-06-25,Boston Police Dept,Detective,,"Hunt, Daniel J.",Individual,201,2015 Mid-Year Report (ND),MA,,0,5fb64bb0-01fd-5e6c-a5a1-db3304aaad4e,02122,02122,Daniel Hunt
221B Neponset Ave,40.0,15721,Dorchester,Dorchester,"Moore, Nicholas",Suffolk County,7/22/2015,2015-07-22,Boston Police Dept,Detective,,"Hunt, Daniel J.",Individual,201,2015 Year-end Report (ND),MA,,0,e941aa92-9e61-5b25-bc55-ba0ba1848de1,02122,02122,Daniel Hunt
221B Neponset Ave,40.0,15721,Dorchester,Dorchester,"Moore, Nicholas",Suffolk County,8/30/2015,2015-08-30,Boston Police Dept,Detective,,"Hunt, Daniel J.",Individual,201,2015 Year-end Report (ND),MA,,0,81e7a519-1f33-5ea8-9d1e-21ed6b343daa,02122,02122,Daniel Hunt
221B Neponset Ave,40.0,15721,Dorchester,Dorchester,"Moore, Nicholas",Suffolk County,9/22/2015,2015-09-22,Boston Police Dept,Detective,,"Hunt, Daniel J.",Individual,201,2015 Year-end Report (ND),MA,,0,de8c0a58-9fec-5a0a-81cf-ab2232ef3e7f,02122,02122,Daniel Hunt
221B Neponset Ave,40.0,15721,Dorchester,Dorchester,"Moore, Nicholas",Suffolk County,10/20/2015,2015-10-20,Boston Police Dept,Detective,,"Hunt, Daniel J.",Individual,201,2015 Year-end Report (ND),MA,,0,6d7798a6-575d-52a5-8e60-35f6402f120f,02122,02122,Daniel Hunt
221B Neponset Ave,40.0,15721,Dorchester,Dorchester,"Moore, Nicholas",Suffolk County,11/26/2015,2015-11-26,Boston Police Dept,Detective,,"Hunt, Daniel J.",Individual,201,2015 Year-end Report (ND),MA,,0,657ed23a-3d97-59ff-ba15-e2a48363a152,02122,02122,Daniel Hunt
16 St Brendan Road,250.0,15721,Dorchester,Dorchester Center,"Young, Joseph",Suffolk County,12/10/2015,2015-12-10,Boston Police Dept,Detective,,"Hunt, Daniel J.",Individual,201,2015 Year-end Report (ND),MA,,0,a06d2a79-32db-5c15-9ed1-d3fcb4b91933,02124,02124,Daniel Hunt
221B Neponset Ave,40.0,15721,Dorchester,Dorchester,"Moore, Nicholas",Suffolk County,1/21/2016,2016-01-21,Boston Police Dept,Detective,,"Hunt, Daniel J.",Individual,201,2016 Pre-primary Report (ND),MA,,0,6970eafa-4dbd-55f1-b144-4e9d54e92cad,02122,02122,Daniel Hunt
221B Neponset Ave,40.0,15721,Dorchester,Dorchester,"Moore, Nicholas",Suffolk County,2/24/2016,2016-02-24,Boston Police Dept,Detective,,"Hunt, Daniel J.",Individual,201,2016 Pre-primary Report (ND),MA,,0,c32fc417-5691-5649-a56f-d44f519256c5,02122,02122,Daniel Hunt
14 Longmeadow Road,40.0,15721,Scituate,Greenbush,"Moore, Nicholas",Plymouth County,9/10/2016,2016-09-10,Boston Police Dept,Detective,,"Hunt, Daniel J.",Individual,201,2016 Pre-election Report (ND),MA,,0,34469d28-19d7-5ad2-aa46-4a27afd220d8,02040,02040,Daniel Hunt
14 Longmeadow Road,40.0,15721,Scituate,Greenbush,"Moore, Nicholas",Plymouth County,10/14/2016,2016-10-14,Boston Police Dept,Detective,,"Hunt, Daniel J.",Individual,201,2016 Pre-election Report (ND),MA,,0,fa4efd94-75f8-584e-baaf-c9ab91e99f07,02040,02040,Daniel Hunt
14 Longmeadow Road,40.0,15721,Scituate,Scituate,"Moore, Nicholas",Plymouth County,11/10/2016,2016-11-10,Boston Police Dept,Detective,,"Hunt, Daniel J.",Individual,201,2016 Year-end Report (ND),MA,,0,68be370f-29fb-57e1-9612-1c8a3f645047,02066,02066,Daniel Hunt
14 Longmeadow Road,40.0,15721,Scituate,Scituate,"Moore, Nicholas",Plymouth County,12/7/2016,2016-12-07,Boston Police Dept,Detective,,"Hunt, Daniel J.",Individual,201,2016 Year-end Report (ND),MA,,0,f50491dd-5941-5fe4-8578-f1f1a372ba25,02066,02066,Daniel Hunt
14 Longmeadow Road,40.0,15721,Scituate,Scituate,"Moore, Nicholas",Plymouth County,2/5/2017,2017-02-05,Boston Police Dept,Detective,,"Hunt, Daniel J.",Individual,201,2017 Mid-Year Report (ND),MA,,0,94d4283d-81d1-54be-afa6-1926a99409a3,02066,02066,Daniel Hunt
14 Longmeadow Road,40.0,15721,Scituate,Scituate,"Moore, Nicholas",Plymouth County,3/3/2017,2017-03-03,Boston Police Dept,Detective,,"Hunt, Daniel J.",Individual,201,2017 Mid-Year Report (ND),MA,,0,d142ad2a-0945-5dd5-a1f6-6cc9630c24c9,02066,02066,Daniel Hunt
14 Longmeadow Road,40.0,15721,Scituate,Scituate,"Moore, Nicholas",Plymouth County,4/9/2017,2017-04-09,Boston Police Dept,Detective,,"Hunt, Daniel J.",Individual,201,2017 Mid-Year Report (ND),MA,,0,adea40fb-60e4-5311-89d2-63da560495b5,02066,02066,Daniel Hunt
14 Longmeadow Road,40.0,15721,Scituate,Scituate,"Moore, Nicholas",Plymouth County,5/10/2017,2017-05-10,Boston Police Dept,Detective,,"Hunt, Daniel J.",Individual,201,2017 Mid-Year Report (ND),MA,,0,939cee67-3131-53ef-8e4f-4c84bda3b4a4,02066,02066,Daniel Hunt
14 Longmeadow Road,40.0,15721,Scituate,Scituate,"Moore, Nicholas",Plymouth County,6/5/2017,2017-06-05,Boston Police Dept,Detective,,"Hunt, Daniel J.",Individual,201,2017 Mid-Year Report (ND),MA,,0,9c4f34c9-5f4b-5ded-a4fd-fa91c580cc9e,02066,02066,Daniel Hunt
16 Saint Brendan Road,250.0,15721,Dorchester,Dorchester Center,"Young, Joseph M.",Suffolk County,12/7/2017,2017-12-07,Boston Police Department,Detective,,"Hunt, Daniel J.",Individual,201,2017 Year-end Report (ND),MA,,0,39d451a5-9d0b-5632-9e73-c0740af3bbfd,02124,02124,Daniel Hunt
16 Saint Brendan Road,500.0,15721,Dorchester,Dorchester Center,"Young, Joseph M.",Suffolk County,6/20/2019,2019-06-20,Boston Police Department,Detective,,"Hunt, Daniel J.",Individual,201,2019 Mid-Year Report,MA,Not Specified,0,0ef91a03-5d61-5237-bc7c-15a1e354888f,02124,02124,Daniel Hunt
84 Houghton Street,100.0,15721,Dorchester,Dorchester,"Murray, Timothy",Suffolk County,1/18/2014,2014-01-18,MA State Police,Trooper,,"Hunt, Daniel J.",Individual,201,2014 Pre-primary Report (Special) (ND),MA,Not Specified,0,09995528-e549-5e18-892e-a311fe647fde,02122,02122,Daniel Hunt
3 Edwards Rd.,200.0,15721,Braintree,Braintree,"Hunter, Edwatd F.",Norfolk County,12/1/2017,2017-12-01,Mass State Police,Trooper,,"Hunt, Daniel J.",Individual,201,2017 Year-end Report (ND),MA,,0,953e690c-bbf3-53c9-ab0b-d1f80ff21b8d,02184,02184,Daniel Hunt
"11 Beacon Street, Ste 700",150.0,15721,Boston,Boston,"Patterson, David A.",Suffolk County,12/26/2013,2013-12-26,State Police Assoc of MA,Troop Representative,,"Hunt, Daniel J.",Individual,201,2013 Year-end Report (ND),MA,Not Specified,0,753ec3a4-27d1-51fe-9548-0b0c1d9b4f1f,02108,02108,Daniel Hunt
16 Rosemont Road,200.0,15721,Worcester,Worcester,"Pullman, Dana A.",Worcester County,12/26/2013,2013-12-26,State Police Assoc of MA,President,,"Hunt, Daniel J.",Individual,201,2013 Year-end Report (ND),MA,Not Specified,0,3dfe9446-f4c2-5770-92d4-ca82f5225e93,01605,01605,Daniel Hunt
172 Train Street,150.0,15721,Dorchester,Dorchester,"Gillis, Susan",Suffolk County,1/18/2014,2014-01-18,Boston Police Department,Admin,,"Hunt, Daniel J.",Individual,201,2014 Pre-primary Report (Special) (ND),MA,Not Specified,0,42ee064e-b616-5cd5-9ba3-6d03bbe20595,02122,02122,Daniel Hunt
16 Rosemont Road,200.0,15721,Worcester,Worcester,"Pullman, Dana A.",Worcester County,12/1/2017,2017-12-01,State Police Assoc of MA,President,,"Hunt, Daniel J.",Individual,201,2017 Year-end Report (ND),MA,,0,78fbad95-1b6b-525b-88ea-fd1f364d135d,01605,01605,Daniel Hunt
2 Seneca Lane,100.0,15041,Sandwich,Sandwich,"Neal, David",Barnstable County,3/22/2010,2010-03-22,Barnstable County Sheriff,Deputy Sheriff,,"Hunt, F. Randal ",Individual,201,2010 Pre-primary Report (ND),MA,Not Specified,0,9bacab6e-6371-584a-9fe6-fceb9d1f7d1f,02563,02563,F. Hunt
2 Seneca Lane,50.0,15041,Sandwich,Sandwich,"Neal, David",Barnstable County,7/23/2010,2010-07-23,Barnstable County Sheriff,Deputy Sheriff,,"Hunt, F. Randal ",Individual,201,2010 Pre-primary Report (ND),MA,Not Specified,0,893abfcc-50ad-56f2-8a85-0b862cc7bae5,02563,02563,F. Hunt
2 Seneca Lane,100.0,15041,Sandwich,Sandwich,"Neal, David",Barnstable County,8/12/2010,2010-08-12,Barnstable County Sheriff,Deputy Sheriff,,"Hunt, F. Randal ",Individual,201,2010 Pre-primary Report (ND),MA,Not Specified,0,71ebfc93-1fb0-5a11-8707-4e0151b3c965,02563,02563,F. Hunt
2 Seneca Lane,100.0,15041,Sandwich,Sandwich,"Neal, David",Barnstable County,10/25/2010,2010-10-25,Barnstable County Sheriff,Deputy Sheriff,,"Hunt, F. Randal ",Individual,201,2010 Year-end Report (ND),MA,Not Specified,0,86e6d3f2-5fee-5683-827e-6ab3fd9d5388,02563,02563,F. Hunt
2 Seneca Lane,100.0,15041,Sandwich,Sandwich,"Neal, David",Barnstable County,6/30/2011,2011-06-30,Barnstable County Sheriff,Deputy Sheriff,,"Hunt, F. Randal ",Individual,201,2011 Mid-Year Report (ND),MA,Not Specified,0,9d922b1b-6e6a-508d-8572-06864328bf71,02563,02563,F. Hunt
7 Burning Tree Lane,100.0,15041,East Sandwich,East Sandwich,"Perry, Jeffrey",Barnstable County,6/30/2011,2011-06-30,Commonwealth of MA,Special Sheriff,,"Hunt, F. Randal ",Individual,201,2011 Mid-Year Report (ND),MA,Not Specified,0,82440cc1-a9fd-5c6c-9f4a-fdb752350811,02537,02537,F. Hunt
2 Seneca Lane,100.0,15041,Sandwich,Sandwich,"Neal, David",Barnstable County,12/30/2011,2011-12-30,Barnstable County Sheriff,Deputy Sheriff,,"Hunt, F. Randal ",Individual,201,2011 Year-end Report (ND),MA,Not Specified,0,ebf707be-48ab-5918-992a-46c41de06a96,02563,02563,F. Hunt
7 Burning Tree Lane,100.0,15041,East Sandwich,East Sandwich,"Perry, Jeffrey",Barnstable County,12/30/2011,2011-12-30,Commonwealth of MA,Special Sheriff,,"Hunt, F. Randal ",Individual,201,2011 Year-end Report (ND),MA,Not Specified,0,0ee28aca-a99c-5964-b6b4-08d516c579aa,02537,02537,F. Hunt
20 Hudson Street,100.0,15041,Falmouth,Falmouth,"Cummings, James",Barnstable County,3/16/2012,2012-03-16,Commonwealth of MA,Sheriff,,"Hunt, Randy",Individual,201,2012 Pre-primary Report (ND),MA,Not Specified,0,cfa13e55-bf57-56f6-b65e-78a50ee336be,02540,02540,Randy Hunt
2 Seneca Lane,100.0,15041,Sandwich,Sandwich,"Neal, David",Barnstable County,3/16/2012,2012-03-16,Commonwealth of MA,Deputy Sheriff,,"Hunt, Randy",Individual,201,2012 Pre-primary Report (ND),MA,Not Specified,0,3d93c3ed-c858-5524-94eb-2494b9d7a318,02563,02563,Randy Hunt
7 Burning Tree Lane,100.0,15041,East Sandwich,East Sandwich,"Perry, Jeffrey",Barnstable County,3/16/2012,2012-03-16,Commonwealth of MA,Special Sheriff,,"Hunt, Randy",Individual,201,2012 Pre-primary Report (ND),MA,Not Specified,0,e2fa0c5c-8074-5f54-b7cb-de423fcd73df,02537,02537,Randy Hunt
20 Hudson Street,100.0,15041,Falmouth,Falmouth,"Cummings, James",Barnstable County,6/12/2012,2012-06-12,Commonwealth of MA,Sheriff,,"Hunt, Randy",Individual,201,2012 Pre-primary Report (ND),MA,Not Specified,0,82db27bd-82b5-546d-8fe5-2ae0d94f65fa,02540,02540,Randy Hunt
2 Seneca Lane,100.0,15041,Sandwich,Sandwich,"Neal, David",Barnstable County,6/14/2012,2012-06-14,Commonwealth of MA,Deputy Sheriff,,"Hunt, Randy",Individual,201,2012 Pre-primary Report (ND),MA,Not Specified,0,3218d285-9c93-5a4e-882f-50e21e41b194,02563,02563,Randy Hunt
7 Burning Tree Lane,70.0,15041,East Sandwich,East Sandwich,"Perry, Jeffrey",Barnstable County,8/19/2012,2012-08-19,Commonwealth of MA,Special Sheriff,,"Hunt, Randy",Individual,201,2012 Pre-primary Report (ND),MA,Not Specified,0,c9b00ad0-0bc3-5dcb-880c-49201d131d03,02537,02537,Randy Hunt
2 Seneca Lane,100.0,15041,Sandwich,Sandwich,"Neal, David",Barnstable County,10/2/2012,2012-10-02,Commonwealth of MA,Deputy Sheriff,,"Hunt, Randy",Individual,201,2012 Pre-election Report (ND),MA,Not Specified,0,78e36ee3-6f04-5291-b343-d9eb3e65d27b,02563,02563,Randy Hunt
7 Burning Tree Lane,50.0,15041,East Sandwich,East Sandwich,"Perry, Jeffrey",Barnstable County,10/2/2012,2012-10-02,Commonwealth of MA,Special Sheriff,,"Hunt, Randy",Individual,201,2012 Pre-election Report (ND),MA,Not Specified,0,a4a8fa76-8b7b-50bb-969b-c37cfcf803f3,02537,02537,Randy Hunt
7 Burning Tree Lane,105.0,15041,East Sandwich,East Sandwich,"Perry, Jeffrey",Barnstable County,10/4/2012,2012-10-04,Commonwealth of MA,Special Sheriff,,"Hunt, Randy",Individual,201,2012 Pre-election Report (ND),MA,Not Specified,0,c562e223-7dd2-555f-b360-e2bb82a3e3c6,02537,02537,Randy Hunt
20 Hudson Street,300.0,15041,Falmouth,Falmouth,"Cummings, James",Barnstable County,10/11/2012,2012-10-11,Commonwealth of MA,Sheriff,,"Hunt, Randy",Individual,201,2012 Pre-election Report (ND),MA,Not Specified,0,d47a34b3-3c73-5482-8ce4-7cded130435a,02540,02540,Randy Hunt
2 Seneca Lane,100.0,15041,Sandwich,Sandwich,"Neal, David",Barnstable County,2/13/2013,2013-02-13,Barnstable County Sheriff,Deputy Sheriff,,"Hunt, Randy",Individual,201,2013 Mid-Year Report (ND),MA,Not Specified,0,31b3be9f-2a38-54f1-b8df-5d9139a2a370,02563,02563,Randy Hunt
127 Main Street,100.0,15041,Sandwich,Sandwich,"Perry, Jeffrey",Barnstable County,8/27/2013,2013-08-27,Commonwealth of MA,Special Sheriff,,"Hunt, Randy",Individual,201,2013 Year-end Report (ND),MA,Not Specified,0,40aa5e1c-f637-5411-be33-a6ccbd54a8d5,02563,02563,Randy Hunt
2 Seneca Lane,50.0,15041,Sandwich,Sandwich,"Neal, David",Barnstable County,8/30/2013,2013-08-30,Barnstable County Sheriff,Deputy Sheriff,,"Hunt, Randy",Individual,201,2013 Year-end Report (ND),MA,Not Specified,0,89759737-571c-5430-8dea-bb249369e62f,02563,02563,Randy Hunt
127 Main Street,100.0,15041,Sandwich,Sandwich,"Perry, Jeffrey",Barnstable County,12/28/2013,2013-12-28,Commonwealth of MA,Special Sheriff,,"Hunt, Randy",Individual,201,2013 Year-end Report (ND),MA,Not Specified,0,da9c0258-cdeb-5a31-af06-c1c02d7a74ac,02563,02563,Randy Hunt
2 Seneca Lane,100.0,15041,Sandwich,Sandwich,"Neal, David",Barnstable County,3/19/2014,2014-03-19,Barnstable County Sheriff,Deputy Sheriff,,"Hunt, Randy",Individual,201,2014 Pre-primary Report (ND),MA,Not Specified,0,44b370aa-83ad-592c-9c09-5f6d40ad317e,02563,02563,Randy Hunt
2 Seneca Lane,100.0,15041,Sandwich,Sandwich,"Neal, David",Barnstable County,4/18/2014,2014-04-18,Barnstable County Sheriff,Deputy Sheriff,,"Hunt, Randy",Individual,201,2014 Pre-primary Report (ND),MA,Not Specified,0,4b9fd14e-a95a-5974-8068-752506daf4e4,02563,02563,Randy Hunt
127 Main Street,100.0,15041,Sandwich,Sandwich,"Perry, Jeffrey",Barnstable County,4/18/2014,2014-04-18,Commonwealth of MA,Special Sheriff,,"Hunt, Randy",Individual,201,2014 Pre-primary Report (ND),MA,Not Specified,0,50d9f52b-6a7d-5cbb-89da-43f5b9420b51,02563,02563,Randy Hunt
2 Seneca Lane,100.0,15041,Sandwich,Sandwich,"Neal, David",Barnstable County,7/7/2014,2014-07-07,Barnstable County Sheriff,Deputy Sheriff,,"Hunt, Randy",Individual,201,2014 Pre-primary Report (ND),MA,Not Specified,0,0d7ccc2c-1af8-5e97-80c7-2d8152e55499,02563,02563,Randy Hunt
127 Main Street,50.0,15041,Sandwich,Sandwich,"Perry, Jeffrey",Barnstable County,7/7/2014,2014-07-07,Commonwealth of MA,Special Sheriff,,"Hunt, Randy",Individual,201,2014 Pre-primary Report (ND),MA,Not Specified,0,d9a66ce5-d754-5b20-a06c-614d0c4a1765,02563,02563,Randy Hunt
2 Seneca Lane,100.0,15041,Sandwich,Sandwich,"Neal, David",Barnstable County,7/12/2014,2014-07-12,Barnstable County Sheriff,Deputy Sheriff,,"Hunt, Randy",Individual,201,2014 Pre-primary Report (ND),MA,Not Specified,0,792d9abd-1676-509b-90eb-2cf863564dca,02563,02563,Randy Hunt
20 Hudson Street,250.0,15041,Falmouth,Falmouth,"Cummings, James",Barnstable County,7/28/2014,2014-07-28,Commonwealth of MA,Sheriff,,"Hunt, Randy",Individual,201,2014 Pre-primary Report (ND),MA,Not Specified,0,47f4b6db-33de-556c-be69-0ed97f6aabc1,02540,02540,Randy Hunt
2 Seneca Lane,100.0,15041,Sandwich,Sandwich,"Neal, David",Barnstable County,8/29/2014,2014-08-29,Barnstable County Sheriff,Deputy Sheriff,,"Hunt, Randy",Individual,201,2014 Pre-election Report (ND),MA,Not Specified,0,ceff7b8b-8034-54c0-9f14-12454bb11992,02563,02563,Randy Hunt
127 Main Street,50.0,15041,Sandwich,Sandwich,"Perry, Jeffrey",Barnstable County,9/22/2014,2014-09-22,Commonwealth of MA,Special Sheriff,,"Hunt, Randy",Individual,201,2014 Pre-election Report (ND),MA,Not Specified,0,968cd378-f58a-584f-bd0a-aa533b1fe84a,02563,02563,Randy Hunt
127 Main Street,80.0,15041,Sandwich,Sandwich,"Perry, Jeffrey",Barnstable County,10/15/2014,2014-10-15,Commonwealth of MA,Special Sheriff,,"Hunt, Randy",Individual,201,2014 Pre-election Report (ND),MA,Not Specified,0,042cc0a7-6a61-5bd8-bd27-ff1657a2e19b,02563,02563,Randy Hunt
20 Hudson Street,250.0,15041,Falmouth,Falmouth,"Cummings, James",Barnstable County,10/16/2014,2014-10-16,Commonwealth of MA,Sheriff,,"Hunt, Randy",Individual,201,2014 Pre-election Report (ND),MA,Not Specified,0,8b11ac1c-6ff2-51fb-86c9-bc8a627cf58d,02540,02540,Randy Hunt
127 Main Street,50.0,15041,Sandwich,Sandwich,"Perry, Jeffrey",Barnstable County,10/16/2014,2014-10-16,Commonwealth of MA,Special Sheriff,,"Hunt, Randy",Individual,201,2014 Pre-election Report (ND),MA,Not Specified,0,46f907a2-1e9b-524b-a8fa-5106c8a49998,02563,02563,Randy Hunt
127 Main Street,100.0,15041,Sandwich,Sandwich,"Perry, Jeffrey",Barnstable County,10/17/2015,2015-10-17,Commonwealth of Ma,Special Sheriff,,"Hunt, Randy",Individual,201,2015 Year-end Report (ND),MA,,0,2960918e-2624-5d69-804d-a7d9e19ac5ce,02563,02563,Randy Hunt
2 Seneca Lane,100.0,15041,Sandwich,Sandwich,"Neal, David",Barnstable County,12/18/2015,2015-12-18,Barnstable County Sheriff,Deputy Sheriff,,"Hunt, Randy",Individual,201,2015 Year-end Report (ND),MA,,0,b3345084-a7de-5623-8cfc-f13900bee7b0,02563,02563,Randy Hunt
127 Main Street,100.0,15041,Sandwich,Sandwich,"Perry, Jeffrey",Barnstable County,2/1/2016,2016-02-01,Commonwealth of Ma,Special Sheriff,,"Hunt, Randy",Individual,201,2016 Pre-primary Report (ND),MA,,0,4d41272e-26b3-59c7-8073-b2266728b4c6,02563,02563,Randy Hunt
127 Main Street,100.0,15041,Sandwich,Sandwich,"Perry, Jeffrey",Barnstable County,10/17/2016,2016-10-17,Commonwealth of Ma,Special Sheriff,,"Hunt, Randy",Individual,201,2016 Pre-election Report (ND),MA,,0,fe8c81a9-738d-5cf6-ae5e-40b32a10d4d3,02563,02563,Randy Hunt
127 Main Street,100.0,15041,Sandwich,Sandwich,"Perry, Jeffrey",Barnstable County,9/8/2017,2017-09-08,Commonwealth of Ma,Special Sheriff,,"Hunt, Randy",Individual,201,2017 Year-end Report (ND),MA,,0,076125c8-6f47-5dbc-994b-4759401cd780,02563,02563,Randy Hunt
20 Hudson Street,100.0,15041,Falmouth,Falmouth,"Cummings, James",Barnstable County,6/18/2018,2018-06-18,Commonwealth of MA,Sheriff,,"Hunt, Randy",Individual,201,2018 Pre-Primary Report,MA,Not Specified,0,fe59a0f2-01da-5d88-bc75-3daf6f7ea6e0,02540,02540,Randy Hunt
2 Seneca Lane,100.0,15041,Sandwich,Sandwich,"Neal, David",Barnstable County,6/19/2018,2018-06-19,Barnstable County Sheriff,Deputy Sheriff,,"Hunt, Randy",Individual,201,2018 Pre-Primary Report,MA,Not Specified,0,14501e5f-534b-5b18-8518-8aa66c0de0d5,02563,02563,Randy Hunt
127 Main Street,100.0,15041,Sandwich,Sandwich,"Perry, Jeffrey",Barnstable County,6/19/2018,2018-06-19,Commonwealth of Ma,Special Sheriff,,"Hunt, Randy",Individual,201,2018 Pre-Primary Report,MA,Not Specified,0,d6b2c5fc-c279-5093-a7f4-a729c836852c,02563,02563,Randy Hunt
127 Main Street,100.0,15041,Sandwich,Sandwich,"Perry, Jeffrey",Barnstable County,7/30/2018,2018-07-30,Commonwealth of Ma,Special Sheriff,,"Hunt, Randy",Individual,201,2018 Pre-Primary Report,MA,Not Specified,0,9082821f-1b1a-57a4-9521-59c7ac4ed93c,02563,02563,Randy Hunt
2 Seneca Lane,100.0,15041,Sandwich,Sandwich,"Neal, David",Barnstable County,7/31/2018,2018-07-31,Barnstable County Sheriff,Deputy Sheriff,,"Hunt, Randy",Individual,201,2018 Pre-Primary Report,MA,Not Specified,0,aa054491-f6c8-5c30-8a8d-2b9511a8cba3,02563,02563,Randy Hunt
2 Seneca Lane,100.0,15041,Sandwich,Sandwich,"Neal, David",Barnstable County,9/24/2018,2018-09-24,Barnstable County Sheriff,Deputy Sheriff,,"Hunt, Randy",Individual,201,2018 Pre-Election Report,MA,Not Specified,0,f962fd9b-d440-5e4e-81dc-5b42d524f982,02563,02563,Randy Hunt
127 Main Street,100.0,15041,Sandwich,Sandwich,"Perry, Jeffrey",Barnstable County,9/24/2018,2018-09-24,Commonwealth of Ma,Special Sheriff,,"Hunt, Randy",Individual,201,2018 Pre-Election Report,MA,Not Specified,0,a50eaf3f-e53c-5901-9a3f-8e443507a9ec,02563,02563,Randy Hunt
"625 U.S. Hwy 1, Suite 202",500.0,17454,Key West,,"Crane, Jonathan",,4/25/2020,2020-04-25,Monroe County Sheriff Department,Law Enforcement Officer,,"Hurst, Denise",Individual,201,4/25/20 Deposit Report,FL,Check,1,d1a3a3c3-4c84-58e1-8f98-2f8d6074fd62,33040,NA,Denise Hurst
3 Jeffrey Road,100.0,12534,North Reading,North Reading,"Jones, Daniel M.",Middlesex County,7/7/2010,2010-07-07,Town of North Reading,Police Officer,,"Jones Jr., Bradley H.",Individual,201,2010 Pre-primary Report (ND),MA,Not Specified,0,894f4102-ec0c-5524-a2e4-b4b5c461249a,01864,01864,Jr. Jones
3 Jeffrey Road,100.0,12534,North Reading,North Reading,"Jones, Daniel M.",Middlesex County,9/5/2012,2012-09-05,Town of North Reading,Police Officer,,"Jones Jr., Bradley H.",Individual,201,2012 Pre-election Report (ND),MA,Not Specified,0,9accc52d-87c3-547f-975f-c3c3cfb886db,01864,01864,Jr. Jones
16 Saint Brenda Road,200.0,12534,Dorchester,Dorchester Center,"Young, Joseph M",Suffolk County,12/18/2012,2012-12-18,City of Boston,Police Offcier,,"Jones Jr., Bradley H.",Individual,201,2012 Year-end Report (ND),MA,Not Specified,0,ed646c3c-aff9-5d39-b082-b779875fe7e3,02124,02124,Jr. Jones
16 Saint Brenda Road,200.0,12534,Dorchester,Dorchester Center,"Young, Joseph M",Suffolk County,4/2/2014,2014-04-02,City of Boston,Police Officer,,"Jones Jr., Bradley H.",Individual,201,2014 Pre-primary Report (ND),MA,Not Specified,0,06098a45-7db4-5853-bf6a-06fe7d5f6585,02124,02124,Jr. Jones
16 Saint Brendan Road,200.0,12534,Dorchester,Dorchester Center,"Young, Joseph M",Suffolk County,4/1/2015,2015-04-01,City of Boston,Police Officer,,"Jones Jr., Bradley H.",Individual,201,2015 Mid-Year Report (ND),MA,,0,e50eb613-f116-5bd6-acaa-7932a30de552,02124,02124,Jr. Jones
16 Saint Brenda Road,300.0,12534,Dorchester,Dorchester Center,"Young, Joseph M",Suffolk County,6/8/2017,2017-06-08,City of Boston,Police Officer,,"Jones Jr., Bradley H.",Individual,201,2017 Mid-Year Report (ND),MA,,0,bbe16b98-0dac-5c19-8aac-8c4b2e84cde7,02124,02124,Jr. Jones
16 Saint Brendan Road,500.0,12534,Dorchester,Dorchester Center,"Young, Joseph M",Suffolk County,5/23/2019,2019-05-23,City of Boston,Police Officer,,"Jones Jr., Bradley H.",Individual,201,2019 Mid-Year Report,MA,Not Specified,0,c0102d59-e1d9-5a78-a9ff-3898ddcf4804,02124,02124,Jr. Jones
24 Forest Drive,250.0,12534,Holden,Holden,"Daly, Anfrew J.",Worcester County,4/6/2016,2016-04-06,Mass. State,State Trooper,,"Jones Jr., Bradley H.",Individual,201,2016 Pre-primary Report (ND),MA,,0,c9a5d7c4-d9da-5654-8d75-a6013a602caa,01520,01520,Jr. Jones
3 Edwards Road,250.0,12534,Braintree,Braintree,"Hunter, Edward F.",Norfolk County,4/6/2016,2016-04-06,Mass. State Police,State Trooper,,"Jones Jr., Bradley H.",Individual,201,2016 Pre-primary Report (ND),MA,,0,73493363-5c37-5cd9-bd06-5162d905ed50,02184,02184,Jr. Jones
60 Summer St.,75.0,15930,Westborough,Westborough,"Gordon, Alan",Worcester County,1/21/2015,2015-01-21,Town of Westborough,Police Chief,,"Kane, Hannah",Individual,201,2015 Pre-primary Report (Special) (ND),MA,Not Specified,0,07e63254-5031-52ba-99a6-44dd5be0c3a2,01581,01581,Hannah Kane
395 Walnut Street,50.0,15930,Shrewsbury,Shrewsbury,"Newell, Ryan",Worcester County,2/25/2015,2015-02-25,Town of Southborough,Police Officer,,"Kane, Hannah",Individual,201,2015 Pre-election Report (Special) (ND),MA,Not Specified,0,5c6886ec-63da-51e2-8245-0fe4aaaa743e,01545,01545,Hannah Kane
60 Summer St.,50.0,15930,Westborough,Westborough,"Gordon, Alan",Worcester County,10/15/2016,2016-10-15,Town of Westborough,Police Chief,,"Kane, Hannah",Individual,201,2016 Pre-election Report (ND),MA,,0,b2119eca-9545-59d6-9cf5-a6329d46d79f,01581,01581,Hannah Kane
70 Richfield Rd,500.0,15930,Arlington,Arlington,"Sofis, Lisa",Middlesex County,9/8/2019,2019-09-08,Self Employed,Police Ed. & Training,,"Kane, Hannah",Individual,201,2019 Year-end Report,MA,Not Specified,0,be05bdaa-3e48-575b-8d26-ca23c884cfbc,02474,02474,Hannah Kane
26 Ortolani Cir ,100.0,15930,Kingston,Kingston,"McDonald, Jr., Joseph",Plymouth County,3/5/2015,2015-03-05,Plymouth county,Sheriff,,"Kane, Hannah",Individual,201,2015 Pre-election Report (Special) (ND),MA,Not Specified,0,80bd0ee9-1bb0-576f-a1af-9f305cf83ddb,02364,02364,Hannah Kane
110 East Main St.,100.0,16962,Northborough,Northborough,"Kearney, William",Worcester County,7/31/2018,2018-07-31,Westborough Police Department,Police Officer,,"Kearney, Patrick J.",Individual,201,2018 Pre-Primary Report,MA,Not Specified,0,7a61b0a0-7d27-5e9f-9491-a9cd704bf73e,01532,01532,Patrick Kearney
2 Canoe River Rd,200.0,16962,South Easton,South Easton,"Rota, John",Bristol County,9/10/2018,2018-09-10,Ma State Police,Police,,"Kearney, Patrick J.",Individual,201,2018 Pre-Election Report,MA,Not Specified,0,0e7d2527-ed4a-5db2-a09f-8a26c816ecef,02375,02375,Patrick Kearney
2 canoe River Rd,300.0,16962,South Easton,South Easton,"Rota, John",Bristol County,10/19/2018,2018-10-19,Commonwealth of Massachusetts ,State Police Lieutenant,,"Kearney, Patrick J.",Individual,201,2018 Pre-Election Report,MA,Not Specified,0,43a30c29-5de5-5fc9-b235-5075d62af4a2,02375,02375,Patrick Kearney
2 Canoe River Rd,100.0,16962,South Easton ,South Easton,"Rota, John",Bristol County,7/8/2019,2019-07-08,Comm of Mass,State Police,,"Kearney, Patrick J.",Individual,201,2019 Year-end Report,MA,Not Specified,0,9aad1bc0-dd99-5af1-8ffd-92c248bd6ed7,02375,02375,Patrick Kearney
360 Neponset St,100.0,16962,Canton,Canton,"Porro, Richard",Norfolk County,7/28/2019,2019-07-28,Dedham ,Police,,"Kearney, Patrick J.",Individual,201,2019 Year-end Report,MA,Not Specified,0,7a1049dc-f1f2-5598-8e03-50cb3fcd062d,02021,02021,Patrick Kearney
28 Vernon Rd,50.0,16962,Scituate ,Scituate,"Arroyo, James",Plymouth County,12/23/2019,2019-12-23,Comm of Mass,Law enforcement ,,"Kearney, Patrick J.",Individual,201,2019 Year-end Report,MA,Not Specified,0,7dd9aa79-67c6-5811-8265-35aca9593052,02066,02066,Patrick Kearney
14 Lord St,100.0,16962,Waltham,Waltham,"Koutoujian, Peter",Middlesex County,8/28/2018,2018-08-28,Commonwealth of MA,Sheriff,,"Kearney, Patrick J.",Individual,201,2018 Pre-Election Report,MA,Not Specified,0,5e1d0476-951f-505f-9534-d7374b53e3b4,02451,02451,Patrick Kearney
64 Ossipee Rd,100.0,16962,Somerville,Somerville,"Ciampa, Thelma",Middlesex County,9/14/2018,2018-09-14,Middlesex County,Sheriffs Department Part Time,,"Kearney, Patrick J.",Individual,201,2018 Pre-Election Report,MA,Not Specified,0,a9d9e585-79ae-546c-8481-c41a79fb0513,02144,02144,Patrick Kearney
PO Box 986,50.0,16962,Nantucket,Nantucket,"Perelman, James",Nantucket County,9/21/2018,2018-09-21,State of MA,Nantucket Sheriff,,"Kearney, Patrick J.",Individual,201,2018 Pre-Election Report,MA,Not Specified,0,a0c018f4-9c0e-594a-9edd-8b03562fa3b9,02554,02554,Patrick Kearney
3 N Dale St,500.0,16962,Peabody,Peabody,"Glynn, Thomas",Essex County,5/15/2018,2018-05-15,Retired,Retired State Trooper,,"Kearney, Patrick J.",Individual,201,2018 Pre-Primary Report,MA,Not Specified,0,0353d742-5fff-5ead-80ad-b09b22c33864,01960,01960,Patrick Kearney
2 Canoe Riv,200.0,16962,South Easton,South Easton,"Rota, John",Bristol County,9/14/2018,2018-09-14,State Police,Trooper,,"Kearney, Patrick J.",Individual,201,2018 Pre-Election Report,MA,Not Specified,0,26148ed9-e0a6-55eb-a7b5-4e20e181544d,02375,02375,Patrick Kearney
115 Quincy Ave,100.0,16962,Marshfield ,Marshfield,"Reidy, Robert",Plymouth County,7/28/2019,2019-07-28,Marshfield Police,k-9 handler,,"Kearney, Patrick J.",Individual,201,2019 Year-end Report,MA,Not Specified,0,8e83abda-e3c7-5a1b-bb04-507347fd1868,02050,02050,Patrick Kearney
,50.0,14957,Holden,Holden,"Gregory, Simon",Worcester County,12/26/2017,2017-12-26,,Retired Military Police Officer,,"Keefe, Mary S.",Individual,201,2017 Year-end Report (ND),MA,,0,f3786a4c-7ca5-552d-8c18-d86086c35219,01520,01520,Mary Keefe
9 Avry Heights Dr,50.0,14957,Holden,Holden,"Gregory, Simon",Worcester County,7/2/2018,2018-07-02,,Retired Military Police Officer,,"Keefe, Mary S.",Individual,201,2018 Pre-Primary Report,MA,Not Specified,0,a268be0d-22ee-50ca-93c6-39f8feb0cb3d,01520,01520,Mary Keefe
Po Box 1434,100.0,15527,Newburyport,Newburyport,"Adams, Howard",Essex County,3/9/2017,2017-03-09,City of Newburyport,Police Officer,,"Kelcourse, James M.",Individual,201,2017 Mid-Year Report (ND),MA,,0,c316b8dd-d86d-59ca-9647-ff6cfc520746,01950,01950,James Kelcourse
Po Box 1434,125.0,15527,Newburyport,Newburyport,"Adams, Howard",Essex County,6/5/2017,2017-06-05,City of Newburyport,Police Officer,,"Kelcourse, James M.",Individual,201,2017 Mid-Year Report (ND),MA,,0,d883eb70-41ec-5bdd-ac6f-73bc3e17ade8,01950,01950,James Kelcourse
334 Central St,100.0,15527,Rowley,Rowley,"Reilly, Michael",Essex County,11/20/2017,2017-11-20,Town of Newbury,Chief of Police,,"Kelcourse, James M.",Individual,201,2017 Year-end Report (ND),MA,,0,467bcf65-3458-5598-a925-76d5726a970a,01969,01969,James Kelcourse
1 Lt Leary Drive,100.0,15527,Newburyport,Newburyport,"Gabriel, James",Essex County,1/2/2018,2018-01-02,Everett,Police,,"Kelcourse, James M.",Individual,201,2018 Pre-Primary Report,MA,Not Specified,0,5c98df6c-bb43-58a5-841f-c6de2ed19559,01950,01950,James Kelcourse
Po Box 1434,100.0,15527,Newburyport,Newburyport,"Adams, Howard",Essex County,2/26/2018,2018-02-26,City of Newburyport,Police Officer,,"Kelcourse, James M.",Individual,201,2018 Pre-Primary Report,MA,Not Specified,0,39837945-58d4-57e5-b533-3f056c56793a,01950,01950,James Kelcourse
1 Lt Leary Drive,100.0,15527,Newburyport,Newburyport,"Gabriel, James",Essex County,3/19/2018,2018-03-19,Everett,Police,,"Kelcourse, James M.",Individual,201,2018 Pre-Primary Report,MA,Not Specified,0,dce82fa1-3a59-52fa-8f88-d2c0589b8fa1,01950,01950,James Kelcourse
334 Central St,100.0,15527,Rowley,Rowley,"Reilly, Michael",Essex County,3/19/2018,2018-03-19,Town of Newbury,Chief of Police,,"Kelcourse, James M.",Individual,201,2018 Pre-Primary Report,MA,Not Specified,0,fc8de4f0-f668-574d-a0c3-91bae31c822c,01969,01969,James Kelcourse
Po Box 1434,125.0,15527,Newburyport,Newburyport,"Adams, Howard",Essex County,6/4/2018,2018-06-04,City of Newburyport,Police Officer,,"Kelcourse, James M.",Individual,201,2018 Pre-Primary Report,MA,Not Specified,0,95e19a8b-ecf6-5f8f-b9b9-493f81db9826,01950,01950,James Kelcourse
1 Lt Leary Drive,150.0,15527,Newburyport,Newburyport,"Gabriel, James",Essex County,8/24/2018,2018-08-24,Everett,Police,,"Kelcourse, James M.",Individual,201,2018 Pre-election Report (ND),MA,Not Specified,0,4103c4d3-5a04-5326-bf99-3e99e9d2c06c,01950,01950,James Kelcourse
Po Box 1434,100.0,15527,Newburyport,Newburyport,"Adams, Howard",Essex County,7/12/2019,2019-07-12,City of Newburyport,Police Officer,,"Kelcourse, James M.",Individual,201,2019 Year-end Report,MA,Not Specified,0,a1e4cc8c-61ae-520d-aefa-1f9c6062143e,01950,01950,James Kelcourse
17 Rawson Avenue,100.0,15527,Newburyport,Newburyport,"Cutter, Ryan",Essex County,8/26/2019,2019-08-26,City of Newburyport,Police Officer,,"Kelcourse, James M.",Individual,201,2019 Year-end Report,MA,Not Specified,0,03f00e2d-20e0-55c7-a1cd-8f2172631ac2,01950,01950,James Kelcourse
12c Partidge Lane,100.0,15527,Salisbury,Salisbury,"Fowler, Thomas",Essex County,8/26/2019,2019-08-26,Town of Salisbury,Chief of Police,,"Kelcourse, James M.",Individual,201,2019 Year-end Report,MA,Not Specified,0,7dbd8d87-35a5-5254-9895-2be62e6ed6cf,01952,01952,James Kelcourse
1 Lt Leary Drive,150.0,15527,Newburyport,Newburyport,"Gabriel, James",Essex County,8/26/2019,2019-08-26,Everett,Police,,"Kelcourse, James M.",Individual,201,2019 Year-end Report,MA,Not Specified,0,1c2764b8-1a29-5d21-9a1d-8ff9f1d95198,01950,01950,James Kelcourse
17 Rawson Avenue,200.0,15527,Newburyport,Newburyport,"Cutter, Ryan",Essex County,12/21/2019,2019-12-21,City of Newburyport,Police Officer,,"Kelcourse, James M.",Individual,201,2019 Year-end Report,MA,Not Specified,0,a7ba7d1e-c91d-5466-a57a-b3e35495274b,01950,01950,James Kelcourse
1 Lt Leary Drive,150.0,15527,Newburyport,Newburyport,"Gabriel, James",Essex County,12/21/2019,2019-12-21,Everett,Police,,"Kelcourse, James M.",Individual,201,2019 Year-end Report,MA,Not Specified,0,f0e60703-741b-5134-b971-5756e35e0237,01950,01950,James Kelcourse
2 Seneca Ln.,50.0,14256,Sandwich,Sandwich,"Neal, David",Barnstable County,10/17/2010,2010-10-17,"Barnstable County , Massachusetts",Deputy Sheriff,,"Keyes, Thomas F.",Individual,201,2010 Year-end Report (ND),MA,Not Specified,0,f7f1bdf7-e65d-5308-9e41-a27eb3e1d1e7,02563,02563,Thomas Keyes
2 Seneca Ln.,100.0,14256,Sandwich,Sandwich,"Neal, David",Barnstable County,10/29/2010,2010-10-29,"Barnstable County, Massachusetts",Deputy Sheriff,,"Keyes, Thomas F.",Individual,201,2010 Year-end Report (ND),MA,Not Specified,0,a5452b42-903f-5430-b0ea-d5a0caae5f74,02563,02563,Thomas Keyes
24 Forest Drive,250.0,11323,Holden,Holden,"Daly, Andrew",Worcester County,4/5/2016,2016-04-05,Ma State Police,State Trooper,,"Kulik, Stephen",Individual,201,2016 Pre-primary Report (ND),MA,,0,d91cd579-d784-50b1-9169-b490a74c53f7,01520,01520,Stephen Kulik
3 Edwards Road,250.0,11323,Braintree,Braintree,"Hunter, Edward",Norfolk County,4/5/2016,2016-04-05,Commonwealth of Ma,State Trooper,,"Kulik, Stephen",Individual,201,2016 Pre-primary Report (ND),MA,,0,52624842-b6ad-50c4-8452-2bd9242320db,02184,02184,Stephen Kulik
139 Windham Rd,200.0,16092,Hyde Park,Hyde Park,"Chrispin, Eddy",Suffolk County,8/17/2016,2016-08-17,City of Boston,Police Officer,,"Lacet, Jovan",Individual,201,2016 Pre-primary Report (ND),MA,,0,b790b73e-afbc-5af1-9333-1ab3d13345bd,02136,02136,Jovan Lacet
108 Devon St,300.0,16092,Dorchester,Dorchester,"Stephens, Vincent",Suffolk County,8/23/2016,2016-08-23,CITY OF BOSTON,Police Officer,,"Lacet, Jovan",Individual,201,2016 Year-end Report (ND),MA,,0,74830454-937d-569b-a419-d1019248e2bb,02121,02121,Jovan Lacet
108 Devon Street,300.0,16092,Dorchester,Dorchester,"Stephens, Vincent",Suffolk County,8/24/2016,2016-08-24,CITY OF BOSTON,Police Officer,,"Lacet, Jovan",Individual,201,2016 Year-end Report (ND),MA,,0,92749137-7798-52f3-8158-0f10ce680d64,02121,02121,Jovan Lacet
108 Devon Street,300.0,16092,Dorchester,Dorchester,"Stephens, Vincent",Suffolk County,8/22/2018,2018-08-22,CITY OF BOSTON,Police Officer,,"Lacet, Jovan",Individual,201,2018 Pre-Election Report,MA,Not Specified,0,84d609b1-05b2-5aba-9ab4-4bba1248fc8e,02121,02121,Jovan Lacet
139 Windham Rd,200.0,16092,Hyde Park,Hyde Park,"Chrispin, Eddy",Suffolk County,5/16/2020,2020-05-16,City of Boston,Police Officer,,"Lacet, Jovan",Individual,201,5/16/20 Deposit Report,MA,Credit Card,3,4424253c-edd9-5706-b8cb-96baba73a514,02136,02136,Jovan Lacet
144 Glenwood Ave,500.0,16092,Hyde Park,Hyde Park,"Forbes, Gretta",Suffolk County,6/20/2016,2016-06-20,CITY OF BOSTON,Law Enforcement Officer,,"Lacet, Jovan",Individual,201,2016 Pre-primary Report (ND),MA,,0,3660fcaf-69a5-5221-bc61-679e5983c365,02136,02136,Jovan Lacet
31 Orchard Street,100.0,16092,Hyde Park,Hyde Park,"Long, Michael",Suffolk County,4/5/2018,2018-04-05,City of Boston,Law Enforcement Officer,,"Lacet, Jovan",Individual,201,2018 Pre-primary Report (ND),MA,,0,7f4e1b2a-46df-5928-822b-23e4601304f6,02136,02136,Jovan Lacet
144 Glenwood Ave,500.0,16092,Hyde Park,Hyde Park,"Forbes, Gretta",Suffolk County,4/7/2018,2018-04-07,CITY OF BOSTON,Law Enforcement Officer,,"Lacet, Jovan",Individual,201,2018 Pre-primary Report (ND),MA,,0,3bd9a983-352e-5601-9197-2fdddb2d9008,02136,02136,Jovan Lacet
"25 New Chardon Street, Unit 6544",100.0,16092,Boston,Boston,"Wheeler, Bernard",Suffolk County,6/28/2018,2018-06-28,State of Ma,Law Enforcement,,"Lacet, Jovan",Individual,201,2018 Pre-primary Report (ND),MA,,0,232af02b-16eb-5411-9223-2fac1afc2353,02114,02114,Jovan Lacet
3 Roberta Lane,250.0,16092,Bellingham,Bellingham,"Humber, Michael",Norfolk County,7/29/2018,2018-07-29,Commonwealth of Massachusetts,Law Enforcement,,"Lacet, Jovan",Individual,201,2018 Pre-primary Report (ND),MA,,0,29c6750c-535c-5695-bba0-d434b20a0e2f,02019,02019,Jovan Lacet
144 Glenwood Ave,300.0,16092,Hyde Park,Hyde Park,"Forbes, Gretta",Suffolk County,8/29/2018,2018-08-29,CITY OF BOSTON,Law Enforcement Officer,,"Lacet, Jovan",Individual,201,2018 Pre-Election Report,MA,Not Specified,0,69fecdc2-bb0c-5ba6-90cc-dac3c816e4ec,02136,02136,Jovan Lacet
139 Windham Rd,300.0,16092,Hyde Park,Hyde Park,"Chrispin, Eddy",Suffolk County,8/31/2018,2018-08-31,City of Boston,Law Enforcement Officer,,"Lacet, Jovan",Individual,201,2018 Pre-Election Report,MA,Not Specified,0,c96690aa-c8c1-541d-aa59-f77a8bc8609b,02136,02136,Jovan Lacet
61 Columbia Road,100.0,16092,Boston,Dorchester,"Ellison, Larry",Suffolk County,9/1/2018,2018-09-01,City of Boston,Law Enforcement Officer,,"Lacet, Jovan",Individual,201,2018 Pre-Election Report,MA,Not Specified,0,b63856c1-f4b9-5672-a296-feb4846adb4a,02121,02121,Jovan Lacet
1165 Blue Hill Avenue,500.0,16092,Boston,Dorchester Center,"Hosein, Haseeb",Suffolk County,12/8/2018,2018-12-08,City of Boston,Law Enforcement,,"Lacet, Jovan",Individual,201,2018 Year-end Report,MA,Not Specified,0,0035738f-88ed-552d-857e-0a6dc4b0d785,02124,02124,Jovan Lacet
1165 Blue Hill Avenue,500.0,16092,Boston,Dorchester Center,"Hosein, Haseeb",Suffolk County,1/10/2020,2020-01-10,City of Boston,Law Enforcement,,"Lacet, Jovan",Individual,201,1/10/20 Deposit Report,MA,Check,1,97777529-25d0-5e5d-b59f-e8093003406b,02124,02124,Jovan Lacet
82 Rosseter Street,100.0,16092,Boston,Dorchester,"William, Terrance",Suffolk County,1/10/2020,2020-01-10,Suffolk County Sheriff's Department,Law Enforcement,,"Lacet, Jovan",Individual,201,1/10/20 Deposit Report,MA,Check,1,ab358e76-6ded-5e7f-8d75-43dda3d459cc,02121,02121,Jovan Lacet
2400 Washington Street,200.0,16092,Dorchester,Dorchester,"Stephens, Vincent",Suffolk County,1/27/2020,2020-01-27,CITY OF BOSTON,Law Enforcement,,"Lacet, Jovan",Individual,201,1/27/20 Deposit Report,MA,Check,1,aa01bf80-16f8-532f-859a-ed87ea5cc1b7,02121,02121,Jovan Lacet
144 Glenwood Ave,250.0,16092,Hyde Park,Hyde Park,"Forbes, Gretta",Suffolk County,4/9/2020,2020-04-09,CITY OF BOSTON,Law Enforcement,,"Lacet, Jovan",Individual,201,4/9/20 Deposit Report,MA,Check,1,170f6d10-b0a4-5faa-87f1-e7cb857a6be6,02136,02136,Jovan Lacet
266 Valley Street,500.0,17016,Pembroke,Pembroke,"Mazzola, Douglas",Plymouth County,3/9/2020,2020-03-09,"Town of Plympton, Ma",Police Officer,,"LaNatra, Kathleen R.",Individual,201,3/9/20 Deposit Report,MA,Check,1,b35c6755-775b-5053-b671-b91478bed8a1,02359,02359,Kathleen LaNatra
12 Crestshire Dr.,250.0,13828,Lawrence,Lawrence,"Garrihy, Michael",Essex County,5/1/2010,2010-05-01,City Of Lawrence,Police Officer,,"Lantigua, William",Individual,201,2010 Year-end report (MUN),MA,Not Specified,0,d97ac412-d987-5947-855b-e40e280742de,01843,01843,William Lantigua
12 Crestshire DR.,250.0,13828,Lawrence,Lawrence,"Romero, John J.",Essex County,5/1/2010,2010-05-01,City of Lawrence,Chief of Police,,"Lantigua, William",Individual,201,2010 Year-end report (MUN),MA,Not Specified,0,28ea9b5b-44ed-564a-92ac-03eada785210,01843,01843,William Lantigua
674 Salem St.,250.0,13828,North Andover,North Andover,"Takesian, Stephen M.",Essex County,5/1/2010,2010-05-01,City of Lawrence,Police Officer,,"Lantigua, William",Individual,201,2010 Year-end report (MUN),MA,Not Specified,0,a8303c30-e8af-58ac-aabc-17aa6a6f44f7,01845,01845,William Lantigua
12 Crestshire Dr.,150.0,13828,Lawrence,Lawrence,"Garrihy, Michael",Essex County,12/28/2010,2010-12-28,City Of Lawrence,Police Officer,,"Lantigua, William",Individual,201,2010 Year-end report (MUN),MA,Not Specified,0,e36fcd7a-6ea0-5786-8730-552b67ab05f7,01843,01843,William Lantigua
674 Salem St.,100.0,13828,North Andover,North Andover,"Takesian, Stephen M.",Essex County,2/23/2011,2011-02-23,City of Lawrence,Police Officer,,"Lantigua, William",Individual,201,2011 Year-end report (MUN),MA,Not Specified,0,d3b37b82-4da4-5d41-9b0b-79aab9e3c3b2,01845,01845,William Lantigua
65b Oak St,200.0,13828,Lawrence,Lawrence,"Yancey, Gary",Essex County,2/8/2012,2012-02-08,City of Lawrence,Police Officer,,"Lantigua, William",Individual,201,2012 Year-end report (MUN),MA,Not Specified,0,05317dcf-b3bd-5a27-9e3a-8c5f60f2af7b,01841,01841,William Lantigua
2 Museum Sq. Apt. 1013,500.0,13828,Lawrence,Lawrence,"Flores Jr., Jose A.",Essex County,3/5/2012,2012-03-05,City of Lawrence,Police Officer,,"Lantigua, William",Individual,201,2012 Year-end report (MUN),MA,Not Specified,0,e51fd3eb-c5ac-556d-b8f4-0ef57d3d6fb4,01840,01840,William Lantigua
79 Dracut St.,100.0,13828,Lawrence,Lawrence,"Aguiler, Maurice",Essex County,2/25/2013,2013-02-25,City Of Lawrence,Police Officer,,"Lantigua, William",Individual,201,2013 Pre-primary Report (MUN),MA,Not Specified,0,0137b0a0-e1a6-58fe-9412-d5fa02a14743,01843,01843,William Lantigua
14 Marie Lane,100.0,13828,Lawrence,Lawrence,"Guerrero, Fabian",Essex County,2/25/2013,2013-02-25,City of Lawrence,Police Officer,,"Lantigua, William",Individual,201,2013 Pre-primary Report (MUN),MA,Not Specified,0,2782b2a9-6c5f-5da5-902a-2d741daa49cd,01843,01843,William Lantigua
100 Meadow Creek Dr,250.0,13828,Dracut,Dracut,"McNamara, Scott J",Middlesex County,2/25/2013,2013-02-25,Lawrence Police Dept.,POLICE Officer,,"Lantigua, William",Individual,201,2013 Pre-primary Report (MUN),MA,Not Specified,0,31e2d4e2-fca2-5893-9e85-dd533edc49fa,01826,01826,William Lantigua
65b Oak St,100.0,13828,Lawrence,Lawrence,"Yancey, Gary",Essex County,3/1/2013,2013-03-01,City of Lawrence,Police Officer,,"Lantigua, William",Individual,201,2013 Pre-primary Report (MUN),MA,Not Specified,0,dd3e9219-e9f2-59c4-b0f1-6e3e4964ab9e,01841,01841,William Lantigua
79 Dracut St.,100.0,13828,Lawrence,Lawrence,"Aguiler, Maurice",Essex County,3/26/2013,2013-03-26,City Of Lawrence,Police Officer,,"Lantigua, William",Individual,201,2013 Pre-primary Report (MUN),MA,Not Specified,0,56ae7d1a-7e7f-5761-a835-d21dec6038a8,01843,01843,William Lantigua
71 Bowdoing St,100.0,13828,Lawrence,Lawrence,"Crow, Jhon W",Essex County,3/26/2013,2013-03-26,lawrence police dept,police officer ,,"Lantigua, William",Individual,201,2013 Pre-primary Report (MUN),MA,Not Specified,0,10a9ee95-8558-504a-aa91-d1e300bf309d,01843,01843,William Lantigua
14 Marie Lane,100.0,13828,Lawrence,Lawrence,"Guerrero, Fabian",Essex County,3/26/2013,2013-03-26,City of Lawrence,Police Officer,,"Lantigua, William",Individual,201,2013 Pre-primary Report (MUN),MA,Not Specified,0,da9750bc-b81c-5710-9d81-1e3b7f5ab9d3,01843,01843,William Lantigua
288 Brandybrow Rd.,100.0,13828,Haverhill,Haverhill,"McCarthy, Michael F.",Essex County,3/26/2013,2013-03-26,City of Lawrence,Police Officer,,"Lantigua, William",Individual,201,2013 Pre-primary Report (MUN),MA,Not Specified,0,e74bf1da-fd19-58f9-bd61-b8c8353c2c48,01830,01830,William Lantigua
15 Nesmith St,100.0,13828,Lawrence,Lawrence,"Purpora, Carmen",Essex County,3/26/2013,2013-03-26,Lawrence Police,Police Officer,,"Lantigua, William",Individual,201,2013 Pre-primary Report (MUN),MA,Not Specified,0,b1df61a4-68ea-5a8d-8d13-d44d328c8515,01841,01841,William Lantigua
98 Photine Dr.,500.0,13828,Lowell,Lowell,"Martinez, Jose O.",Middlesex County,4/9/2013,2013-04-09,city of lawrence ,police officer,,"Lantigua, William",Individual,201,2013 Pre-primary Report (MUN),MA,Not Specified,0,20c885ed-d0f3-5a7b-aacd-dad4a8c8c302,01854,01854,William Lantigua
65b Oak St,100.0,13828,Lawrence,Lawrence,"Yancey, Gary",Essex County,4/9/2013,2013-04-09,City of Lawrence,Police Officer,,"Lantigua, William",Individual,201,2013 Pre-primary Report (MUN),MA,Not Specified,0,5c4a7a35-1150-5304-8768-8fedf29959f8,01841,01841,William Lantigua
14 Marie Lane,100.0,13828,Lawrence,Lawrence,"Guerrero, Fabian",Essex County,7/3/2013,2013-07-03,City of Lawrence,Police Officer,,"Lantigua, William",Individual,201,2013 Pre-primary Report (MUN),MA,Not Specified,0,e989ca7d-0aa5-57c2-9b11-9a3203a102f6,01843,01843,William Lantigua
8 Sherman St,500.0,13828,Lawrence,Lawrence,"Conway, Shawn",Essex County,7/15/2013,2013-07-15,city of lawrence ,police officer,,"Lantigua, William",Individual,201,2013 Pre-primary Report (MUN),MA,Not Specified,0,90670a30-bd2b-5a36-8d7e-4103587ce735,01841,01841,William Lantigua
65B Oak St,300.0,13828,Lawrence,Lawrence,"Yancey, Gary",Essex County,7/15/2013,2013-07-15,City of Lawrence,Police Officer,,"Lantigua, William",Individual,201,2013 Pre-primary Report (MUN),MA,Not Specified,0,f79a90c8-215e-54b6-988f-f54d1f4e7788,01841,01841,William Lantigua
14 Marie Lane,100.0,13828,Lawrence,Lawrence,"Guerrero, Fabian",Essex County,8/20/2013,2013-08-20,City of Lawrence,Police Officer,,"Lantigua, William",Individual,201,2013 Pre-primary Report (MUN),MA,Not Specified,0,aca9e54c-5618-50be-9349-9c2700d0fe57,01843,01843,William Lantigua
100 Meadow Creek Dr,100.0,13828,Dracut,Dracut,"McNamara, Scott J",Middlesex County,8/20/2013,2013-08-20,Lawrence Police Dept.,POLICE Officer,,"Lantigua, William",Individual,201,2013 Pre-primary Report (MUN),MA,Not Specified,0,a2a255e7-e780-51b1-8473-09956cd4b455,01826,01826,William Lantigua
4 Wabash Road,100.0,13828,Wilmington,Wilmington,"Fraser, Daron L",Middlesex County,9/4/2013,2013-09-04,Lawrence Police Dept.,Police Officer,,"Lantigua, William",Individual,201,2013 Pre-election Report (MUN),MA,Not Specified,0,97595d8d-c278-5814-b629-611e5fc5ec0f,01887,01887,William Lantigua
27 Ferncliff Ave,100.0,13828,Saugus,Saugus,"Pennington, Terence D",Essex County,9/4/2013,2013-09-04,lawrence police dept ,police officer ,,"Lantigua, William",Individual,201,2013 Pre-election Report (MUN),MA,Not Specified,0,fe61ee3b-3532-5ce6-8618-7694a3de9827,01906,01906,William Lantigua
79 Dracut St.,100.0,13828,Lawrence,Lawrence,"Aguiler, Maurice",Essex County,9/9/2013,2013-09-09,City Of Lawrence,Police Officer,,"Lantigua, William",Individual,201,2013 Pre-election Report (MUN),MA,Not Specified,0,95029923-3cb8-54f4-bbdb-13b82f674827,01843,01843,William Lantigua
288 Brandybrow Rd.,100.0,13828,Haverhill,Haverhill,"McCarthy, Michael F.",Essex County,9/9/2013,2013-09-09,City of Lawrence,Police Officer,,"Lantigua, William",Individual,201,2013 Pre-election Report (MUN),MA,Not Specified,0,6254068c-8b0f-50fa-9a0f-dfc3ed3f4c3e,01830,01830,William Lantigua
100 Meadow Creek Dr,100.0,13828,Dracut,Dracut,"McNamara, Scott J",Middlesex County,9/9/2013,2013-09-09,Lawrence Police Dept.,POLICE Officer,,"Lantigua, William",Individual,201,2013 Pre-election Report (MUN),MA,Not Specified,0,2538994a-d4e3-57bf-ae24-f75d589d1cd9,01826,01826,William Lantigua
15 Smith St,100.0,13828,Lawrence,Lawrence,"Purpora, Carmen J.",Essex County,9/9/2013,2013-09-09,City of Lawrence,Police Officer,,"Lantigua, William",Individual,201,2013 Pre-election Report (MUN),MA,Not Specified,0,b766d1ca-bf38-5642-b453-27e1f52610f5,01843,01843,William Lantigua
140 Prospect Hill Dr,100.0,13828,Tewksbury,Tewksbury,"Fleming, Daniel J",Middlesex County,9/14/2013,2013-09-14,Lawrence Police Dept.,Police Officer,,"Lantigua, William",Individual,201,2013 Pre-election Report (MUN),MA,Not Specified,0,7cc9c80f-99f9-5fe2-834c-65a4650fdf78,01876,01876,William Lantigua
14 Marie Lane,100.0,13828,Lawrence,Lawrence,"Guerrero, Fabian",Essex County,10/5/2013,2013-10-05,City of Lawrence,Police Officer,,"Lantigua, William",Individual,201,2013 Pre-election Report (MUN),MA,Not Specified,0,8df4dd42-ba8e-598e-a5ed-553597811034,01843,01843,William Lantigua
6 State St,100.0,13828,Lawrence,Lawrence,"Purpora, Carmen J.",Essex County,10/5/2013,2013-10-05,Lawrence Police,Police Officer,,"Lantigua, William",Individual,201,2013 Pre-election Report (MUN),MA,Not Specified,0,94a5e5ba-9dbc-5213-aba7-8a1a7d129755,01843,01843,William Lantigua
116 Chester St,100.0,13828,Lawrence,Lawrence,"Camacho, Claudio E",Essex County,10/21/2013,2013-10-21,City of Lawrence,Police Officer,,"Lantigua, William",Individual,201,2013 Year-end report (MUN),MA,Not Specified,0,fe2c6118-8129-5526-bc44-64e207b27608,01843,01843,William Lantigua
140 Prospect Hill Dr,100.0,13828,Tewksbury,Tewksbury,"Fleming, Daniel J",Middlesex County,10/21/2013,2013-10-21,Lawrence Police Dept.,Police Officer,,"Lantigua, William",Individual,201,2013 Year-end report (MUN),MA,Not Specified,0,c61810e1-c435-53bd-aa18-f2e44882017c,01876,01876,William Lantigua
2 Museum Sq. Apt. 1013,200.0,13828,Lawrence,Lawrence,"Flores Jr., Jose A.",Essex County,10/21/2013,2013-10-21,City of Lawrence,Police Officer,,"Lantigua, William",Individual,201,2013 Year-end report (MUN),MA,Not Specified,0,a894cd46-9e2c-56f1-9e10-cfe5a224612e,01840,01840,William Lantigua
288 Brandybrow Rd.,100.0,13828,Haverhill,Haverhill,"McCarthy, Michael F.",Essex County,10/21/2013,2013-10-21,City of Lawrence,Police Officer,,"Lantigua, William",Individual,201,2013 Year-end report (MUN),MA,Not Specified,0,402dfbd4-9dde-59f3-b0a9-17db0778d061,01830,01830,William Lantigua
6 State St,100.0,13828,Lawrence,Lawrence,"Purpora, Carmen J.",Essex County,10/21/2013,2013-10-21,Lawrence Police,Police Officer,,"Lantigua, William",Individual,201,2013 Year-end report (MUN),MA,Not Specified,0,5161ff0e-be19-5fd0-a0c2-1e24853a725a,01843,01843,William Lantigua
104 Beacon St,100.0,13828,Lawrence,Lawrence,"Vasque, Roy",Essex County,10/21/2013,2013-10-21,City of Lawrence,Police Officer,,"Lantigua, William",Individual,201,2013 Year-end report (MUN),MA,Not Specified,0,2599450d-74d7-5623-94b7-018a8a1f0820,01843,01843,William Lantigua
37 Webb St.,500.0,13828,Methuen,Methuen,"Alarcon, Elvin",Essex County,11/12/2013,2013-11-12,City of Methuen,Police Officer,,"Lantigua, William",Individual,201,2013 Year-end report (MUN),MA,Not Specified,0,b5e72f17-0774-5131-8106-d9abdc2e66ba,01844,01844,William Lantigua
79 7dracut St.,100.0,13828,Lawrence,Lawrence,"Aguiler, Maurice",Essex County,9/18/2014,2014-09-18,City Of Lawrence,Police Officer,,"Lantigua, William",Individual,201,2014 Pre-election Report (ND),MA,Not Specified,0,2b0c84fe-dcdb-51fb-9492-d61af20ab1f5,01843,01843,William Lantigua
14 Marie Lane,200.0,13828,Lawrence,Lawrence,"Guerrero, Fabian",Essex County,9/18/2014,2014-09-18,City of Lawrence,Police Officer,,"Lantigua, William",Individual,201,2014 Pre-election Report (ND),MA,Not Specified,0,f61874b9-1443-50ca-b461-8eac674cebee,01843,01843,William Lantigua
6 State St,100.0,13828,Lawrence,Lawrence,"Purpora, Carmen",Essex County,9/18/2014,2014-09-18,Lawrence Police,Police Officer,,"Lantigua, William",Individual,201,2014 Pre-election Report (ND),MA,Not Specified,0,4fc49f0e-d70c-55a2-8954-9ea6c949ca90,01843,01843,William Lantigua
65b Oak St,250.0,13828,Lawrence,Lawrence,"Yancey, Gary",Essex County,9/18/2014,2014-09-18,City of Lawrence,Police Officer,,"Lantigua, William",Individual,201,2014 Pre-election Report (ND),MA,Not Specified,0,bb0f2094-942b-566f-b38b-42da4f00fd3e,01841,01841,William Lantigua
79 Dracut St.,100.0,13828,Lawrence,Lawrence,"Aguiler, Maurice",Essex County,10/7/2014,2014-10-07,City Of Lawrence,Police Officer,,"Lantigua, William",Individual,201,2014 Pre-election Report (ND),MA,Not Specified,0,1d5b9b89-a784-52b4-aba8-8118c2fa8421,01843,01843,William Lantigua
4 Wabash Road,100.0,13828,Wilmington,Wilmington,"Fraser, Daron L",Middlesex County,10/7/2014,2014-10-07,Lawrence Police Dept.,Police Officer,,"Lantigua, William",Individual,201,2014 Pre-election Report (ND),MA,Not Specified,0,85824180-9586-51ce-9631-a766be7f81a0,01887,01887,William Lantigua
14 Marie Lane,100.0,13828,Lawrence,Lawrence,"Guerrero, Fabian",Essex County,10/7/2014,2014-10-07,City of Lawrence,Police Officer,,"Lantigua, William",Individual,201,2014 Pre-election Report (ND),MA,Not Specified,0,5ce2282c-7ddd-559e-b8df-ba1f54e1562e,01843,01843,William Lantigua
6 State St,100.0,13828,Lawrence,Lawrence,"Purpora, Carmen",Essex County,10/7/2014,2014-10-07,Lawrence Police,Police Officer,,"Lantigua, William",Individual,201,2014 Pre-election Report (ND),MA,Not Specified,0,fc2f7cc0-ac55-527c-b046-7893e45d996f,01843,01843,William Lantigua
79 7dracut St.,100.0,13828,Lawrence,Lawrence,"Aguiler, Maurice",Essex County,10/28/2014,2014-10-28,City Of Lawrence,Police Officer,,"Lantigua, William",Individual,201,2014 Year-end Report (ND),MA,Not Specified,0,6ef1078c-de35-5c3d-b698-cde37f6472b1,01843,01843,William Lantigua
116 Chester St,100.0,13828,Lawrence,Lawrence,"Camacho, Claudio E",Essex County,10/28/2014,2014-10-28,City of Lawrence,Police Officer,,"Lantigua, William",Individual,201,2014 Year-end Report (ND),MA,Not Specified,0,c40bd5ed-4e72-5b29-aa11-8297ad5e1c23,01843,01843,William Lantigua
6 State St,50.0,13828,Lawrence,Lawrence,"Purpora, Carmen",Essex County,10/28/2014,2014-10-28,Lawrence Police,Police Officer,,"Lantigua, William",Individual,201,2014 Year-end Report (ND),MA,Not Specified,0,6b5cdc45-8ec6-56cf-b4c2-bc3efd5bb24a,01843,01843,William Lantigua
14 Marie Lane,100.0,13828,Lawrence,Lawrence,"Guerrero, Fabian",Essex County,11/3/2014,2014-11-03,City of Lawrence,Police Officer,,"Lantigua, William",Individual,201,2014 Year-end Report (ND),MA,Not Specified,0,9b93c875-6d48-5338-9195-5da325599c16,01843,01843,William Lantigua
66 Chase Rd.,100.0,13828,Londonderry,,"Brooks, Richard",,8/17/2017,2017-08-17,City of Lawrence,Police Officer,,"Lantigua, William",Individual,201,8/17/17 Deposit Report,NH,Check,1,08458266-6ca3-5234-9ef2-79e67d9a651e,03053,NA,William Lantigua
15 Beresford St.,50.0,13828,Lawrence,Lawrence,"Camacho, Claudio E.",Essex County,8/17/2017,2017-08-17,City of Lawrence,Police Officer,,"Lantigua, William",Individual,201,8/17/17 Deposit Report,MA,Check,1,27639dd6-be97-5bc7-9086-d3620c7adad5,01843,01843,William Lantigua
15 Mahoney Way,100.0,13828,Haverhill,Haverhill,"Raso, James J.",Essex County,8/17/2017,2017-08-17,,Police Lieutenant,,"Lantigua, William",Individual,201,8/17/17 Deposit Report,MA,Check,1,a9589bbb-bff5-5102-9b70-31aec661aa07,01832,01832,William Lantigua
18 Arrowwood St,300.0,13828,Methuen,Methuen,"Simard, Michael",Essex County,8/17/2017,2017-08-17,City of Lawrence,Police Sergeant,,"Lantigua, William",Individual,201,8/17/17 Deposit Report,MA,Check,1,c027e530-597e-5e76-aa87-3ceb274f7f36,01844,01844,William Lantigua
18 Farrwood Dr,100.0,13828,Haverhill,Haverhill,"Takesian, Stephen M.",Essex County,9/8/2017,2017-09-08,City of Lawrence,Police Officer,,"Lantigua, William",Individual,201,9/8/17 Deposit Report,MA,Check,1,c2afec2f-2ede-5f91-9e94-e7427693e404,01835,01835,William Lantigua
18 Arrowwood St,50.0,13828,Methuen,Methuen,"Simard, Michael",Essex County,9/21/2017,2017-09-21,City of Lawrence,Police Sergeant,,"Lantigua, William",Individual,201,9/21/17 Deposit Report,MA,Check,1,e306975b-ce11-536c-901c-1632167bbc80,01844,01844,William Lantigua
65b Oak St,250.0,13828,Lawrence,Lawrence,"Yancey, Gary",Essex County,10/10/2017,2017-10-10,City of Lawrence,Police Officer,,"Lantigua, William",Individual,201,10/10/17 Deposit Report,MA,Check,1,63a5d60e-27af-56de-929b-d2022be05077,01841,01841,William Lantigua
18 Farrwood Dr,100.0,13828,Haverhill,Haverhill,"Takesian, Stephen M.",Essex County,10/27/2017,2017-10-27,City of Lawrence,Police Officer,,"Lantigua, William",Individual,201,10/27/17 Deposit Report,MA,Check,1,4f0c8c3e-856e-5ee2-a997-2894ad587574,01835,01835,William Lantigua
15 Beresford St.,100.0,13828,Lawrence,Lawrence,"Camacho, Claudio E.",Essex County,11/6/2017,2017-11-06,City of Lawrence,Police Officer,,"Lantigua, William",Individual,201,11/6/17 Deposit Report,MA,Check,1,fed8d670-976f-513e-b6ba-a469e2c21ebf,01843,01843,William Lantigua
3 Field Rd,100.0,13828,Windham,,"Murphy, Thomas",,11/6/2017,2017-11-06,Lawrence Police Dept.,Policeman,,"Lantigua, William",Individual,201,11/6/17 Deposit Report,NH,Check,1,90704888-68df-52df-aeeb-a55cd86f4b96,03087,NA,William Lantigua
15 Mahoney Way,100.0,13828,Haverhill,Haverhill,"Raso, James J.",Essex County,11/6/2017,2017-11-06,City of Lawrence,Police Lieutenant,,"Lantigua, William",Individual,201,11/6/17 Deposit Report,MA,Check,1,36d30635-7635-59d8-b722-14779ea68f3e,01832,01832,William Lantigua
18 Arrowwood St,100.0,13828,Methuen,Methuen,"Simard, Michael",Essex County,11/6/2017,2017-11-06,City of Lawrence,Police Sergeant,,"Lantigua, William",Individual,201,11/6/17 Deposit Report,MA,Check,1,1ef5d45e-a0fc-53b2-b64d-c5dc539a7db7,01844,01844,William Lantigua
639 Haverhill St,50.0,13828,Lawrence,Lawrence,"Vargas, Jordany",Essex County,11/6/2017,2017-11-06,City of Lawrence,Police Officer,,"Lantigua, William",Individual,201,11/6/17 Deposit Report,MA,Check,1,e4fac3a2-93a2-5210-be3f-4cba20348065,01841,01841,William Lantigua
Po Box 3157,500.0,13828,Lawrence,Lawrence,"Russo, Andress",Essex County,6/21/2018,2018-06-21,LPD,Police Officer,,"Lantigua, William",Individual,201,2018 Pre-Primary Report,MA,Not Specified,0,bae875d9-7bd7-5c96-b716-789c835b1534,01840,01840,William Lantigua
18 Farrwood Dr,100.0,13828,Haverhill,Haverhill,"Takesian, Stephen M.",Essex County,6/29/2018,2018-06-29,City of Lawrence,Police Officer,,"Lantigua, William",Individual,201,2018 Pre-Primary Report,MA,Not Specified,0,a44afcd2-0ce2-5803-a01a-866a63227f0a,01835,01835,William Lantigua
18 Arrowwood St,50.0,13828,Methuen,Methuen,"Simard, Michael",Essex County,8/20/2018,2018-08-20,City of Lawrence,Police Sergeant,,"Lantigua, William",Individual,201,2018 Pre-Election Report,MA,Not Specified,0,befb562b-5ae2-5bcc-8c3a-c2254431fda2,01844,01844,William Lantigua
65B Oak St,100.0,13828,Lawrence,Lawrence,"Yancey, Gary C.",Essex County,10/23/2018,2018-10-23,City of Lawrence,Police Officer,,"Lantigua, William",Individual,201,2018 Year-end Report,MA,Not Specified,0,194b90e8-7336-559e-a1cd-16baf4cece7b,01841,01841,William Lantigua
43 cage st ,300.0,13828,Methuen,Methuen,"Encarnacion, Junior",Essex County,4/23/2013,2013-04-23,Essex County Sheriff,Deputy Sheriff,,"Lantigua, William",Individual,201,2013 Pre-primary Report (MUN),MA,Not Specified,0,811c18ec-0906-50bb-ade8-0bc722e21d8f,01844,01844,William Lantigua
2 Plisch Way,250.0,13828,Lawrence,Lawrence,"Jackson, J.L.",Essex County,5/1/2010,2010-05-01,Lawrence Police Dept.,Facilities Director,,"Lantigua, William",Individual,201,2010 Year-end report (MUN),MA,Not Specified,0,bfc159a8-392e-5ede-b645-3648016dce30,01841,01841,William Lantigua
2 Plisch Way,35.0,13828,Lawrence,Lawrence,"Jackson, J.L.",Essex County,12/13/2010,2010-12-13,lawrence police dept.,director of facilities,,"Lantigua, William",Individual,201,2010 Year-end report (MUN),MA,Not Specified,0,15d06ff4-f68d-5b11-b291-ae0aa3daf09b,01841,01841,William Lantigua
29 Robinson Ct,100.0,13828,Lawrence,Lawrence,"Garcia, Carlos R",Essex County,10/31/2013,2013-10-31,Lawrence Police,911 Dispacher,,"Lantigua, William",Individual,201,2013 Year-end report (MUN),MA,Not Specified,0,e5034518-c8cc-5069-acb9-3598fb7db74f,01841,01841,William Lantigua
358 Lockville Rd,25.0,17486,Harding,,"Hurchick, Andrew",,4/8/2020,2020-04-08,Pa State Police,Trooper,,"LaRose, William",Individual,201,4/8/20 Deposit Report,PA,Credit Card,3,cd917214-be1e-5345-848c-4d7d5401a988,18643,NA,William LaRose
6107 New London Rd,250.0,17486,New Market,,"North, Robert",,4/28/2020,2020-04-28,Maryland State Police,Trooper,,"LaRose, William",Individual,201,4/28/20 Deposit Report,MD,Credit Card,3,3203ea37-846a-56f6-b7c8-58823ecf50c4,21774,NA,William LaRose
11 Puritan Road,200.0,15297,Watertown,Watertown,"Grady, Thomas J.",Middlesex County,2/23/2011,2011-02-23,Watertown Police Department,POLICE OFFICER,,"Lawn, John",Individual,201,2011 Pre-primary Report (Special) (ND),MA,Not Specified,0,d435533d-a972-50d0-a31f-74aa77da025b,02472,02472,John Lawn
11 Pierce Avenue,250.0,15297,Westford,Westford,"Hanrahan, Justin",Middlesex County,3/16/2011,2011-03-16,Watertown Police Department,POLICE OFFICER,,"Lawn, John",Individual,201,2011 Pre-primary Report (Special) (ND),MA,Not Specified,0,e3598d81-8df1-53b8-9558-8bdbc25693a2,01886,01886,John Lawn
11 Puritan Road,150.0,15297,Watertown,Watertown,"Grady, Thomas J.",Middlesex County,3/16/2013,2013-03-16,Watertown Police Department,POLICE OFFICER,,"Lawn, John",Individual,201,2013 Mid-Year Report (ND),MA,Not Specified,0,69b89612-b363-5b65-94bf-9f2240d7fbe4,02472,02472,John Lawn
8 Carleton Road,50.0,15297,Waltham,Waltham,"O'Connell, Kevin",Middlesex County,12/5/2019,2019-12-05,City of Waltham,Police Captain,,"Lawn, John",Individual,201,2019 Year-end Report,MA,Not Specified,0,bca41738-c60d-5332-b9ad-7188b8f24262,02451,02451,John Lawn
15 Derby Road,100.0,15297,Watertown,Watertown,"Amedio, Kerilyn",Middlesex County,12/9/2019,2019-12-09,Town of Watertown,POLICE OFFICER,,"Lawn, John",Individual,201,2019 Year-end Report,MA,Not Specified,0,ad928df3-0672-550c-b022-36e489ab313b,02471,02471,John Lawn
258 Beal Road,300.0,15297,Waltham,Waltham,"Lawn, Michael P.",Middlesex County,12/12/2019,2019-12-12,Town of Watertown,Police Chief,,"Lawn, John",Individual,201,2019 Year-end Report,MA,Not Specified,0,fc2b2e9f-db31-5702-a6a6-a9699e55fef4,02453,02453,John Lawn
20 Puritan Road,100.0,15297,Watertown,Watertown,"Driscoll, Timothy S.",Middlesex County,12/17/2019,2019-12-17,Comm of Mass,State Police Officer,,"Lawn, John",Individual,201,2019 Year-end Report,MA,Not Specified,0,a5a8d7ea-8e1e-56a2-aa79-db689bc93846,02472,02472,John Lawn
40 LaFayette Street,50.0,15297,Waltham,Waltham,"McLaughlin, Joseph",Middlesex County,12/17/2019,2019-12-17,,Newton Police,,"Lawn, John",Individual,201,2019 Year-end Report,MA,Not Specified,0,5be72fb9-abc7-5982-9086-75080a1a5a5d,02453,02453,John Lawn
258 Beal Road,250.0,15297,Waltham,Watertown,"Lawn, Michael P.",Middlesex County,4/19/2012,2012-04-19,Watertown Police Department,Detective Division Commander                                                  ,David Collins,"Lawn, John",Individual,201,2012 Pre-primary Report (ND),MA,Not Specified,0,881fc1ce-39a1-538b-a144-eb4d5b877d93,02477,02477,John Lawn
20 Puritan Road,200.0,15297,Watertown,Watertown,"Driscoll, Timothy S.",Middlesex County,4/26/2012,2012-04-26,Massachusetts State Police,Officer,,"Lawn, John",Individual,201,2012 Pre-primary Report (ND),MA,Not Specified,0,62009fdd-92a5-5e1e-a317-f1faaa867fbb,02472,02472,John Lawn
20 Puritan Road,200.0,15297,Watertown,Watertown,"Driscoll, Timothy S.",Middlesex County,3/16/2013,2013-03-16,Massachusetts State Police,Officer,,"Lawn, John",Individual,201,2013 Mid-Year Report (ND),MA,Not Specified,0,9c54f3ea-4c98-5faf-b34b-e3c587985516,02472,02472,John Lawn
5 Summer Street,100.0,15297,Mattapoisett,Mattapoisett,"Machado, James",Plymouth County,3/5/2015,2015-03-05,Mass Police Association,Legislative Agent,,"Lawn, John",Individual,201,2015 Mid-Year Report (ND),MA,Check,1,9c1e55d8-79e5-54da-ac1a-7a09e8efac37,02739,02739,John Lawn
20 Puritan Road,200.0,15297,Watertown,Watertown,"Driscoll, Timothy S.",Middlesex County,5/12/2015,2015-05-12,Massachusetts State Police,Officer,,"Lawn, John",Individual,201,2015 Mid-Year Report (ND),MA,Check,1,3ebc477a-07c2-52de-9232-3e01bf53a9ff,02472,02472,John Lawn
11 Phoenix Street,100.0,16867,Worcester,Worcester,"Bonardi, Jesse",Worcester County,1/1/2018,2018-01-01,Worcester Police Department,police officer,,"LeBoeuf, David Henry Argosky",Individual,201,2018 Pre-Primary Report,MA,Not Specified,0,a6f43887-52c2-57fb-914b-33c9bed0fd76,01604,01604,David LeBoeuf
Pô Box 181119,100.0,16867,Boston,Boston,"Clapham, Ronald",Suffolk County,12/16/2017,2017-12-16,Massachusetts State Police,State Trooper,,"LeBoeuf, David Henry Argosky",Individual,201,2017 Year-end Report (ND),MA,,0,c4897827-3630-5c7c-98e2-f3c9915ead92,02118,02118,David LeBoeuf
60 Dudley Street,100.0,16867,Chelsea,Chelsea,"Clapham, Ronald",Suffolk County,1/17/2020,2020-01-17,Massachusetts State Police,State Trooper,,"LeBoeuf, David Henry Argosky",Individual,201,1/17/20 Deposit Report,MA,Credit Card,3,29b51959-cde1-567a-bdb8-7766abb09f89,02150,02150,David LeBoeuf
po box 316,250.0,15581,wakefield,Wakefield,"O'Connell, Michael",Middlesex County,3/26/2013,2013-03-26,town of wakefield ma,police detective,,"Livingstone, Jay",Individual,201,2013 Pre-primary Report (Special) (ND),MA,Not Specified,0,a0a6708d-6b9d-564c-b210-2644334ce616,01880,01880,Jay Livingstone
po box 316,250.0,15581,wakefield,Wakefield,"O'Connell, Michael",Middlesex County,12/21/2015,2015-12-21,town of wakefield ma,police detective,,"Livingstone, Jay",Individual,201,2015 Year-end Report (ND),MA,,0,492bdc15-43c1-5d56-a409-019f39eb0899,01880,01880,Jay Livingstone
101 Wordsworth St,200.0,15581,East Boston,Boston,"Deveau, Edward",Suffolk County,2/9/2016,2016-02-09,Watertown Police Department,Police Chief,,"Livingstone, Jay",Individual,201,2016 Pre-primary Report (Special) (ND),MA,,0,df5d0352-facc-5228-8646-98be53f31939,02128,02128,Jay Livingstone
95 Franklin St,1000.0,15581,Revere,Revere,"Mullen, Michael",Suffolk County,2/18/2016,2016-02-18,City of Revere,Police Officer,,"Livingstone, Jay",Individual,201,2016 Pre-primary Report (Special) (ND),MA,,0,d48c71e6-c7b1-5912-8128-a9d218f24699,02151,02151,Jay Livingstone
19 Bolton Rd.,100.0,15581,Billerica,Billerica,"Magalhaes, Steven",Middlesex County,6/11/2013,2013-06-11,Cambridge Police,Detective,,"Livingstone, Jay",Individual,201,2013 Post-election Report (ND),MA,Not Specified,0,ccc391c2-d6e9-590b-8074-d04446a293f7,01821,01821,Jay Livingstone
,200.0,14232,Billerica,Billerica,"West, Bill",Middlesex County,4/28/2014,2014-04-28,Town of Billerica,Police Officer,,"Lombardo, Marc",Individual,201,2014 Pre-primary Report (ND),MA,Not Specified,0,62ed13c3-a2f0-5ce8-bac5-c318ee7b3f2a,01821,01821,Marc Lombardo
21 King Street Extension,75.0,17005,Leicester,Leicester,"Hagglund, Nathan",Worcester County,8/4/2018,2018-08-04,Town of Sudbury Ma,Police Officer,,"Loosemore, W. Stuart",Individual,201,2018 Pre-primary Report (ND),MA,,0,d7541343-d1a9-57c0-b3a6-3b867b474d21,01524,01524,W. Loosemore
23 Ardmore St,500.0,15934,Braintree,Braintree,"DiBona, Anthony",Norfolk County,12/29/2014,2014-12-29,City of Quincy,Captain of Police Department,,"Madaro, Adrian",Individual,201,2014 Year-end Report (ND),MA,Not Specified,0,bfd3c230-35e4-5b84-92f0-1f88f901ec88,02184,02184,Adrian Madaro
23 Ardmore St ,1000.0,15934,Braintree,Braintree,"DiBona, Anthony",Norfolk County,1/22/2015,2015-01-22,City of Quincy,Captain of Police Department,,"Madaro, Adrian",Individual,201,2015 Pre-primary Report (Special) (ND),MA,Not Specified,0,ac076785-5ebc-5d3c-b609-d75b0a1792ad,02184,02184,Adrian Madaro
29 Adams Street,100.0,15934,Wilmington,Wilmington,"Gallarelli, Joseph",Middlesex County,2/27/2015,2015-02-27,City of Boston,Police Officer,,"Madaro, Adrian",Individual,201,2015 Pre-election Report (Special) (ND),MA,Not Specified,0,0d3372c2-4f26-54b1-aaf9-d43eeed5b7a6,01887,01887,Adrian Madaro
16 Cottage St,50.0,15934,East Boston,Boston,"Perez, Norberto",Suffolk County,3/27/2015,2015-03-27,Boston Police Department,Police Officer,,"Madaro, Adrian",Individual,201,2015 Post-election Report (ND),MA,,0,20d9024f-ed57-56ec-87aa-873ebf9945cd,02128,02128,Adrian Madaro
30 Pine Street,250.0,15934,Medfield,Medfield,"Martin, James",Norfolk County,4/10/2015,2015-04-10,City of Boston,Police Officer,,"Madaro, Adrian",Individual,201,2015 Post-election Report (ND),MA,,0,04d820e2-20d6-5a90-af16-fb21535fe5ec,02052,02052,Adrian Madaro
27 Sanders Drive,200.0,15934,Saugus,Saugus,"Domenico, Thomas",Essex County,4/22/2015,2015-04-22,City of Boston,Policeman,,"Madaro, Adrian",Individual,201,2015 Mid-Year Report (ND),MA,,0,a0cbf838-1d11-586e-ab5d-4df8d9aaf24a,01906,01906,Adrian Madaro
16 Cottage St,100.0,15934,East Boston,Boston,"Perez, Norberto",Suffolk County,4/22/2015,2015-04-22,Boston Police Department,Police Officer,,"Madaro, Adrian",Individual,201,2015 Mid-Year Report (ND),MA,,0,ebaad90e-ca9a-5c96-8146-0c4565f69bb4,02128,02128,Adrian Madaro
16 Cottage St,100.0,15934,East Boston,Boston,"Perez, Norberto",Suffolk County,11/13/2015,2015-11-13,Boston Police Department,Police Officer,,"Madaro, Adrian",Individual,201,2015 Year-end Report (ND),MA,,0,50a3a973-7d37-545b-9666-60b0907c2cb9,02128,02128,Adrian Madaro
30 Pine Street,100.0,15934,Medfield,Medfield,"Martin, James",Norfolk County,11/23/2015,2015-11-23,City of Boston,Police Officer,,"Madaro, Adrian",Individual,201,2015 Year-end Report (ND),MA,,0,2cbbe342-14c7-55ae-a89b-0ecb7e36f099,02052,02052,Adrian Madaro
"350 Brement St., Unit 103",25.0,15934,East Boston,Boston,"Martin, Rashaun",Suffolk County,4/8/2016,2016-04-08,City of Boston,Police Officer,,"Madaro, Adrian",Individual,201,2016 Pre-primary Report (ND),MA,,0,00c96b93-edc3-509a-8a38-7963d79b0675,02128,02128,Adrian Madaro
607 Chestnut Street,200.0,15934,Lynnfield,Lynnfield,"Marino, Gary",Essex County,4/25/2016,2016-04-25,City of Boston,Police Officer,,"Madaro, Adrian",Individual,201,2016 Pre-primary Report (ND),MA,,0,06a23feb-6158-50ca-9e3b-6e1cc2e31a21,01940,01940,Adrian Madaro
16 Cottage St,100.0,15934,East Boston,Boston,"Perez, Norberto",Suffolk County,10/4/2016,2016-10-04,Boston Police Department,Police Officer,,"Madaro, Adrian",Individual,201,2016 Pre-election Report (ND),MA,,0,d373e7b9-f46c-57dd-ba2b-9c82dd5d86f6,02128,02128,Adrian Madaro
30 Pine Street,100.0,15934,Medfield,Medfield,"Martin, James",Norfolk County,10/21/2016,2016-10-21,City of Boston,Police Officer,,"Madaro, Adrian",Individual,201,2016 Pre-election Report (ND),MA,,0,21fd45b7-5e3e-5a66-920c-7a5615999027,02052,02052,Adrian Madaro
"350 Brement St., Unit 103",50.0,15934,East Boston,Boston,"Martin, Rashaun",Suffolk County,10/21/2016,2016-10-21,City of Boston,Police Officer,,"Madaro, Adrian",Individual,201,2016 Pre-election Report (ND),MA,,0,424559d6-ca37-56d5-9273-37aa099e16d6,02128,02128,Adrian Madaro
30 Pine St,200.0,15934,Medfield,Medfield,"Martin, James",Norfolk County,3/17/2017,2017-03-17,Boston Police,Police Officer,,"Madaro, Adrian",Individual,201,2017 Mid-Year Report (ND),MA,Not Specified,0,3cbd0859-2775-5a6c-ad0d-4cbd03dae9c1,02052-1703,02052,Adrian Madaro
422 Summer St,100.0,15934,Boston,Boston,"Dibiasio, Allison",Suffolk County,6/16/2017,2017-06-16,City of Boston,Police Officer,,"Madaro, Adrian",Individual,201,2017 Mid-Year Report (ND),MA,Not Specified,0,c8160e22-708a-5244-bd29-03bdb01e7b62,02210-1717,02210,Adrian Madaro
488 Baker St,100.0,15934,West Roxbury,West Roxbury,"Poulos, Anthony",Suffolk County,6/23/2017,2017-06-23,BPD,Police Officer,,"Madaro, Adrian",Individual,201,2017 Mid-Year Report (ND),MA,Not Specified,0,f658a442-f22b-52e6-bf8c-b7f8a47a0991,02132-4236,02132,Adrian Madaro
30 Pine St,100.0,15934,Medfield,Medfield,"Martin, James",Norfolk County,7/7/2017,2017-07-07,Boston Police,Police Officer,,"Madaro, Adrian",Individual,201,2017 Year-end Report (ND),MA,Not Specified,0,6e073f2d-0512-5498-a459-2ca81d47026d,02052-1703,02052,Adrian Madaro
30 Pine St,100.0,15934,Medfield,Medfield,"Martin, James",Norfolk County,10/24/2017,2017-10-24,Boston Police,Police Officer,,"Madaro, Adrian",Individual,201,2017 Year-end Report (ND),MA,Not Specified,0,5c171771-fa7b-5c38-8991-f0fc9d43437d,02052-1703,02052,Adrian Madaro
422 Sumner St,100.0,15934,Boston,Boston,"Eng, Allison",Suffolk County,11/3/2017,2017-11-03,City of Boston,Police Officer,,"Madaro, Adrian",Individual,201,2017 Year-end Report (ND),MA,Not Specified,0,a11ee702-7297-59f2-9f36-41fa3514b28f,02128-2220,02128,Adrian Madaro
30 Pine St,100.0,15934,Medfield,Medfield,"Martin, James",Norfolk County,11/3/2017,2017-11-03,Boston Police,Police Officer,,"Madaro, Adrian",Individual,201,2017 Year-end Report (ND),MA,Not Specified,0,b2fa376e-b14c-588f-bba4-a73af241f6bb,02052-1703,02052,Adrian Madaro
1 Ellen Rd,100.0,15934,Woburn,Woburn,"Simons, Daniel",Middlesex County,11/3/2017,2017-11-03,City of Boston,Police Officer,,"Madaro, Adrian",Individual,201,2017 Year-end Report (ND),MA,Not Specified,0,c33bc46d-9fbe-5c7f-a3b3-8bac9f25b0eb,01801-2209,01801,Adrian Madaro
46 Bayswater St,50.0,15934,Boston,Boston,"Santillana, Mario",Suffolk County,11/7/2017,2017-11-07,City of boston,Police officer,,"Madaro, Adrian",Individual,201,2017 Year-end Report (ND),MA,Not Specified,0,05e1bf5f-cdd2-5e83-9133-0ec6aaf7b12a,02128-1219,02128,Adrian Madaro
27 Sanders Dr,75.0,15934,Saugus,Saugus,"Domenico, Thomas",Essex County,5/31/2018,2018-05-31,City of Boston,Police Officer,,"Madaro, Adrian",Individual,201,2018 Pre-Primary Report,MA,Not Specified,0,70dfec4b-98a4-5d07-baa5-7913833e238f,01906-1281,01906,Adrian Madaro
27 Sanders Dr,100.0,15934,Saugus,Saugus,"Domenico, Thomas",Essex County,6/1/2018,2018-06-01,City of Boston,Police Officer,,"Madaro, Adrian",Individual,201,2018 Pre-Primary Report,MA,Not Specified,0,9c01d659-502e-5e56-81dc-4f7a27bd40c3,01906-1281,01906,Adrian Madaro
167 Trenton St,50.0,15934,Boston,Boston,"Nuzzo, Anthony",Suffolk County,6/8/2018,2018-06-08,US Army,Military Police,,"Madaro, Adrian",Individual,201,2018 Pre-Primary Report,MA,Not Specified,0,964bbfb4-23f8-5318-8d60-b50a9a1a7da8,02128-2518,02128,Adrian Madaro
30 Pine St,25.0,15934,Medfield,Medfield,"Martin, James",Norfolk County,6/25/2018,2018-06-25,Boston Police,Police Officer,,"Madaro, Adrian",Individual,201,2018 Pre-Primary Report,MA,Not Specified,0,514d1e2c-7549-5218-849d-870c8140407c,02052-1703,02052,Adrian Madaro
30 Pine St,25.0,15934,Medfield,Medfield,"Martin, James",Norfolk County,7/20/2018,2018-07-20,Boston Police,Police Officer,,"Madaro, Adrian",Individual,201,2018 Pre-Primary Report,MA,Not Specified,0,184649ac-375d-54b4-9e5a-eb6699dd0be0,02052-1703,02052,Adrian Madaro
30 Pine St,25.0,15934,Medfield,Medfield,"Martin, James",Norfolk County,9/5/2018,2018-09-05,City of Boston,Police Officer,,"Madaro, Adrian",Individual,201,2018 Pre-election Report (ND),MA,Not Specified,0,77680ba7-7ca7-5b6c-b5a8-79aad171a553,02052-1703,02052,Adrian Madaro
30 Pine St,100.0,15934,Medfield,Medfield,"Martin, James",Norfolk County,9/21/2018,2018-09-21,Boston Police,Police Officer,,"Madaro, Adrian",Individual,201,2018 Pre-election Report (ND),MA,Not Specified,0,4a7999ac-50e5-580e-b999-a335a77b6dd4,02052-1703,02052,Adrian Madaro
30 Pine St,100.0,15934,Medfield,Medfield,"Martin, James",Norfolk County,10/19/2018,2018-10-19,City of Boston,Police Officer,,"Madaro, Adrian",Individual,201,2018 Pre-election Report (ND),MA,Not Specified,0,4746c488-ab6f-5ee9-b526-e3498b2dac10,02052-1703,02052,Adrian Madaro
30 Pine St,100.0,15934,Medfield,Medfield,"Martin, James",Norfolk County,11/6/2018,2018-11-06,Boston Police,Police Officer,,"Madaro, Adrian",Individual,201,2018 Year-end Report,MA,Not Specified,0,991c0def-91c1-55d9-84af-b645827e25e4,02052-1703,02052,Adrian Madaro
16 Cottage St,50.0,15934,East Boston,Boston,"Perez, Norberto",Suffolk County,11/7/2018,2018-11-07,city of boston,boston police sergeant,,"Madaro, Adrian",Individual,201,2018 Year-end Report,MA,Not Specified,0,0a073427-f975-5c67-8fb8-97f510f0c3c4,02128-2209,02128,Adrian Madaro
PO Box 1201,100.0,15934,Middleton,Middleton,"Mancini, Diana",Essex County,11/20/2018,2018-11-20,City of Boston,Police Officer,,"Madaro, Adrian",Individual,201,2018 Year-end Report,MA,Not Specified,0,d55c9ca6-ee9e-5473-b4b4-24e2a9574b12,01949-3201,01949,Adrian Madaro
488 Baker St ,200.0,15934,West Roxbury,West Roxbury,"Poulos, Anthony",Suffolk County,3/15/2019,2019-03-15,BPD,Police Officer,,"Madaro, Adrian",Individual,201,2019 Mid-Year Report,MA,Not Specified,0,ff7775d5-573c-51d8-b308-936dd4b0fdde,02132-4236,02132,Adrian Madaro
422 Sumner St ,100.0,15934,Boston,Boston,"Eng, Allison",Suffolk County,3/25/2019,2019-03-25,City of Boston,Police Officer,,"Madaro, Adrian",Individual,201,2019 Mid-Year Report,MA,Not Specified,0,66bca51a-3d97-5a8f-9f9a-7e19b278b02d,02128-2220,02128,Adrian Madaro
16 Cottage St ,100.0,15934,East Boston,Boston,"Perez, Norberto",Suffolk County,6/18/2019,2019-06-18,city of boston,boston police sergeant,,"Madaro, Adrian",Individual,201,2019 Mid-Year Report,MA,Not Specified,0,c7b5ae82-666c-5ff0-854e-6a1069a8ec6f,02128-2209,02128,Adrian Madaro
30 Pine St ,250.0,15934,Medfield,Medfield,"Martin, James",Norfolk County,6/28/2019,2019-06-28,Boston Police,Police Officer,,"Madaro, Adrian",Individual,201,2019 Mid-Year Report,MA,Not Specified,0,d009f814-dba1-58a3-ae2c-2e18905e9695,02052-1703,02052,Adrian Madaro
30 Pine St,50.0,15934,Medfield,Medfield,"Martin, James",Norfolk County,8/26/2019,2019-08-26,Boston Police,Police Sergeant,,"Madaro, Adrian",Individual,201,2019 Year-end Report,MA,Not Specified,0,7085cb0a-ddae-5813-94bf-bd39a814051b,02052-1703,02052,Adrian Madaro
30 Pine St,50.0,15934,Medfield,Medfield,"Martin, James",Norfolk County,9/24/2019,2019-09-24,Boston Police,Police Sergeant,,"Madaro, Adrian",Individual,201,2019 Year-end Report,MA,Not Specified,0,e1b1c875-6b6b-5df0-992c-190b7badfb28,02052-1703,02052,Adrian Madaro
27 Sanders Dr,75.0,15934,Saugus,Saugus,"Domenico, Thomas",Essex County,10/11/2019,2019-10-11,City of Boston,Police Officer,,"Madaro, Adrian",Individual,201,2019 Year-end Report,MA,Not Specified,0,b20444fe-d984-5f0b-8d5a-52129ff88dd9,01906-1281,01906,Adrian Madaro
30 Pine St,50.0,15934,Medfield,Medfield,"Martin, James",Norfolk County,11/7/2019,2019-11-07,Boston Police,Police Sergeant,,"Madaro, Adrian",Individual,201,2019 Year-end Report,MA,Not Specified,0,a0f5da83-c4b4-560c-afe5-f277a1e8ad04,02052-1703,02052,Adrian Madaro
27 Sanders Dr,75.0,15934,Saugus,Saugus,"Domenico, Thomas",Essex County,11/8/2019,2019-11-08,City of Boston,Police Officer,,"Madaro, Adrian",Individual,201,2019 Year-end Report,MA,Not Specified,0,30f167da-250f-5df5-8a2d-4bd536075d87,01906-1281,01906,Adrian Madaro
30 Pine St,200.0,15934,Medfield,Medfield,"Martin, James",Norfolk County,11/8/2019,2019-11-08,Boston Police,Police Sergeant,,"Madaro, Adrian",Individual,201,2019 Year-end Report,MA,Not Specified,0,f526ecd8-d49e-5bbd-a85e-3c6f295a4890,02052-1703,02052,Adrian Madaro
30 Pine St,50.0,15934,Medfield,Medfield,"Martin, James",Norfolk County,12/6/2019,2019-12-06,Boston Police,Police Sergeant,,"Madaro, Adrian",Individual,201,2019 Year-end Report,MA,Not Specified,0,75249e1f-964a-54ca-803e-943f6065a1e0,02052-1703,02052,Adrian Madaro
30 Pine St,50.0,15934,Medfield,Medfield,"Martin, James",Norfolk County,12/30/2019,2019-12-30,Boston Police,Police Sergeant,,"Madaro, Adrian",Individual,201,2019 Year-end Report,MA,Not Specified,0,82628405-abba-5472-9ac5-d74b37f7b54c,02052-1703,02052,Adrian Madaro
30 Pine St,50.0,15934,Medfield,Medfield,"Martin, James",Norfolk County,1/27/2020,2020-01-27,Boston Police,Police Sergeant,,"Madaro, Adrian",Individual,201,1/27/20 Deposit Report,MA,Credit Card,3,bee4b894-5899-5bba-a247-93658f29cb40,02052-1703,02052,Adrian Madaro
30 Pine St,50.0,15934,Medfield,Medfield,"Martin, James",Norfolk County,3/9/2020,2020-03-09,Boston Police,Police Sergeant,,"Madaro, Adrian",Individual,201,3/9/20 Deposit Report,MA,Credit Card,3,5435fcde-b9f9-573d-8ca0-53b9e491d44e,02052-1703,02052,Adrian Madaro
48 Hayes Street,500.0,15934,Boston,Boston,"Lyons, Jr., Anthony",Suffolk County,3/4/2015,2015-03-04,Suffolk County Sheriff's Office,Deputy Sheriff,,"Madaro, Adrian",Individual,201,2015 Pre-election Report (Special) (ND),MA,Not Specified,0,1271ecfc-5998-52d8-8d65-a17b60bdb860,02128,02128,Adrian Madaro
48 Hayes Street,100.0,15934,Boston,Boston,"Lyons, Jr., Anthony",Suffolk County,11/13/2015,2015-11-13,Suffolk County Sheriff's Office,Deputy Sheriff,,"Madaro, Adrian",Individual,201,2015 Year-end Report (ND),MA,,0,0681d304-e1cd-55c9-8253-1214456a45e6,02128,02128,Adrian Madaro
91 Downey Street,200.0,15934,Hopkinton,Hopkinton,"Babbin, Timothy",Middlesex County,3/27/2015,2015-03-27,Commonwealth of Massachusetts,State Trooper,,"Madaro, Adrian",Individual,201,2015 Post-election Report (ND),MA,,0,7b3eeac5-0c5a-51a4-8248-57ac6cb3313d,01748,01748,Adrian Madaro
3 Edwards Road,200.0,15934,Braintree,Braintree,"Hunter, Edward",Norfolk County,3/27/2015,2015-03-27,Mass State Police,State Trooper,,"Madaro, Adrian",Individual,201,2015 Post-election Report (ND),MA,,0,a1c992b7-cabc-5005-a60c-c76eaf361c19,02184,02184,Adrian Madaro
68 Beachview Rd,25.0,15934,Boston,Boston,"Goodwin, Jeremiah",Suffolk County,11/8/2019,2019-11-08,Police,City of Boston,,"Madaro, Adrian",Individual,201,2019 Year-end Report,MA,Not Specified,0,ed1f2c53-6e20-54db-83d1-e3137f959ab7,02128-1002,02128,Adrian Madaro
400 RESERVOIR ST,200.0,14681,HOLDEN,Holden,"FOGARTY, JAMES P",Worcester County,10/7/2010,2010-10-07,,POLICE OFFICER,,"Mahoney, John J.",Individual,201,2010 Pre-election Report (ND),MA,Not Specified,0,4a4ae7e1-f404-5b26-997d-4a36c670b168,015201210,01520,John Mahoney
91 Downey Street,200.0,14681,Hopkinton,Hopkinton,"Babbin, Timothy",Middlesex County,12/31/2015,2015-12-31,Commonwealth of Massachusetts,State Police,,"Mahoney, John J.",Individual,201,2015 Year-end Report (ND),MA,,0,f709224d-3666-5776-8162-bbf5d4b219a8,01748,01748,John Mahoney
24 Forest Drive,200.0,14681,Holden,Holden,"Daly, Andrew",Worcester County,12/31/2015,2015-12-31,Commonwealth of Massachusetts,State Police,,"Mahoney, John J.",Individual,201,2015 Year-end Report (ND),MA,,0,325780ca-9e9a-520b-a9c4-fe4610a5cd74,01520,01520,John Mahoney
3 Edwards Rd,200.0,14681,Braintree,Braintree,"Hunter, Edward",Norfolk County,12/31/2015,2015-12-31,Commonwealth of Massachusetts,State Police,,"Mahoney, John J.",Individual,201,2015 Year-end Report (ND),MA,,0,5e2e9a2b-440d-5ab8-9d09-58c96641d376,02184,02184,John Mahoney
16 Rosemont Rd,200.0,14681,Worcester,Worcester,"Pullman, Dana",Worcester County,12/31/2015,2015-12-31,Commonwealth of Massachusetts,State Police,,"Mahoney, John J.",Individual,201,2015 Year-end Report (ND),MA,,0,c1ff014e-b956-5fd5-9c74-0bc93a30a2ed,01605,01605,John Mahoney
16 St. Brendan's Rd,200.0,14681,Dorchester,Dorchester Center,"Young, Joseph",Suffolk County,12/16/2015,2015-12-16,City of Boston,Detective,,"Mahoney, John J.",Individual,201,2015 Year-end Report (ND),MA,,0,3b6f94c7-bc47-5928-8de3-7da26c6b43fc,02124,02124,John Mahoney
16 Rosemont Rd,150.0,14681,Worcester,Worcester,"Pullman, Dana",Worcester County,10/28/2014,2014-10-28,State Police of Massachusetts,President,,"Mahoney, John J.",Individual,201,2014 Year-end Report (ND),MA,Not Specified,0,8ebf1152-dcb2-5a98-ad93-8070178ff853,01605,01605,John Mahoney
24 Forest Dr.,200.0,14681,Holden,Holden,"Daly, Andrew",Worcester County,4/5/2016,2016-04-05,State Police Association of Massachusetts,Treasurer,,"Mahoney, John J.",Individual,201,2016 Pre-primary Report (ND),MA,,0,e39d0183-15a3-5f7e-ba76-0bfccd1e57b8,01520,01520,John Mahoney
16 Rosemont Rd.,200.0,14681,Worcester,Worcester,"Pullman, Dana",Worcester County,4/5/2016,2016-04-05,State Police Association of Massachusetts,President,,"Mahoney, John J.",Individual,201,2016 Pre-primary Report (ND),MA,,0,ff603c13-90ed-50a2-942c-43c18c2c209f,01605-1220,01605,John Mahoney
10 Bournedale Road,25.0,13232,Jamaica Plain,Jamaica Plain,"O'Connor Jr., Michael P.",Suffolk County,10/30/2014,2014-10-30,City of Boston,Police Officer,,"Malia, Elizabeth A.",Individual,201,2014 Year-end Report (ND),MA,Not Specified,0,0b7bb2e8-2084-59dc-a92e-bad6deb14adb,02130,02130,Elizabeth Malia
500 Victory Road,250.0,12122,Quincy,Quincy,"O'Connell, William S.",Norfolk County,4/6/2010,2010-04-06,MA State Police,Trooper,,"Mariano, Ronald",Individual,201,2010 Pre-primary Report (ND),MA,Not Specified,0,c4f0e19a-c3e4-50be-87a1-ac84bcec2c66,02171,02171,Ronald Mariano
1 Tiffany Avenue,250.0,12122,Worcester,Worcester,"Sullivan, Michael J.",Worcester County,6/4/2013,2013-06-04,Massachusetts State Police,State Trooper,,"Mariano, Ronald",Individual,201,2013 Mid-Year Report (ND),MA,Not Specified,0,54001d3c-d3ca-5f27-8f1e-6c4f09d27bcc,01604,01604,Ronald Mariano
150 Kendall Road,250.0,12122,Tewksbury,Tewksbury,"Caron, Mark",Middlesex County,6/5/2013,2013-06-05,Massachusetts State Police,State Trooper,,"Mariano, Ronald",Individual,201,2013 Mid-Year Report (ND),MA,Not Specified,0,5b744a69-b897-567d-8ea2-b3ef917243bb,01876,01876,Ronald Mariano
P.O. Box 1012,250.0,12122,Hanson,Hanson,"Crowley, Paul C.",Plymouth County,6/5/2013,2013-06-05,Massachusetts State Police,State Trooper,,"Mariano, Ronald",Individual,201,2013 Mid-Year Report (ND),MA,Not Specified,0,36bacbd6-f447-5253-820c-677e77686251,02341,02341,Ronald Mariano
24 Forest Drive,250.0,12122,Hudson,Holden,"Daly, Andrew J.",Worcester County,6/5/2013,2013-06-05,Massachusetts State Police,State Trooper,,"Mariano, Ronald",Individual,201,2013 Mid-Year Report (ND),MA,Not Specified,0,01101ae7-20e0-5a10-b030-7a3d53862fc5,01520,01520,Ronald Mariano
153 Aldrich Street,250.0,12122,Boston,Roslindale,"Holland, Scott M.",Suffolk County,6/5/2013,2013-06-05,Massachusetts State Police,State Trooper,,"Mariano, Ronald",Individual,201,2013 Mid-Year Report (ND),MA,Not Specified,0,3c749c83-a784-5e32-b720-fea64f466e1a,02131,02131,Ronald Mariano
3 Edwards Road,250.0,12122,Braintree,Braintree,"Hunter, Edward F.",Norfolk County,6/5/2013,2013-06-05,Massachusetts State Police,State Trooper,,"Mariano, Ronald",Individual,201,2013 Mid-Year Report (ND),MA,Not Specified,0,e3561e8a-82ed-59a6-8335-99a2af768ed8,02184,02184,Ronald Mariano
16 Lincoln Circle,250.0,12122,Andover,Andover,"Martin, James W.",Essex County,6/5/2013,2013-06-05,Massachusetts State Police,State Trooper,,"Mariano, Ronald",Individual,201,2013 Mid-Year Report (ND),MA,Not Specified,0,dfdb78d3-23f5-5efd-a847-136e1d019104,01810,01810,Ronald Mariano
641 Summer Avenue,250.0,12122,Reading,Reading,"Stanford, Joseph",Middlesex County,6/5/2013,2013-06-05,Massachusetts State Police,State Trooper,,"Mariano, Ronald",Individual,201,2013 Mid-Year Report (ND),MA,Not Specified,0,6769a1b2-9356-592f-8058-ca851f9fa809,01867,01867,Ronald Mariano
91 Downey Street,250.0,12122,Hopkinton,Hopkinton,"Babbin, Timothy G.",Middlesex County,6/5/2013,2013-06-05,State Police Association of Massachusetts,Vice President,,"Mariano, Ronald",Individual,201,2013 Mid-Year Report (ND),MA,Not Specified,0,32ffb2cc-11bc-58ee-a15e-3660905a6699,01748,01748,Ronald Mariano
27 Buttaro Road,250.0,12122,Woburn,Woburn,"Beckwith, Robert",Middlesex County,6/5/2013,2013-06-05,State Police Association of Massachusetts,Special Operations,,"Mariano, Ronald",Individual,201,2013 Mid-Year Report (ND),MA,Not Specified,0,5904f29c-76c8-597e-996e-16ee97f377ba,01801,01801,Ronald Mariano
11 Winnatuxett Beach Rd,200.0,15107,Mattapoisett,Mattapoisett,"Fontaine, Lauren",Plymouth County,6/23/2014,2014-06-23,Bristol County Sheriff,Sheriffs Dept.,,"Markey, Christopher M.",Individual,201,2014 Pre-primary Report (ND),MA,Not Specified,0,29a66b88-c527-59af-804d-3f454fd2dd77,02739,02739,Christopher Markey
64 Lunar Ave,75.0,15107,Braintree,,"Blaney, Keith",,8/10/2011,2011-08-10,Commonwealth of Massachusetts,Trooper,,"Markey, Christopher M.",Individual,201,2011 Year-end Report (ND),MA,Not Specified,0,4c9f2bd0-c657-55e4-9d41-3e4301354b36,,NA,Christopher Markey
64 Lunar Ave,75.0,15107,Braintree,,"Blaney, Keith",,9/28/2012,2012-09-28,Commonwealth of Massachusetts,Trooper,,"Markey, Christopher M.",Individual,201,2012 Pre-election Report (ND),MA,Not Specified,0,c8a716a6-1791-55b5-b3ed-c451fbd97430,,NA,Christopher Markey
64 Lunar Ave,80.0,15107,Braintree,Braintree,"Blaney, Keith",Norfolk County,8/13/2015,2015-08-13,Commonwealth of Massachusetts,Trooper,,"Markey, Christopher M.",Individual,201,2015 Year-end Report (ND),MA,,0,6d94ade4-8a40-5b06-8241-7a3782cfd8f6,02184,02184,Christopher Markey
"160 Point Grove Rd, #114",100.0,16976,Southwick,Southwick,"Fournier, Michelle",Hampden County,6/7/2018,2018-06-07,MHC,Police Officer,,"McCourt, P. Marie",Individual,201,2018 Pre-primary Report (ND),MA,,0,c030ba44-5150-534c-b0ee-b761288ff886,01077,01077,P. McCourt
5 Mason Lane,100.0,15809,Webster,Webster,"Suss, Aaron",Worcester County,2/1/2016,2016-02-01,Webster Police Department,Police Officer,,"McKenna, Joseph D.",Individual,201,2016 Pre-primary Report (ND),MA,,0,01b58671-3522-581a-a085-684ccf76630c,01570,01570,Joseph McKenna
5 Mason Lane,100.0,15809,Webster,Webster,"Suss, Aaron",Worcester County,8/19/2016,2016-08-19,Webster Police Departmet,Police Officer,,"McKenna, Joseph D.",Individual,201,2016 Pre-primary Report (ND),MA,,0,bf3e905a-d77d-5572-8a05-af0c4a1b689a,01570,01570,Joseph McKenna
65 Clearwater Dr.,250.0,14680,Westwood,Westwood,"Daher, Geroge",Norfolk County,10/6/2016,2016-10-06,Westwood Police,Police,,"McMurtry, Paul",Individual,201,2016 Pre-election Report (ND),MA,,0,91107c48-f240-5d6d-9a87-abb47e9f3dc0,02090,02090,Paul McMurtry
3 Searle Rd.,100.0,14680,West Roxbury,West Roxbury,"Cullity, James",Suffolk County,11/26/2017,2017-11-26,City of Boston,Police Officer,,"McMurtry, Paul",Individual,201,2017 Year-end Report (ND),MA,,0,fa2536e3-df97-5f75-8f6e-540c91c9935e,02132,02132,Paul McMurtry
7 Patriot Circle,25.0,14680,Foxborough,Foxboro,"Cady, Paul",Norfolk County,9/7/2018,2018-09-07,Town of Dedham,Police Officer,,"McMurtry, Paul",Individual,201,2018 Pre-Election Report,MA,Not Specified,0,e8e133af-3f30-5947-acd1-d220958be7c4,02035,02035,Paul McMurtry
3 Searle Rd.,250.0,14680,West Roxbury,West Roxbury,"Cullity, James",Suffolk County,5/30/2019,2019-05-30,City of Boston,Police Officer,,"McMurtry, Paul",Individual,201,2019 Mid-Year Report,MA,Not Specified,0,02a2bd6b-2625-5c22-b3f0-51d80e197f9b,02132,02132,Paul McMurtry
2 Trimount St,100.0,14680,Dedham,Dedham,"Concannon, Kevin",Norfolk County,6/8/2011,2011-06-08,Dedham Police,Officer,,"McMurtry , Paul",Individual,201,2011 Mid-Year Report (ND),MA,Not Specified,0,1cff7953-f9bd-5b41-918d-a2488996a10b,02026,02026, McMurtry
2 Trimount St,300.0,14680,Dedham,Dedham,"Concannon, Kevin",Norfolk County,12/29/2011,2011-12-29,Dedham Police,Officer,,"McMurtry , Paul",Individual,201,2011 Year-end Report (ND),MA,Not Specified,0,87c862f5-f71c-57d3-a281-95488ff4d994,02026,02026, McMurtry
"3 SEARLE RD, 3",250.0,14680,WEST ROXBURY,West Roxbury,"CULLITY, JAMES",Suffolk County,8/29/2013,2013-08-29,BOSTON POLICE,OFFICER,,"McMurtry , Paul",Individual,201,2013 Year-end Report (ND),MA,Not Specified,0,992afd42-234f-5688-82eb-9ee50a0843b8,02132,02132, McMurtry
"3 SEARLE RD, 3",200.0,14680,WEST ROXBURY,West Roxbury,"CULLITY, JAMES",Suffolk County,6/9/2014,2014-06-09,BOSTON POLICE,OFFICER,,"McMurtry, Paul",Individual,201,2014 Pre-primary Report (ND),MA,Not Specified,0,cc410f1a-d6ba-57b0-beaa-9cb9365f6b8a,02132,02132,Paul McMurtry
"3 SEARLE RD, 3",100.0,14680,WEST ROXBURY,West Roxbury,"CULLITY, JAMES",Suffolk County,10/16/2016,2016-10-16,BOSTON POLICE,OFFICER,,"McMurtry, Paul",Individual,201,2016 Pre-election Report (ND),MA,,0,0cab2d6e-2fc3-5a43-96ca-f0aa87d31e77,02132,02132,Paul McMurtry
3 Searle Rd,250.0,14680,West Roxbury,West Roxbury,"Cullity, James",Suffolk County,9/6/2018,2018-09-06,Boston Police,Officer,,"McMurtry, Paul",Individual,201,2018 Pre-Election Report,MA,Not Specified,0,42b42d08-96cb-52da-aa23-260f4279533f,02132,02132,Paul McMurtry
6 Valley View Drive,50.0,17447,Westfield,Westfield,"Blascak, John",Hampden County,5/4/2020,2020-05-04,City of Westfield Massachusetts,Police officer,,"Mercadante, Dino",Individual,201,5/4/20 Deposit Report,MA,Cash,6,b9c8df36-eb1d-51ab-babc-0ac7230bab56,01085,01085,Dino Mercadante
34 Harvest Drive,100.0,16293,Kingston,Kingston,"LaNatra, Michael",Plymouth County,9/17/2018,2018-09-17,Kingston Police Dept.,Police Officer,,"Meschino, Joan",Individual,201,2018 Pre-Election Report,MA,Not Specified,0,1a0e2f26-d107-537f-9e8b-088422f3b9ac,02364,02364,Joan Meschino
16 Saint Brendan Rd,1000.0,14902,Dorchester,Dorchester Center,"Young, Joseph",Suffolk County,5/30/2019,2019-05-30,Boston Police Department,Police Detective,,"Michlewitz, Aaron",Individual,201,2019 Mid-Year Report,MA,Not Specified,0,725e605b-ab45-5aae-b797-145ca7e30f47,02124,02124,Aaron Michlewitz
8 Chester St,250.0,14902,North Reading,North Reading,"Rosati, David",Middlesex County,7/16/2019,2019-07-16,Sheriff's Department,Law enforcement,,"Michlewitz, Aaron",Individual,201,2019 Year-end Report,MA,Not Specified,0,04131dde-6341-555d-a676-6a2075b70827,01864,01864,Aaron Michlewitz
18 Leverett Ave 9B,250.0,14902,East Boston,,"Cataldo, Joseph",,4/7/2015,2015-04-07,Middlesex Sheriff Office,Deputy Sheriff,,"Michlewitz, Aaron",Individual,201,2015 Mid-Year Report,MA,Not Specified,0,b1d14c62-e8e0-5bba-8099-968035ed9081,2128,NA,Aaron Michlewitz
91 DOWNEY STREET,250.0,14902,HOPKINTON,Hopkinton,"BABBIN, TIMOTHY G",Middlesex County,10/14/2014,2014-10-14,MASS STATE POLICE,STATE TROOPER,,"Michlewitz, Aaron",Individual,201,2014 Pre-Election Report,MA,Not Specified,0,beccb1b7-2a29-5599-a410-d786b939a36f,01748,01748,Aaron Michlewitz
P. O. BOX 1012,250.0,14902,HANSON,Hanson,"CROWLEY, PAUL C",Plymouth County,10/14/2014,2014-10-14,MASS STATE POLICE,STATE TROOPER,,"Michlewitz, Aaron",Individual,201,2014 Pre-Election Report,MA,Not Specified,0,28be567c-a3b2-553c-8aca-aedc98cb9dfa,02341,02341,Aaron Michlewitz
24 FOREST DR,250.0,14902,HOLDEN,Holden,"DALY, ANDREW J",Worcester County,10/14/2014,2014-10-14,MASS STATE POLICE,STATE TROOPER,,"Michlewitz, Aaron",Individual,201,2014 Pre-Election Report,MA,Not Specified,0,a0ffe85f-35e5-5b5a-a3dc-b8b68c446c10,01520,01520,Aaron Michlewitz
150 KENDALL RD,250.0,14902,TEWKSBURY,Tewksbury,"DEMASI, KAREN",Middlesex County,10/14/2014,2014-10-14,MASS STATE POLICE,STATE TROOPER,,"Michlewitz, Aaron",Individual,201,2014 Pre-Election Report,MA,Not Specified,0,5fc2ed07-2f53-5a14-9f6e-490ca86ff7d6,01876,01876,Aaron Michlewitz
48 BELMONT ST,250.0,14902,TAUNTON,Taunton,"FREDETTE, KEVIN",Bristol County,10/14/2014,2014-10-14,MASS STATE POLICE,TROOPER,,"Michlewitz, Aaron",Individual,201,2014 Pre-Election Report,MA,Not Specified,0,f3531d83-841a-5d7d-b9b8-8fa1505af4f3,02780,02780,Aaron Michlewitz
4 BRANEY RD,250.0,14902,MILLBURY,Millbury,"GILBERT, JEFFREY",Worcester County,10/14/2014,2014-10-14,MASS STATE POLICE,STATE TROOPER,,"Michlewitz, Aaron",Individual,201,2014 Pre-Election Report,MA,Not Specified,0,ec3e7f40-ab7c-5464-902c-eb2c22e5e2c2,01527-3902,01527,Aaron Michlewitz
49 OLDE FORGE RD,250.0,14902,HANOVER,Hanover,"GILLESPIE, TIMOTHY",Plymouth County,10/14/2014,2014-10-14,MASS STATE POLICE,STATE TROOPER,,"Michlewitz, Aaron",Individual,201,2014 Pre-Election Report,MA,Not Specified,0,46d2971b-d341-5932-9217-b8a7741982b4,02339,02339,Aaron Michlewitz
153 ALDRICH ST,250.0,14902,ROSLINDALE,Roslindale,"HOLLAND, SCOTT M",Suffolk County,10/14/2014,2014-10-14,MASS STATE POLICE,STATE TROOPER,,"Michlewitz, Aaron",Individual,201,2014 Pre-Election Report,MA,Not Specified,0,65cf245b-4dea-5718-8b00-d85960eacfd8,02131,02131,Aaron Michlewitz
3 EDWARDS RD,250.0,14902,BRAINTREE,Braintree,"HUNTER, EDWARD F",Norfolk County,10/14/2014,2014-10-14,MASS STATE POLICE,STATE TROOPER,,"Michlewitz, Aaron",Individual,201,2014 Pre-Election Report,MA,Not Specified,0,5f6dba89-aef4-53d2-b536-cb501e7e8da0,02184,02184,Aaron Michlewitz
16 LINCLON CIRCLE,250.0,14902,ANDOVER,Andover,"MARTIN, JAMES W",Essex County,10/14/2014,2014-10-14,MA STATE POLICE,STATE TROOPER,,"Michlewitz, Aaron",Individual,201,2014 Pre-Election Report,MA,Not Specified,0,1e970c03-0f52-5e8d-a50c-e9cb42cc33be,01810,01810,Aaron Michlewitz
P.O.BOX 240,250.0,14902,MEDWAY,Medway,"PATTERSON, DAVID A",Norfolk County,10/14/2014,2014-10-14,MASS STATE POLICE,STATE TROOPER,,"Michlewitz, Aaron",Individual,201,2014 Pre-Election Report,MA,Not Specified,0,4e5d0566-7f35-50aa-b8f2-4aecad32b528,02053-0222,02053,Aaron Michlewitz
20 LEALAND PECK DR,250.0,14902,WRENTHAM,Wrentham,"POWELL, JR., PAUL",Norfolk County,10/14/2014,2014-10-14,MASS STATE POLICE,TROOPER,,"Michlewitz, Aaron",Individual,201,2014 Pre-Election Report,MA,Not Specified,0,ac7a89f2-d3e0-5257-b68f-e63469018dfb,02093,02093,Aaron Michlewitz
16 ROSEMONT RD,200.0,14902,WORCESTER,Worcester,"PULLMAN, DANA A",Worcester County,10/14/2014,2014-10-14,COMMONWEALTH OF MA,STATE TROOPER,,"Michlewitz, Aaron",Individual,201,2014 Pre-Election Report,MA,Not Specified,0,c3fc7f6f-80e1-5ec5-8e25-f08830b189a5,01605-1220,01605,Aaron Michlewitz
1 TIFFANY AVE.,250.0,14902,WORCESTER,Worcester,"SULLIVAN, MICHAEL J",Worcester County,10/14/2014,2014-10-14,MA STATE POLICE,STATE TROOPER,,"Michlewitz, Aaron",Individual,201,2014 Pre-Election Report,MA,Not Specified,0,0114c955-6b18-517b-ba3a-2501b69ab7a2,01604,01604,Aaron Michlewitz
5 Summer St.,200.0,14902,Mattapoisett,Mattapoisett,"Machado, James",Plymouth County,4/5/2016,2016-04-05,Massachusetts Police Association,Exectuive Director,,"Michlewitz, Aaron",Individual,201,2016 Pre-Primary Report,MA,Not Specified,0,e2de8d14-b79a-57d9-a140-80be920fae29,02739,02739,Aaron Michlewitz
651 Walpole St,200.0,14902,Norwood,Norwood,"Talbot, Michael",Norfolk County,4/11/2017,2017-04-11,Boston Police Superior Officers Union,Vice President,,"Michlewitz, Aaron",Individual,201,2017 Mid-Year Report,MA,Not Specified,0,c0457f44-d7e5-5fc7-ba6a-04d2395b9938,02062,02062,Aaron Michlewitz
616 Mt Pleasant Ave,250.0,14902,Providence,,"Hull, Raymond",,6/6/2019,2019-06-06,Providence Police Department,Sergeant,,"Michlewitz, Aaron",Individual,201,2019 Mid-Year Report,RI,Not Specified,0,cc8a11a3-2888-53f3-928f-0136f6642a42,02908,NA,Aaron Michlewitz
132 Rosseter St. ,50.0,16987,Dorchester,Dorchester,"Finklea, Leon",Suffolk County,4/28/2018,2018-04-28,Federal Reserve,Police Officer,,"Miranda, Elizabeth",Individual,201,2018 Pre-Primary Report,MA,Not Specified,0,99191269-dd04-5082-94c5-6fa570dbf7aa,02121,02121,Elizabeth Miranda
39b Circuit Street,100.0,16987,Boston,Roxbury,"Coakley, Neva",Suffolk County,6/4/2018,2018-06-04,Boston Police,Police Detective,,"Miranda, Elizabeth",Individual,201,2018 Pre-Primary Report,MA,Not Specified,0,e8dc0477-dabd-5728-ab31-3e3c14c641ce,02119,02119,Elizabeth Miranda
505 Harland St,500.0,16987,Milton,Milton,"Hosein, Haseeb",Norfolk County,10/26/2018,2018-10-26,City of Boston,Police officer,,"Miranda, Elizabeth",Individual,201,2018 Year-end Report,MA,Not Specified,0,678348ed-4319-5754-be80-f618ab23e01b,02186,02186,Elizabeth Miranda
39B Circuit St,100.0,16987,Roxbury,Roxbury,"Coakley, Neva",Suffolk County,3/6/2020,2020-03-06,BPD,law enforcement,,"Miranda, Elizabeth",Individual,201,3/6/20 Deposit Report,MA,Credit Card,3,5692b61a-38c7-5815-96b9-12410a7641a0,02119,02119,Elizabeth Miranda
3 Longmeadow st,50.0,16987,Roxbury,Roxbury,"Lopes, Deniqua",Suffolk County,8/18/2018,2018-08-18,,Suffolk County Sheriffs Office,,"Miranda, Elizabeth",Individual,201,2018 Pre-Election Report,MA,Not Specified,0,1f8ed836-2dd8-5c41-874c-caa7ab467bbb,02119,02119,Elizabeth Miranda
PO Box 41,100.0,16987,North Reading,North Reading,"Butner, Lisa",Middlesex County,2/28/2020,2020-02-28,MA State Police,Trooper,,"Miranda, Elizabeth",Individual,201,2/28/20 Deposit Report,MA,Credit Card,3,72c8c4b9-0511-5203-a63a-41b7fbe38650,01864,01864,Elizabeth Miranda
101 WEST JENNESS ST,200.0,14410,Lowell,Lowell,"MALDONADO, FRANCISCO",Middlesex County,6/20/2014,2014-06-20,CITY OF LOWELL,Police Officer,,"Mom, Rady",Individual,201,2014 Pre-primary Report (ND),MA,,0,979ec8c6-e4d1-58ce-a327-7234c04ccb5d,01852,01852,Rady Mom
642 WILDER ST,100.0,14410,Lowell,Lowell,"VAN, KHA",Middlesex County,6/20/2014,2014-06-20,CITY OF LOWELL,Police Officer,,"Mom, Rady",Individual,201,2014 Pre-primary Report (ND),MA,,0,4bce26db-1229-5e04-8fd5-3ecf4efcac2f,01852,01852,Rady Mom
642 WILDER ST ,200.0,14410,Lowell,Lowell,"VAN, KHA",Middlesex County,10/25/2014,2014-10-25,CITY OF LOWELL,Police Officer,,"Mom, Rady",Individual,201,2014 Year-end Report (ND),MA,,0,b7849b8f-f8ea-59a6-b7f1-b0df7d4d6c72,01851,01851,Rady Mom
101 WEST JENNESS ST,100.0,14410,Lowell,Lowell,"MALDONADO, FRANCISCO",Middlesex County,4/23/2015,2015-04-23,Lowell Ma.,Police Officer,,"Mom, Rady",Individual,201,2015 Mid-Year Report (ND),MA,,0,d753089e-e353-5fa7-a949-e34ead4b4576,01852,01852,Rady Mom
101 WEST JENNESS ST,100.0,14410,Lowell,Lowell,"MALDONADO, FRANCISCO",Middlesex County,10/20/2015,2015-10-20,Lowell Ma.,Police Officer,,"Mom, Rady",Individual,201,2015 Year-end Report (ND),MA,,0,96d5fb8c-32ce-5538-a8ce-481cb0890908,01852,01852,Rady Mom
101 WEST JENNESS ST,100.0,14410,Lowell,Lowell,"MALDONADO, FRANCISCO",Middlesex County,1/28/2016,2016-01-28,Lowell Ma.,Police Officer,,"Mom, Rady",Individual,201,2016 Pre-primary Report (ND),MA,,0,4ea146a1-87bf-5ea2-abd4-b7ef95e5c2db,01852,01852,Rady Mom
101 WEST JENNESS ST,100.0,14410,Lowell,Lowell,"MALDONADO, FRANCISCO",Middlesex County,4/8/2016,2016-04-08,Lowell Ma.,Police Officer,,"Mom, Rady",Individual,201,2016 Pre-primary Report (ND),MA,,0,e912ae74-7b9b-5c3b-bc9c-308ecd66dc55,01852,01852,Rady Mom
101 WEST JENNESS ST,100.0,14410,Lowell,Lowell,"MALDONADO, Francisco",Middlesex County,8/12/2016,2016-08-12,Lowell Ma.,Police Officer,,"Mom, Rady",Individual,201,2016 Pre-primary Report (ND),MA,,0,3e9afd38-4cca-5af8-acb2-3cbec57e0ec0,01852,01852,Rady Mom
15 Alton St. Unit 6,100.0,14410,Lowell,Lowell,"GORMAN, Alexander",Middlesex County,8/23/2018,2018-08-23,Dracut Ma.,Police Officer,,"Mom, Rady",Individual,201,2018 Pre-Election Report,MA,Not Specified,0,3dd1f58e-5dde-54b1-8f1b-aba171481851,01852,01852,Rady Mom
14 Marie Lane,100.0,15498,Lawrence,Lawrence,"Guerrero, Fabian",Essex County,11/3/2014,2014-11-03,City of Lawrence,Police Sargent,,"Moran, Frank",Individual,201,2014 Year-end Report (ND),MA,Not Specified,0,66443515-9b37-5ad7-b779-550bd8a7bff0,01843,01843,Frank Moran
98 Photine Dr,200.0,15498,Lowell,Lowell,"Martinez, Jose",Middlesex County,6/19/2015,2015-06-19,Lawrence Pd,Police Sargent,,"Moran, Frank",Individual,201,2015 Mid-Year Report (ND),MA,,0,11c6cc59-1b13-5b04-8c00-a86dcb2db7b6,01854,01854,Frank Moran
140 Prospect Hill Dr,200.0,15498,Tewksbury,Tewksbury,"Fleming, Daniel",Middlesex County,3/14/2016,2016-03-14,Lawrence Pd,Police Lieutenant,,"Moran, Frank",Individual,201,2016 Pre-primary Report (ND),MA,,0,55c6570a-aa33-52eb-a38a-4316eb6a204a,01876,01876,Frank Moran
140 Prospect Hill Dr,200.0,15498,Tewksbury,Tewksbury,"Fleming, Daniel",Middlesex County,11/4/2016,2016-11-04,Lawrence Pd,Police Lieutenant,,"Moran, Frank",Individual,201,2016 Year-end Report (ND),MA,,0,c97d9f9d-3cf6-5a95-9f26-e2312c839474,01876,01876,Frank Moran
98 Photine Drive,200.0,15498,Lowell,Lowell,"Martinez, Jose",Middlesex County,11/4/2016,2016-11-04,City of Lawrence,Police Sargent,,"Moran, Frank",Individual,201,2016 Year-end Report (ND),MA,,0,5f081865-721f-5b2b-ba6e-f3bbfc1ceaee,01854,01854,Frank Moran
79 Dracut St,200.0,15498,Lawrence,Lawrence,"Aguiler, Maurice",Essex County,6/3/2019,2019-06-03,LPD,Police Detective,,"Moran, Frank",Individual,201,2019 Mid-Year Report,MA,Not Specified,0,db3ad1c2-4b28-5915-8eb1-c51ce23cb68c,01843,01843,Frank Moran
140 Prospect Hill Dr,200.0,15498,Tewksbury,Tewksbury,"Fleming, Daniel",Middlesex County,6/3/2019,2019-06-03,Lawrence Pd,Police Lieutenant,,"Moran, Frank",Individual,201,2019 Mid-Year Report,MA,Not Specified,0,2f89ce84-983d-51eb-bb1a-802aa46b337a,01876,01876,Frank Moran
101 Sawyer Ave #2,200.0,12650,Dorchester,Dorchester,"McHugh, Michael",Suffolk County,3/21/2010,2010-03-21,City of Boston,Police Officer,,"Moran, Michael J.",Individual,201,2010 Pre-primary Report (ND),MA,Not Specified,0,e982489c-0477-5422-af54-1f10eadf7872,02125,02125,Michael Moran
16 Saint Brendan Rd,400.0,12650,Dorchester,Dorchester Center,"Young, Joseph",Suffolk County,12/4/2019,2019-12-04,City of Boston,Police Officer,,"Moran, Michael J.",Individual,201,2019 Year-end Report,MA,Not Specified,0,33b2448f-c77d-529a-88be-f67d3b6555ec,02124,02124,Michael Moran
35 Baldwin Street,100.0,12650,Charlestown,Charlestown,"Callahan, Dennis",Suffolk County,3/13/2011,2011-03-13,Boston Police Department,,,"Moran, Michael J.",Individual,201,2011 Mid-Year Report (ND),MA,Not Specified,0,b067370f-5861-53c8-8315-6b7d0ad397d1,02129,02129,Michael Moran
35 Baldwin Street,100.0,12650,Charlestown,Charlestown,"Callahan, Dennis",Suffolk County,3/25/2012,2012-03-25,Boston Police Department,,,"Moran, Michael J.",Individual,201,2012 Pre-primary Report (ND),MA,Not Specified,0,100909e9-6266-566c-8bdd-d66223c2ad4a,02129,02129,Michael Moran
109 Tremont Street #418,100.0,12650,Boston,Brighton,"Sullivan, James",Suffolk County,3/25/2012,2012-03-25,Boston Police Department,Manager,,"Moran, Michael J.",Individual,201,2012 Pre-primary Report (ND),MA,Not Specified,0,d4dda1cb-7224-5618-abc0-fc418e145aa4,02135,02135,Michael Moran
35 Baldwin Street,100.0,12650,Charlestown,Charlestown,"Callahan, Dennis",Suffolk County,3/24/2013,2013-03-24,Boston Police Department,,,"Moran, Michael J.",Individual,201,2013 Mid-Year Report (ND),MA,Not Specified,0,11b953d3-6613-5984-8e13-1c4432472aa3,02129,02129,Michael Moran
Po Box 136,500.0,15779,Northbridge,Northbridge,"Warchol, Walter",Worcester County,12/10/2016,2016-12-10,Town of Northbridge,Police Chief,,"Muradian, Jr., David Kent",Individual,201,2016 Year-end Report (ND),MA,,0,223abb06-10f0-5171-a680-a3b5dd2718bb,01534,01534,Jr. Muradian
8 Anderson Lane,200.0,15779,North Grafton,North Grafton,"Swift, Michael",Worcester County,10/11/2018,2018-10-11,Town of Grafton,Police Officer,,"Muradian, Jr., David Kent",Individual,201,2018 Pre-Election Report,MA,Not Specified,0,176fe42d-d115-55bc-b70c-d90d7f79f4e3,01536,01536,Jr. Muradian
7 Ryans Way,50.0,15806,Plymouth,Plymouth,"Higgins, Jason",Plymouth County,6/27/2019,2019-06-27,Town of Plymouth,Police Lieutenant,,"Muratore, Mathew J.",Individual,201,2019 Mid-Year Report,MA,Not Specified,0,a88720ce-7aa3-5986-bd52-f034ecb27ff3,02360,02360,Mathew Muratore
9 Santo Street,15.0,15806,Plymouth,Plymouth,"Mallia III, William",Plymouth County,9/2/2016,2016-09-02,Plymouth County Sheriff's Department,Deputy Sheriff,,"Muratore, Matthew J.",Individual,201,2016 Pre-election Report (ND),MA,,0,beb2275e-df0f-58f1-9a22-398dd14c4df6,02360,02360,Matthew Muratore
2018 Washington Street,150.0,15806,Canton,Canton,"Pudolsky, Gerald",Norfolk County,9/23/2016,2016-09-23,Plymouth County Sheriff's Department,Special Sheriff,,"Muratore, Matthew J.",Individual,201,2016 Pre-election Report (ND),MA,,0,5ef0b617-dbb8-5bed-87b4-b4ae17a701a9,02021,02021,Matthew Muratore
28 Ortolani Circle,100.0,15806,Kingston,Kingston,"McDonald, Jr., Joseph",Plymouth County,9/29/2016,2016-09-29,Plymouth County Sheriff's Department,Sheriff,,"Muratore, Matthew J.",Individual,201,2016 Pre-election Report (ND),MA,,0,745be7ae-b4eb-567d-97c8-88b78248a95b,02364,02364,Matthew Muratore
26 Ortolani Circle,100.0,15806,Kingston,Kingston,"McDonald Jr., Joseph",Plymouth County,6/14/2017,2017-06-14,Plymouth County Sheriff Department,Sheriff,,"Muratore, Mathew J.",Individual,201,2017 Mid-Year Report (ND),MA,,0,cef3f312-7d76-530b-ab7c-4e2842f116b7,02364,02364,Mathew Muratore
26 Ortolani Circle,50.0,15806,Kingston,Kingston,"McDonald Jr., Joseph",Plymouth County,11/1/2017,2017-11-01,Plymouth County Sheriff Department,Sheriff,,"Muratore, Mathew J.",Individual,201,2017 Year-end Report (ND),MA,,0,2644ef40-5db4-596d-ad3c-c08fcfb98dc9,02364,02364,Mathew Muratore
26 Ortolani Circle,50.0,15806,Kingston,Kingston,"McDonald Jr., Joseph",Plymouth County,8/23/2019,2019-08-23,Plymouth County Sheriff Department,Sheriff,,"Muratore, Mathew J.",Individual,201,2019 Year-end Report,MA,Not Specified,0,7fbd09b1-a60b-5eab-9a7d-305a7e2cb703,02364,02364,Mathew Muratore
80 Beaumont Street Unit 209,500.0,13724,Boston,Dorchester Center,"O'Toole, John E.",Suffolk County,3/12/2012,2012-03-12,City of Boston,Police Officer,,"Murphy, James",Individual,201,2012 Pre-primary Report (ND),MA,Not Specified,0,325cc22a-aa6a-50dc-b416-6b365007552c,02124,02124,James Murphy
45 Oriole Street,200.0,13724,West Roxbury,West Roxbury,"O'Toole, Katelyn",Suffolk County,6/29/2013,2013-06-29,City of Boston,Police Department,,"Murphy, James",Individual,201,2013 Mid-Year Report (ND),MA,Not Specified,0,5b01e2d0-6d11-5fe5-ae1b-3fc871aaf729,02132,02132,James Murphy
80 Beaumont Street Unit 209,200.0,13724,Dorchester,Dorchester Center,"O'Toole, John E.",Suffolk County,3/17/2014,2014-03-17,City of Boston,Police Officer,,"Murphy, James",Individual,201,2014 Pre-primary Report (ND),MA,Not Specified,0,0056b103-28eb-5ec7-961e-2d27af44b591,02124,02124,James Murphy
45 Oriole Street,200.0,13724,West Roxbury,West Roxbury,"O'Toole, John",Suffolk County,3/9/2015,2015-03-09,City of Boston,Police Department,,"Murphy, James",Individual,201,2015 Mid-Year Report (ND),MA,,0,c444f4de-9c55-5c75-bd8c-04839fe2491c,02132,02132,James Murphy
45 Oriole Street,200.0,13724,West Roxbury,West Roxbury,"O'toole, John",Suffolk County,3/7/2016,2016-03-07,City of Boston,Police Department,,"Murphy, James",Individual,201,2016 Pre-primary Report (ND),MA,,0,b5e52d80-e4c3-5f6b-80c4-2774283e0d1c,02132,02132,James Murphy
45 Oriole Street,300.0,13724,West Roxbury,West Roxbury,"O'toole, John",Suffolk County,3/6/2017,2017-03-06,City of Boston,Police Department,,"Murphy, James",Individual,201,2017 Mid-Year Report (ND),MA,,0,a155f6b7-7a1a-5958-8977-a4b6d1411f48,02132,02132,James Murphy
16 Saint Brendan Rd,350.0,13724,Dorchester,Dorchester Center,"Young, Joseph",Suffolk County,10/29/2019,2019-10-29,City of Boston,Police Officer,,"Murphy, James",Individual,201,2019 Year-end Report,MA,Not Specified,0,c9c2aade-dc0f-5dee-8249-b2b34eaa285a,02124,02124,James Murphy
78 Monatiquot Ave,300.0,13724,Dorchester,Dorchester Center,"O'Toole, John E.",Suffolk County,3/30/2020,2020-03-30,City of Boston,Police Officer,,"Murphy, James",Individual,201,3/30/20 Deposit Report,MA,Check,1,a6d1a48a-559a-533d-b6c2-aabd2bf6895b,02124,02124,James Murphy
100 Cove Way 907,200.0,13724,Quincy,Quincy,"Lally, Michael S.",Norfolk County,3/5/2019,2019-03-05,Suffolk County Sheriff's Department,Deputy Sheriff,,"Murphy, James",Individual,201,2019 Mid-Year Report,MA,Not Specified,0,615acbe7-3ce8-5fa5-bd7a-e02c4a46a37a,02169,02169,James Murphy
17 Middle Street,150.0,13724,Weymouth,East Weymouth,"Conlon, Robert",Norfolk County,9/30/2010,2010-09-30,Police Officer,Retired,,"Murphy, James",Individual,201,2010 Pre-election Report (ND),MA,Not Specified,0,5bf28f37-08fa-587b-91f5-d42c8eca96f1,02189,02189,James Murphy
17 Middle Street,100.0,13724,Weymouth,East Weymouth,"Conlon, Robert",Norfolk County,10/29/2011,2011-10-29,Police Officer,Retired,,"Murphy, James",Individual,201,2011 Year-end Report (ND),MA,Not Specified,0,11ccce89-4f54-5c0e-9859-a8be7332ccbd,02189,02189,James Murphy
17 Middle Street,100.0,13724,Weymouth,East Weymouth,"Conlon, Robert",Norfolk County,4/24/2015,2015-04-24,Police Officer,Retired,,"Murphy, James",Individual,201,2015 Mid-Year Report (ND),MA,,0,1053b139-f9c8-5e4b-87e7-a17b461d9068,02189,02189,James Murphy
17 Middle Street,100.0,13724,Weymouth,East Weymouth,"Conlon, Robert",Norfolk County,3/5/2019,2019-03-05,Police Officer,Retired,,"Murphy, James",Individual,201,2019 Mid-Year Report,MA,Not Specified,0,cba22107-20b9-5785-bdaa-1e8520d04740,02189,02189,James Murphy
3 Isaiah Circle,200.0,16478,Milford,Milford,"Oloughlin, Thomas",Worcester County,9/21/2016,2016-09-21,Town of Milford,Police Chief,,"Murray, Brian W. ",Individual,201,2016 Pre-election Report (ND),MA,,0,540a0677-32d8-5e08-8c98-354324dd6795,01757,01757,Brian Murray
3 Isaiah Circle,100.0,16478,Milford,Milford,"Oloughlin, Thomas",Worcester County,5/24/2018,2018-05-24,Town of Milford,Police Chief,,"Murray, Brian W.",Individual,201,2018 Pre-primary Report (ND),MA,,0,c79915aa-babf-52a7-a17a-ffcda9f56de6,01757,01757,Brian Murray
5 Summer St,200.0,13338,Mattapoisett,Mattapoisett,"Machado, James M.",Plymouth County,3/16/2012,2012-03-16,City of Fall River,Police Officer,,"Nangle, David M.",Individual,201,2012 Pre-primary Report (ND),MA,Not Specified,0,9e01ecd0-5f99-58da-903b-02c5b4377a0b,02739,02739,David Nangle
533 Chicopee Row,150.0,13338,Groton,Groton,"Hoey, Thomas J.",Middlesex County,9/24/2012,2012-09-24,Harvard University,Police Officer,,"Nangle, David M.",Individual,201,2012 Pre-election Report (ND),MA,Not Specified,0,98b76faa-b125-5bdc-80ce-e7ab32c2288b,01450,01450,David Nangle
111 Hildreth St #306,100.0,13338,Lowell,Lowell,"Golden, Timothy F.",Middlesex County,6/30/2013,2013-06-30,City of Lowell,Police Officer,,"Nangle, David M.",Individual,201,2013 Mid-Year Report (ND),MA,Not Specified,0,fc1ef1da-324f-52a5-961a-3cc6ba4d5a86,01854,01854,David Nangle
13 Stonegate Rd,400.0,13338,Chelmsford,Chelmsford,"Fleming, Thomas A.",Middlesex County,5/22/2014,2014-05-22,City of Lowell,Police Officer,,"Nangle, David M.",Individual,201,2014 Pre-primary Report (ND),MA,Not Specified,0,9c600109-dd4e-5e96-bb88-4f3971d3b0ca,01824,01824,David Nangle
53 Glenn Rd,100.0,13338,Lowell,Lowell,"Moriarty, Dennis",Middlesex County,10/10/2014,2014-10-10,City of Lowell,Police Officer,,"Nangle, David M.",Individual,201,2014 Pre-election Report (ND),MA,Not Specified,0,7291cf66-9386-56a1-91db-6cefaa8aab02,01852,01852,David Nangle
155 Depot St,100.0,13338,Dunstable,Dunstable,"Richardson, Raymond",Middlesex County,4/14/2015,2015-04-14,City of Lowell,Police Officer,,"Nangle, David M.",Individual,201,2015 Mid-Year Report,MA,Not Specified,0,a881bf1a-d8b6-52a5-b8f6-92ce19027742,01827,01827,David Nangle
533 Chicopee Row,100.0,13338,Groton,Groton,"Hoey, Thomas J.",Middlesex County,8/23/2015,2015-08-23,Harvard University,Police Officer,,"Nangle, David M.",Individual,201,2015 Year-end Report,MA,Not Specified,0,1170e272-b024-5a3c-a361-80e6a8ce58db,01450,01450,David Nangle
155 Depot St,100.0,13338,Dunstable,Dunstable,"Richardson, Raymond",Middlesex County,8/23/2015,2015-08-23,City of Lowell,Police Officer,,"Nangle, David M.",Individual,201,2015 Year-end Report,MA,Not Specified,0,42afdcea-cda5-5a63-840d-bbb63df5f78c,01827,01827,David Nangle
13 Stonegate Rd,400.0,13338,Chelmsford,Chelmsford,"Fleming, Thomas A.",Middlesex County,8/27/2015,2015-08-27,City of Lowell,Police Officer,,"Nangle, David M.",Individual,201,2015 Year-end Report,MA,Not Specified,0,a45228b7-3a0f-54c6-9f6a-4ade2b0853ac,01824,01824,David Nangle
145 7th St,200.0,13338,Tewksbury,Tewksbury,"MacLeod, Thomas",Middlesex County,10/12/2015,2015-10-12,Umass Lowell,Police Sargeant,,"Nangle, David M.",Individual,201,2015 Year-end Report,MA,Not Specified,0,38ba839a-97d8-5188-bb1e-8b6c7e533de7,01876,01876,David Nangle
155 Depot St,100.0,13338,Dunstable,Dunstable,"Richardson, Raymond",Middlesex County,4/4/2016,2016-04-04,City of Lowell,Police Officer,,"Nangle, David M.",Individual,201,2016 Pre-primary Report (ND),MA,,0,d2262d36-0049-5b4e-8fd9-777876b956a2,01827,01827,David Nangle
155 Depot St,100.0,13338,Dunstable,Dunstable,"Richardson, Raymond",Middlesex County,9/29/2016,2016-09-29,City of Lowell,Police Officer,,"Nangle, David M.",Individual,201,2016 Pre-election Report (ND),MA,,0,a8cb6fbe-74da-5425-b111-d5cb4a85ba88,01827,01827,David Nangle
533 Chicopee Row,100.0,13338,Groton,Groton,"Hoey, Thomas J.",Middlesex County,6/5/2018,2018-06-05,Harvard University,Police Officer,,"Nangle, David M.",Individual,201,2018 Pre-Primary Report,MA,Not Specified,0,ccd15ef7-bc0d-5b3c-9801-7c4469da248b,01450,01450,David Nangle
177 Havilah St,100.0,13338,Lowell,Lowell,"Golden, Timothy F.",Middlesex County,10/17/2018,2018-10-17,Lowell Police Department,Police Officer,,"Nangle, David M.",Individual,201,2018 Pre-election Report (ND),MA,Not Specified,0,3f2fc545-e35f-527b-9661-2cba418768a7,01852,01852,David Nangle
77 Lincoln Pkwy,150.0,13338,Lowell,Lowell,"Conroy, Phillip",Middlesex County,6/11/2019,2019-06-11,City of Lowell,Police Officer,,"Nangle, David M.",Individual,201,2019 Mid-Year Report,MA,Not Specified,0,35f09de0-7021-55a1-a236-c504a31f8963,01851,01851,David Nangle
28 Rindo Park Dr,100.0,13338,Lowell,Lowell,"Moriarty, Dennis",Middlesex County,9/30/2019,2019-09-30,City of Lowell,Police Officer,,"Nangle, David M.",Individual,201,2019 Year-end Report,MA,Not Specified,0,391dd60d-fe7f-52e7-821a-856801ae6fe7,01851,01851,David Nangle
39 Converse St,100.0,13338,Wakefield,Wakefield,"Santos, Shaun",Middlesex County,9/30/2019,2019-09-30,Lowell PD,Police Officer,,"Nangle, David M.",Individual,201,2019 Year-end Report,MA,Not Specified,0,ff58883a-4cf1-5874-8dd0-d7073cb2e510,01880,01880,David Nangle
24 Forest Drive,200.0,13338,Holden,Holden,"Daly, Andrew",Worcester County,4/30/2018,2018-04-30,Commonwealth of Ma,State Trooper,,"Nangle, David M.",Individual,201,2018 Pre-Primary Report,MA,Not Specified,0,e60329c1-670d-5bf3-90f1-8e7c9e748d75,01520,01520,David Nangle
3 Edwards Rd,200.0,13338,Braintree,Braintree,"Hunter, Edward",Norfolk County,4/30/2018,2018-04-30,Commonwealth of Ma,State Trooper,,"Nangle, David M.",Individual,201,2018 Pre-Primary Report,MA,Not Specified,0,4a1e5241-c020-5c44-ad22-ad8f300472e4,02184,02184,David Nangle
16 Rosemont Rd,200.0,13338,Worcester,Worcester,"Pullman, Dana A",Worcester County,4/30/2018,2018-04-30,Commonwealth of Ma,State Trooper,,"Nangle, David M.",Individual,201,2018 Pre-Primary Report,MA,Not Specified,0,7d5c2833-a2f3-515b-9560-7bc97127f6dc,01605,01605,David Nangle
57 Main St,200.0,13338,Westford,Westford,"Sullivan, Kevin",Middlesex County,4/24/2017,2017-04-24,Lowell Police Dept,Captain,,"Nangle, David M.",Individual,201,2017 Mid-Year Report (ND),MA,,0,5123209b-8bb1-560b-93a2-d0a64e4121ff,01886,01886,David Nangle
130 Shirley Rd,100.0,12832,Lancaster,Lancaster,"Welch, Michael",Worcester County,6/25/2010,2010-06-25,Town of Clinton,Police OFFICER,,"Naughton Jr., Harold P.",Individual,201,2010 Pre-primary Report (ND),MA,Not Specified,0,18ea89b1-b717-5c43-b2f2-cb110db13d88,01523,01523,Jr. Naughton
130 Shirley Rd,100.0,12832,Lancaster,Lancaster,"Welch, Michael",Worcester County,10/13/2010,2010-10-13,Town of Clinton,Police OFFICER,,"Naughton Jr., Harold P.",Individual,201,2010 Pre-election Report (ND),MA,Not Specified,0,d21ceaad-055a-57f2-bf2c-52ff2c893ed9,01523,01523,Jr. Naughton
130 Shirley Rd,100.0,12832,Lancaster,Lancaster,"Welch, Michael",Worcester County,10/6/2011,2011-10-06,Town of Clinton,Police OFFICER,,"Naughton Jr., Harold P.",Individual,201,2011 Year-end Report (ND),MA,Not Specified,0,b5716dfb-bc59-5b7e-8775-ba018eb60637,01523,01523,Jr. Naughton
130 Shirley Rd,100.0,12832,Lancaster,Lancaster,"Welch, Michael",Worcester County,7/30/2012,2012-07-30,Town of Clinton,Police OFFICER,,"Naughton Jr., Harold P.",Individual,201,2012 Pre-primary Report (ND),MA,Not Specified,0,7301042d-b32d-5ef1-8d72-59bc3c69da60,01523,01523,Jr. Naughton
119 Orange St,100.0,12832,Clinton,Clinton,"Welch , Richard B",Worcester County,11/6/2013,2013-11-06,Clinton,Police Officer,,"Naughton Jr., Harold P.",Individual,201,11/6/13 Deposit Report,MA,Check,1,697d0a1b-1f46-5ecd-bf43-1ec7771b6b85,01510-2216,01510,Jr. Naughton
130 Shirley Rd,250.0,12832,Lancaster,Lancaster,"Welch , Michael J",Worcester County,11/13/2013,2013-11-13,Town of Clinton,Police Officer,,"Naughton Jr., Harold P.",Individual,201,11/13/13 Deposit Report,MA,Check,1,6b958e2a-d907-5ca9-9dcc-6c692bdb51f5,01523-2563,01523,Jr. Naughton
35 Hedge St,50.0,12832,Fairhaven,Fairhaven,"Becotte , Armand ",Bristol County,12/31/2013,2013-12-31,Town of Fairhaven,Police Officer (Retired),,"Naughton Jr., Harold P.",Individual,201,12/31/13 Deposit Report,MA,Credit Card,3,16c26926-f5c3-5b1e-adf9-a8150d97bb6b,02719-3339,02719,Jr. Naughton
130 Shirley Rd,500.0,12832,Lancaster,Lancaster,"Welch, Michael",Worcester County,2/3/2014,2014-02-03,Town of Clinton,Police Officer,,"Naughton Jr., Harold P.",Individual,201,2014 Pre-primary Report (ND),MA,Not Specified,0,34180918-16a8-57bc-8f5d-7179c57cab87,01523,01523,Jr. Naughton
130 Shirley Rd,500.0,12832,Lancaster,Lancaster,"Welch , Michael J",Worcester County,2/3/2014,2014-02-03,Town of Clinton,Police Officer,,"Naughton Jr., Harold P.",Individual,201,2/3/14 Deposit Report,MA,Credit Card,3,96600679-b9ee-5db1-8ec9-c57ba68651f0,01523-2563,01523,Jr. Naughton
130 Shirley Rd.,250.0,12832,Lancaster,Lancaster,"Welch, Michael",Worcester County,1/26/2015,2015-01-26,Town of Clinton,Police Sergeant,,"Naughton, Harold P.",Individual,201,2015 Mid-Year Report,MA,Not Specified,0,bbe94e1a-8ead-57a3-82f5-e8382d9fe32d,01523,01523,Harold Naughton
5 Summer St.,200.0,12832,Mattapoisett,Mattapoisett,"Machado, James",Plymouth County,3/2/2015,2015-03-02,,Police Officer,,"Naughton, Harold P.",Individual,201,2015 Mid-Year Report,MA,Not Specified,0,16dfa315-03dd-5d68-ac46-988b59ceadf0,02739,02739,Harold Naughton
119 Orange St,50.0,12832,Clinton,Clinton,"Welch, Richard B.",Worcester County,5/22/2015,2015-05-22,Clinton,Police Officer,,"Naughton, Harold P.",Individual,201,2015 Mid-Year Report,MA,Not Specified,0,42e7db15-aad2-55d7-8b48-fcb12456fde7,01510,01510,Harold Naughton
91 Downey Street,500.0,12832,Hopkinton,Hopkinton,"Babbin, Timothy",Middlesex County,12/28/2015,2015-12-28,Mass State Police,State Police Officer,,"Naughton, Harold P.",Individual,201,2015 Year-end Report,MA,Not Specified,0,486d9610-3dbd-5e49-8fab-64ea6b764f56,01748,01748,Harold Naughton
48 Belmont St,500.0,12832,Taunton,Taunton,"Fredette, Kevin",Bristol County,12/28/2015,2015-12-28,Commonwealth of MA,State Police Officer,,"Naughton, Harold P.",Individual,201,2015 Year-end Report,MA,Not Specified,0,4e4e72e7-8b91-5dd1-b0f7-f2f7608d3f46,02780,02780,Harold Naughton
153 Aldrich St,500.0,12832,Roslindale,Roslindale,"Holland, Scott",Suffolk County,12/28/2015,2015-12-28,Commonwealth of Ma,State Police,,"Naughton, Harold P.",Individual,201,2015 Year-end Report,MA,Not Specified,0,4489932d-2c84-56ba-b7c7-27c5eab58363,02131,02131,Harold Naughton
19 Plain Street,500.0,12832,Franklin,Franklin,"Patterson, David",Norfolk County,12/28/2015,2015-12-28,Commonwealth of MA,State Police,,"Naughton, Harold P.",Individual,201,2015 Year-end Report,MA,Not Specified,0,6a936be0-40c0-5bdc-a5a1-f878b172432d,02038,02038,Harold Naughton
20 Lealand Peck Drive,500.0,12832,Wrentham,Wrentham,"Powell, Paul",Norfolk County,12/28/2015,2015-12-28,Commonwealth of Mass,State Police,,"Naughton, Harold P.",Individual,201,2015 Year-end Report,MA,Not Specified,0,a321f4f0-304d-521e-b3e9-4095fa889c09,02093,02093,Harold Naughton
130 Shirley Road,250.0,12832,Lancaster,Lancaster,"Welch, Michael",Worcester County,6/8/2016,2016-06-08,"Town of Clinton, MA",Police officer,,"Naughton, Harold P.",Individual,201,2016 Pre-Primary Report,MA,Not Specified,0,a2e5c58f-0f77-5214-90ea-7c7ad21a4ff8,01523,01523,Harold Naughton
119 Orange St,50.0,12832,Clinton,Clinton,"Welch, Richard B.",Worcester County,6/17/2016,2016-06-17,Clinton,Police Officer,,"Naughton, Harold P.",Individual,201,2016 Pre-Primary Report,MA,Not Specified,0,cba610dc-f4dd-5493-8ee5-d9b398b951a1,01510,01510,Harold Naughton
119 Orange St,100.0,12832,Clinton,Clinton,"Welch, Richard B.",Worcester County,10/31/2017,2017-10-31,Clinton,Police Officer,,"Naughton, Harold P.",Individual,201,2017 Year-end Report,MA,Not Specified,0,0fb62b7c-615c-521a-9565-c1ec82b2efd5,01510,01510,Harold Naughton
91 Downey Street,500.0,12832,Hopkinton,Hopkinton,"Babbin, Timothy",Middlesex County,12/21/2017,2017-12-21,Commonwealth of Massachusetts ,State Police,,"Naughton, Harold P.",Individual,201,2017 Year-end Report,MA,Not Specified,0,02986183-3403-5028-8662-201707185fb4,01748,01748,Harold Naughton
46 Juniper Ln,250.0,12832,Holden,Holden,"Brenner, Karl",Worcester County,12/21/2017,2017-12-21,Comonwealth of Massachusetts,State Police,,"Naughton, Harold P.",Individual,201,2017 Year-end Report,MA,Not Specified,0,c52d154c-debd-5d1e-9063-773776912d92,01520,01520,Harold Naughton
153 Aldrich Street,250.0,12832,Roslindale,Roslindale,"Holland, Scott",Suffolk County,12/21/2017,2017-12-21,Commonwealth of Massachusetts,State Police,,"Naughton, Harold P.",Individual,201,2017 Year-end Report,MA,Not Specified,0,f561fb5c-742f-51b7-93c2-1aa881cf330b,02131,02131,Harold Naughton
3 Edwards Rd,500.0,12832,Braintree,Braintree,"Hunter, Edward",Norfolk County,12/21/2017,2017-12-21,Commonwealth of Massachusetts ,State Police,,"Naughton, Harold P.",Individual,201,2017 Year-end Report,MA,Not Specified,0,a71c6301-1eb4-50fa-9316-37b09ce68357,02184,02184,Harold Naughton
6 Weld St,250.0,12832,Westborough,Westborough,"Lynch, Mark",Worcester County,12/21/2017,2017-12-21,Commonwealth of Massachusetts,State Police,,"Naughton, Harold P.",Individual,201,2017 Year-end Report,MA,Not Specified,0,b55cccfc-1e69-5933-9100-f569cf3dea8d,01581,01581,Harold Naughton
19 Plain Street,250.0,12832,Franklin,Franklin,"Patterson, David",Norfolk County,12/21/2017,2017-12-21,Commonwealth of Massachusetts,State Police,,"Naughton, Harold P.",Individual,201,2017 Year-end Report,MA,Not Specified,0,dc669b8f-7ae5-5cf9-b99d-46093372d1a5,02038,02038,Harold Naughton
20 Lealand Peck Drive,250.0,12832,Wrentham,Wrentham,"Powell, Paul",Norfolk County,12/21/2017,2017-12-21,Commonwealth of Massachusetts,State Police,,"Naughton, Harold P.",Individual,201,2017 Year-end Report,MA,Not Specified,0,24d80891-57ba-58c3-ac79-907a198f579e,02093,02093,Harold Naughton
16 Rosemont Road,200.0,12832,Worcester,Worcester,"Pullman, Dana A",Worcester County,12/21/2017,2017-12-21,Commonwealth of Massachusetts,State Police,,"Naughton, Harold P.",Individual,201,2017 Year-end Report,MA,Not Specified,0,94ebe9c6-58e2-55ee-b14e-98f4cc0c99ee,01605,01605,Harold Naughton
119 Orange St,57.73,12832,Clinton,Clinton,"Welch, Richard B.",Worcester County,6/4/2018,2018-06-04,Clinton,Police Officer,,"Naughton, Harold P.",Individual,201,2018 Pre-Primary Report,MA,Not Specified,0,1ccd15c9-5584-58a0-b76d-4b4b30ffde88,01510,01510,Harold Naughton
88 Griswold St.,25.0,12832,Cambridge,Cambridge,"Rosa, Louis C.",Middlesex County,6/7/2018,2018-06-07,MIT,Mit Police Officer,,"Naughton, Harold P.",Individual,201,2018 Pre-Primary Report,MA,Not Specified,0,16011472-8892-561f-b6ed-a8678c118aba,02138,02138,Harold Naughton
71 Corning Street,100.0,12832,Beverly,Beverly,"Nelson, John",Essex County,10/31/2018,2018-10-31,,POLICE OFFICER,,"Naughton, Harold P.",Individual,201,2018 Year-end Report,MA,Not Specified,0,12216baa-e2d3-5c31-8ff0-8dc25e546ca5,01915,01915,Harold Naughton
130 Shirley Rd,200.0,12832,Lancaster,Lancaster,"Welch, Michael",Worcester County,11/2/2018,2018-11-02,Town of Clinton,Police Officer,,"Naughton, Harold P.",Individual,201,2018 Year-end Report,MA,Not Specified,0,ab26fd50-3cb6-58ef-86a4-62b25649c55d,01523,01523,Harold Naughton
110 East Main Street,100.0,12832,Northborough,Northborough,"Kearney, William P",Worcester County,11/7/2018,2018-11-07,Westborough Police Dept.,POLICE OFFICER,,"Naughton, Harold P.",Individual,201,2018 Year-end Report,MA,Not Specified,0,1bf8a773-704a-5337-9144-b1d8df8d1512,01532,01532,Harold Naughton
50 Auburn Street,100.0,12832,Clinton,Clinton,"O'Malley, Brendon",Worcester County,11/8/2019,2019-11-08,CLINTON POLICE DEPARTMENT,Police Officer,,"Naughton, Harold P.",Individual,201,2019 Year-end Report,MA,Not Specified,0,40c1b620-ab8b-53f0-9f3c-2cb35f82df95,01510,01510,Harold Naughton
119 Orange St,100.0,12832,Clinton,Clinton,"Welch, Richard B",Worcester County,11/9/2019,2019-11-09,CLINTON POLICE DEPARTMENT,Police Officer,,"Naughton, Harold P.",Individual,201,2019 Year-end Report,MA,Not Specified,0,5d34f378-1532-55dd-b746-20bc5d96c0c7,01510,01510,Harold Naughton
50 Auburn Street,50.0,12832,Clinton,Clinton,"O'Malley, Brendon",Worcester County,11/15/2019,2019-11-15,CLINTON POLICE DEPARTMENT,Police Officer,,"Naughton, Harold P.",Individual,201,2019 Year-end Report,MA,Not Specified,0,81ff72c1-ca6d-556b-9a2e-e39ac71137df,01510,01510,Harold Naughton
39 Old Cart Road,200.0,12832,Auburn,Auburn,"Glodis, Guy",Worcester County,6/28/2011,2011-06-28,MASS,SHERIFF,,"Naughton Jr., Harold P.",Individual,201,2011 Mid-Year Report (ND),MA,Not Specified,0,554f5414-8890-50b0-9aa5-7a36c365f1c3,01501,01501,Jr. Naughton
69 Morningside Drive,200.0,12832,Walpole,Walpole,"Cherven, Michael",Norfolk County,12/15/2012,2012-12-15,Comm of Mass,State Trooper,,"Naughton Jr., Harold P.",Individual,201,2012 Year-end Report (ND),MA,Not Specified,0,11355b86-46f7-5208-b0be-1b60fb71a68e,02081,02081,Jr. Naughton
271 Main Street,250.0,12832,Stoneham,Stoneham,"Moynihan, Daniel",Middlesex County,12/15/2012,2012-12-15,Comm of Mass,State Trooper,,"Naughton Jr., Harold P.",Individual,201,2012 Year-end Report (ND),MA,Not Specified,0,ccf03dcd-084c-5cd9-9098-af6c126c3f9e,02180,02180,Jr. Naughton
PO Box 1012,200.0,12832,Hanson,Hanson,"Crowley , Paul C",Plymouth County,12/31/2013,2013-12-31,State Police Association of MA (SPAM),Trooper Representative,,"Naughton Jr., Harold P.",Individual,201,12/31/13 Deposit Report,MA,Check,1,131d8965-bc81-558c-95be-e9266044313c,02341-6012,02341,Jr. Naughton
16 Lincoln Cir,250.0,12832,Andover,Andover,"Martin , James W",Essex County,12/31/2013,2013-12-31,State Police Association of MA (SPAM),Trooper Representative,,"Naughton Jr., Harold P.",Individual,201,12/31/13 Deposit Report,MA,Check,1,8084e035-db66-5778-b23d-8c0cc20112e6,01810-2947,01810,Jr. Naughton
1 Tiffany Ave,200.0,12832,Worcester,Worcester,"Sullivan , Michael J",Worcester County,12/31/2013,2013-12-31,State Police Association of MA (SPAM),Trooper Representative,,"Naughton Jr., Harold P.",Individual,201,12/31/13 Deposit Report,MA,Check,1,260a3f74-3db6-53a7-9633-22cb18a9f8e7,01604-3247,01604,Jr. Naughton
16A Bristol Rd,125.0,12832,Peabody,Peabody,"Mullen, Kevin",Essex County,4/24/2014,2014-04-24,Commonwealth of Massachusetts,State Trooper,,"Naughton Jr., Harold P.",Individual,201,2014 Pre-primary Report (ND),MA,Not Specified,0,fd7729b2-410d-57ce-bd5d-3c4d180590ad,01960,01960,Jr. Naughton
PO Box 1012,500.0,12832,Hanson,Hanson,"Crowley, Paul C",Plymouth County,12/28/2015,2015-12-28,State Police Association of MA (SPAM),Trooper Representative,,"Naughton, Harold P.",Individual,201,2015 Year-end Report,MA,Not Specified,0,c4cb2e33-86a9-559e-b0c5-eccabedd2cbe,02341,02341,Harold Naughton
4 Braney Road,500.0,12832,Millbury,Millbury,"Gilbert, Kim",Worcester County,12/28/2015,2015-12-28,State Police Assoc of Ma,State Trooper,,"Naughton, Harold P.",Individual,201,2015 Year-end Report,MA,Not Specified,0,6440008b-524e-5059-a88f-0d26bbf443d4,01527,01527,Harold Naughton
49 Olde Forge Rd,500.0,12832,Hanover,Hanover,"Gillespie, Timothy",Plymouth County,12/28/2015,2015-12-28,Mass State Police,Trooper,,"Naughton, Harold P.",Individual,201,2015 Year-end Report,MA,Not Specified,0,6e8f06be-d77e-53f3-876f-1e21ee48c272,02339,02339,Harold Naughton
3 Edwards Rd,500.0,12832,Braintree,Braintree,"Hunter, Edward",Norfolk County,12/28/2015,2015-12-28,Mass State Police,Trooper,,"Naughton, Harold P.",Individual,201,2015 Year-end Report,MA,Not Specified,0,53b6f068-b402-5fdc-9ab6-67b5182ee2ac,02184,02184,Harold Naughton
1 Tiffany Ave,500.0,12832,Worcester,Worcester,"Sullivan, Michael J",Worcester County,12/28/2015,2015-12-28,State Police Association of MA (SPAM),Trooper Representative,,"Naughton, Harold P.",Individual,201,2015 Year-end Report,MA,Not Specified,0,6a4e2c31-8469-5c4a-9315-06ddcf279a66,01601,01601,Harold Naughton
PO Box 1012,250.0,12832,Hanson,Hanson,"Crowley, Paul C",Plymouth County,12/21/2017,2017-12-21,State Police Association of MA (SPAM),Trooper Representative,,"Naughton, Harold P.",Individual,201,2017 Year-end Report,MA,Not Specified,0,e331b931-7655-52dd-bbf9-e643d09850c4,02341,02341,Harold Naughton
1 Tiffany Ave,250.0,12832,Worcester,Worcester,"Sullivan, Michael J",Worcester County,12/21/2017,2017-12-21,State Police Association of MA (SPAM),Trooper Representative,,"Naughton, Harold P.",Individual,201,2017 Year-end Report,MA,Not Specified,0,d77f44f1-425b-57b6-b6f9-de3cb5079688,01604,01604,Harold Naughton
5 Summer St.,200.0,12832,Mattapoisett,Mattapoisett,"Machado, James M.",Plymouth County,3/4/2011,2011-03-04,Fall River Police,Sergeant,,"Naughton Jr., Harold P.",Individual,201,2011 Mid-Year Report (ND),MA,Not Specified,0,952c7019-11eb-573c-b597-808fd4660963,02739,02739,Jr. Naughton
5 Summer St.,200.0,12832,Mattapoisett,Mattapoisett,"Machado, James M.",Plymouth County,12/29/2012,2012-12-29,Fall River Police,Sergeant,,"Naughton Jr., Harold P.",Individual,201,2012 Year-end Report (ND),MA,Not Specified,0,bd49d649-8e0b-5a02-8b7e-a55777fa2447,02739,02739,Jr. Naughton
5 Summer St.,200.0,12832,Mattapoisett,Mattapoisett,"Machado, James M.",Plymouth County,5/1/2013,2013-05-01,Fall River Police,Sergeant,,"Naughton Jr., Harold P.",Individual,201,2013 Mid-Year Report (ND),MA,Not Specified,0,068eebd5-61c8-5970-9188-b2d8711778dc,02739,02739,Jr. Naughton
91 Downey St,200.0,12832,Hopkinton,Hopkinton,"Babbin , Timothy G",Middlesex County,12/31/2013,2013-12-31,State Police Association of MA (SPAM),Vice President,,"Naughton Jr., Harold P.",Individual,201,12/31/13 Deposit Report,MA,Check,1,23dca9b4-af90-58da-baec-11885d4a532a,01748-2702,01748,Jr. Naughton
11 Beacon St,200.0,12832,Boston,Boston,"Daly , Andrew J",Suffolk County,12/31/2013,2013-12-31,State Police Association of MA (SPAM),Treasurer,,"Naughton Jr., Harold P.",Individual,201,12/31/13 Deposit Report,MA,Check,1,827d5c91-b88a-5de0-b85a-3356c4995f2e,02108-3017,02108,Jr. Naughton
3 Edwards Rd,200.0,12832,Braintree,Braintree,"Hunter , Edward F",Norfolk County,12/31/2013,2013-12-31,State Police Association of MA (SPAM),Secretary,,"Naughton Jr., Harold P.",Individual,201,12/31/13 Deposit Report,MA,Check,1,2d55d251-ee0b-58fe-9406-22293e204959,02184-1405,02184,Jr. Naughton
16 Rosemont Rd,200.0,12832,Worcester,Worcester,"Pullman , Dana A",Worcester County,12/31/2013,2013-12-31,State Police Association of MA (SPAM),President,,"Naughton Jr., Harold P.",Individual,201,12/31/13 Deposit Report,MA,Check,1,ee57f149-3fc3-58da-aa30-cbce48f3ca2c,01605-1220,01605,Jr. Naughton
5 Summer St,200.0,12832,Mattapoisett,Mattapoisett,"Machado, James",Plymouth County,4/17/2014,2014-04-17,Massachusetts Police Association,"Director of Operations, Legislative Agent",,"Naughton Jr., Harold P.",Individual,201,2014 Pre-primary Report (ND),MA,Not Specified,0,a1ac818c-b1a7-5301-80e2-38a855a48810,02739,02739,Jr. Naughton
11 Beacon St,500.0,12832,Boston,,"Daly, Andrew J",,12/28/2015,2015-12-28,State Police Association of MA (SPAM),Treasurer,,"Naughton, Harold P.",Individual,201,2015 Year-end Report,MA,Not Specified,0,3d8d5b03-0753-5bcb-87a8-8eaa0beccc42,02101,NA,Harold Naughton
24 Forest Dr,500.0,12832,Holden,Holden,"Daly, Andrew J",Worcester County,12/21/2017,2017-12-21,State Police Association of MA (SPAM),Treasurer,,"Naughton, Harold P.",Individual,201,2017 Year-end Report,MA,Not Specified,0,7a734e41-36d3-5fde-b383-40d2badddf2f,01520,01520,Harold Naughton
24 Forest Dr,250.0,12832,Holden,Holden,"Daly, Andrew J",Worcester County,4/5/2018,2018-04-05,State Police Association of MA (SPAM),Treasurer,,"Naughton, Harold P.",Individual,201,2018 Pre-Primary Report,MA,Not Specified,0,bc4198ff-e1ff-5cc0-9ee1-5e6ffda54207,01520,01520,Harold Naughton
16 Rosemont Rd,200.0,12832,Worcester,Worcester,"Pullman, Dana A",Worcester County,4/5/2018,2018-04-05,State Police Assoc. of Massachusetts,President,,"Naughton, Harold P.",Individual,201,2018 Pre-Primary Report,MA,Not Specified,0,98e807c4-190b-5939-9917-15aaa52cd8ef,01605,01605,Harold Naughton
11 Elizabeth Dr,100.0,12832,Auburn,Auburn,"Zona, Thomas",Worcester County,6/4/2018,2018-06-04,Ma State Police,Lt. Colonel,,"Naughton, Harold P.",Individual,201,2018 Pre-Primary Report,MA,Not Specified,0,7c549db8-e28d-5337-ac0a-838784113c9f,01501,01501,Harold Naughton
47 Catamount Road,25.0,16891,Tewksbury,Tewksbury,"Sitar, Michael",Middlesex County,2/21/2018,2018-02-21,Boston University,police officer,,"Nguyen, Tram",Individual,201,2018 Pre-Primary Report,MA,Not Specified,0,0b8fb290-a766-5271-96d1-fa3ebc9d8659,01876,01876,Tram Nguyen
26 Ortolani Cir,100.0,14877,Kingston,Kingston,"McDonald, Joseph",Plymouth County,9/27/2018,2018-09-27,PCS,Sheriff,,"O'Connell, Edward J.",Individual,201,2018 Pre-election Report (ND),MA,Not Specified,0,46e989ef-edc5-5735-a954-8ebae6ab3e73,02364,02364,Edward O'Connell
4 Crest Street,100.0,14668,Wilbraham,Wilbraham,"Murphy, Sean",Hampden County,5/3/2011,2011-05-03,City of Springfield,Police Officer,,"O'Day, James J.",Individual,201,2011 Mid-Year Report (ND),MA,Not Specified,0,1933d968-a6a4-59c0-b31e-20eca001e7f1,01095,01095,James O'Day
76 Charnock Hill Road,100.0,14668,Rutland,Rutland,"Glynn, Francis",Worcester County,2/4/2013,2013-02-04,West Boylston PD,Police Sergeant,,"O'Day, James J.",Individual,201,2013 Mid-Year Report (ND),MA,Not Specified,0,c76c5a19-20c6-5eae-8005-d3b17593bd14,01543,01543,James O'Day
24 Forest Drive,250.0,14668,Holden,Holden,"Daly, Andrew",Worcester County,9/10/2012,2012-09-10,Commonwealth of MA,State Trooper,,"O'Day, James J.",Individual,201,2012 Pre-election Report (ND),MA,Not Specified,0,f65b48b7-7c6e-5d44-b70e-38ab70f0df9a,01520,01520,James O'Day
16 Rosemont Road,250.0,14668,Worcester,Worcester,"Pullman, Dana",Worcester County,9/10/2012,2012-09-10,Commonwealth of MA,State Trooper,,"O'Day, James J.",Individual,201,2012 Pre-election Report (ND),MA,Not Specified,0,085333c4-3030-57ff-9102-4dc473c89682,01605,01605,James O'Day
3 Edwards Road,250.0,14668,Braintree,Braintree,"Hunter, Edward",Norfolk County,9/11/2012,2012-09-11,Commonwealth of MA,State Trooper,,"O'Day, James J.",Individual,201,2012 Pre-election Report (ND),MA,Not Specified,0,e2b4b76a-4355-52be-9172-82c7c5cf22e4,02184,02184,James O'Day
91 Downey Street,250.0,14668,Hopkinton,Hopkinton,"Babbin, Timothy",Middlesex County,10/18/2012,2012-10-18,Commonwealth of MA,State Trooper,,"O'Day, James J.",Individual,201,2012 Pre-election Report (ND),MA,Not Specified,0,5e4ed0a1-325d-5923-9f70-9043b6692804,01748,01748,James O'Day
1 Shepard Avenue,500.0,14668,Dudley,Dudley,"Teatreau, Roxann",Worcester County,10/18/2012,2012-10-18,Commonwealth of MA,State Trooper,,"O'Day, James J.",Individual,201,2012 Pre-election Report (ND),MA,Not Specified,0,d0df3057-3bb3-507a-a5d7-49bee8193c3a,01571,01571,James O'Day
"11 Beacon Street, Suite 300",200.0,14668,Boston,Boston,"Machado, James",Suffolk County,5/22/2012,2012-05-22,State Police Association of MA,Executive Director,,"O'Day, James J.",Individual,201,2012 Pre-primary Report (ND),MA,Not Specified,0,7ae37e53-4f96-5127-ad1b-4b8c893882b5,02108,02108,James O'Day
5 Summer Street,200.0,14668,Mattapoisett,Mattapoisett,"Machado, James",Plymouth County,5/22/2013,2013-05-22,MA Police Assoc,Legislative Agent,,"O'Day, James J.",Individual,201,2013 Mid-Year Report (ND),MA,Not Specified,0,7134b893-0b3b-536d-ba2c-2e74bc2dc390,02739,02739,James O'Day
12 Leatherchip Road,50.0,16927,Holbrook,Holbrook,"Morgan, Joseh",Norfolk County,3/25/2018,2018-03-25,Bridgewater State College,Police Officer,,"Orrall, Norman J.",Individual,201,2018 Pre-primary Report (ND),MA,Not Specified,0,167e9a14-70e2-5ba3-92f1-1252faa1ff87,02343,02343,Norman Orrall
PO Box 181119,100.0,14208,Boston,Boston,"Clapham, Ronald ",Suffolk County,9/11/2013,2013-09-11,Massachusetts State Police,Trooper,,"Peake, Sarah K.",Individual,201,2013 Year-end Report (ND),MA,Not Specified,0,8ec06aac-387c-5107-a2ba-08b83ff8c9bd,02118,02118,Sarah Peake
101 Cherry Street #17,1000.0,16627,Plymouth,Plymouth,"Vecchi, Scott",Plymouth County,10/1/2019,2019-10-01,Town of Plymouth,Detective Sergeant,,"Pereira, Jimmy",Individual,201,10/1/19 Deposit Report,MA,Credit Card,3,0ce8d246-263c-5ff8-9d0f-9305065a48d2,02360,02360,Jimmy Pereira
718 Alden Street,100.0,11102,Ludlow,Ludlow,"McGowan, James",Hampden County,5/18/2011,2011-05-18,Town of Ludlow,Chief of Police,,"Petrolati, Thomas M.",Individual,201,2011 Mid-Year Report (ND),MA,Not Specified,0,91d65680-311a-51a8-b5ec-243065593b52,01056,01056,Thomas Petrolati
277 Gillette Avenue,100.0,11102,Springfield,Springfield,"Noonan, William",Hampden County,5/18/2011,2011-05-18,Springfield Police Dept,police detective,,"Petrolati, Thomas M.",Individual,201,2011 Mid-Year Report (ND),MA,Not Specified,0,bfc270a2-f195-5e0b-8235-4e3e11d624cc,01118,01118,Thomas Petrolati
718 Alden Street,100.0,11102,Ludlow,Ludlow,"McGowan, James",Hampden County,4/30/2012,2012-04-30,Town of Ludlow,Chief of Police,,"Petrolati, Thomas M.",Individual,201,2012 Pre-primary Report (ND),MA,Not Specified,0,08888335-9773-5919-83ea-3017d180e4d4,01056,01056,Thomas Petrolati
718 Alden Street,100.0,11102,Ludlow,Ludlow,"McGowan, James",Hampden County,4/26/2013,2013-04-26,Town of Ludlow,Chief of Police,,"Petrolati, Thomas M.",Individual,201,2013 Mid-Year Report (ND),MA,Not Specified,0,b8a6c945-cd53-59c0-8152-23b87260b08c,01056,01056,Thomas Petrolati
277 Gillette Avenue,100.0,11102,Springfield,Springfield,"Noonan, William",Hampden County,5/16/2013,2013-05-16,Springfield Police Dept,police detective,,"Petrolati, Thomas M.",Individual,201,2013 Mid-Year Report (ND),MA,Not Specified,0,80c09f6c-c251-5e81-9fbd-86e474f16ad2,01118,01118,Thomas Petrolati
P.O. Box 946,100.0,11102,East Otis,East Otis,"Douthwright, David",Berkshire County,8/12/2013,2013-08-12,Commonwealth of Massachusetts,State Police,,"Petrolati, Thomas M.",Individual,201,2013 Year-end Report (ND),MA,Not Specified,0,0e52777b-943c-5824-8b16-5f7070b0b3c3,01029,01029,Thomas Petrolati
718 Alden Street,100.0,11102,Ludlow,Ludlow,"McGowan, James",Hampden County,4/27/2014,2014-04-27,Town of Ludlow,Chief of Police,,"Petrolati, Thomas M.",Individual,201,2014 Pre-primary Report (ND),MA,Not Specified,0,06583f3b-d837-5edb-a787-d5d14ebf4e1e,01056,01056,Thomas Petrolati
P.O. Box 946,100.0,11102,East Otis,East Otis,"Douthwright, David",Berkshire County,5/13/2016,2016-05-13,Commonwealth of Massachusetts,State Police,,"Petrolati, Thomas M.",Individual,201,2016 Pre-primary Report (ND),MA,,0,ea8f8fb1-8486-5727-a1a9-e58893992d02,01029,01029,Thomas Petrolati
P.O. Box 946,100.0,11102,East Otis,East Otis,"Douthwright, David",Berkshire County,9/14/2017,2017-09-14,Commonwealth of Massachusetts,State Police,,"Petrolati, Thomas M.",Individual,201,2017 Year-end Report (ND),MA,,0,a66a37d1-9261-5793-a743-02a25224d02d,01029,01029,Thomas Petrolati
2 Park Dr,100.0,11102,Wilbraham,Wilbraham,"McCullough, John",Hampden County,9/20/2017,2017-09-20,Commonwealth of Massachusetts,State Police,,"Petrolati, Thomas M.",Individual,201,2017 Year-end Report (ND),MA,,0,d746a609-a948-52f5-b8aa-a0c9394c9504,01095,01095,Thomas Petrolati
436 Davis Street,500.0,11102,Greenfield,Greenfield,"Capen II, James E.",Franklin County,6/14/2010,2010-06-14,Franklin County,Deputy Sheriff,,"Petrolati, Thomas M.",Individual,201,2010 Pre-primary Report (ND),MA,Not Specified,0,89d2c261-ce07-5fa0-adb1-afdc64700859,01302,01302,Thomas Petrolati
98 Myrtlebank Ave.,100.0,16592,Dorchester,Dorchester Center,"Woods, Lauren",Suffolk County,8/7/2017,2017-08-07,City of Boston,Police Officer,,"Philips, Edward Ryan",Individual,201,2017 Pre-primary Report (Special) (ND),MA,,0,94bdceab-6b54-5380-b7b9-58d0b7cd7fd8,02124,02124,Edward Philips
172 Green St,250.0,12730,Jamaica Plain,Jamaica Plain,"Cabral, Andrea",Suffolk County,9/27/2010,2010-09-27,suffolk county,sheriff,,"Pignatelli, William",Individual,201,2010 Pre-election Report (ND),MA,Not Specified,0,7c720593-01a6-5e16-b472-dd7d088e8a0d,02130,02130,William Pignatelli
242 Mount Hope St,50.0,13455,N Attleboro,North Attleboro,"Morse, Frederick",Bristol County,6/10/2015,2015-06-10,State Police,STATE POLICE,,"Poirier, Elizabeth A.",Individual,201,2015 Mid-Year Report (ND),MA,,0,d3e96d2d-cbb8-5154-9c62-0189ef7535fa,02760,02760,Elizabeth Poirier
242 Mount Hope St,50.0,13455,N Attleboro,North Attleboro,"Morse, Frederick",Bristol County,6/23/2016,2016-06-23,State Police,STATE POLICE,,"Poirier, Elizabeth A.",Individual,201,2016 Pre-primary Report (ND),MA,,0,97f6244d-f465-569d-867c-f34a845b62ee,02760,02760,Elizabeth Poirier
61 Whalen Dr,40.0,13455,North Attleboro,North Attleboro,"Richman, Kevin",Bristol County,11/10/2016,2016-11-10,,POLICE OFFICER,,"Poirier, Elizabeth A.",Individual,201,2016 Year-end Report (ND),MA,,0,a7bce091-1154-5944-84e6-3d8a52206b7d,02760,02760,Elizabeth Poirier
242 Mount Hope St,50.0,13455,North Attleboro,North Attleboro,"Morse, Frederick",Bristol County,12/8/2016,2016-12-08,State Police,STATE POLICE,,"Poirier, Elizabeth A.",Individual,201,2016 Year-end Report (ND),MA,,0,01e24505-43fd-5ada-a3e3-2d745746dd79,02760,02760,Elizabeth Poirier
242 Mount Hope St,50.0,13455,N Attleboro,North Attleboro,"Morse, Frederick",Bristol County,11/16/2017,2017-11-16,State Police,STATE POLICE,,"Poirier, Elizabeth A.",Individual,201,2017 Year-end Report (ND),MA,,0,fa6edb4f-4d67-5478-99b1-c5a1526ac78a,02760,02760,Elizabeth Poirier
158 Hathaway Rd,100.0,13455,N Dartmouth,North Dartmouth,"Hodgson, Sheriff & Mrs. Thomas",Bristol County,9/4/2015,2015-09-04,Sheriff of Bristol County,Sheriff,,"Poirier, Elizabeth A.",Individual,201,2015 Year-end Report (ND),MA,,0,d9bfbaa9-0835-5af6-8c23-d3ccc69009cc,02747,02747,Elizabeth Poirier
158 Hathaway Rd,100.0,13455,N Dartmouth,North Dartmouth,"Hodgson, Thomas",Bristol County,5/25/2016,2016-05-25,Commonwealth of MA,Sheriff,,"Poirier, Elizabeth A.",Individual,201,2016 Pre-primary Report (ND),MA,,0,493d5fd5-3f7c-5ef9-a28e-70498dd3693d,02747,02747,Elizabeth Poirier
158 Hathaway Rd,100.0,13455,N Dartmouth,North Dartmouth,"Hodgson, Sheriff & Mrs.Thomas",Bristol County,11/9/2017,2017-11-09,Sheriff of Bristol County,Sheriff,,"Poirier, Elizabeth A.",Individual,201,2017 Year-end Report (ND),MA,,0,fcb33d5f-acd5-522e-9efb-f50599226394,02747,02747,Elizabeth Poirier
242 Main Street,100.0,12889,Brimfield,Brimfield,"Loos, David",Hampden County,10/28/2012,2012-10-28,Commonwealth of Massachusetts,Environmental Police Officer,,"Puppolo Jr., Angelo J.",Individual,201,2012 Year-end Report (ND),MA,Not Specified,0,1cb472ec-69aa-589d-b384-c7a0b8b052f1,01010,01010,Jr. Puppolo
91 Downey Street,125.0,12889,Hopkinton,Hopkinton,"Babbin, Timothy",Middlesex County,4/14/2012,2012-04-14,Commonwealth of Massachusetts,Trooper,,"Puppolo Jr., Angelo J.",Individual,201,2012 Pre-primary Report (ND),MA,Not Specified,0,22003a35-3f0d-55c4-8882-23fcb4df42c6,01748,01748,Jr. Puppolo
28 Chesset Lane,125.0,12889,Attleboro,Attleboro,"Brown, Richard",Bristol County,4/14/2012,2012-04-14,Commonwealth of Mass,Trooper,,"Puppolo Jr., Angelo J.",Individual,201,2012 Pre-primary Report (ND),MA,Not Specified,0,0967ff3f-7ac0-561d-bf4e-2245f7f83533,02703,02703,Jr. Puppolo
3 Edwards Road,125.0,12889,Braintree,Braintree,"Hunter, Edward",Norfolk County,4/14/2012,2012-04-14,Commonwealth of Mass,Trooper,,"Puppolo Jr., Angelo J.",Individual,201,2012 Pre-primary Report (ND),MA,Not Specified,0,71a3f307-e00c-5b8c-aaa9-d9f1b99201f4,02184,02184,Jr. Puppolo
16 Rosemeont Road,125.0,12889,Worcester,Worcester,"Pullman, Dana",Worcester County,4/14/2012,2012-04-14,Commonwealth of Mass,Trooper,,"Puppolo Jr., Angelo J.",Individual,201,2012 Pre-primary Report (ND),MA,Not Specified,0,9f3a6c83-32ab-56ce-b5fe-565675a7dbdc,01605,01605,Jr. Puppolo
24 Forest Drive,250.0,12889,Holden,Holden,"Daly, Andrew",Worcester County,10/28/2012,2012-10-28,Commonwealth of Massachusetts,Trooper,,"Puppolo Jr., Angelo J.",Individual,201,2012 Year-end Report (ND),MA,Not Specified,0,97b9cde1-81d2-52f3-bc05-cf3a1a497ca0,01520,01520,Jr. Puppolo
16 Rosemeont Road,250.0,12889,Worcester,Worcester,"Pullman, Dana",Worcester County,10/28/2012,2012-10-28,Commonwealth of Mass,Trooper,,"Puppolo Jr., Angelo J.",Individual,201,2012 Year-end Report (ND),MA,Not Specified,0,adf1b4e1-eb33-5157-8a90-b67403f05bd2,01605,01605,Jr. Puppolo
1308 Lovers Lane,250.0,12889,Washington,Becket,"Gale, Dan",Berkshire County,11/9/2012,2012-11-09,Commonwealth of Massachusetts,Trooper,,"Puppolo Jr., Angelo J.",Individual,201,2012 Year-end Report (ND),MA,Not Specified,0,6ed7e3f6-7f37-5171-ae16-129f0b91727b,01223,01223,Jr. Puppolo
1308 Lovers Lane,100.0,12889,Washington,Becket,"Gale, Dan",Berkshire County,2/8/2014,2014-02-08,Commonwealth of Massachusetts,Trooper,,"Puppolo Jr., Angelo J.",Individual,201,2014 Pre-primary Report (ND),MA,Not Specified,0,ea50c239-6145-5bba-8a0a-8d6ccf6c0720,01223,01223,Jr. Puppolo
24 Forest Drive,200.0,12889,Holden,Holden,"Daly, Andrew",Worcester County,7/13/2014,2014-07-13,Commonwealth of Massachusetts,Trooper,,"Puppolo Jr., Angelo J.",Individual,201,2014 Pre-primary Report (ND),MA,Not Specified,0,c34c0910-fd7f-5131-affc-4e5d4daf55ca,01520,01520,Jr. Puppolo
3 Edwards Road,200.0,12889,Braintree,Braintree,"Hunter, Edward",Norfolk County,7/13/2014,2014-07-13,Commonwealth of Mass,Trooper,,"Puppolo Jr., Angelo J.",Individual,201,2014 Pre-primary Report (ND),MA,Not Specified,0,30ef6fdd-1025-5748-bfa0-2e7174c48898,02184,02184,Jr. Puppolo
16 Rosemeont Road,200.0,12889,Worcester,Worcester,"Pullman, Dana",Worcester County,7/13/2014,2014-07-13,Commonwealth of Mass,Trooper,,"Puppolo Jr., Angelo J.",Individual,201,2014 Pre-primary Report (ND),MA,Not Specified,0,28b31c45-cf11-55e6-bbad-e7e9244ad1d5,01605,01605,Jr. Puppolo
24 Forest Drive,200.0,12889,Holden,Holden,"Daly, Andrew",Worcester County,11/2/2014,2014-11-02,Commonwealth of Massachusetts,Trooper,,"Puppolo Jr., Angelo J.",Individual,201,2014 Year-end Report (ND),MA,Not Specified,0,8e4aafdb-504e-5c00-a34a-4a85e4da2ef5,01520,01520,Jr. Puppolo
16 Stratford Terrace,200.0,12889,Springfield,Springfield,"Dilorenzo, Americo",Hampden County,6/8/2015,2015-06-08,Commonwealth of Mass,Trooper,,"Puppolo Jr., Angelo J.",Individual,201,2015 Mid-Year Report (ND),MA,Other,5,9d1a6c3e-168f-5041-9044-42c79c5174af,01108,01108,Jr. Puppolo
91 Downey Street,500.0,12889,Hopkinton,Hopkinton,"Babbin, Timothy",Middlesex County,10/23/2015,2015-10-23,Commonwealth of Massachusetts,Trooper,,"Puppolo Jr., Angelo J.",Individual,201,2015 Year-end Report (ND),MA,,0,91d55d33-bd48-594c-83ea-1e7ebfb1fa4b,01748,01748,Jr. Puppolo
24 Forest Drive,200.0,12889,Holden,Holden,"Daly, Andrew",Worcester County,10/23/2015,2015-10-23,Commonwealth of Massachusetts,Trooper,,"Puppolo Jr., Angelo J.",Individual,201,2015 Year-end Report (ND),MA,,0,b946dace-649a-5986-b536-0b8a44681e5a,01520,01520,Jr. Puppolo
16 Rosemeont Road,200.0,12889,Worcester,Worcester,"Pullman, Dana",Worcester County,10/23/2015,2015-10-23,Commonwealth of Mass,Trooper,,"Puppolo Jr., Angelo J.",Individual,201,2015 Year-end Report (ND),MA,,0,86eae85a-b098-5e1f-9831-1bf95b603737,01605,01605,Jr. Puppolo
91 Downey Street,500.0,12889,Hopkinton,Hopkinton,"Babbin, Timothy",Middlesex County,12/28/2017,2017-12-28,Commonwealth of Massachusetts,Trooper,,"Puppolo Jr., Angelo J.",Individual,201,2017 Year-end Report (ND),MA,,0,a08c74d6-edcd-52c6-8611-637c2e671932,01748,01748,Jr. Puppolo
46 Juniper Lane,250.0,12889,Holden,Holden,"Brenner, Karl",Worcester County,12/28/2017,2017-12-28,Commonwealth of Massachusetts,Trooper,,"Puppolo Jr., Angelo J.",Individual,201,2017 Year-end Report (ND),MA,,0,e3fc0c65-902e-529d-ad12-23f9fd9c72f3,01520,01520,Jr. Puppolo
Box 1012,250.0,12889,Hanson,Hanson,"Crowley, Paul",Plymouth County,12/28/2017,2017-12-28,Commonwealth of Massachusetts,Trooper,,"Puppolo Jr., Angelo J.",Individual,201,2017 Year-end Report (ND),MA,,0,b367128d-9ba6-5a2b-9bdc-9a722c4a5c4f,02341,02341,Jr. Puppolo
24 Forest Drive,500.0,12889,Holden,Holden,"Daly, Andrew",Worcester County,12/28/2017,2017-12-28,Commonwealth of Massachusetts,Trooper,,"Puppolo Jr., Angelo J.",Individual,201,2017 Year-end Report (ND),MA,,0,4e6c18e6-eba4-5f26-b430-2c9c4d98458e,01520,01520,Jr. Puppolo
1 Kyles Way,250.0,12889,Lakeville,Lakeville,"Fredette, Kevin",Plymouth County,12/28/2017,2017-12-28,Commonwealth of Massachusetts,Trooper,,"Puppolo Jr., Angelo J.",Individual,201,2017 Year-end Report (ND),MA,,0,24f44091-e3fe-501a-8060-e93b23c91f4e,02347,02347,Jr. Puppolo
4 Braney Road,250.0,12889,Millbury,Millbury,"Gilbert, Jeffrey",Worcester County,12/28/2017,2017-12-28,Commonwealth of Massachusetts,Trooper,,"Puppolo Jr., Angelo J.",Individual,201,2017 Year-end Report (ND),MA,,0,39dcffd5-3b18-5576-82ba-f6f7781c9516,01527,01527,Jr. Puppolo
49 Olde  Forge Road,250.0,12889,Holden,Holden,"Gillespie, Timothy",Worcester County,12/28/2017,2017-12-28,Commonwealth of Massachusetts,Trooper,,"Puppolo Jr., Angelo J.",Individual,201,2017 Year-end Report (ND),MA,,0,066a0351-5594-5219-b332-01d96b248174,01520,01520,Jr. Puppolo
153 Aldrick Street,250.0,12889,Roslindale,Roslindale,"Holland, Scott",Suffolk County,12/28/2017,2017-12-28,Commonwealth of Mass,Trooper,,"Puppolo Jr., Angelo J.",Individual,201,2017 Year-end Report (ND),MA,,0,280ba41c-96d9-53fc-9f17-65559feb4687,02131,02131,Jr. Puppolo
3 Edwards Road,500.0,12889,Braintree,Braintree,"Hunter, Edward",Norfolk County,12/28/2017,2017-12-28,Commonwealth of Mass,Trooper,,"Puppolo Jr., Angelo J.",Individual,201,2017 Year-end Report (ND),MA,,0,3352a6e1-6b2b-52d1-a8ad-7e8be0a76d6d,02184,02184,Jr. Puppolo
6 Weld Street,250.0,12889,Westborough,Westborough,"Lynch, Mark",Worcester County,12/28/2017,2017-12-28,Commonwealth of Massachusetts,Trooper,,"Puppolo Jr., Angelo J.",Individual,201,2017 Year-end Report (ND),MA,,0,b90c8eb3-d9bf-5609-a5ac-32e0521fd40f,01580,01580,Jr. Puppolo
20 Lealand Peck Drive,250.0,12889,Wrentham,Sheldonville,"Powell, Paul",Norfolk County,12/28/2017,2017-12-28,Commonwealth of Massachusetts,Trooper,,"Puppolo Jr., Angelo J.",Individual,201,2017 Year-end Report (ND),MA,,0,f6012403-55cb-5ea3-b420-c64557c1153a,02070,02070,Jr. Puppolo
16 Rosemeont Road,200.0,12889,Worcester,Worcester,"Pullman, Dana",Worcester County,12/28/2017,2017-12-28,Commonwealth of Mass,Trooper,,"Puppolo Jr., Angelo J.",Individual,201,2017 Year-end Report (ND),MA,,0,8b1132af-e3fc-5b9a-b9f5-504900865cd4,01605,01605,Jr. Puppolo
1 Tiffany Avenue,250.0,12889,Worcester,Worcester,"Sullivan, Michael",Worcester County,12/28/2017,2017-12-28,Commonwealth of Massachusetts,Trooper,,"Puppolo Jr., Angelo J.",Individual,201,2017 Year-end Report (ND),MA,,0,48118bde-c683-56ee-a06e-88541f21f760,01604,01604,Jr. Puppolo
242 Main Street,100.0,12889,Brimfield,Brimfield,"Loos, David",Hampden County,9/14/2014,2014-09-14,Mass Environmental Police,Investigator,,"Puppolo Jr., Angelo J.",Individual,201,2014 Pre-election Report (ND),MA,Not Specified,0,e7b90706-706d-5551-83e1-07787b420bf0,01010,01010,Jr. Puppolo
242 Main Street,50.0,12889,Brimfield,Brimfield,"Loos, David",Hampden County,11/1/2014,2014-11-01,Mass Environmental Police,Investigator,,"Puppolo Jr., Angelo J.",Individual,201,2014 Year-end Report (ND),MA,Not Specified,0,419d305e-c87e-5a15-a949-518d35293277,01010,01010,Jr. Puppolo
365 Prospect Street,250.0,12889,Westfield,Westfield,"Larriu, Angel",Hampden County,6/7/2017,2017-06-07,State Police,Commonwealth of Massachusetts,,"Puppolo Jr., Angelo J.",Individual,201,2017 Mid-Year Report (ND),MA,,0,bb65752e-548f-56c5-a0e5-4c102cf1a39a,01085,01085,Jr. Puppolo
365 Prospect Street,200.0,12889,Westfield,Westfield,"Larriu, Angel",Hampden County,10/29/2017,2017-10-29,State Police,Commonwealth of Massachusetts,,"Puppolo Jr., Angelo J.",Individual,201,2017 Year-end Report (ND),MA,,0,0c48361e-4fb7-596d-a81f-0711363551ed,01085,01085,Jr. Puppolo
365 Prospect Street,200.0,12889,Westfield,Westfield,"Larriu, Angel",Hampden County,5/22/2018,2018-05-22,State Police,Commonwealth of Massachusetts,,"Puppolo Jr., Angelo J.",Individual,201,2018 Pre-primary Report (ND),MA,,0,c3b8e69e-9f7d-5be3-acd4-d0018655c1e4,01085,01085,Jr. Puppolo
365 Prospect Street,200.0,12889,Westfield,Westfield,"Larriu, Angel",Hampden County,10/29/2018,2018-10-29,State Police,Commonwealth of Massachusetts,,"Puppolo Jr., Angelo J.",Individual,201,2018 Year-end Report,MA,Not Specified,0,c179b3e5-4a76-5a82-bfda-567b68790143,01085,01085,Jr. Puppolo
365 Prospect Street,200.0,12889,Westfield,Westfield,"Larriu, Angel",Hampden County,3/31/2019,2019-03-31,State Police,Commonwealth of Massachusetts,,"Puppolo Jr., Angelo J.",Individual,201,2019 Mid-Year Report,MA,Not Specified,0,8e5268f2-eb29-59a7-888d-5a0b2c5da872,01085,01085,Jr. Puppolo
365 Prospect Street,200.0,12889,Westfield,Westfield,"Larriu, Angel",Hampden County,10/27/2019,2019-10-27,State Police,Commonwealth of Massachusetts,,"Puppolo, Angelo J.",Individual,201,2019 Year-end Report,MA,Not Specified,0,47f80246-bfa2-564f-9478-73ef91aa7450,01085,01085,Angelo Puppolo
200 Market St Unit 3211,200.0,17043,Lowell,Lowell,"Gaynor, Scott P",Middlesex County,7/17/2018,2018-07-17,Tewksbury Police,Admin Lieutenant,,"Robertson, David A.",Individual,201,2018 Pre-Primary Report,MA,Not Specified,0,fc27de33-f201-5d4a-9714-2060c98886f8,01852,01852,David Robertson
24 Forest Drive,200.0,12242,Holden,Holden,"Daly, Andrew",Worcester County,6/26/2013,2013-06-26,SPAM,State Police Officer ,,"Rogers, John H.",Individual,201,2013 Mid-Year Report (ND),MA,Not Specified,0,8298d8a5-d140-5019-b7c3-acaf8f1dfbbd,01520,01520,John Rogers
24 Forest Drive,200.0,12242,Holden,Holden,"Daly, Andrew",Worcester County,7/23/2014,2014-07-23,SPAM,State Police Officer ,,"Rogers, John H.",Individual,201,2014 Pre-primary Report (ND),MA,Not Specified,0,6ae9471b-a37e-5c62-9f13-6823a80aa826,01520,01520,John Rogers
3 Edwards Rd,200.0,12242,Braintree,Malden,"Hunter, Edward",Middlesex County,7/23/2014,2014-07-23,Commonwealth of Massachusetts ,State Police Officer ,,"Rogers, John H.",Individual,201,2014 Pre-primary Report (ND),MA,Not Specified,0,c76448d5-6eca-5e8a-b81b-04da3769bb02,02148,02148,John Rogers
39 Hawthorne Street,200.0,12242,Westwood,Westwood,"McLaughlin, Paul",Norfolk County,6/19/2019,2019-06-19,Boston Police Department,Policeman,,"Rogers, John H.",Individual,201,2019 Mid-Year Report,MA,Not Specified,0,bfe96e7f-e8c7-5699-b8ab-f8254496b347,02090,02090,John Rogers
16 Rosemont Rd,250.0,12242,Worcester,Worcester,"Pullman, Dana",Worcester County,10/22/2012,2012-10-22,Mass. State Police,State Trooper,,"Rogers, John H.",Individual,201,2012 Year-end Report (ND),MA,Not Specified,0,025daf72-8049-5970-a2a5-0c4b48528173,01605,01605,John Rogers
3 Edwards Road,250.0,12242,Braintree,Braintree,"Hunter, Edward",Norfolk County,10/23/2012,2012-10-23,Mass. State Police,State Trooper,,"Rogers, John H.",Individual,201,2012 Year-end Report (ND),MA,Not Specified,0,9782bc5b-cb18-5e46-b12b-fb9a1b178af2,02184,02184,John Rogers
24 Forest Dr,250.0,12242,Holden,Holden,"Daly, Andrew",Worcester County,10/24/2012,2012-10-24,State Police Association of Massachusetts,State Trooper,,"Rogers, John H.",Individual,201,2012 Year-end Report (ND),MA,Not Specified,0,4b0deb45-6054-5e25-a4ae-61aecb73ff25,01520,01520,John Rogers
91 Downey Street,250.0,12242,Hopkinton,Hopkinton,"Babbin, Timothy",Middlesex County,10/23/2012,2012-10-23,State Police Association of Massachusetts,Vice Presedent,,"Rogers, John H.",Individual,201,2012 Year-end Report (ND),MA,Not Specified,0,2572dd83-b2e7-5c22-91f2-714769ca664a,01748,01748,John Rogers
21 SACKVILLE ST,250.0,15544,CHARLESTOWN,Charlestown,"LEONARD, STANLEY J",Suffolk County,2/26/2014,2014-02-26,CITY OF BOSTON,POLICE DEPARTMENT,,"Ryan, Daniel Joseph",Individual,201,2014 Pre-election Report (Special) (ND),MA,Not Specified,0,ff697fed-06ae-5863-9bfe-18144e676a6a,021291954,02129,Daniel Ryan
5 WALKER ST,100.0,15544,CHARLESTOWN,Charlestown,"CASTRO, JOHN D",Suffolk County,5/6/2014,2014-05-06,MASSPORT,POLICEMAN,,"Ryan, Daniel Joseph",Individual,201,2014 Pre-primary Report (ND),MA,Not Specified,0,3e93e301-5b99-5330-bdd3-d4727a646db3,021293014,02129,Daniel Ryan
21 SACKVILLE ST,250.0,15544,CHARLESTOWN,Charlestown,"LEONARD, STANLEY J",Suffolk County,8/4/2014,2014-08-04,CITY OF BOSTON,POLICE DEPARTMENT,,"Ryan, Daniel Joseph",Individual,201,2014 Pre-primary Report (ND),MA,Not Specified,0,1409ff72-eec2-5651-940b-2093f61a01c0,021291954,02129,Daniel Ryan
480 MEDFORD ST,250.0,15544,CHARLESTOWN,Charlestown,"CHARDAVOYNE, ROBERT F",Suffolk County,8/21/2014,2014-08-21,COB,POLICE OFFICER,,"Ryan, Daniel Joseph",Individual,201,2014 Pre-primary Report (ND),MA,Not Specified,0,e40ae3a2-5bb3-59d4-b3d1-f18efc147dee,02129,02129,Daniel Ryan
98 Sassamon Avenue,200.0,15544,Milton,Milton,"Foley, Kevin P.",Norfolk County,3/25/2015,2015-03-25,Milton Police Dept.,Police Officer,,"Ryan, Daniel Joseph",Individual,201,2015 Mid-Year Report (ND),MA,,0,7137aaec-69a5-5899-919e-9578e4761c7b,02186,02186,Daniel Ryan
21 SACKVILLE ST,100.0,15544,CHARLESTOWN,Charlestown,"LEONARD, STANLEY J",Suffolk County,12/4/2015,2015-12-04,CITY OF BOSTON,POLICE DEPARTMENT,,"Ryan, Daniel Joseph",Individual,201,2015 Year-end Report (ND),MA,,0,2cfc1bce-d774-5ed2-a35f-29513e90d00e,02129,02129,Daniel Ryan
3 KARL RD,200.0,15544,Wakefield,,"LENT, JONATHAN E",,12/14/2015,2015-12-14,Massport,Police Officer,,"Ryan, Daniel Joseph",Individual,201,2015 Year-end Report (ND),MA,,0,495f8f37-57a4-5db5-a209-c01ba7ad7332,,NA,Daniel Ryan
21 SACKVILLE ST,100.0,15544,CHARLESTOWN,Charlestown,"LEONARD, STANLEY J",Suffolk County,1/28/2016,2016-01-28,CITY OF BOSTON,POLICE DEPARTMENT,,"Ryan, Daniel Joseph",Individual,201,2016 Pre-primary Report (ND),MA,,0,a35b518f-20af-5a9d-9218-ac4e1e6448f9,02129,02129,Daniel Ryan
21 SACKVILLE ST,100.0,15544,CHARLESTOWN,Charlestown,"LEONARD, STANLEY J",Suffolk County,7/6/2016,2016-07-06,CITY OF BOSTON,POLICE DEPARTMENT,,"Ryan, Daniel Joseph",Individual,201,2016 Pre-primary Report (ND),MA,,0,249017d7-fb48-5cac-a1b3-62f1db3b3091,02129,02129,Daniel Ryan
21 SACKVILLE ST,100.0,15544,CHARLESTOWN,Charlestown,"LEONARD, STANLEY J",Suffolk County,9/5/2017,2017-09-05,CITY OF BOSTON,Police Officer,,"Ryan, Daniel Joseph",Individual,201,2017 Year-end Report (ND),MA,,0,9d954f81-4e2e-592b-b689-d6312623240f,02129,02129,Daniel Ryan
21 SACKVILLE ST,100.0,15544,CHARLESTOWN,Charlestown,"LEONARD, STANLEY J",Suffolk County,3/28/2018,2018-03-28,CITY OF BOSTON,Police Officer,,"Ryan, Daniel Joseph",Individual,201,2018 Pre-Primary Report,MA,Not Specified,0,393d2c24-74b9-5627-8b45-c0a214e3c2c3,02129,02129,Daniel Ryan
21 SACKVILLE ST,100.0,15544,CHARLESTOWN,,"LEONARD, STANLEY J",,12/6/2018,2018-12-06,CITY OF BOSTON,POLICE DEPARTMENT,,"Ryan, Daniel Joseph",Individual,201,2018 Year-end Report,MA,Not Specified,0,3f6f7ffd-8118-51ed-a35d-27f104492383,,NA,Daniel Ryan
21 SACKVILLE ST,50.0,15544,CHARLESTOWN,Charlestown,"LEONARD, STANLEY J",Suffolk County,7/30/2019,2019-07-30,CITY OF BOSTON,POLICE DEPARTMENT,,"Ryan, Daniel Joseph",Individual,201,2019 Year-end Report,MA,Not Specified,0,e0327fd0-6d10-5b44-a36d-80cdcd5c67d3,02129,02129,Daniel Ryan
21 SACKVILLE ST,100.0,15544,CHARLESTOWN,Charlestown,"LEONARD, STANLEY J",Suffolk County,10/8/2019,2019-10-08,CITY OF BOSTON,POLICE DEPARTMENT,,"Ryan, Daniel Joseph",Individual,201,2019 Year-end Report,MA,Not Specified,0,fc3f9549-17af-5598-bc01-b8a1dfae7dbc,02129,02129,Daniel Ryan
719 Summer Street,100.0,15544,Lynnfield,Lynnfield,"Ezekiel, John",Essex County,10/22/2019,2019-10-22,Boston Police Department,Police Officer,,"Ryan, Daniel Joseph",Individual,201,2019 Year-end Report,MA,Not Specified,0,92e0540a-9b27-516d-940d-ffd3e07c0222,01940,01940,Daniel Ryan
98 Sassamon Avenue,125.0,15544,Milton,Milton,"Foley, Kevin P.",Norfolk County,12/16/2019,2019-12-16,Milton Police Dept.,Police Officer,,"Ryan, Daniel Joseph",Individual,201,2019 Year-end Report,MA,Not Specified,0,e2380666-f032-5963-ac55-d4c030c721f7,02186,02186,Daniel Ryan
P.O. Bo 155,250.0,15544,North Quincy,Quincy,"Bellotti, Michael",Norfolk County,4/6/2018,2018-04-06,Norfolk County,Sheriff,,"Ryan, Daniel Joseph",Individual,201,2018 Pre-Primary Report,MA,Not Specified,0,881987a3-b6d7-5199-8297-fb4049fc0935,02171,02171,Daniel Ryan
17 Trenton Street,100.0,15544,Charlestown,Charlestown,"Callahan, Edward P.",Suffolk County,12/14/2015,2015-12-14,Boston Police Department,Deputy Director Administration & Technology,,"Ryan, Daniel Joseph",Individual,201,2015 Year-end Report (ND),MA,,0,95848445-f117-5f21-9b9b-d747c54f7a8d,02129,02129,Daniel Ryan
"17 TRENTON ST, 2",100.0,15544,CHARLESTOWN,Charlestown,"CALLAHAN, EDWARD PATRICK",Suffolk County,6/29/2016,2016-06-29,Boston Police Department,Retired,,"Ryan, Daniel Joseph",Individual,201,2016 Pre-primary Report (ND),MA,,0,36c54917-e89f-53f3-9e06-9f871df4b817,02129,02129,Daniel Ryan
17 Trenton Street,100.0,15544,Charlestown,Charlestown,"Callahan, Edward P.",Suffolk County,12/15/2017,2017-12-15,Boston Police Department,Retired,,"Ryan, Daniel Joseph",Individual,201,2017 Year-end Report (ND),MA,,0,46bc8d9f-6e80-598c-9901-3f16b2f4007d,02129,02129,Daniel Ryan
17 Trenton Street,100.0,15544,Charlestown,Charlestown,"Callahan, Edward P.",Suffolk County,7/10/2018,2018-07-10,Boston Police Department,Retired,,"Ryan, Daniel Joseph",Individual,201,2018 Pre-Primary Report,MA,Not Specified,0,fc6c9d79-77df-537e-a384-b4a29789df46,02129,02129,Daniel Ryan
4 THETFORD AVE,50.0,15544,BRAINTREE,Braintree,"PIERCE, JOHN J",Norfolk County,10/11/2019,2019-10-11,Boston Police Department,Retired,,"Ryan, Daniel Joseph",Individual,201,2019 Year-end Report,MA,Not Specified,0,75421fc2-f087-586b-b99d-36bb93e123ee,02184,02184,Daniel Ryan
30 Weymouth Avenue,100.0,16919,Boston,West Roxbury,"Pagan, Javier",Suffolk County,4/2/2018,2018-04-02,Not Employed,Police Officer City of Boston,,"Santiago, Jon",Individual,201,2018 Pre-Primary Report,MA,Not Specified,0,c1084f77-94d7-557a-b914-86e498301f3d,02132,02132,Jon Santiago
16 Perrin St,100.0,16919,Boston,Roxbury,"williams, frank",Suffolk County,7/11/2018,2018-07-11,City of Boston,Police Officer,,"Santiago, Jon",Individual,201,2018 Pre-Primary Report,MA,Not Specified,0,cc7ea0e4-bd98-5333-9f5e-ac27fff47892,02119,02119,Jon Santiago
30 Weymouth Avenue,100.0,16919,Boston,West Roxbury,"Pagan, Javier",Suffolk County,11/20/2019,2019-11-20,City of Boston,Police Officer,,"Santiago, Jon",Individual,201,2019 Year-end Report,MA,Not Specified,0,2511874a-0bd4-5b1d-bce8-01a36634f75a,02132,02132,Jon Santiago
166 Mansur Street,250.0,17426,Lowell,Lowell,"Golner, Barry",Middlesex County,1/9/2020,2020-01-09,City of Lowell,Police Officer,,"Santos, Ann",Individual,201,1/9/20 Deposit Report,MA,Check,1,3faa960d-ef30-59de-9246-3e7ca1da1279,01850,01850,Ann Santos
28 Rindo Park Drive,100.0,17426,Lowell,Lowell,"Moriarty, Dennis",Middlesex County,1/9/2020,2020-01-09,City of Lowell,Police Officer,,"Santos, Ann",Individual,201,1/9/20 Deposit Report,MA,Check,1,46ff49e3-9aff-53b6-ab92-266a9a89be13,01850,01850,Ann Santos
64 Oliver Drive,250.0,17426,Dracut,Dracut,"Nobrega Jr., Frank",Middlesex County,1/29/2020,2020-01-29,City of Lowell,Police Officer,,"Santos, Ann",Individual,201,1/29/20 Deposit Report,MA,Check,1,d69bbe6d-e799-55b0-a235-f87e08be96ce,01826,01826,Ann Santos
1038 Ocean Blvd,250.0,17426,Hampton,,"Smith, Christopher",,1/29/2020,2020-01-29,City of Lowell,Police Officer,,"Santos, Ann",Individual,201,1/29/20 Deposit Report,NH,Check,1,7eb72ba1-1d4b-5769-ba27-4f3be1b0f787,03842,NA,Ann Santos
10 Clifford Street,100.0,10389,Readville,Hyde Park,"Knecht, William",Suffolk County,3/15/2014,2014-03-15,,Police Officer,,"Scaccia, Angelo M.",Individual,201,2014 Pre-primary Report (ND),MA,Not Specified,0,a9795845-0fea-50da-9f36-71a463989f83,02136,02136,Angelo Scaccia
5 Summer St.,200.0,15093,Mattapoisett,Mattapoisett,"Machado, James M.",Plymouth County,7/29/2016,2016-07-29,Massachusetts Police Association,Executive Director,,"Schmid III, Paul A.",Individual,201,2016 Pre-primary Report (ND),MA,,0,9d0eb534-f397-55f5-9014-24b13a9f4695,02739,02739,III Schmid
290 Bartemus Trail,100.0,17472,Nashua,,"Reeby, Dawn",,5/20/2020,2020-05-20,Self,Law Enforcement Strategist,,"Sharp, Catia",Individual,201,5/20/20 Deposit Report,NH,Credit Card,3,20120a1c-78c1-5a8e-8e21-b5ad9c6a4d08,03063,NA,Catia Sharp
50 Grattan St.,100.0,15060,Fall River,Fall River,"Fogarty, Michael",Bristol County,11/1/2013,2013-11-01,FR Police Department,police officer,,"Silvia, Alan",Individual,201,2013 Year-end Report (ND),MA,Not Specified,0,5a57ae5d-46d4-5993-94b9-7a039b91d870,02721,02721,Alan Silvia
50 Grattan St.,50.0,15060,Fall River,Fall River,"Fogarty, Michael",Bristol County,7/29/2014,2014-07-29,FR Police Department,police officer,,"Silvia, Alan",Individual,201,2014 Pre-primary Report (ND),MA,Not Specified,0,4f65df1d-eb4c-56b9-9edd-fa77e700a034,02721,02721,Alan Silvia
50 Grattan St.,25.0,15060,Fall River,Fall River,"Fogarty, Michael",Bristol County,8/22/2015,2015-08-22,FR Police Department,police officer,,"Silvia, Alan",Individual,201,2015 Year-end Report (ND),MA,,0,7f2305a1-ad85-5905-ad3c-c7bf272a2f8b,02721,02721,Alan Silvia
61 Forge Road,60.0,15060,Assonet,Assonet,"Correiro, William",Bristol County,10/16/2017,2017-10-16,Retired,Retired Police Officer,,"Silvia, Alan",Individual,201,2017 Year-end Report (ND),MA,,0,12a5e7ad-81ad-551c-a294-0ea42fc36656,02702,02702,Alan Silvia
61 Forge Road,100.0,15060,Assonet,Assonet,"Correiro, William",Bristol County,10/31/2017,2017-10-31,Retired,Retired Police Officer,,"Silvia, Alan",Individual,201,2017 Year-end Report (ND),MA,,0,752fc115-3413-55ed-a0c6-0300ec23d1e9,02702,02702,Alan Silvia
5 Summer Street,200.0,15060,Mattapoisett,Mattapoisett,"Machado, James",Plymouth County,11/22/2017,2017-11-22,City of Fall River,Police Officer,,"Silvia, Alan",Individual,201,2017 Year-end Report (ND),MA,,0,76d175f0-4ec1-5eeb-a7f0-838c0a937cec,02739,02739,Alan Silvia
61 Forge Road,70.0,15060,Assonet,Assonet,"Correiro, William",Bristol County,2/15/2018,2018-02-15,Retired,Retired Police Officer,,"Silvia, Alan",Individual,201,2018 Pre-primary Report (ND),MA,,0,6c1b5003-87ad-53c9-a9ce-4983bc4bd8ca,02702,02702,Alan Silvia
61 Forge Road,60.0,15060,Assonet,Assonet,"Correiro, William",Bristol County,8/28/2018,2018-08-28,Retired,Retired Police Officer,,"Silvia, Alan",Individual,201,2018 Pre-Election Report,MA,Not Specified,0,26f20cc7-1c10-5cef-8e9a-0bae6bfe40ff,02702,02702,Alan Silvia
1865 Locust Street,100.0,15060,Fall River,Fall River,"Machado, David",Bristol County,5/13/2016,2016-05-13,Retired From Police Dept.,Retired,,"Silvia, Alan",Individual,201,2016 Pre-primary Report (ND),MA,,0,dd7bef53-46ed-57ad-8993-ffb71682e87b,02723,02723,Alan Silvia
Po Box 242,200.0,14168,Brimfield,Brimfield,"Loos, David",Hampden County,8/27/2015,2015-08-27,Commonwealth of Massachusetts,Environmental Police Officer,,"Smola, Todd M.",Individual,201,2015 Year-end Report (ND),MA,,0,1ae45826-1f08-59dd-9ed3-8de27f37db31,01010,01010,Todd Smola
Po Box 242,200.0,14168,Brimfield,Brimfield,"Loos, David",Hampden County,9/17/2016,2016-09-17,Commonwealth of Massachusetts,Environmental Police Officer,,"Smola, Todd M.",Individual,201,2016 Pre-election Report (ND),MA,,0,99e90356-6472-581a-8594-85dfa9080fe7,01010,01010,Todd Smola
16 Rosemont Road,200.0,10403,Worcester,Worcester,"Pullman, Trooper Dana A.",Worcester County,9/3/2014,2014-09-03,Commonwealth of Ma,State Trooper,,"Speliotis, Theodore C.",Individual,201,2014 Pre-election Report (ND),MA,Not Specified,0,30f6f34e-9865-5773-a7cc-36f759691001,01605,01605,Theodore Speliotis
16 Rosemont Road,200.0,10403,Worcester,Worcester,"Pullman, Trooper Dana A.",Worcester County,4/25/2018,2018-04-25,Commonwealth of Ma,State Trooper,,"Speliotis, Theodore C.",Individual,201,2018 Pre-primary Report (ND),MA,,0,0168f029-2bfe-54dc-9803-209e5f6b1427,01605,01605,Theodore Speliotis
24 Forest Drive,300.0,10403,Holden,Holden,"Daly, Andrew",Worcester County,4/25/2018,2018-04-25,State Police Association of Ma,Sergeant,,"Speliotis, Theodore C.",Individual,201,2018 Pre-primary Report (ND),MA,,0,5dbe00bc-c31f-5bc6-89f1-1b088a9c666f,01520,01520,Theodore Speliotis
9 Brightwood Road,100.0,13645,Waltham,Waltham,"Maher, Timothy",Middlesex County,2/22/2010,2010-02-22,City of Waltham,Police Officer,,"Stanley, Thomas M.",Individual,201,2010 Pre-primary Report (ND),MA,Not Specified,0,a8fbd331-e5a9-5ee1-a7d1-25fc2062634e,02453,02453,Thomas Stanley
9 Brightwood Road,100.0,13645,Waltham,Waltham,"Maher, Timothy",Middlesex County,5/25/2010,2010-05-25,City of Waltham,Police Officer,,"Stanley, Thomas M.",Individual,201,2010 Pre-primary Report (ND),MA,Not Specified,0,92e742f2-8a8b-520b-a49a-bc8c1af84d7f,02453,02453,Thomas Stanley
9 Brightwood Road,100.0,13645,Waltham,Waltham,"Maher, Timothy",Middlesex County,10/12/2010,2010-10-12,City of Waltham,Police Officer,,"Stanley, Thomas M.",Individual,201,2010 Pre-election Report (ND),MA,Not Specified,0,3afb3f22-e1d5-5ab5-b2aa-61a1c35a30a0,02453,02453,Thomas Stanley
9 Brightwood Road,100.0,13645,Waltham,Waltham,"Maher, Timothy",Middlesex County,9/30/2011,2011-09-30,City of Waltham,Police Officer,,"Stanley, Thomas M.",Individual,201,2011 Year-end Report (ND),MA,Not Specified,0,a54672af-902a-50c8-a28a-1d5e4b554ec0,02453,02453,Thomas Stanley
9 Brightwood Road,50.0,13645,Waltham,Waltham,"Maher, Timothy",Middlesex County,10/17/2011,2011-10-17,City of Waltham,Police Officer,,"Stanley, Thomas M.",Individual,201,2011 Year-end Report (ND),MA,Not Specified,0,0ecf62d5-2b88-566b-9f9d-d0a62e74cc83,02453,02453,Thomas Stanley
65 Gilbert St,25.0,13645,Waltham,Waltham,"Orta, Jorge",Middlesex County,9/23/2014,2014-09-23,City of Waltham,Police Officer,,"Stanley, Thomas M.",Individual,201,2014 Pre-election Report (ND),MA,Not Specified,0,ada36610-1b91-5f9f-b8f3-e4275c40ca39,02453,02453,Thomas Stanley
65 Gilbert St,100.0,13645,Waltham,Waltham,"Orta, Jorge",Middlesex County,12/12/2014,2014-12-12,City of Waltham,Police Officer,,"Stanley, Thomas M.",Individual,201,2014 Year-end Report (ND),MA,Not Specified,0,b2475915-9555-586a-bc6e-19dbe951a265,02453,02453,Thomas Stanley
66 Mayall Road,50.0,13645,Waltham,Waltham,"Guigno Jr., Joseph",Middlesex County,12/17/2014,2014-12-17,City of Waltham,Police Detective Sgt,,"Stanley, Thomas M.",Individual,201,2014 Year-end Report (ND),MA,Not Specified,0,33aadb66-6186-551a-a7b6-f7093c23793f,02453,02453,Thomas Stanley
18 Brookview Rd,50.0,13645,Millis,Millis,"O'Dowd, Philip",Norfolk County,4/3/2015,2015-04-03,City of Waltham,Police Officer,,"Stanley, Thomas M.",Individual,201,2015 Pre-election Report (MUN),MA,Other,5,79ee2dc3-a1d4-5766-8152-e3dd6edf0732,02054,02054,Thomas Stanley
51 Stone Rd,25.0,13645,Waltham,Waltham,"Bryant, Thomas",Middlesex County,10/22/2015,2015-10-22,City of Waltham,Police Officer,,"Stanley, Thomas M.",Individual,201,2015 Year-end report (MUN),MA,,0,edefbfe3-6a7a-5563-86b5-4c9d86533822,02453,02453,Thomas Stanley
9 Brightwood Road,50.0,13645,Waltham,Waltham,"Maher, Timothy",Middlesex County,11/3/2015,2015-11-03,City of Waltham,Police Officer,,"Stanley, Thomas M.",Individual,201,2015 Year-end report (MUN),MA,,0,878b30cc-ec81-5a76-9fe9-f00bc06d5565,02453,02453,Thomas Stanley
65 Gilbert St,50.0,13645,Waltham,Waltham,"Orta, Jorge",Middlesex County,11/3/2016,2016-11-03,City of Waltham,Police Officer,,"Stanley, Thomas M.",Individual,201,2016 Year-end Report (ND),MA,,0,54f97636-b9a2-5e89-95a5-bcace21dae66,02453,02453,Thomas Stanley
65 Gilbert St,25.0,13645,Waltham,,"Orta, Jorge",,3/13/2017,2017-03-13,City of Waltham,Police Officer,,"Stanley, Thomas M.",Individual,201,2017 Mid-Year Report (ND),MA,,0,5ffabd4a-ea87-5132-a9f4-773103dda0ae,,NA,Thomas Stanley
65 Gilbert St,50.0,13645,Waltham,Waltham,"Orta, Jorge",Middlesex County,11/13/2017,2017-11-13,City of Waltham,Police Officer,,"Stanley, Thomas M.",Individual,201,2017 Year-end Report (ND),MA,,0,16a9d855-9c2a-56ce-9d94-28dd3ec7fa99,02453,02453,Thomas Stanley
65 Gilbert St,25.0,13645,Waltham,Waltham,"Orta, Jorge",Middlesex County,3/20/2018,2018-03-20,City of Waltham,Police Officer,,"Stanley, Thomas M.",Individual,201,2018 Pre-primary Report (ND),MA,,0,879868a8-3706-5fbb-8357-d6ae5e5b9b6f,02453,02453,Thomas Stanley
65 Gilbert St,25.0,13645,Waltham,Waltham,"Orta, Jorge",Middlesex County,9/27/2018,2018-09-27,City of Waltham,Police Officer,,"Stanley, Thomas M.",Individual,201,2018 Pre-election Report (ND),MA,Not Specified,0,c757c087-5397-5102-b4de-b49f700dce75,02453,02453,Thomas Stanley
11 Crestview Rd,100.0,13645,Waltham,Waltham,"Tracey, Paul J.",Middlesex County,3/18/2015,2015-03-18,City of Waltham,Law Enforcement,,"Stanley, Thomas M.",Individual,201,2015 Pre-election Report (MUN),MA,Other,5,fd5a3d48-2a5a-56e5-b85d-5b94a67fea7b,02451,02451,Thomas Stanley
24 Washburn Ave #1,50.0,13645,Cambridge,Cambridge,"Delaney, Daniel",Middlesex County,3/26/2015,2015-03-26,Delaney Police Group,Legislative Agent,,"Stanley, Thomas M.",Individual,201,2015 Pre-election Report (MUN),MA,Other,5,1d0f21b9-5e19-5ee5-b530-5b6a2d569bee,02140,02140,Thomas Stanley
24 Washburn Ave #1,100.0,13645,Cambridge,Cambridge,"Delaney, Daniel",Middlesex County,5/29/2020,2020-05-29,Delaney Police Group,Legislative Agent,,"Stanley, Thomas M.",Individual,201,5/29/20 Deposit Report,MA,Credit Card,3,b4e1d1ec-68b5-53f6-a994-5a1b3e5bad16,02140,02140,Thomas Stanley
30 Aldie Street,125.0,13645,Allston,Allston,"Snedeker, Catherine",Suffolk County,5/29/2020,2020-05-29,Boston Police Department,Principle Analyst,,"Stanley, Thomas M.",Individual,201,5/29/20 Deposit Report,MA,Credit Card,3,5cf53312-f0c8-524a-93ee-4ac288bb88b7,02134,02134,Thomas Stanley
5 Summer St.,200.0,11466,Mattapoisett,Mattapoisett,"Machado, James M.",Plymouth County,9/21/2010,2010-09-21,City of Fall River,Police Officer,,"Straus, William M.",Individual,201,2010 Pre-election Report (ND),MA,Not Specified,0,b74849bb-2b73-56f0-9485-baaa5432c796,02739,02739,William Straus
5 Summer St.,200.0,11466,Mattapoisett,Mattapoisett,"Machado, James M.",Plymouth County,3/24/2011,2011-03-24,City of Fall River,Police Officer,,"Straus, William M.",Individual,201,2011 Mid-Year Report (ND),MA,Not Specified,0,fca9261f-b92b-53ba-8f49-4598ae2b75c8,02739,02739,William Straus
5 Summer St.,200.0,11466,Mattapoisett,Mattapoisett,"Machado, James M.",Plymouth County,10/2/2013,2013-10-02,Mass Police Association,Legislative Agent,,"Straus, William M.",Individual,201,2013 Year-end Report (ND),MA,Not Specified,0,495c78b6-a9cd-5522-8aab-32099ee9c664,02739,02739,William Straus
5 Summer St.,200.0,11466,Mattapoisett,Mattapoisett,"Machado, James M.",Plymouth County,10/27/2014,2014-10-27,Mass Police Association,Legislative Agent,,"Straus, William M.",Individual,201,2014 Year-end Report (ND),MA,Not Specified,0,27fc6cf4-2a5a-554a-afe6-fa7aa71aa497,02739,02739,William Straus
5 Summer St.,200.0,11466,Mattapoisett,Mattapoisett,"Machado, James M.",Plymouth County,10/20/2015,2015-10-20,Mass Police Association,Legislative Agent,,"Straus, William M.",Individual,201,2015 Year-end Report (ND),MA,,0,c0ec9b0e-5586-5dc7-a0d9-940a21921839,02739,02739,William Straus
30 Saint James Ave,100.0,16980,East Bridgewater,East Bridgewater,"Almeida, George",Plymouth County,12/16/2019,2019-12-16,City of Brockton,Police Officer,,"Sullivan, Alyson M.",Individual,201,2019 Year-end Report,MA,Not Specified,0,7c711d32-2986-50a1-ab82-4bf70a2ae7a5,02333,02333,Alyson Sullivan
29 Malinda Dr,100.0,16980,Abington,Abington,"Sullivan, Robert",Plymouth County,12/16/2019,2019-12-16,Town of Weymouth,police officer,,"Sullivan, Alyson M.",Individual,201,2019 Year-end Report,MA,Not Specified,0,b880d6fe-3343-5de5-a983-20161cce7548,02351,02351,Alyson Sullivan
2018 Washington St,1000.0,16980,Canton,Canton,"Pudolsky, Gerald C",Norfolk County,6/27/2018,2018-06-27,Plymouth County Sheriff's Department,Special Sheriff,,"Sullivan, Alyson M.",Individual,201,2018 Pre-Primary Report,MA,Not Specified,0,c31645de-2f06-58a6-a77f-b8d2017071be,02021,02021,Alyson Sullivan
2018 Washington St,1000.0,16980,Canton,Canton,"Pudolsky, Gerald C",Norfolk County,3/21/2019,2019-03-21,Plymouth County Sheriff's Department,Special Sheriff,,"Sullivan, Alyson M.",Individual,201,2019 Mid-Year Report,MA,Not Specified,0,8572df90-5abb-51d5-b8a3-a0b45fc4ccb5,02021,02021,Alyson Sullivan
67 americo strett,250.0,13785,Ludlow,Ludlow,"tardiff, robert",Hampden County,7/21/2010,2010-07-21,springfile police dept,police officer,,"Tosado, Jose F.",Individual,201,7/21/10 Deposit Report,MA,Check,1,547c2d37-7d66-52c3-9a83-5612086666d3,01056,01056,Jose Tosado
12 Amy Drive,500.0,13785,Westfield,Westfield,"Howard, Charles ",Hampden County,3/28/2011,2011-03-28,Springfield Police Dept,Police Officer,,"Tosado, Jose F.",Individual,201,3/28/11 Deposit Report,MA,Check,1,8f4d48ba-aa01-5ef3-8e36-386939b7dd38,01085,01085,Jose Tosado
194 Waverly Street,100.0,15307,Boston,Roxbury," Sullivan, Richard",Suffolk County,7/29/2016,2016-07-29,MBTA,police,,"Tuitt, Marydith E.",Individual,201,2016 Pre-primary Report (ND),MA,,0,ab99a721-c668-55f1-9446-dd4c1a2b5dd0,02119,02119,Marydith Tuitt
362 spring street,100.0,15307,Rockland,Rockland,"ellison, larry",Plymouth County,7/15/2013,2013-07-15,city,law enforcement,,"Tuitt, Mary-dith E. ",Individual,201,2013 Pre-primary Report (Special) (ND),MA,Not Specified,0,51d43344-2a4c-59c4-b10f-d03598768164,02370,02370,Mary-dith Tuitt
715 Tremont St #501,40.0,16408,Boston,Boston,"Williams, Nicey",Suffolk County,4/21/2016,2016-04-21,Boston Police Department,Police Clerk,,"Tyler, Chynah",Individual,201,2016 Pre-primary Report (ND),MA,,0,dd85dcd3-800f-5142-b00b-3a50a770c274,02118,02118,Chynah Tyler
41 Temple St,50.0,16408,Mattapan,Mattapan,"Robinson, Sky",Suffolk County,6/13/2016,2016-06-13,City of Boston,Police Officer,,"Tyler, Chynah",Individual,201,2016 Pre-primary Report (ND),MA,,0,96a4389a-4a3d-59a1-880d-f9a167fe8267,02126,02126,Chynah Tyler
58 Hamlet St,100.0,16408,Newton,Newton Center,"Sumpter, Lynnette",Middlesex County,4/21/2016,2016-04-21,Boston Police Department,Retired,,"Tyler, Chynah",Individual,201,2016 Pre-primary Report (ND),MA,,0,fb389d9b-a3e2-58dd-a6b8-90dbbcfa62de,02459,02459,Chynah Tyler
58 Hamlet Street,40.0,16408,Newton,Newton Center,"Tyler, Lynette",Middlesex County,3/13/2017,2017-03-13,Boston Police Department,Retired,,"Tyler, Chynah",Individual,201,2017 Mid-Year Report (ND),MA,,0,15427d3c-427e-52ee-9984-c2ce29519994,02459,02459,Chynah Tyler
58 Hamlet St,50.0,16408,Newton,Newton Center,"Sumpter, Lynnette",Middlesex County,4/3/2019,2019-04-03,Boston Police Department,Retired,,"Tyler, Chynah",Individual,201,2019 Mid-Year Report,MA,Not Specified,0,792015e4-5513-50a2-baeb-b7794ca8074b,02459,02459,Chynah Tyler
35 Rexhame Street,100.0,16856,Roslindale,Roslindale,"Besold, Pam",Suffolk County,8/26/2018,2018-08-26,Boston Police Department,Sargeant,,"Van Ness, Gretchen",Individual,201,2018 Pre-election Report (ND),MA,,0,afd785cb-7382-53db-8d87-922e8ca1bf74,02131,02131,Ness Van
9 Hunter Slope,100.0,15533,Westfield,Westfield,"Sustache, Edwin",Hampden County,10/25/2012,2012-10-25,Holyoke Police Department,Police Office,,"Vega, Aaron",Individual,201,2012 Year-end Report (ND),MA,Not Specified,0,8b2bc2d7-c66d-5907-835a-84633fab014c,01085,01085,Aaron Vega
9 Wycoff Ave,50.0,15533,Holyoke,Holyoke,"Leahy, Patrick",Hampden County,4/28/2014,2014-04-28,City of Holyoke,Police Officer,,"Vega, Aaron",Individual,201,2014 Pre-primary Report (ND),MA,Not Specified,0,b8f46cce-5d3d-5127-bf1e-1aec3453fd0e,01040,01040,Aaron Vega
9 Wycoff Ave,50.0,15533,Holyoke,Holyoke,"Leahy, Patrick",Hampden County,6/20/2014,2014-06-20,City of Holyoke,Police Officer,,"Vega, Aaron",Individual,201,2014 Pre-primary Report (ND),MA,Not Specified,0,fb93a215-b932-5f9e-8e46-0823f4f9be69,01040,01040,Aaron Vega
40 Madison Ave,85.0,15533,Holyoke,Holyoke,"Moriarty, Matthew F",Hampden County,6/20/2014,2014-06-20,City of Holyoke,Police Officer,,"Vega, Aaron",Individual,201,2014 Pre-primary Report (ND),MA,Not Specified,0,5b5795bd-d68a-5201-bdae-acf5cc81c5c6,01040,01040,Aaron Vega
9 Wycoff Ave,200.0,15533,Holyoke,Holyoke,"Leahy, Patrick",Hampden County,4/21/2016,2016-04-21,City of Holyoke,Police Officer,,"Vega, Aaron",Individual,201,2016 Pre-primary Report (ND),MA,,0,52b82a60-7aae-5ea9-bbb8-2b0d5df67838,01040,01040,Aaron Vega
9 Wycoff Ave,100.0,15533,Holyoke,Holyoke,"Leahy, Patrick",Hampden County,2/26/2018,2018-02-26,City of Holyoke,Police Officer,,"Vega, Aaron",Individual,201,2018 Pre-Primary Report,MA,Not Specified,0,8398a15f-418f-54de-a3f2-463e05d30669,01040,01040,Aaron Vega
40 Madison Ave,100.0,15533,Holyoke,Holyoke,"Moriarty, Mike",Hampden County,2/26/2018,2018-02-26,City of Holyoke,Police Officer,,"Vega, Aaron",Individual,201,2018 Pre-Primary Report,MA,Not Specified,0,2a977621-dc1b-51d7-bc5e-1b68756029e5,01040,01040,Aaron Vega
40 Madison Ave,50.0,15533,Holyoke,Holyoke,"Moriarty, Matthew F",Hampden County,3/7/2019,2019-03-07,City of Holyoke,Police Officer,,"Vega, Aaron",Individual,201,2019 Mid-Year Report,MA,Not Specified,0,bf2d2baf-547c-5389-b124-c57fb7ef818d,01040,01040,Aaron Vega
20 Hudson Street,250.0,15025,Falmouth,Falmouth,"Cummings, James",Barnstable County,9/14/2010,2010-09-14,Barnstable county,sheriff,,"Vieira, David T.",Individual,201,2010 Pre-election Report (ND),MA,Not Specified,0,3859f358-8a17-5fba-8df2-df9ff07fcc71,02540,02540,David Vieira
20 Hudson Street,250.0,15025,Falmouth,Falmouth,"Cummings, James",Barnstable County,12/30/2011,2011-12-30,Barnstable county,sheriff,,"Vieira, David T.",Individual,201,2011 Year-end Report (ND),MA,Not Specified,0,a5da499a-d372-552d-b574-4263fd5eed17,02540,02540,David Vieira
20 Hudson Street,100.0,15025,Falmouth,Falmouth,"Cummings, James",Barnstable County,9/14/2016,2016-09-14,Barnstable county,sheriff,,"Vieira, David T.",Individual,201,2016 Pre-election Report (ND),MA,,0,ccd99d3a-dc23-521b-a5ce-8b3809399290,02540,02540,David Vieira
20 Hudson Street,100.0,15025,Falmouth,Falmouth,"Cummings, James",Barnstable County,10/31/2016,2016-10-31,Barnstable county,sheriff,,"Vieira, David T.",Individual,201,2016 Year-end Report (ND),MA,,0,9dec586f-0a16-5bf6-865b-ee25d01ad861,02540,02540,David Vieira
20 Hudson Street,100.0,15025,Falmouth,Falmouth,"Cummings, James",Barnstable County,12/20/2017,2017-12-20,Barnstable County,Sheriff,,"Vieira, David T.",Individual,201,2017 Year-end Report (ND),MA,,0,142a65a4-fcd5-5b47-903f-479ecdf80d66,02540,02540,David Vieira
40 Cumloden,200.0,15025,Falmouth,Falmouth,"Smith, Richard",Barnstable County,9/16/2016,2016-09-16,Police,Retired,,"Vieira, David T.",Individual,201,2016 Pre-election Report (ND),MA,,0,b004949a-aee5-535a-a423-f1857b14ec99,02540,02540,David Vieira
23 Hemingway Road,200.0,12103,Wilbraham,Wilbraham,"Jebb, William",Hampden County,3/15/2018,2018-03-15,City of Chicopee,Chief of Police,,"Wagner, Joseph F.",Individual,201,2018 Pre-Primary Report,MA,Not Specified,0,e726fd13-4533-5253-ad77-9dbbf270f69e,01095,01095,Joseph Wagner
23 Hemingway Road,250.0,12103,Wilbraham,Wilbraham,"Jebb, William",Hampden County,10/22/2019,2019-10-22,City of Chicopee,Chief of Police,,"Wagner, Joseph F.",Individual,201,2019 Year-end Report,MA,Not Specified,0,baa9639d-913d-5f33-990c-49b3dc44b4b9,01095,01095,Joseph Wagner
48 Jackie Drive,100.0,12103,Ludlow,Ludlow,"Cocchi, Nicholas",Hampden County,4/11/2017,2017-04-11,Hampden County Correctional Facility,Sheriff,,"Wagner, Joseph F.",Individual,201,2017 Mid-Year Report (ND),MA,,0,f71d5323-31aa-5903-9000-3dc488e587e6,01056,01056,Joseph Wagner
48 Jackie Drive,125.0,12103,Ludlow,Ludlow,"Cocchi, Nicholas",Hampden County,6/20/2017,2017-06-20,Hampden County Correctional Facility,Sheriff,,"Wagner, Joseph F.",Individual,201,2017 Mid-Year Report (ND),MA,,0,8945352e-dd0a-5331-9ef6-262dbf3678f8,01056,01056,Joseph Wagner
48 Jackie Drive,100.0,12103,Ludlow,Ludlow,"Cocchi, Nicholas",Hampden County,5/20/2018,2018-05-20,Hampden County Correctional Facility,Sheriff,,"Wagner, Joseph F.",Individual,201,2018 Pre-Primary Report,MA,Not Specified,0,5d194c70-1467-55ed-9b73-12990862d95e,01056,01056,Joseph Wagner
24 Forest Drive,250.0,12103,Holden,Holden,"Daly, Andrew",Worcester County,6/4/2013,2013-06-04,State Police Association,Letter Sent,,"Wagner, Joseph F.",Individual,201,2013 Mid-Year Report (ND),MA,Not Specified,0,f6e4b392-d504-5b76-abde-701cc5fa0374,01520,01520,Joseph Wagner
24 Forest Drive,200.0,15729,Holden,Holden,"Daly, Andrew",Worcester County,12/11/2013,2013-12-11,Commonwealth of Mass,State Police,,"Whelan, Timothy R.",Individual,201,2013 Year-end Report (ND),MA,Not Specified,0,2ec3937f-80f6-544b-979c-850f5426ea2f,01520,01520,Timothy Whelan
3 Edwards Road,200.0,15729,Braintree,Braintree,"Hunter, Edward",Norfolk County,12/11/2013,2013-12-11,Commonwealth of Mass,State Police,,"Whelan, Timothy R.",Individual,201,2013 Year-end Report (ND),MA,Not Specified,0,faf657c0-5229-5a89-b33b-48e81ecf2201,02184,02184,Timothy Whelan
16 Rosemont Road,200.0,15729,Worcester,Worcester,"Pullman, Dana",Worcester County,12/11/2013,2013-12-11,Commonwealth of Mass,State Police,,"Whelan, Timothy R.",Individual,201,2013 Year-end Report (ND),MA,Not Specified,0,4b0b68e1-46c8-5e22-88ec-5a0f9e23b3bb,01605,01605,Timothy Whelan
12 Lakeshore Dr.,250.0,15729,Fiskdale,Fiskdale,"Thorpe, Michael",Worcester County,3/16/2014,2014-03-16,Commonwealth of Mass,State Police,,"Whelan, Timothy R.",Individual,201,2014 Pre-primary Report (ND),MA,Not Specified,0,c7ec5202-8189-5f21-93e6-f1bb0a4da633,01518,01518,Timothy Whelan
P.O. Box 1072,500.0,15729,Marstons Mills,Marstons Mills,"Heywood, Daralyn",Barnstable County,5/12/2014,2014-05-12,Commonwealth of Mass,State Police,,"Whelan, Timothy R.",Individual,201,2014 Pre-primary Report (ND),MA,Not Specified,0,902a61a3-7075-52b1-a59f-601bed05b011,02648,02648,Timothy Whelan
3 Edwards Road,100.0,15729,Braintree,Braintree,"Hunter, Edward",Norfolk County,5/15/2014,2014-05-15,Commonwealth of Mass,State Police,,"Whelan, Timothy R.",Individual,201,2014 Pre-primary Report (ND),MA,Not Specified,0,6e17afe1-14e3-5d0a-bbff-e240ca9a36a5,02184,02184,Timothy Whelan
12 Lakeshore Dr.,100.0,15729,Fiskdale,Fiskdale,"Thorpe, Michael",Worcester County,5/15/2014,2014-05-15,Commonwealth of Mass,State Police,,"Whelan, Timothy R.",Individual,201,2014 Pre-primary Report (ND),MA,Not Specified,0,472b2922-f573-5897-a32c-062a4a68a6b6,01518,01518,Timothy Whelan
10-201 Chapman Street,250.0,15729,Weymouth,East Weymouth,"Quigley, William",Norfolk County,7/17/2014,2014-07-17,Cohasset Police Dept.,Police,,"Whelan, Timothy R.",Individual,201,2014 Pre-primary Report (ND),MA,Not Specified,0,6e1bbb97-e533-5c91-8d88-4912506df6f9,02189,02189,Timothy Whelan
28 Manamok Cir.,100.0,15729,Sandwich,Sandwich,"Coker, David",Barnstable County,8/22/2014,2014-08-22,Commonwealth of Mass,Police Officer,,"Whelan, Timothy R.",Individual,201,2014 Pre-primary Report (ND),MA,Not Specified,0,7aeab398-87c2-546f-9845-e928fd8e4f27,02563,02563,Timothy Whelan
7 Rainbow Way,250.0,15729,Harwich,Harwich,"Finacom, Robert",Barnstable County,9/26/2014,2014-09-26,Commonwealth of Mass,State Police,,"Whelan, Timothy R.",Individual,201,2014 Pre-election Report (ND),MA,Not Specified,0,b0ac0cb9-951e-580a-8e7c-8c0a15f0df31,02645,02645,Timothy Whelan
2 Canoe River Road,200.0,15729,South Easton,South Easton,"Rota, John",Bristol County,10/27/2014,2014-10-27,Commonwealth of Mass,State Police,,"Whelan, Timothy R.",Individual,201,2014 Year-end Report (ND),MA,Not Specified,0,59930773-dc53-5941-a174-5a4ed3b9b40e,02375,02375,Timothy Whelan
657 Dorchester Avenue,100.0,15729,South Boston,Boston,"Rolak, Richard",Suffolk County,11/14/2014,2014-11-14,Commonwealth of Mass,State Police,,"Whelan, Timothy R.",Individual,201,2014 Year-end Report (ND),MA,Not Specified,0,2f8cc073-f2b6-5587-a6ae-cec2b37ff828,02127,02127,Timothy Whelan
12 Lakeshore Dr.,100.0,15729,Fiskdale,Fiskdale,"Thorpe, Michael",Worcester County,3/23/2015,2015-03-23,Commonwealth of Mass,State Police,,"Whelan, Timothy R.",Individual,201,2015 Mid-Year Report (ND),MA,Other,5,b41525f3-9ee3-5531-a562-6ff5d54aaa50,01518,01518,Timothy Whelan
1 Jefferson Ave. Apt. E7,200.0,15729,Rockville Centre,,"Fogarty, James",,6/3/2015,2015-06-03,Commonwealth of Mass,State Police,,"Whelan, Timothy R.",Individual,201,2015 Mid-Year Report (ND),NY,,0,8efa730b-cbbf-5d78-9353-a7015c7ee87f,11570,NA,Timothy Whelan
12 Lakeshore Dr.,150.0,15729,Fiskdale,Fiskdale,"Thorpe, Michael",Worcester County,6/3/2015,2015-06-03,Commonwealth of Mass,State Police,,"Whelan, Timothy R.",Individual,201,2015 Mid-Year Report (ND),MA,,0,73af6e3a-e50b-5c0f-a609-707f6f0617b9,01518,01518,Timothy Whelan
91 Downey Street,500.0,15729,Hopkinton,Hopkinton,"Babbin, Timothy",Middlesex County,6/16/2015,2015-06-16,Commonwealth of Mass,State Police,,"Whelan, Timothy R.",Individual,201,2015 Mid-Year Report (ND),MA,,0,29e6c0a1-749b-503f-b7f5-1991c4f6d0a5,01748,01748,Timothy Whelan
P.O. Box 1012,300.0,15729,Hanson,Hanson,"Crowley, Paul",Plymouth County,6/16/2015,2015-06-16,Commonwealth of Mass,State Police,,"Whelan, Timothy R.",Individual,201,2015 Mid-Year Report (ND),MA,,0,caede49f-cebd-5107-a1ce-0c14728a171b,02341,02341,Timothy Whelan
11 Beacon St. #700,500.0,15729,Boston,Boston,"Daly, Andrew",Suffolk County,6/16/2015,2015-06-16,Commonwealth of Mass,State Police,,"Whelan, Timothy R.",Individual,201,2015 Mid-Year Report (ND),MA,,0,2f90dede-12d1-5f2b-8ac8-1285af773fbe,02133,02133,Timothy Whelan
48 Belmont St.,300.0,15729,Taunton,Taunton,"Fredette, Kevin",Bristol County,6/16/2015,2015-06-16,Commonwealth of Mass,State Police,,"Whelan, Timothy R.",Individual,201,2015 Mid-Year Report (ND),MA,,0,ae4faeb7-6b61-528e-9734-5133e3c8c06e,02780,02780,Timothy Whelan
4 Braney Road,300.0,15729,Millbury,Millbury,"Gilbert, Jeffrey",Worcester County,6/16/2015,2015-06-16,Commonwealth of Mass,State Police,,"Whelan, Timothy R.",Individual,201,2015 Mid-Year Report (ND),MA,,0,dc8d750a-409f-5cd8-9a12-8383d8a2de1d,01527,01527,Timothy Whelan
153 Aldrich St.,300.0,15729,Roslindale,Roslindale,"Holland, Scott",Suffolk County,6/16/2015,2015-06-16,Commonwealth of Mass,State Police,,"Whelan, Timothy R.",Individual,201,2015 Mid-Year Report (ND),MA,,0,7c45675a-d144-58ce-ad3a-16bb673dc45f,02131,02131,Timothy Whelan
3 Edwards Road,500.0,15729,Braintree,Braintree,"Hunter, Edward",Norfolk County,6/16/2015,2015-06-16,Commonwealth of Mass,State Police,,"Whelan, Timothy R.",Individual,201,2015 Mid-Year Report (ND),MA,,0,f3babe78-45fb-5ea1-93e1-bf79edd0adab,02184,02184,Timothy Whelan
16 Linclon Circle,300.0,15729,Andover,Andover,"Martin, James",Essex County,6/16/2015,2015-06-16,Commonwealth of Mass,State Police,,"Whelan, Timothy R.",Individual,201,2015 Mid-Year Report (ND),MA,,0,f6cfa856-dbaf-509d-afb0-fa2f5678f1ad,01810,01810,Timothy Whelan
11 Beacon St.  #700,300.0,15729,Boston,Boston,"Patterson, David",Suffolk County,6/16/2015,2015-06-16,Commonwealth of Mass,State Police,,"Whelan, Timothy R.",Individual,201,2015 Mid-Year Report (ND),MA,,0,d33f18c0-1c27-517f-a1c2-f863cdf31fe1,02133,02133,Timothy Whelan
20 Lealand Peck Drive,300.0,15729,Wrentham,Wrentham,"Powell, Jr., Paul",Norfolk County,6/16/2015,2015-06-16,Commonwealth of Mass,State Police,,"Whelan, Timothy R.",Individual,201,2015 Mid-Year Report (ND),MA,,0,e002ee90-9608-567c-8c95-cc2c7e671a8a,02093,02093,Timothy Whelan
16 Rosemont Road,200.0,15729,Worcester,Worcester,"Pullman, Dana",Worcester County,6/16/2015,2015-06-16,Commonwealth of Mass,State Police,,"Whelan, Timothy R.",Individual,201,2015 Mid-Year Report (ND),MA,,0,cde23e45-edcb-59a5-9d30-6c1dd545343f,01605,01605,Timothy Whelan
1 Tiffany Ave.,300.0,15729,Worcester,Worcester,"Sullivan, Michael",Worcester County,6/16/2015,2015-06-16,Commonwealth of Mass,State Police,,"Whelan, Timothy R.",Individual,201,2015 Mid-Year Report (ND),MA,,0,64943138-0196-5930-bcf5-6c5369f74645,01604,01604,Timothy Whelan
88 Pond View Drive,200.0,15729,Kingston,Kingston,"Grasso, Jimi",Plymouth County,6/24/2015,2015-06-24,Commonwealth of Mass,State Police,,"Whelan, Timothy R.",Individual,201,2015 Mid-Year Report (ND),MA,,0,5edf3fe5-c21b-5ff1-a61b-a18b99591e51,02364,02364,Timothy Whelan
9 Birch Avenue East,250.0,15729,East Longmeadow,East Longmeadow,"Fairchild, Eric",Hampden County,7/21/2015,2015-07-21,Commonwealth of Massachusetts,State Police,,"Whelan, Timothy R.",Individual,201,2015 Year-end Report (ND),MA,,0,d99a701d-0214-5f9b-885a-4da205983777,01028,01028,Timothy Whelan
31 Oletree Rd,200.0,15729,Pembroke,Pembroke,"Wong, Kenneth",Plymouth County,7/29/2015,2015-07-29,Commonwealth of Massachusetts,State Police,,"Whelan, Timothy R.",Individual,201,2015 Year-end Report (ND),MA,,0,4b3eb309-0337-5bba-b60a-4042b77e2e71,02359,02359,Timothy Whelan
11 Elizabeth Drive,100.0,15729,Auburn,Auburn,"Zona, Thomas",Worcester County,12/30/2015,2015-12-30,Commonwealth of Mass,State Police,,"Whelan, Timothy R.",Individual,201,2015 Year-end Report (ND),MA,,0,44c5859a-553f-5c51-994d-364768a73b1d,01501,01501,Timothy Whelan
12 Lakeshore Dr.,100.0,15729,Fiskdale,Fiskdale,"Thorpe, Michael",Worcester County,12/31/2015,2015-12-31,Commonwealth of Mass,State Police,,"Whelan, Timothy R.",Individual,201,2015 Year-end Report (ND),MA,,0,3161d359-814f-523c-8eb4-0eadafb36aa3,01518,01518,Timothy Whelan
3 Edwards Road,250.0,15729,Braintree,Braintree,"Hunter, Edward",Norfolk County,5/4/2016,2016-05-04,Commonwealth of Mass,State Police,,"Whelan, Timothy R.",Individual,201,2016 Pre-primary Report (ND),MA,,0,aa02445e-7c1c-54cd-995d-ff90d9868709,02184,02184,Timothy Whelan
9 Birch Avenue East,100.0,15729,East Longmeadow,East Longmeadow,"Fairchild, Eric",Hampden County,6/27/2016,2016-06-27,Commonwealth of Massachusetts,State Police,,"Whelan, Timothy R.",Individual,201,2016 Pre-primary Report (ND),MA,,0,8e775da1-281c-5a87-8b24-e9fd10c9a4f0,01028,01028,Timothy Whelan
88 Pond View Drive,100.0,15729,Kingston,Kingston,"Grasso, Jimi",Plymouth County,9/21/2016,2016-09-21,Commonwealth of Mass,State Police,,"Whelan, Timothy R.",Individual,201,2016 Pre-election Report (ND),MA,,0,27111b5b-aa19-5c43-b606-90a267ea004a,02364,02364,Timothy Whelan
2 Canoe River Road,200.0,15729,South Easton,South Easton,"Rota, John",Bristol County,9/21/2016,2016-09-21,Commonwealth of Mass,State Police,,"Whelan, Timothy R.",Individual,201,2016 Pre-election Report (ND),MA,,0,d7da05a4-95ac-5b2f-8eba-1bde361f9c78,02375,02375,Timothy Whelan
11 Elizabeth Drive,100.0,15729,Auburn,Auburn,"Zona, Thomas",Worcester County,9/21/2016,2016-09-21,Commonwealth of Mass,State Police,,"Whelan, Timothy R.",Individual,201,2016 Pre-election Report (ND),MA,,0,924deaac-c6df-50cb-9da7-ae63ca17278d,01501,01501,Timothy Whelan
659 Liberty St.,100.0,15729,Rockland,Rockland,"Quigley, William",Plymouth County,9/26/2016,2016-09-26,Cohasset Police Dept.,Police,,"Whelan, Timothy R.",Individual,201,2016 Pre-election Report (ND),MA,,0,dd7abc0d-70ff-560f-83ce-98fc3bd2fe90,02370,02370,Timothy Whelan
31 Oletree Rd,100.0,15729,Pembroke,Pembroke,"Wong, Kenneth",Plymouth County,10/21/2016,2016-10-21,Commonwealth of Massachusetts,State Police,,"Whelan, Timothy R.",Individual,201,2016 Pre-election Report (ND),MA,,0,a0ecba41-b2cf-537e-bc7b-f0fac428a67f,02359,02359,Timothy Whelan
98 Hibiscus Ave.,200.0,15729,Waltham,Waltham,"Mahoney, Denis",Middlesex County,10/29/2016,2016-10-29,Commonwealth of Massachusetts,Police Officer,,"Whelan, Timothy R.",Individual,201,2016 Year-end Report (ND),MA,,0,5569e739-a94f-5a94-b5a2-b068820cce57,02451,02451,Timothy Whelan
120 Zona Dr.,250.0,15729,Brewster,Brewster,"Koch, Jr., Richard",Barnstable County,11/28/2016,2016-11-28,Town of Brewster,Police,,"Whelan, Timothy R.",Individual,201,2016 Year-end Report (ND),MA,,0,4289b4a9-a813-5cf2-b4c7-308410286019,02631,02631,Timothy Whelan
12 Lakeshore Dr.,125.0,15729,Fiskdale,Fiskdale,"Thorpe, Michael",Worcester County,12/6/2016,2016-12-06,Commonwealth of Mass,State Police,,"Whelan, Timothy R.",Individual,201,2016 Year-end Report (ND),MA,,0,9f2735af-1383-51fb-b4d4-7d99eab0328a,01518,01518,Timothy Whelan
11 Beacon St. #700,500.0,15729,Boston,Boston,"Daly, Andrew",Suffolk County,6/22/2017,2017-06-22,Commonwealth of Mass,State Police,,"Whelan, Timothy R.",Individual,201,2017 Mid-Year Report (ND),MA,,0,21748ed3-b00b-5999-8f42-82bbb4f1693a,02133,02133,Timothy Whelan
3 Edwards Road,500.0,15729,Braintree,Braintree,"Hunter, Edward",Norfolk County,6/22/2017,2017-06-22,Commonwealth of Mass,State Police,,"Whelan, Timothy R.",Individual,201,2017 Mid-Year Report (ND),MA,,0,078477ee-c5f6-542d-8e4d-e45c2f331c18,02184,02184,Timothy Whelan
16 Rosemont Road,200.0,15729,Worcester,Worcester,"Pullman, Dana",Worcester County,6/22/2017,2017-06-22,Commonwealth of Mass,State Police,,"Whelan, Timothy R.",Individual,201,2017 Mid-Year Report (ND),MA,,0,0f0401a3-89db-513e-a2c2-0e36b0cef153,01605,01605,Timothy Whelan
P.O. Box 9,250.0,15729,Millbury,Millbury,"Macguire, Scott",Worcester County,10/23/2017,2017-10-23,Commonwealth of Mass,State Police,,"Whelan, Timothy R.",Individual,201,2017 Year-end Report (ND),MA,,0,53e4bceb-524d-543f-b757-3ee16a2b7574,01527,01527,Timothy Whelan
12 Lakeshore Dr.,150.0,15729,Fiskdale,Fiskdale,"Thorpe, Michael",Worcester County,10/23/2017,2017-10-23,Commonwealth of Mass,State Police,,"Whelan, Timothy R.",Individual,201,2017 Year-end Report (ND),MA,,0,02b878e8-22f0-5b59-838b-08df89ac9401,01518,01518,Timothy Whelan
11 Elizabeth Drive,100.0,15729,Auburn,Auburn,"Zona, Thomas",Worcester County,10/23/2017,2017-10-23,Commonwealth of Mass,State Police,,"Whelan, Timothy R.",Individual,201,2017 Year-end Report (ND),MA,,0,f5a5d7ca-bf4d-551b-9d52-6fc71a925837,01501,01501,Timothy Whelan
120 Zona Dr.,100.0,15729,Brewster,Brewster,"Koch, Jr., Richard",Barnstable County,10/25/2017,2017-10-25,Town of Brewster,Police,,"Whelan, Timothy R.",Individual,201,2017 Year-end Report (ND),MA,,0,a407f21d-7076-5777-a908-082ef35ae90d,02631,02631,Timothy Whelan
7 Rainbow Way,100.0,15729,Harwich,Harwich,"Finacom, Robert",Barnstable County,11/1/2017,2017-11-01,Commonwealth of Mass,State Police,,"Whelan, Timothy R.",Individual,201,2017 Year-end Report (ND),MA,,0,6387022a-9cdc-5511-a4d5-1e75f22e3c82,02645,02645,Timothy Whelan
P.O. Box 1001,200.0,15729,Sturbridge,Sturbridge,"Murphy, Shawn",Worcester County,12/7/2017,2017-12-07,Commonwealth of Massachusetts,State Police,,"Whelan, Timothy R.",Individual,201,2017 Year-end Report (ND),MA,,0,1fdf6cc1-1b16-565d-ac82-a1675efc3544,01566,01566,Timothy Whelan
10 Lochrobin Lane,200.0,15729,East Bridgewater,East Bridgewater,"Gallagher, David",Plymouth County,12/20/2017,2017-12-20,Commonwealth of Massachusetts,State Police,,"Whelan, Timothy R.",Individual,201,2017 Year-end Report (ND),MA,,0,de647437-9403-59c4-9a02-92054e5f902e,02333,02333,Timothy Whelan
88 Pond View Drive,100.0,15729,Kingston,Kingston,"Grasso, Jimi",Plymouth County,12/20/2017,2017-12-20,Commonwealth of Mass,State Police,,"Whelan, Timothy R.",Individual,201,2017 Year-end Report (ND),MA,,0,7bb26b2e-d6f7-589d-9944-ae17b8ca7f39,02364,02364,Timothy Whelan
91 Downey Street,500.0,15729,Hopkinton,Hopkinton,"Babbin, Timothy",Middlesex County,12/27/2017,2017-12-27,Commonwealth of Mass,State Police,,"Whelan, Timothy R.",Individual,201,2017 Year-end Report (ND),MA,,0,0b4d85bf-c762-511b-a425-2852c5b47352,01748,01748,Timothy Whelan
11 Beacon St.  #700,150.0,15729,Boston,Boston,"Patterson, David",Suffolk County,12/27/2017,2017-12-27,Commonwealth of Mass,State Police,,"Whelan, Timothy R.",Individual,201,2017 Year-end Report (ND),MA,,0,6b5882ce-f00b-5016-966e-93d28c264016,02133,02133,Timothy Whelan
31 Oletree Rd,100.0,15729,Pembroke,Pembroke,"Wong, Kenneth",Plymouth County,1/29/2018,2018-01-29,Commonwealth of Massachusetts,State Police,,"Whelan, Timothy R.",Individual,201,2018 Pre-primary Report (ND),MA,,0,5afdc208-2a4a-5dcb-a852-dfe1d92fa623,02359,02359,Timothy Whelan
120 Zona Dr.,100.0,15729,Brewster,Brewster,"Koch, Jr., Richard",Barnstable County,5/30/2018,2018-05-30,Town of Brewster,Police,,"Whelan, Timothy R.",Individual,201,2018 Pre-primary Report (ND),MA,,0,bf238d44-5ccb-5fbd-bbcc-f99066a2d4c4,02631,02631,Timothy Whelan
11 Elizabeth Drive,100.0,15729,Auburn,Auburn,"Zona, Thomas",Worcester County,8/22/2018,2018-08-22,Commonwealth of Mass,State Police,,"Whelan, Timothy R.",Individual,201,2018 Pre-election Report (ND),MA,Not Specified,0,b086af16-4500-559c-a3a0-37446ba08355,01501,01501,Timothy Whelan
10 Lochrobin Lane,100.0,15729,East Bridgewater,East Bridgewater,"Gallagher, David",Plymouth County,8/29/2018,2018-08-29,Commonwealth of Massachusetts,State Police,,"Whelan, Timothy R.",Individual,201,2018 Pre-election Report (ND),MA,Not Specified,0,5b5aca7c-0a17-5211-b609-c0b1f2b66bd4,02333,02333,Timothy Whelan
7 Rainbow Way,100.0,15729,Harwich,Harwich,"Finacom, Robert",Barnstable County,9/10/2018,2018-09-10,Commonwealth of Mass,State Police,,"Whelan, Timothy R.",Individual,201,2018 Pre-election Report (ND),MA,Not Specified,0,95b052aa-336a-5a2f-9478-7f7c11c375ad,02645,02645,Timothy Whelan
Po Box 9,200.0,15729,Millbury,Millbury,"Maguire, Scott",Worcester County,10/9/2018,2018-10-09,Commonwealth of Massachusetts,State Police,,"Whelan, Timothy R.",Individual,201,2018 Pre-election Report (ND),MA,Not Specified,0,b90dc24d-87f1-5ead-a0bc-eacabef5e8a0,01527,01527,Timothy Whelan
12 Lakeshore Dr.,250.0,15729,Fiskdale,Fiskdale,"Thorpe, Michael",Worcester County,5/5/2019,2019-05-05,Commonwealth of Mass,Police Officer,,"Whelan, Timothy R.",Individual,201,2019 Mid-Year Report,MA,Not Specified,0,d351ca5d-d900-58d7-806d-dc216a5b05cc,01518,01518,Timothy Whelan
5 Cooper Road,100.0,15729,Mansfield,Mansfield,"Atchison, III, Charles",Bristol County,6/30/2019,2019-06-30,State of Massachusetts,State Policeman,,"Whelan, Timothy R.",Individual,201,2019 Mid-Year Report,MA,Not Specified,0,284fe5f3-df2e-5de3-a5b8-ef3f58921f0d,02048,02048,Timothy Whelan
137 Crescent Lane,50.0,15729,Brewster,Brewster,"Ruggiero, Ronald",Barnstable County,12/5/2019,2019-12-05,Town of Harwich,Police Officer,,"Whelan, Timothy R.",Individual,201,2019 Year-end Report,MA,Not Specified,0,b7555700-fbbb-5c03-b031-71abb3b340c6,02631,02631,Timothy Whelan
2 Canoe River Road,100.0,15729,South Easton,South Easton,"Rota, John",Bristol County,2/2/2020,2020-02-02,Commonwealth of Mass,State Police,,"Whelan, Timothy R.",Individual,201,2/2/20 Deposit Report,MA,Credit Card,3,aa6bdfa1-fab2-516d-811e-d4dbe75e4c96,02375,02375,Timothy Whelan
69 Morningside Dr.,250.0,15729,Walpole,Walpole,"Cherven, Michael",Norfolk County,12/27/2016,2016-12-27,Commonwealth of Mass,Law Enforcement,,"Whelan, Timothy R.",Individual,201,2016 Year-end Report (ND),MA,,0,4b0f5e24-8196-5e46-8a38-bfa8230d8999,02081,02081,Timothy Whelan
2 Senaca Ln.,100.0,15729,Sandwich,Sandwich,"Neal, David",Barnstable County,7/19/2014,2014-07-19,Barnstable Count Sheriffs Department,Deputy Sheriff,,"Whelan, Timothy R.",Individual,201,2014 Pre-primary Report (ND),MA,Not Specified,0,d008dee4-e3e7-5a0a-a653-1e104c5ccce2,02563,02563,Timothy Whelan
20 Hudson Street,250.0,15729,Falmouth,Falmouth,"Cummings, James",Barnstable County,8/15/2014,2014-08-15,Barnstable Count Sheriffs Department,Sheriff,,"Whelan, Timothy R.",Individual,201,2014 Pre-primary Report (ND),MA,Not Specified,0,bbf2c123-2318-5fe6-a897-ae358974e9a4,02540,02540,Timothy Whelan
2 Senaca Ln.,100.0,15729,Sandwich,Sandwich,"Neal, David",Barnstable County,9/25/2014,2014-09-25,Barnstable Count Sheriffs Department,Deputy Sheriff,,"Whelan, Timothy R.",Individual,201,2014 Pre-election Report (ND),MA,Not Specified,0,f901dba1-e4ab-5e74-a041-ad355a362b27,02563,02563,Timothy Whelan
2 Senaca Ln.,100.0,15729,Sandwich,Sandwich,"Neal, David",Barnstable County,10/5/2014,2014-10-05,Barnstable Count Sheriffs Department,Deputy Sheriff,,"Whelan, Timothy R.",Individual,201,2014 Pre-election Report (ND),MA,Not Specified,0,73d2d246-82fd-5849-aa16-19dfe2284a09,02563,02563,Timothy Whelan
20 Hudson Street,100.0,15729,Falmouth,Falmouth,"Cummings, James",Barnstable County,12/2/2015,2015-12-02,Barnstable Count Sheriffs Department,Sheriff,,"Whelan, Timothy R.",Individual,201,2015 Year-end Report (ND),MA,,0,c8a3f8f4-fe9b-5cad-8fee-d488634c9364,02540,02540,Timothy Whelan
"37 Carlson Lane, Unit 3",200.0,15729,Falmouth,Falmouth,"Millar, Thomas",Barnstable County,5/17/2018,2018-05-17,Barnstable County Sheriffs Office,Deputy Sheriff,,"Whelan, Timothy R.",Individual,201,2018 Pre-primary Report (ND),MA,,0,8b5ec2d4-27c7-56dd-a1de-150f6c5813bb,02540,02540,Timothy Whelan
"37 Carlson Lane, Unit 3",200.0,15729,Falmouth,Falmouth,"Millar, Thomas",Barnstable County,8/29/2018,2018-08-29,Barnstable Count Sheriffs Department,Deputy Sheriff,,"Whelan, Timothy R.",Individual,201,2018 Pre-election Report (ND),MA,Not Specified,0,46d8c475-4b2b-5bb0-83b7-3dc6d6787b57,02540,02540,Timothy Whelan
130 Old Barnstable Rd,250.0,15729,East Falmouth,East Falmouth,"Cherven, D.",Barnstable County,6/26/2014,2014-06-26,Commonwealth of Mass,Trooper,,"Whelan, Timothy R.",Individual,201,2014 Pre-primary Report (ND),MA,Not Specified,0,d65ef537-1aa5-5594-bf23-09563231355e,02536,02536,Timothy Whelan
5 Summer St.,200.0,15729,Mattapoisett,Mattapoisett,"Machado, James",Plymouth County,12/10/2015,2015-12-10,Massachusetts Police Association,Executive Director,,"Whelan, Timothy R.",Individual,201,2015 Year-end Report (ND),MA,,0,74bd687b-3a37-5e17-8981-6df3c891f224,02739,02739,Timothy Whelan
7 Lynn Shore Dr,250.0,15463,Lynn,Lynn,"McGinn, James",Essex County,6/27/2015,2015-06-27,Commonwealth of Massachusetts,"Colonel, Environmental Police",,"Lee, Susannah M. Whipps",Individual,201,2015 Mid-Year Report (ND),MA,,0,b2996046-a10f-5a1b-b2fc-5e502587100a,01901,01901,Susannah Lee
220 Lincoln Rd,500.0,15463,Phillipston,Athol,"Daoust, Thomas",Worcester County,2/27/2016,2016-02-27,City of Fitchburg,Police Detective,,"Whipps, Susannah M.",Individual,201,2016 Pre-primary Report (ND),MA,,0,fcb87baa-c810-5db2-b567-43b8cc4df61d,01331,01331,Susannah Whipps
7 Lynn Shore Dr,200.0,15463,Lynn,Lynn,"McGinn, James",Essex County,7/3/2016,2016-07-03,Commonwealth of Massachusetts,"Colonel, Environmental Police",,"Whipps, Susannah M.",Individual,201,2016 Pre-primary Report (ND),MA,,0,5729222c-bd68-5a2a-9518-ae0e9549fe1d,01901,01901,Susannah Whipps
220 Lincoln Rd,250.0,15463,Phillipston,Athol,"Daoust, Thomas",Worcester County,7/18/2016,2016-07-18,City of Fitchburg,Police Detective,,"Whipps, Susannah M.",Individual,201,2016 Pre-primary Report (ND),MA,,0,44d605ed-51d1-57bf-9767-f53fa5b096d1,01331,01331,Susannah Whipps
220 Lincoln Rd,100.0,15463,Phillipston,Athol,"Daoust, Thomas",Worcester County,10/1/2016,2016-10-01,City of Fitchburg,Police Detective,,"Whipps, Susannah M.",Individual,201,2016 Pre-election Report (ND),MA,,0,eb0ebda8-6556-5947-8ef2-b6229287e8a4,01331,01331,Susannah Whipps
Po Box 83,100.0,15463,Royalston,Royalston,"Deveneau, Curtis",Worcester County,10/1/2016,2016-10-01,Town of Royalston,Police Chief,,"Whipps, Susannah M.",Individual,201,2016 Pre-election Report (ND),MA,,0,0429d1a1-22c7-52d2-82c4-34b86db6acfd,01368,01368,Susannah Whipps
220 Lincoln Rd,250.0,15463,Phillipston,Athol,"Daoust, Thomas",Worcester County,6/26/2018,2018-06-26,City of Fitchburg,Police Detective,,"Whipps, Susannah M.",Individual,201,2018 Pre-primary Report (ND),MA,,0,798a9741-b621-5b78-8461-7ce81f959afa,01331,01331,Susannah Whipps
215 Newell Rd,200.0,15463,Holden,Holden,"Evangelidis, Lewis",Worcester County,12/26/2015,2015-12-26,Worcester County Sheriff's Office,Sheriff,,"Lee, Susannah M. Whipps",Individual,201,2015 Year-end Report (ND),MA,,0,a6668ceb-9ed2-5b69-83c1-26e28f1a29c7,01520,01520,Susannah Lee
215 Newell Rd,100.0,15463,Holden,Holden,"Evangelidis, Lewis",Worcester County,2/26/2019,2019-02-26,Worcester County Sheriff's Office,Sheriff,,"Whipps, Susannah M.",Individual,201,2019 Mid-Year Report,MA,Not Specified,0,8665ec43-3ffa-5f20-bbf9-52f550d6561d,01520,01520,Susannah Whipps
128 Arthur Avenue,100.0,15463,Athol,Athol,"Cote, Ronny",Worcester County,10/1/2016,2016-10-01,Town of Athol,Detective,,"Whipps, Susannah M.",Individual,201,2016 Pre-election Report (ND),MA,,0,bad8aedc-31ed-5b5a-a8e5-bc9350b3ba8d,01331,01331,Susannah Whipps
5 Evergreen Street,150.0,15174,Saugus,Saugus,"DiMella, Domenic",Essex County,1/26/2011,2011-01-26,Saugus Police Dept.,Police Chief,,"Wong, Donald H.",Individual,201,2011 Mid-Year Report (ND),MA,Not Specified,0,490ed0a6-85f1-5c06-9bdc-7b4484a56100,01906,01906,Donald Wong
2 Dunstan Rd,200.0,15174,Lynnfield,Lynnfield,"DiMella, Domenic",Essex County,4/12/2012,2012-04-12,Saugus Police Dept.,Police Chief,,"Wong, Donald H.",Individual,201,2012 Pre-primary Report (ND),MA,Not Specified,0,fad9efcc-8871-5d6f-ad10-938d813e973b,01940,01940,Donald Wong
12 Archer Lane,100.0,15174,Lynnfield,Lynnfield,"Flynn, Shawn",Essex County,11/10/2014,2014-11-10,Town of Saugus,police officer,,"Wong, Donald H.",Individual,201,2014 Year-end Report (ND),MA,Not Specified,0,f4d550c3-4339-5e97-abc4-78dd77dffd47,01940,01940,Donald Wong
12 Archer Lane,100.0,15174,Lynnfield,Lynnfield,"Flynn, Shawn",Essex County,11/5/2015,2015-11-05,Town of Saugus,Police Officer,,"Wong, Donald H.",Individual,201,2015 Year-end Report (ND),MA,,0,631e5e74-252b-510f-95ba-329dc8747996,01940,01940,Donald Wong
12 Archer Lane,250.0,15174,Lynnfield,Lynnfield,"Flynn, Shawn",Essex County,3/21/2016,2016-03-21,Town of Saugus,Police Officer,,"Wong, Donald H.",Individual,201,2016 Pre-primary Report (ND),MA,,0,87015876-ac6e-5973-b39c-b34c2a6609b6,01940,01940,Donald Wong
Festa Rd,500.0,15174,Revere,Revere,"Pisano, Steven",Suffolk County,8/10/2016,2016-08-10,City of Revere,Police Officer,,"Wong, Donald H.",Individual,201,2016 Pre-primary Report (ND),MA,,0,81c28be1-8f5a-51fb-8d26-c47ddd939db5,02151,02151,Donald Wong
12 Archer Lane,100.0,15174,Lynnfield,Lynnfield,"Flynn, Shawn",Essex County,10/7/2016,2016-10-07,Town of Saugus,Police Officer,,"Wong, Donald H.",Individual,201,2016 Pre-election Report (ND),MA,,0,441579cf-3161-5505-b711-1420877eec63,01940,01940,Donald Wong
12 Archer Lane,100.0,15174,Lynnfield,Lynnfield,"Flynn, Shawn",Essex County,3/1/2018,2018-03-01,Town of Saugus,Police Officer,,"Wong, Donald H.",Individual,201,2018 Pre-primary Report (ND),MA,,0,ea9a1d24-9d26-5b89-8c87-3ba7d347bf0a,01940,01940,Donald Wong
12 Archer Lane,100.0,15174,Lynnfield,Lynnfield,"Flynn, Shawn",Essex County,9/7/2018,2018-09-07,Town of Saugus,Police Officer,,"Wong, Donald H.",Individual,201,2018 Pre-election Report (ND),MA,Not Specified,0,67d3b92e-d374-5d65-b865-589b242ff865,01940,01940,Donald Wong
12 Archer Lane,100.0,15174,Lynnfield,Lynnfield,"Flynn, Shawn",Essex County,3/3/2019,2019-03-03,Town of Saugus,Police Officer,,"Wong, Donald H.",Individual,201,2019 Mid-Year Report,MA,Not Specified,0,445ce106-dbc9-5fb3-bc81-1e8aca02caf8,01940,01940,Donald Wong
12 Archer Lane,100.0,15174,Lynnfield,Lynnfield,"Flynn, Shawn",Essex County,4/8/2020,2020-04-08,Town of Saugus,Police Officer,,"Wong, Donald H.",Individual,201,4/8/20 Deposit Report,MA,Check,1,a211c70b-a11f-5bad-98bb-a05e9696e02a,01940,01940,Donald Wong
153 Aldrich St,250.0,15174,Roslindale,Roslindale,"Holland, Scott",Suffolk County,10/1/2016,2016-10-01,Comm of Ma,State Trooper,,"Wong, Donald H.",Individual,201,2016 Pre-election Report (ND),MA,,0,c34d6ec3-6f6a-50f4-ae5d-46ac96a7801a,02131,02131,Donald Wong
16 Rosemont Ave,200.0,15174,Worcester,Worcester,"Pullman, Dana",Worcester County,10/10/2016,2016-10-10,Comm of Ma,State Trooper,,"Wong, Donald H.",Individual,201,2016 Pre-election Report (ND),MA,,0,bb4b8547-c0e0-516a-9f00-e25ed49176e3,01601,01601,Donald Wong
25 Captain Noyes Road,100.0,17394,South Yarmouth,South Yarmouth,"McEachem, Chris",Barnstable County,12/17/2019,2019-12-17,Yarmouth Police Department,Police Officer,,"Xiarhos, Steven G.",Individual,201,2019 Year-end Report,MA,Not Specified,0,a62fa146-63a9-5bc3-9d1d-ba8d3c14301d,02664,02664,Steven Xiarhos
Po Box 765,1000.0,17394,Barnstable,Barnstable,"Frederickson, Frank",Barnstable County,12/28/2019,2019-12-28,Yarmouth Police Department,Police Chief,,"Xiarhos, Steven G.",Individual,201,2019 Year-end Report,MA,Not Specified,0,0584c440-98b3-5a86-90f1-05f7530b471b,02630,02630,Steven Xiarhos
2 Seneca Lane,100.0,17394,Sandwich,Sandwich,"Neal, David",Barnstable County,12/28/2019,2019-12-28,Barnstable County Sheriff Office,Deputy Sheriff,,"Xiarhos, Steven G.",Individual,201,2019 Year-end Report,MA,Not Specified,0,3b549c98-ad33-5c06-bcf4-da86ae59ea00,02563,02563,Steven Xiarhos
2 Seneca Lane,50.0,17394,Sandwich,Sandwich,"Neal, David",Barnstable County,2/7/2020,2020-02-07,Barnstable County Sheriff Office,Deputy Sheriff,,"Xiarhos, Steven G.",Individual,201,2/7/20 Deposit Report,MA,Check,1,66ac19de-3769-5eac-9955-5f951caf7ba3,02563,02563,Steven Xiarhos
Po Box 2344,500.0,17394,Brewster,Brewster,"Bohannon, Douglas",Barnstable County,12/10/2019,2019-12-10,Douglas Bohannon Private Investigator,Private Detective,,"Xiarhos, Steven G.",Individual,201,2019 Year-end Report,MA,Not Specified,0,b4ab4471-7e18-5c6d-9bf2-d07109f7fc0e,02631,02631,Steven Xiarhos
67 Saddle Lane,1000.0,17394,West Barnstable,West Barnstable,"Xiarhos, Steven",Barnstable County,10/31/2019,2019-10-31,Yarmouth Police Department,Retired Deputy Chief,,"Xiarhos, Steven G.",Individual,201,2019 Year-end Report,MA,Not Specified,0,5278d273-5187-51e3-ac3b-fea033701bac,02668,02668,Steven Xiarhos
,10.0,15488,,,"Erickson, Neil",,10/11/2016,2016-10-11,City of Gardner,Chief of Police,,"Zlotnik, Jonathan David",Individual,201,2016 Pre-election Report (ND),MA,,0,07646e92-f2f6-57b1-ad36-9b4f5ad3ea30,,NA,Jonathan Zlotnik
268 Ash Street,100.0,15488,Winchendon,Winchendon,"Woytek, Bill",Worcester County,12/27/2017,2017-12-27,Commonwealth of Massachusetts,Enviromental Police Officer,,"Zlotnik, Jonathan David",Individual,201,2017 Year-end Report (ND),MA,,0,5dcfb6aa-dd9b-5607-9d9f-5b103540d2a8,01475,01475,Jonathan Zlotnik
5 Summer St.,200.0,15093,Mattapoisett,Mattapoisett,"Machado, James M.",Plymouth County,7/29/2016,2016-07-29,Massachusetts Police Association,Executive Director,,"Schmid III, Paul A.",Individual,201,2016 Pre-primary Report (ND),MA,,0,9d0eb534-f397-55f5-9014-24b13a9f4695,02739,02739,III Schmid
290 Bartemus Trail,100.0,17472,Nashua,,"Reeby, Dawn",,5/20/2020,2020-05-20,Self,Law Enforcement Strategist,,"Sharp, Catia",Individual,201,5/20/20 Deposit Report,NH,Credit Card,3,20120a1c-78c1-5a8e-8e21-b5ad9c6a4d08,03063,NA,Catia Sharp
50 Grattan St.,100.0,15060,Fall River,Fall River,"Fogarty, Michael",Bristol County,11/1/2013,2013-11-01,FR Police Department,police officer,,"Silvia, Alan",Individual,201,2013 Year-end Report (ND),MA,Not Specified,0,5a57ae5d-46d4-5993-94b9-7a039b91d870,02721,02721,Alan Silvia
50 Grattan St.,50.0,15060,Fall River,Fall River,"Fogarty, Michael",Bristol County,7/29/2014,2014-07-29,FR Police Department,police officer,,"Silvia, Alan",Individual,201,2014 Pre-primary Report (ND),MA,Not Specified,0,4f65df1d-eb4c-56b9-9edd-fa77e700a034,02721,02721,Alan Silvia
50 Grattan St.,25.0,15060,Fall River,Fall River,"Fogarty, Michael",Bristol County,8/22/2015,2015-08-22,FR Police Department,police officer,,"Silvia, Alan",Individual,201,2015 Year-end Report (ND),MA,,0,7f2305a1-ad85-5905-ad3c-c7bf272a2f8b,02721,02721,Alan Silvia
61 Forge Road,60.0,15060,Assonet,Assonet,"Correiro, William",Bristol County,10/16/2017,2017-10-16,Retired,Retired Police Officer,,"Silvia, Alan",Individual,201,2017 Year-end Report (ND),MA,,0,12a5e7ad-81ad-551c-a294-0ea42fc36656,02702,02702,Alan Silvia
61 Forge Road,100.0,15060,Assonet,Assonet,"Correiro, William",Bristol County,10/31/2017,2017-10-31,Retired,Retired Police Officer,,"Silvia, Alan",Individual,201,2017 Year-end Report (ND),MA,,0,752fc115-3413-55ed-a0c6-0300ec23d1e9,02702,02702,Alan Silvia
5 Summer Street,200.0,15060,Mattapoisett,Mattapoisett,"Machado, James",Plymouth County,11/22/2017,2017-11-22,City of Fall River,Police Officer,,"Silvia, Alan",Individual,201,2017 Year-end Report (ND),MA,,0,76d175f0-4ec1-5eeb-a7f0-838c0a937cec,02739,02739,Alan Silvia
61 Forge Road,70.0,15060,Assonet,Assonet,"Correiro, William",Bristol County,2/15/2018,2018-02-15,Retired,Retired Police Officer,,"Silvia, Alan",Individual,201,2018 Pre-primary Report (ND),MA,,0,6c1b5003-87ad-53c9-a9ce-4983bc4bd8ca,02702,02702,Alan Silvia
61 Forge Road,60.0,15060,Assonet,Assonet,"Correiro, William",Bristol County,8/28/2018,2018-08-28,Retired,Retired Police Officer,,"Silvia, Alan",Individual,201,2018 Pre-Election Report,MA,Not Specified,0,26f20cc7-1c10-5cef-8e9a-0bae6bfe40ff,02702,02702,Alan Silvia
1865 Locust Street,100.0,15060,Fall River,Fall River,"Machado, David",Bristol County,5/13/2016,2016-05-13,Retired From Police Dept.,Retired,,"Silvia, Alan",Individual,201,2016 Pre-primary Report (ND),MA,,0,dd7bef53-46ed-57ad-8993-ffb71682e87b,02723,02723,Alan Silvia
Po Box 242,200.0,14168,Brimfield,Brimfield,"Loos, David",Hampden County,8/27/2015,2015-08-27,Commonwealth of Massachusetts,Environmental Police Officer,,"Smola, Todd M.",Individual,201,2015 Year-end Report (ND),MA,,0,1ae45826-1f08-59dd-9ed3-8de27f37db31,01010,01010,Todd Smola
Po Box 242,200.0,14168,Brimfield,Brimfield,"Loos, David",Hampden County,9/17/2016,2016-09-17,Commonwealth of Massachusetts,Environmental Police Officer,,"Smola, Todd M.",Individual,201,2016 Pre-election Report (ND),MA,,0,99e90356-6472-581a-8594-85dfa9080fe7,01010,01010,Todd Smola
16 Rosemont Road,200.0,10403,Worcester,Worcester,"Pullman, Trooper Dana A.",Worcester County,9/3/2014,2014-09-03,Commonwealth of Ma,State Trooper,,"Speliotis, Theodore C.",Individual,201,2014 Pre-election Report (ND),MA,Not Specified,0,30f6f34e-9865-5773-a7cc-36f759691001,01605,01605,Theodore Speliotis
16 Rosemont Road,200.0,10403,Worcester,Worcester,"Pullman, Trooper Dana A.",Worcester County,4/25/2018,2018-04-25,Commonwealth of Ma,State Trooper,,"Speliotis, Theodore C.",Individual,201,2018 Pre-primary Report (ND),MA,,0,0168f029-2bfe-54dc-9803-209e5f6b1427,01605,01605,Theodore Speliotis
24 Forest Drive,300.0,10403,Holden,Holden,"Daly, Andrew",Worcester County,4/25/2018,2018-04-25,State Police Association of Ma,Sergeant,,"Speliotis, Theodore C.",Individual,201,2018 Pre-primary Report (ND),MA,,0,5dbe00bc-c31f-5bc6-89f1-1b088a9c666f,01520,01520,Theodore Speliotis
9 Brightwood Road,100.0,13645,Waltham,Waltham,"Maher, Timothy",Middlesex County,2/22/2010,2010-02-22,City of Waltham,Police Officer,,"Stanley, Thomas M.",Individual,201,2010 Pre-primary Report (ND),MA,Not Specified,0,a8fbd331-e5a9-5ee1-a7d1-25fc2062634e,02453,02453,Thomas Stanley
9 Brightwood Road,100.0,13645,Waltham,Waltham,"Maher, Timothy",Middlesex County,5/25/2010,2010-05-25,City of Waltham,Police Officer,,"Stanley, Thomas M.",Individual,201,2010 Pre-primary Report (ND),MA,Not Specified,0,92e742f2-8a8b-520b-a49a-bc8c1af84d7f,02453,02453,Thomas Stanley
9 Brightwood Road,100.0,13645,Waltham,Waltham,"Maher, Timothy",Middlesex County,10/12/2010,2010-10-12,City of Waltham,Police Officer,,"Stanley, Thomas M.",Individual,201,2010 Pre-election Report (ND),MA,Not Specified,0,3afb3f22-e1d5-5ab5-b2aa-61a1c35a30a0,02453,02453,Thomas Stanley
9 Brightwood Road,100.0,13645,Waltham,Waltham,"Maher, Timothy",Middlesex County,9/30/2011,2011-09-30,City of Waltham,Police Officer,,"Stanley, Thomas M.",Individual,201,2011 Year-end Report (ND),MA,Not Specified,0,a54672af-902a-50c8-a28a-1d5e4b554ec0,02453,02453,Thomas Stanley
9 Brightwood Road,50.0,13645,Waltham,Waltham,"Maher, Timothy",Middlesex County,10/17/2011,2011-10-17,City of Waltham,Police Officer,,"Stanley, Thomas M.",Individual,201,2011 Year-end Report (ND),MA,Not Specified,0,0ecf62d5-2b88-566b-9f9d-d0a62e74cc83,02453,02453,Thomas Stanley
65 Gilbert St,25.0,13645,Waltham,Waltham,"Orta, Jorge",Middlesex County,9/23/2014,2014-09-23,City of Waltham,Police Officer,,"Stanley, Thomas M.",Individual,201,2014 Pre-election Report (ND),MA,Not Specified,0,ada36610-1b91-5f9f-b8f3-e4275c40ca39,02453,02453,Thomas Stanley
65 Gilbert St,100.0,13645,Waltham,Waltham,"Orta, Jorge",Middlesex County,12/12/2014,2014-12-12,City of Waltham,Police Officer,,"Stanley, Thomas M.",Individual,201,2014 Year-end Report (ND),MA,Not Specified,0,b2475915-9555-586a-bc6e-19dbe951a265,02453,02453,Thomas Stanley
66 Mayall Road,50.0,13645,Waltham,Waltham,"Guigno Jr., Joseph",Middlesex County,12/17/2014,2014-12-17,City of Waltham,Police Detective Sgt,,"Stanley, Thomas M.",Individual,201,2014 Year-end Report (ND),MA,Not Specified,0,33aadb66-6186-551a-a7b6-f7093c23793f,02453,02453,Thomas Stanley
18 Brookview Rd,50.0,13645,Millis,Millis,"O'Dowd, Philip",Norfolk County,4/3/2015,2015-04-03,City of Waltham,Police Officer,,"Stanley, Thomas M.",Individual,201,2015 Pre-election Report (MUN),MA,Other,5,79ee2dc3-a1d4-5766-8152-e3dd6edf0732,02054,02054,Thomas Stanley
51 Stone Rd,25.0,13645,Waltham,Waltham,"Bryant, Thomas",Middlesex County,10/22/2015,2015-10-22,City of Waltham,Police Officer,,"Stanley, Thomas M.",Individual,201,2015 Year-end report (MUN),MA,,0,edefbfe3-6a7a-5563-86b5-4c9d86533822,02453,02453,Thomas Stanley
9 Brightwood Road,50.0,13645,Waltham,Waltham,"Maher, Timothy",Middlesex County,11/3/2015,2015-11-03,City of Waltham,Police Officer,,"Stanley, Thomas M.",Individual,201,2015 Year-end report (MUN),MA,,0,878b30cc-ec81-5a76-9fe9-f00bc06d5565,02453,02453,Thomas Stanley
65 Gilbert St,50.0,13645,Waltham,Waltham,"Orta, Jorge",Middlesex County,11/3/2016,2016-11-03,City of Waltham,Police Officer,,"Stanley, Thomas M.",Individual,201,2016 Year-end Report (ND),MA,,0,54f97636-b9a2-5e89-95a5-bcace21dae66,02453,02453,Thomas Stanley
65 Gilbert St,25.0,13645,Waltham,,"Orta, Jorge",,3/13/2017,2017-03-13,City of Waltham,Police Officer,,"Stanley, Thomas M.",Individual,201,2017 Mid-Year Report (ND),MA,,0,5ffabd4a-ea87-5132-a9f4-773103dda0ae,,NA,Thomas Stanley
65 Gilbert St,50.0,13645,Waltham,Waltham,"Orta, Jorge",Middlesex County,11/13/2017,2017-11-13,City of Waltham,Police Officer,,"Stanley, Thomas M.",Individual,201,2017 Year-end Report (ND),MA,,0,16a9d855-9c2a-56ce-9d94-28dd3ec7fa99,02453,02453,Thomas Stanley
65 Gilbert St,25.0,13645,Waltham,Waltham,"Orta, Jorge",Middlesex County,3/20/2018,2018-03-20,City of Waltham,Police Officer,,"Stanley, Thomas M.",Individual,201,2018 Pre-primary Report (ND),MA,,0,879868a8-3706-5fbb-8357-d6ae5e5b9b6f,02453,02453,Thomas Stanley
65 Gilbert St,25.0,13645,Waltham,Waltham,"Orta, Jorge",Middlesex County,9/27/2018,2018-09-27,City of Waltham,Police Officer,,"Stanley, Thomas M.",Individual,201,2018 Pre-election Report (ND),MA,Not Specified,0,c757c087-5397-5102-b4de-b49f700dce75,02453,02453,Thomas Stanley
11 Crestview Rd,100.0,13645,Waltham,Waltham,"Tracey, Paul J.",Middlesex County,3/18/2015,2015-03-18,City of Waltham,Law Enforcement,,"Stanley, Thomas M.",Individual,201,2015 Pre-election Report (MUN),MA,Other,5,fd5a3d48-2a5a-56e5-b85d-5b94a67fea7b,02451,02451,Thomas Stanley
24 Washburn Ave #1,50.0,13645,Cambridge,Cambridge,"Delaney, Daniel",Middlesex County,3/26/2015,2015-03-26,Delaney Police Group,Legislative Agent,,"Stanley, Thomas M.",Individual,201,2015 Pre-election Report (MUN),MA,Other,5,1d0f21b9-5e19-5ee5-b530-5b6a2d569bee,02140,02140,Thomas Stanley
24 Washburn Ave #1,100.0,13645,Cambridge,Cambridge,"Delaney, Daniel",Middlesex County,5/29/2020,2020-05-29,Delaney Police Group,Legislative Agent,,"Stanley, Thomas M.",Individual,201,5/29/20 Deposit Report,MA,Credit Card,3,b4e1d1ec-68b5-53f6-a994-5a1b3e5bad16,02140,02140,Thomas Stanley
30 Aldie Street,125.0,13645,Allston,Allston,"Snedeker, Catherine",Suffolk County,5/29/2020,2020-05-29,Boston Police Department,Principle Analyst,,"Stanley, Thomas M.",Individual,201,5/29/20 Deposit Report,MA,Credit Card,3,5cf53312-f0c8-524a-93ee-4ac288bb88b7,02134,02134,Thomas Stanley
5 Summer St.,200.0,11466,Mattapoisett,Mattapoisett,"Machado, James M.",Plymouth County,9/21/2010,2010-09-21,City of Fall River,Police Officer,,"Straus, William M.",Individual,201,2010 Pre-election Report (ND),MA,Not Specified,0,b74849bb-2b73-56f0-9485-baaa5432c796,02739,02739,William Straus
5 Summer St.,200.0,11466,Mattapoisett,Mattapoisett,"Machado, James M.",Plymouth County,3/24/2011,2011-03-24,City of Fall River,Police Officer,,"Straus, William M.",Individual,201,2011 Mid-Year Report (ND),MA,Not Specified,0,fca9261f-b92b-53ba-8f49-4598ae2b75c8,02739,02739,William Straus
5 Summer St.,200.0,11466,Mattapoisett,Mattapoisett,"Machado, James M.",Plymouth County,10/2/2013,2013-10-02,Mass Police Association,Legislative Agent,,"Straus, William M.",Individual,201,2013 Year-end Report (ND),MA,Not Specified,0,495c78b6-a9cd-5522-8aab-32099ee9c664,02739,02739,William Straus
5 Summer St.,200.0,11466,Mattapoisett,Mattapoisett,"Machado, James M.",Plymouth County,10/27/2014,2014-10-27,Mass Police Association,Legislative Agent,,"Straus, William M.",Individual,201,2014 Year-end Report (ND),MA,Not Specified,0,27fc6cf4-2a5a-554a-afe6-fa7aa71aa497,02739,02739,William Straus
5 Summer St.,200.0,11466,Mattapoisett,Mattapoisett,"Machado, James M.",Plymouth County,10/20/2015,2015-10-20,Mass Police Association,Legislative Agent,,"Straus, William M.",Individual,201,2015 Year-end Report (ND),MA,,0,c0ec9b0e-5586-5dc7-a0d9-940a21921839,02739,02739,William Straus
30 Saint James Ave,100.0,16980,East Bridgewater,East Bridgewater,"Almeida, George",Plymouth County,12/16/2019,2019-12-16,City of Brockton,Police Officer,,"Sullivan, Alyson M.",Individual,201,2019 Year-end Report,MA,Not Specified,0,7c711d32-2986-50a1-ab82-4bf70a2ae7a5,02333,02333,Alyson Sullivan
29 Malinda Dr,100.0,16980,Abington,Abington,"Sullivan, Robert",Plymouth County,12/16/2019,2019-12-16,Town of Weymouth,police officer,,"Sullivan, Alyson M.",Individual,201,2019 Year-end Report,MA,Not Specified,0,b880d6fe-3343-5de5-a983-20161cce7548,02351,02351,Alyson Sullivan
2018 Washington St,1000.0,16980,Canton,Canton,"Pudolsky, Gerald C",Norfolk County,6/27/2018,2018-06-27,Plymouth County Sheriff's Department,Special Sheriff,,"Sullivan, Alyson M.",Individual,201,2018 Pre-Primary Report,MA,Not Specified,0,c31645de-2f06-58a6-a77f-b8d2017071be,02021,02021,Alyson Sullivan
2018 Washington St,1000.0,16980,Canton,Canton,"Pudolsky, Gerald C",Norfolk County,3/21/2019,2019-03-21,Plymouth County Sheriff's Department,Special Sheriff,,"Sullivan, Alyson M.",Individual,201,2019 Mid-Year Report,MA,Not Specified,0,8572df90-5abb-51d5-b8a3-a0b45fc4ccb5,02021,02021,Alyson Sullivan
67 americo strett,250.0,13785,Ludlow,Ludlow,"tardiff, robert",Hampden County,7/21/2010,2010-07-21,springfile police dept,police officer,,"Tosado, Jose F.",Individual,201,7/21/10 Deposit Report,MA,Check,1,547c2d37-7d66-52c3-9a83-5612086666d3,01056,01056,Jose Tosado
12 Amy Drive,500.0,13785,Westfield,Westfield,"Howard, Charles ",Hampden County,3/28/2011,2011-03-28,Springfield Police Dept,Police Officer,,"Tosado, Jose F.",Individual,201,3/28/11 Deposit Report,MA,Check,1,8f4d48ba-aa01-5ef3-8e36-386939b7dd38,01085,01085,Jose Tosado
194 Waverly Street,100.0,15307,Boston,Roxbury," Sullivan, Richard",Suffolk County,7/29/2016,2016-07-29,MBTA,police,,"Tuitt, Marydith E.",Individual,201,2016 Pre-primary Report (ND),MA,,0,ab99a721-c668-55f1-9446-dd4c1a2b5dd0,02119,02119,Marydith Tuitt
362 spring street,100.0,15307,Rockland,Rockland,"ellison, larry",Plymouth County,7/15/2013,2013-07-15,city,law enforcement,,"Tuitt, Mary-dith E. ",Individual,201,2013 Pre-primary Report (Special) (ND),MA,Not Specified,0,51d43344-2a4c-59c4-b10f-d03598768164,02370,02370,Mary-dith Tuitt
715 Tremont St #501,40.0,16408,Boston,Boston,"Williams, Nicey",Suffolk County,4/21/2016,2016-04-21,Boston Police Department,Police Clerk,,"Tyler, Chynah",Individual,201,2016 Pre-primary Report (ND),MA,,0,dd85dcd3-800f-5142-b00b-3a50a770c274,02118,02118,Chynah Tyler
41 Temple St,50.0,16408,Mattapan,Mattapan,"Robinson, Sky",Suffolk County,6/13/2016,2016-06-13,City of Boston,Police Officer,,"Tyler, Chynah",Individual,201,2016 Pre-primary Report (ND),MA,,0,96a4389a-4a3d-59a1-880d-f9a167fe8267,02126,02126,Chynah Tyler
58 Hamlet St,100.0,16408,Newton,Newton Center,"Sumpter, Lynnette",Middlesex County,4/21/2016,2016-04-21,Boston Police Department,Retired,,"Tyler, Chynah",Individual,201,2016 Pre-primary Report (ND),MA,,0,fb389d9b-a3e2-58dd-a6b8-90dbbcfa62de,02459,02459,Chynah Tyler
58 Hamlet Street,40.0,16408,Newton,Newton Center,"Tyler, Lynette",Middlesex County,3/13/2017,2017-03-13,Boston Police Department,Retired,,"Tyler, Chynah",Individual,201,2017 Mid-Year Report (ND),MA,,0,15427d3c-427e-52ee-9984-c2ce29519994,02459,02459,Chynah Tyler
58 Hamlet St,50.0,16408,Newton,Newton Center,"Sumpter, Lynnette",Middlesex County,4/3/2019,2019-04-03,Boston Police Department,Retired,,"Tyler, Chynah",Individual,201,2019 Mid-Year Report,MA,Not Specified,0,792015e4-5513-50a2-baeb-b7794ca8074b,02459,02459,Chynah Tyler
35 Rexhame Street,100.0,16856,Roslindale,Roslindale,"Besold, Pam",Suffolk County,8/26/2018,2018-08-26,Boston Police Department,Sargeant,,"Van Ness, Gretchen",Individual,201,2018 Pre-election Report (ND),MA,,0,afd785cb-7382-53db-8d87-922e8ca1bf74,02131,02131,Ness Van
9 Hunter Slope,100.0,15533,Westfield,Westfield,"Sustache, Edwin",Hampden County,10/25/2012,2012-10-25,Holyoke Police Department,Police Office,,"Vega, Aaron",Individual,201,2012 Year-end Report (ND),MA,Not Specified,0,8b2bc2d7-c66d-5907-835a-84633fab014c,01085,01085,Aaron Vega
9 Wycoff Ave,50.0,15533,Holyoke,Holyoke,"Leahy, Patrick",Hampden County,4/28/2014,2014-04-28,City of Holyoke,Police Officer,,"Vega, Aaron",Individual,201,2014 Pre-primary Report (ND),MA,Not Specified,0,b8f46cce-5d3d-5127-bf1e-1aec3453fd0e,01040,01040,Aaron Vega
9 Wycoff Ave,50.0,15533,Holyoke,Holyoke,"Leahy, Patrick",Hampden County,6/20/2014,2014-06-20,City of Holyoke,Police Officer,,"Vega, Aaron",Individual,201,2014 Pre-primary Report (ND),MA,Not Specified,0,fb93a215-b932-5f9e-8e46-0823f4f9be69,01040,01040,Aaron Vega
40 Madison Ave,85.0,15533,Holyoke,Holyoke,"Moriarty, Matthew F",Hampden County,6/20/2014,2014-06-20,City of Holyoke,Police Officer,,"Vega, Aaron",Individual,201,2014 Pre-primary Report (ND),MA,Not Specified,0,5b5795bd-d68a-5201-bdae-acf5cc81c5c6,01040,01040,Aaron Vega
9 Wycoff Ave,200.0,15533,Holyoke,Holyoke,"Leahy, Patrick",Hampden County,4/21/2016,2016-04-21,City of Holyoke,Police Officer,,"Vega, Aaron",Individual,201,2016 Pre-primary Report (ND),MA,,0,52b82a60-7aae-5ea9-bbb8-2b0d5df67838,01040,01040,Aaron Vega
9 Wycoff Ave,100.0,15533,Holyoke,Holyoke,"Leahy, Patrick",Hampden County,2/26/2018,2018-02-26,City of Holyoke,Police Officer,,"Vega, Aaron",Individual,201,2018 Pre-Primary Report,MA,Not Specified,0,8398a15f-418f-54de-a3f2-463e05d30669,01040,01040,Aaron Vega
40 Madison Ave,100.0,15533,Holyoke,Holyoke,"Moriarty, Mike",Hampden County,2/26/2018,2018-02-26,City of Holyoke,Police Officer,,"Vega, Aaron",Individual,201,2018 Pre-Primary Report,MA,Not Specified,0,2a977621-dc1b-51d7-bc5e-1b68756029e5,01040,01040,Aaron Vega
40 Madison Ave,50.0,15533,Holyoke,Holyoke,"Moriarty, Matthew F",Hampden County,3/7/2019,2019-03-07,City of Holyoke,Police Officer,,"Vega, Aaron",Individual,201,2019 Mid-Year Report,MA,Not Specified,0,bf2d2baf-547c-5389-b124-c57fb7ef818d,01040,01040,Aaron Vega
20 Hudson Street,250.0,15025,Falmouth,Falmouth,"Cummings, James",Barnstable County,9/14/2010,2010-09-14,Barnstable county,sheriff,,"Vieira, David T.",Individual,201,2010 Pre-election Report (ND),MA,Not Specified,0,3859f358-8a17-5fba-8df2-df9ff07fcc71,02540,02540,David Vieira
20 Hudson Street,250.0,15025,Falmouth,Falmouth,"Cummings, James",Barnstable County,12/30/2011,2011-12-30,Barnstable county,sheriff,,"Vieira, David T.",Individual,201,2011 Year-end Report (ND),MA,Not Specified,0,a5da499a-d372-552d-b574-4263fd5eed17,02540,02540,David Vieira
20 Hudson Street,100.0,15025,Falmouth,Falmouth,"Cummings, James",Barnstable County,9/14/2016,2016-09-14,Barnstable county,sheriff,,"Vieira, David T.",Individual,201,2016 Pre-election Report (ND),MA,,0,ccd99d3a-dc23-521b-a5ce-8b3809399290,02540,02540,David Vieira
20 Hudson Street,100.0,15025,Falmouth,Falmouth,"Cummings, James",Barnstable County,10/31/2016,2016-10-31,Barnstable county,sheriff,,"Vieira, David T.",Individual,201,2016 Year-end Report (ND),MA,,0,9dec586f-0a16-5bf6-865b-ee25d01ad861,02540,02540,David Vieira
20 Hudson Street,100.0,15025,Falmouth,Falmouth,"Cummings, James",Barnstable County,12/20/2017,2017-12-20,Barnstable County,Sheriff,,"Vieira, David T.",Individual,201,2017 Year-end Report (ND),MA,,0,142a65a4-fcd5-5b47-903f-479ecdf80d66,02540,02540,David Vieira
40 Cumloden,200.0,15025,Falmouth,Falmouth,"Smith, Richard",Barnstable County,9/16/2016,2016-09-16,Police,Retired,,"Vieira, David T.",Individual,201,2016 Pre-election Report (ND),MA,,0,b004949a-aee5-535a-a423-f1857b14ec99,02540,02540,David Vieira
23 Hemingway Road,200.0,12103,Wilbraham,Wilbraham,"Jebb, William",Hampden County,3/15/2018,2018-03-15,City of Chicopee,Chief of Police,,"Wagner, Joseph F.",Individual,201,2018 Pre-Primary Report,MA,Not Specified,0,e726fd13-4533-5253-ad77-9dbbf270f69e,01095,01095,Joseph Wagner
23 Hemingway Road,250.0,12103,Wilbraham,Wilbraham,"Jebb, William",Hampden County,10/22/2019,2019-10-22,City of Chicopee,Chief of Police,,"Wagner, Joseph F.",Individual,201,2019 Year-end Report,MA,Not Specified,0,baa9639d-913d-5f33-990c-49b3dc44b4b9,01095,01095,Joseph Wagner
48 Jackie Drive,100.0,12103,Ludlow,Ludlow,"Cocchi, Nicholas",Hampden County,4/11/2017,2017-04-11,Hampden County Correctional Facility,Sheriff,,"Wagner, Joseph F.",Individual,201,2017 Mid-Year Report (ND),MA,,0,f71d5323-31aa-5903-9000-3dc488e587e6,01056,01056,Joseph Wagner
48 Jackie Drive,125.0,12103,Ludlow,Ludlow,"Cocchi, Nicholas",Hampden County,6/20/2017,2017-06-20,Hampden County Correctional Facility,Sheriff,,"Wagner, Joseph F.",Individual,201,2017 Mid-Year Report (ND),MA,,0,8945352e-dd0a-5331-9ef6-262dbf3678f8,01056,01056,Joseph Wagner
48 Jackie Drive,100.0,12103,Ludlow,Ludlow,"Cocchi, Nicholas",Hampden County,5/20/2018,2018-05-20,Hampden County Correctional Facility,Sheriff,,"Wagner, Joseph F.",Individual,201,2018 Pre-Primary Report,MA,Not Specified,0,5d194c70-1467-55ed-9b73-12990862d95e,01056,01056,Joseph Wagner
24 Forest Drive,250.0,12103,Holden,Holden,"Daly, Andrew",Worcester County,6/4/2013,2013-06-04,State Police Association,Letter Sent,,"Wagner, Joseph F.",Individual,201,2013 Mid-Year Report (ND),MA,Not Specified,0,f6e4b392-d504-5b76-abde-701cc5fa0374,01520,01520,Joseph Wagner
24 Forest Drive,200.0,15729,Holden,Holden,"Daly, Andrew",Worcester County,12/11/2013,2013-12-11,Commonwealth of Mass,State Police,,"Whelan, Timothy R.",Individual,201,2013 Year-end Report (ND),MA,Not Specified,0,2ec3937f-80f6-544b-979c-850f5426ea2f,01520,01520,Timothy Whelan
3 Edwards Road,200.0,15729,Braintree,Braintree,"Hunter, Edward",Norfolk County,12/11/2013,2013-12-11,Commonwealth of Mass,State Police,,"Whelan, Timothy R.",Individual,201,2013 Year-end Report (ND),MA,Not Specified,0,faf657c0-5229-5a89-b33b-48e81ecf2201,02184,02184,Timothy Whelan
16 Rosemont Road,200.0,15729,Worcester,Worcester,"Pullman, Dana",Worcester County,12/11/2013,2013-12-11,Commonwealth of Mass,State Police,,"Whelan, Timothy R.",Individual,201,2013 Year-end Report (ND),MA,Not Specified,0,4b0b68e1-46c8-5e22-88ec-5a0f9e23b3bb,01605,01605,Timothy Whelan
12 Lakeshore Dr.,250.0,15729,Fiskdale,Fiskdale,"Thorpe, Michael",Worcester County,3/16/2014,2014-03-16,Commonwealth of Mass,State Police,,"Whelan, Timothy R.",Individual,201,2014 Pre-primary Report (ND),MA,Not Specified,0,c7ec5202-8189-5f21-93e6-f1bb0a4da633,01518,01518,Timothy Whelan
P.O. Box 1072,500.0,15729,Marstons Mills,Marstons Mills,"Heywood, Daralyn",Barnstable County,5/12/2014,2014-05-12,Commonwealth of Mass,State Police,,"Whelan, Timothy R.",Individual,201,2014 Pre-primary Report (ND),MA,Not Specified,0,902a61a3-7075-52b1-a59f-601bed05b011,02648,02648,Timothy Whelan
3 Edwards Road,100.0,15729,Braintree,Braintree,"Hunter, Edward",Norfolk County,5/15/2014,2014-05-15,Commonwealth of Mass,State Police,,"Whelan, Timothy R.",Individual,201,2014 Pre-primary Report (ND),MA,Not Specified,0,6e17afe1-14e3-5d0a-bbff-e240ca9a36a5,02184,02184,Timothy Whelan
12 Lakeshore Dr.,100.0,15729,Fiskdale,Fiskdale,"Thorpe, Michael",Worcester County,5/15/2014,2014-05-15,Commonwealth of Mass,State Police,,"Whelan, Timothy R.",Individual,201,2014 Pre-primary Report (ND),MA,Not Specified,0,472b2922-f573-5897-a32c-062a4a68a6b6,01518,01518,Timothy Whelan
10-201 Chapman Street,250.0,15729,Weymouth,East Weymouth,"Quigley, William",Norfolk County,7/17/2014,2014-07-17,Cohasset Police Dept.,Police,,"Whelan, Timothy R.",Individual,201,2014 Pre-primary Report (ND),MA,Not Specified,0,6e1bbb97-e533-5c91-8d88-4912506df6f9,02189,02189,Timothy Whelan
28 Manamok Cir.,100.0,15729,Sandwich,Sandwich,"Coker, David",Barnstable County,8/22/2014,2014-08-22,Commonwealth of Mass,Police Officer,,"Whelan, Timothy R.",Individual,201,2014 Pre-primary Report (ND),MA,Not Specified,0,7aeab398-87c2-546f-9845-e928fd8e4f27,02563,02563,Timothy Whelan
7 Rainbow Way,250.0,15729,Harwich,Harwich,"Finacom, Robert",Barnstable County,9/26/2014,2014-09-26,Commonwealth of Mass,State Police,,"Whelan, Timothy R.",Individual,201,2014 Pre-election Report (ND),MA,Not Specified,0,b0ac0cb9-951e-580a-8e7c-8c0a15f0df31,02645,02645,Timothy Whelan
2 Canoe River Road,200.0,15729,South Easton,South Easton,"Rota, John",Bristol County,10/27/2014,2014-10-27,Commonwealth of Mass,State Police,,"Whelan, Timothy R.",Individual,201,2014 Year-end Report (ND),MA,Not Specified,0,59930773-dc53-5941-a174-5a4ed3b9b40e,02375,02375,Timothy Whelan
657 Dorchester Avenue,100.0,15729,South Boston,Boston,"Rolak, Richard",Suffolk County,11/14/2014,2014-11-14,Commonwealth of Mass,State Police,,"Whelan, Timothy R.",Individual,201,2014 Year-end Report (ND),MA,Not Specified,0,2f8cc073-f2b6-5587-a6ae-cec2b37ff828,02127,02127,Timothy Whelan
12 Lakeshore Dr.,100.0,15729,Fiskdale,Fiskdale,"Thorpe, Michael",Worcester County,3/23/2015,2015-03-23,Commonwealth of Mass,State Police,,"Whelan, Timothy R.",Individual,201,2015 Mid-Year Report (ND),MA,Other,5,b41525f3-9ee3-5531-a562-6ff5d54aaa50,01518,01518,Timothy Whelan
1 Jefferson Ave. Apt. E7,200.0,15729,Rockville Centre,,"Fogarty, James",,6/3/2015,2015-06-03,Commonwealth of Mass,State Police,,"Whelan, Timothy R.",Individual,201,2015 Mid-Year Report (ND),NY,,0,8efa730b-cbbf-5d78-9353-a7015c7ee87f,11570,NA,Timothy Whelan
12 Lakeshore Dr.,150.0,15729,Fiskdale,Fiskdale,"Thorpe, Michael",Worcester County,6/3/2015,2015-06-03,Commonwealth of Mass,State Police,,"Whelan, Timothy R.",Individual,201,2015 Mid-Year Report (ND),MA,,0,73af6e3a-e50b-5c0f-a609-707f6f0617b9,01518,01518,Timothy Whelan
91 Downey Street,500.0,15729,Hopkinton,Hopkinton,"Babbin, Timothy",Middlesex County,6/16/2015,2015-06-16,Commonwealth of Mass,State Police,,"Whelan, Timothy R.",Individual,201,2015 Mid-Year Report (ND),MA,,0,29e6c0a1-749b-503f-b7f5-1991c4f6d0a5,01748,01748,Timothy Whelan
P.O. Box 1012,300.0,15729,Hanson,Hanson,"Crowley, Paul",Plymouth County,6/16/2015,2015-06-16,Commonwealth of Mass,State Police,,"Whelan, Timothy R.",Individual,201,2015 Mid-Year Report (ND),MA,,0,caede49f-cebd-5107-a1ce-0c14728a171b,02341,02341,Timothy Whelan
11 Beacon St. #700,500.0,15729,Boston,Boston,"Daly, Andrew",Suffolk County,6/16/2015,2015-06-16,Commonwealth of Mass,State Police,,"Whelan, Timothy R.",Individual,201,2015 Mid-Year Report (ND),MA,,0,2f90dede-12d1-5f2b-8ac8-1285af773fbe,02133,02133,Timothy Whelan
48 Belmont St.,300.0,15729,Taunton,Taunton,"Fredette, Kevin",Bristol County,6/16/2015,2015-06-16,Commonwealth of Mass,State Police,,"Whelan, Timothy R.",Individual,201,2015 Mid-Year Report (ND),MA,,0,ae4faeb7-6b61-528e-9734-5133e3c8c06e,02780,02780,Timothy Whelan
4 Braney Road,300.0,15729,Millbury,Millbury,"Gilbert, Jeffrey",Worcester County,6/16/2015,2015-06-16,Commonwealth of Mass,State Police,,"Whelan, Timothy R.",Individual,201,2015 Mid-Year Report (ND),MA,,0,dc8d750a-409f-5cd8-9a12-8383d8a2de1d,01527,01527,Timothy Whelan
153 Aldrich St.,300.0,15729,Roslindale,Roslindale,"Holland, Scott",Suffolk County,6/16/2015,2015-06-16,Commonwealth of Mass,State Police,,"Whelan, Timothy R.",Individual,201,2015 Mid-Year Report (ND),MA,,0,7c45675a-d144-58ce-ad3a-16bb673dc45f,02131,02131,Timothy Whelan
3 Edwards Road,500.0,15729,Braintree,Braintree,"Hunter, Edward",Norfolk County,6/16/2015,2015-06-16,Commonwealth of Mass,State Police,,"Whelan, Timothy R.",Individual,201,2015 Mid-Year Report (ND),MA,,0,f3babe78-45fb-5ea1-93e1-bf79edd0adab,02184,02184,Timothy Whelan
16 Linclon Circle,300.0,15729,Andover,Andover,"Martin, James",Essex County,6/16/2015,2015-06-16,Commonwealth of Mass,State Police,,"Whelan, Timothy R.",Individual,201,2015 Mid-Year Report (ND),MA,,0,f6cfa856-dbaf-509d-afb0-fa2f5678f1ad,01810,01810,Timothy Whelan
11 Beacon St.  #700,300.0,15729,Boston,Boston,"Patterson, David",Suffolk County,6/16/2015,2015-06-16,Commonwealth of Mass,State Police,,"Whelan, Timothy R.",Individual,201,2015 Mid-Year Report (ND),MA,,0,d33f18c0-1c27-517f-a1c2-f863cdf31fe1,02133,02133,Timothy Whelan
20 Lealand Peck Drive,300.0,15729,Wrentham,Wrentham,"Powell, Jr., Paul",Norfolk County,6/16/2015,2015-06-16,Commonwealth of Mass,State Police,,"Whelan, Timothy R.",Individual,201,2015 Mid-Year Report (ND),MA,,0,e002ee90-9608-567c-8c95-cc2c7e671a8a,02093,02093,Timothy Whelan
16 Rosemont Road,200.0,15729,Worcester,Worcester,"Pullman, Dana",Worcester County,6/16/2015,2015-06-16,Commonwealth of Mass,State Police,,"Whelan, Timothy R.",Individual,201,2015 Mid-Year Report (ND),MA,,0,cde23e45-edcb-59a5-9d30-6c1dd545343f,01605,01605,Timothy Whelan
1 Tiffany Ave.,300.0,15729,Worcester,Worcester,"Sullivan, Michael",Worcester County,6/16/2015,2015-06-16,Commonwealth of Mass,State Police,,"Whelan, Timothy R.",Individual,201,2015 Mid-Year Report (ND),MA,,0,64943138-0196-5930-bcf5-6c5369f74645,01604,01604,Timothy Whelan
88 Pond View Drive,200.0,15729,Kingston,Kingston,"Grasso, Jimi",Plymouth County,6/24/2015,2015-06-24,Commonwealth of Mass,State Police,,"Whelan, Timothy R.",Individual,201,2015 Mid-Year Report (ND),MA,,0,5edf3fe5-c21b-5ff1-a61b-a18b99591e51,02364,02364,Timothy Whelan
9 Birch Avenue East,250.0,15729,East Longmeadow,East Longmeadow,"Fairchild, Eric",Hampden County,7/21/2015,2015-07-21,Commonwealth of Massachusetts,State Police,,"Whelan, Timothy R.",Individual,201,2015 Year-end Report (ND),MA,,0,d99a701d-0214-5f9b-885a-4da205983777,01028,01028,Timothy Whelan
31 Oletree Rd,200.0,15729,Pembroke,Pembroke,"Wong, Kenneth",Plymouth County,7/29/2015,2015-07-29,Commonwealth of Massachusetts,State Police,,"Whelan, Timothy R.",Individual,201,2015 Year-end Report (ND),MA,,0,4b3eb309-0337-5bba-b60a-4042b77e2e71,02359,02359,Timothy Whelan
11 Elizabeth Drive,100.0,15729,Auburn,Auburn,"Zona, Thomas",Worcester County,12/30/2015,2015-12-30,Commonwealth of Mass,State Police,,"Whelan, Timothy R.",Individual,201,2015 Year-end Report (ND),MA,,0,44c5859a-553f-5c51-994d-364768a73b1d,01501,01501,Timothy Whelan
12 Lakeshore Dr.,100.0,15729,Fiskdale,Fiskdale,"Thorpe, Michael",Worcester County,12/31/2015,2015-12-31,Commonwealth of Mass,State Police,,"Whelan, Timothy R.",Individual,201,2015 Year-end Report (ND),MA,,0,3161d359-814f-523c-8eb4-0eadafb36aa3,01518,01518,Timothy Whelan
3 Edwards Road,250.0,15729,Braintree,Braintree,"Hunter, Edward",Norfolk County,5/4/2016,2016-05-04,Commonwealth of Mass,State Police,,"Whelan, Timothy R.",Individual,201,2016 Pre-primary Report (ND),MA,,0,aa02445e-7c1c-54cd-995d-ff90d9868709,02184,02184,Timothy Whelan
9 Birch Avenue East,100.0,15729,East Longmeadow,East Longmeadow,"Fairchild, Eric",Hampden County,6/27/2016,2016-06-27,Commonwealth of Massachusetts,State Police,,"Whelan, Timothy R.",Individual,201,2016 Pre-primary Report (ND),MA,,0,8e775da1-281c-5a87-8b24-e9fd10c9a4f0,01028,01028,Timothy Whelan
88 Pond View Drive,100.0,15729,Kingston,Kingston,"Grasso, Jimi",Plymouth County,9/21/2016,2016-09-21,Commonwealth of Mass,State Police,,"Whelan, Timothy R.",Individual,201,2016 Pre-election Report (ND),MA,,0,27111b5b-aa19-5c43-b606-90a267ea004a,02364,02364,Timothy Whelan
2 Canoe River Road,200.0,15729,South Easton,South Easton,"Rota, John",Bristol County,9/21/2016,2016-09-21,Commonwealth of Mass,State Police,,"Whelan, Timothy R.",Individual,201,2016 Pre-election Report (ND),MA,,0,d7da05a4-95ac-5b2f-8eba-1bde361f9c78,02375,02375,Timothy Whelan
11 Elizabeth Drive,100.0,15729,Auburn,Auburn,"Zona, Thomas",Worcester County,9/21/2016,2016-09-21,Commonwealth of Mass,State Police,,"Whelan, Timothy R.",Individual,201,2016 Pre-election Report (ND),MA,,0,924deaac-c6df-50cb-9da7-ae63ca17278d,01501,01501,Timothy Whelan
659 Liberty St.,100.0,15729,Rockland,Rockland,"Quigley, William",Plymouth County,9/26/2016,2016-09-26,Cohasset Police Dept.,Police,,"Whelan, Timothy R.",Individual,201,2016 Pre-election Report (ND),MA,,0,dd7abc0d-70ff-560f-83ce-98fc3bd2fe90,02370,02370,Timothy Whelan
31 Oletree Rd,100.0,15729,Pembroke,Pembroke,"Wong, Kenneth",Plymouth County,10/21/2016,2016-10-21,Commonwealth of Massachusetts,State Police,,"Whelan, Timothy R.",Individual,201,2016 Pre-election Report (ND),MA,,0,a0ecba41-b2cf-537e-bc7b-f0fac428a67f,02359,02359,Timothy Whelan
98 Hibiscus Ave.,200.0,15729,Waltham,Waltham,"Mahoney, Denis",Middlesex County,10/29/2016,2016-10-29,Commonwealth of Massachusetts,Police Officer,,"Whelan, Timothy R.",Individual,201,2016 Year-end Report (ND),MA,,0,5569e739-a94f-5a94-b5a2-b068820cce57,02451,02451,Timothy Whelan
120 Zona Dr.,250.0,15729,Brewster,Brewster,"Koch, Jr., Richard",Barnstable County,11/28/2016,2016-11-28,Town of Brewster,Police,,"Whelan, Timothy R.",Individual,201,2016 Year-end Report (ND),MA,,0,4289b4a9-a813-5cf2-b4c7-308410286019,02631,02631,Timothy Whelan
12 Lakeshore Dr.,125.0,15729,Fiskdale,Fiskdale,"Thorpe, Michael",Worcester County,12/6/2016,2016-12-06,Commonwealth of Mass,State Police,,"Whelan, Timothy R.",Individual,201,2016 Year-end Report (ND),MA,,0,9f2735af-1383-51fb-b4d4-7d99eab0328a,01518,01518,Timothy Whelan
11 Beacon St. #700,500.0,15729,Boston,Boston,"Daly, Andrew",Suffolk County,6/22/2017,2017-06-22,Commonwealth of Mass,State Police,,"Whelan, Timothy R.",Individual,201,2017 Mid-Year Report (ND),MA,,0,21748ed3-b00b-5999-8f42-82bbb4f1693a,02133,02133,Timothy Whelan
3 Edwards Road,500.0,15729,Braintree,Braintree,"Hunter, Edward",Norfolk County,6/22/2017,2017-06-22,Commonwealth of Mass,State Police,,"Whelan, Timothy R.",Individual,201,2017 Mid-Year Report (ND),MA,,0,078477ee-c5f6-542d-8e4d-e45c2f331c18,02184,02184,Timothy Whelan
16 Rosemont Road,200.0,15729,Worcester,Worcester,"Pullman, Dana",Worcester County,6/22/2017,2017-06-22,Commonwealth of Mass,State Police,,"Whelan, Timothy R.",Individual,201,2017 Mid-Year Report (ND),MA,,0,0f0401a3-89db-513e-a2c2-0e36b0cef153,01605,01605,Timothy Whelan
P.O. Box 9,250.0,15729,Millbury,Millbury,"Macguire, Scott",Worcester County,10/23/2017,2017-10-23,Commonwealth of Mass,State Police,,"Whelan, Timothy R.",Individual,201,2017 Year-end Report (ND),MA,,0,53e4bceb-524d-543f-b757-3ee16a2b7574,01527,01527,Timothy Whelan
12 Lakeshore Dr.,150.0,15729,Fiskdale,Fiskdale,"Thorpe, Michael",Worcester County,10/23/2017,2017-10-23,Commonwealth of Mass,State Police,,"Whelan, Timothy R.",Individual,201,2017 Year-end Report (ND),MA,,0,02b878e8-22f0-5b59-838b-08df89ac9401,01518,01518,Timothy Whelan
11 Elizabeth Drive,100.0,15729,Auburn,Auburn,"Zona, Thomas",Worcester County,10/23/2017,2017-10-23,Commonwealth of Mass,State Police,,"Whelan, Timothy R.",Individual,201,2017 Year-end Report (ND),MA,,0,f5a5d7ca-bf4d-551b-9d52-6fc71a925837,01501,01501,Timothy Whelan
120 Zona Dr.,100.0,15729,Brewster,Brewster,"Koch, Jr., Richard",Barnstable County,10/25/2017,2017-10-25,Town of Brewster,Police,,"Whelan, Timothy R.",Individual,201,2017 Year-end Report (ND),MA,,0,a407f21d-7076-5777-a908-082ef35ae90d,02631,02631,Timothy Whelan
7 Rainbow Way,100.0,15729,Harwich,Harwich,"Finacom, Robert",Barnstable County,11/1/2017,2017-11-01,Commonwealth of Mass,State Police,,"Whelan, Timothy R.",Individual,201,2017 Year-end Report (ND),MA,,0,6387022a-9cdc-5511-a4d5-1e75f22e3c82,02645,02645,Timothy Whelan
P.O. Box 1001,200.0,15729,Sturbridge,Sturbridge,"Murphy, Shawn",Worcester County,12/7/2017,2017-12-07,Commonwealth of Massachusetts,State Police,,"Whelan, Timothy R.",Individual,201,2017 Year-end Report (ND),MA,,0,1fdf6cc1-1b16-565d-ac82-a1675efc3544,01566,01566,Timothy Whelan
10 Lochrobin Lane,200.0,15729,East Bridgewater,East Bridgewater,"Gallagher, David",Plymouth County,12/20/2017,2017-12-20,Commonwealth of Massachusetts,State Police,,"Whelan, Timothy R.",Individual,201,2017 Year-end Report (ND),MA,,0,de647437-9403-59c4-9a02-92054e5f902e,02333,02333,Timothy Whelan
88 Pond View Drive,100.0,15729,Kingston,Kingston,"Grasso, Jimi",Plymouth County,12/20/2017,2017-12-20,Commonwealth of Mass,State Police,,"Whelan, Timothy R.",Individual,201,2017 Year-end Report (ND),MA,,0,7bb26b2e-d6f7-589d-9944-ae17b8ca7f39,02364,02364,Timothy Whelan
91 Downey Street,500.0,15729,Hopkinton,Hopkinton,"Babbin, Timothy",Middlesex County,12/27/2017,2017-12-27,Commonwealth of Mass,State Police,,"Whelan, Timothy R.",Individual,201,2017 Year-end Report (ND),MA,,0,0b4d85bf-c762-511b-a425-2852c5b47352,01748,01748,Timothy Whelan
11 Beacon St.  #700,150.0,15729,Boston,Boston,"Patterson, David",Suffolk County,12/27/2017,2017-12-27,Commonwealth of Mass,State Police,,"Whelan, Timothy R.",Individual,201,2017 Year-end Report (ND),MA,,0,6b5882ce-f00b-5016-966e-93d28c264016,02133,02133,Timothy Whelan
31 Oletree Rd,100.0,15729,Pembroke,Pembroke,"Wong, Kenneth",Plymouth County,1/29/2018,2018-01-29,Commonwealth of Massachusetts,State Police,,"Whelan, Timothy R.",Individual,201,2018 Pre-primary Report (ND),MA,,0,5afdc208-2a4a-5dcb-a852-dfe1d92fa623,02359,02359,Timothy Whelan
120 Zona Dr.,100.0,15729,Brewster,Brewster,"Koch, Jr., Richard",Barnstable County,5/30/2018,2018-05-30,Town of Brewster,Police,,"Whelan, Timothy R.",Individual,201,2018 Pre-primary Report (ND),MA,,0,bf238d44-5ccb-5fbd-bbcc-f99066a2d4c4,02631,02631,Timothy Whelan
11 Elizabeth Drive,100.0,15729,Auburn,Auburn,"Zona, Thomas",Worcester County,8/22/2018,2018-08-22,Commonwealth of Mass,State Police,,"Whelan, Timothy R.",Individual,201,2018 Pre-election Report (ND),MA,Not Specified,0,b086af16-4500-559c-a3a0-37446ba08355,01501,01501,Timothy Whelan
10 Lochrobin Lane,100.0,15729,East Bridgewater,East Bridgewater,"Gallagher, David",Plymouth County,8/29/2018,2018-08-29,Commonwealth of Massachusetts,State Police,,"Whelan, Timothy R.",Individual,201,2018 Pre-election Report (ND),MA,Not Specified,0,5b5aca7c-0a17-5211-b609-c0b1f2b66bd4,02333,02333,Timothy Whelan
7 Rainbow Way,100.0,15729,Harwich,Harwich,"Finacom, Robert",Barnstable County,9/10/2018,2018-09-10,Commonwealth of Mass,State Police,,"Whelan, Timothy R.",Individual,201,2018 Pre-election Report (ND),MA,Not Specified,0,95b052aa-336a-5a2f-9478-7f7c11c375ad,02645,02645,Timothy Whelan
Po Box 9,200.0,15729,Millbury,Millbury,"Maguire, Scott",Worcester County,10/9/2018,2018-10-09,Commonwealth of Massachusetts,State Police,,"Whelan, Timothy R.",Individual,201,2018 Pre-election Report (ND),MA,Not Specified,0,b90dc24d-87f1-5ead-a0bc-eacabef5e8a0,01527,01527,Timothy Whelan
12 Lakeshore Dr.,250.0,15729,Fiskdale,Fiskdale,"Thorpe, Michael",Worcester County,5/5/2019,2019-05-05,Commonwealth of Mass,Police Officer,,"Whelan, Timothy R.",Individual,201,2019 Mid-Year Report,MA,Not Specified,0,d351ca5d-d900-58d7-806d-dc216a5b05cc,01518,01518,Timothy Whelan
5 Cooper Road,100.0,15729,Mansfield,Mansfield,"Atchison, III, Charles",Bristol County,6/30/2019,2019-06-30,State of Massachusetts,State Policeman,,"Whelan, Timothy R.",Individual,201,2019 Mid-Year Report,MA,Not Specified,0,284fe5f3-df2e-5de3-a5b8-ef3f58921f0d,02048,02048,Timothy Whelan
137 Crescent Lane,50.0,15729,Brewster,Brewster,"Ruggiero, Ronald",Barnstable County,12/5/2019,2019-12-05,Town of Harwich,Police Officer,,"Whelan, Timothy R.",Individual,201,2019 Year-end Report,MA,Not Specified,0,b7555700-fbbb-5c03-b031-71abb3b340c6,02631,02631,Timothy Whelan
2 Canoe River Road,100.0,15729,South Easton,South Easton,"Rota, John",Bristol County,2/2/2020,2020-02-02,Commonwealth of Mass,State Police,,"Whelan, Timothy R.",Individual,201,2/2/20 Deposit Report,MA,Credit Card,3,aa6bdfa1-fab2-516d-811e-d4dbe75e4c96,02375,02375,Timothy Whelan
69 Morningside Dr.,250.0,15729,Walpole,Walpole,"Cherven, Michael",Norfolk County,12/27/2016,2016-12-27,Commonwealth of Mass,Law Enforcement,,"Whelan, Timothy R.",Individual,201,2016 Year-end Report (ND),MA,,0,4b0f5e24-8196-5e46-8a38-bfa8230d8999,02081,02081,Timothy Whelan
2 Senaca Ln.,100.0,15729,Sandwich,Sandwich,"Neal, David",Barnstable County,7/19/2014,2014-07-19,Barnstable Count Sheriffs Department,Deputy Sheriff,,"Whelan, Timothy R.",Individual,201,2014 Pre-primary Report (ND),MA,Not Specified,0,d008dee4-e3e7-5a0a-a653-1e104c5ccce2,02563,02563,Timothy Whelan
20 Hudson Street,250.0,15729,Falmouth,Falmouth,"Cummings, James",Barnstable County,8/15/2014,2014-08-15,Barnstable Count Sheriffs Department,Sheriff,,"Whelan, Timothy R.",Individual,201,2014 Pre-primary Report (ND),MA,Not Specified,0,bbf2c123-2318-5fe6-a897-ae358974e9a4,02540,02540,Timothy Whelan
2 Senaca Ln.,100.0,15729,Sandwich,Sandwich,"Neal, David",Barnstable County,9/25/2014,2014-09-25,Barnstable Count Sheriffs Department,Deputy Sheriff,,"Whelan, Timothy R.",Individual,201,2014 Pre-election Report (ND),MA,Not Specified,0,f901dba1-e4ab-5e74-a041-ad355a362b27,02563,02563,Timothy Whelan
2 Senaca Ln.,100.0,15729,Sandwich,Sandwich,"Neal, David",Barnstable County,10/5/2014,2014-10-05,Barnstable Count Sheriffs Department,Deputy Sheriff,,"Whelan, Timothy R.",Individual,201,2014 Pre-election Report (ND),MA,Not Specified,0,73d2d246-82fd-5849-aa16-19dfe2284a09,02563,02563,Timothy Whelan
20 Hudson Street,100.0,15729,Falmouth,Falmouth,"Cummings, James",Barnstable County,12/2/2015,2015-12-02,Barnstable Count Sheriffs Department,Sheriff,,"Whelan, Timothy R.",Individual,201,2015 Year-end Report (ND),MA,,0,c8a3f8f4-fe9b-5cad-8fee-d488634c9364,02540,02540,Timothy Whelan
"37 Carlson Lane, Unit 3",200.0,15729,Falmouth,Falmouth,"Millar, Thomas",Barnstable County,5/17/2018,2018-05-17,Barnstable County Sheriffs Office,Deputy Sheriff,,"Whelan, Timothy R.",Individual,201,2018 Pre-primary Report (ND),MA,,0,8b5ec2d4-27c7-56dd-a1de-150f6c5813bb,02540,02540,Timothy Whelan
"37 Carlson Lane, Unit 3",200.0,15729,Falmouth,Falmouth,"Millar, Thomas",Barnstable County,8/29/2018,2018-08-29,Barnstable Count Sheriffs Department,Deputy Sheriff,,"Whelan, Timothy R.",Individual,201,2018 Pre-election Report (ND),MA,Not Specified,0,46d8c475-4b2b-5bb0-83b7-3dc6d6787b57,02540,02540,Timothy Whelan
130 Old Barnstable Rd,250.0,15729,East Falmouth,East Falmouth,"Cherven, D.",Barnstable County,6/26/2014,2014-06-26,Commonwealth of Mass,Trooper,,"Whelan, Timothy R.",Individual,201,2014 Pre-primary Report (ND),MA,Not Specified,0,d65ef537-1aa5-5594-bf23-09563231355e,02536,02536,Timothy Whelan
5 Summer St.,200.0,15729,Mattapoisett,Mattapoisett,"Machado, James",Plymouth County,12/10/2015,2015-12-10,Massachusetts Police Association,Executive Director,,"Whelan, Timothy R.",Individual,201,2015 Year-end Report (ND),MA,,0,74bd687b-3a37-5e17-8981-6df3c891f224,02739,02739,Timothy Whelan
7 Lynn Shore Dr,250.0,15463,Lynn,Lynn,"McGinn, James",Essex County,6/27/2015,2015-06-27,Commonwealth of Massachusetts,"Colonel, Environmental Police",,"Lee, Susannah M. Whipps",Individual,201,2015 Mid-Year Report (ND),MA,,0,b2996046-a10f-5a1b-b2fc-5e502587100a,01901,01901,Susannah Lee
220 Lincoln Rd,500.0,15463,Phillipston,Athol,"Daoust, Thomas",Worcester County,2/27/2016,2016-02-27,City of Fitchburg,Police Detective,,"Whipps, Susannah M.",Individual,201,2016 Pre-primary Report (ND),MA,,0,fcb87baa-c810-5db2-b567-43b8cc4df61d,01331,01331,Susannah Whipps
7 Lynn Shore Dr,200.0,15463,Lynn,Lynn,"McGinn, James",Essex County,7/3/2016,2016-07-03,Commonwealth of Massachusetts,"Colonel, Environmental Police",,"Whipps, Susannah M.",Individual,201,2016 Pre-primary Report (ND),MA,,0,5729222c-bd68-5a2a-9518-ae0e9549fe1d,01901,01901,Susannah Whipps
220 Lincoln Rd,250.0,15463,Phillipston,Athol,"Daoust, Thomas",Worcester County,7/18/2016,2016-07-18,City of Fitchburg,Police Detective,,"Whipps, Susannah M.",Individual,201,2016 Pre-primary Report (ND),MA,,0,44d605ed-51d1-57bf-9767-f53fa5b096d1,01331,01331,Susannah Whipps
220 Lincoln Rd,100.0,15463,Phillipston,Athol,"Daoust, Thomas",Worcester County,10/1/2016,2016-10-01,City of Fitchburg,Police Detective,,"Whipps, Susannah M.",Individual,201,2016 Pre-election Report (ND),MA,,0,eb0ebda8-6556-5947-8ef2-b6229287e8a4,01331,01331,Susannah Whipps
Po Box 83,100.0,15463,Royalston,Royalston,"Deveneau, Curtis",Worcester County,10/1/2016,2016-10-01,Town of Royalston,Police Chief,,"Whipps, Susannah M.",Individual,201,2016 Pre-election Report (ND),MA,,0,0429d1a1-22c7-52d2-82c4-34b86db6acfd,01368,01368,Susannah Whipps
220 Lincoln Rd,250.0,15463,Phillipston,Athol,"Daoust, Thomas",Worcester County,6/26/2018,2018-06-26,City of Fitchburg,Police Detective,,"Whipps, Susannah M.",Individual,201,2018 Pre-primary Report (ND),MA,,0,798a9741-b621-5b78-8461-7ce81f959afa,01331,01331,Susannah Whipps
215 Newell Rd,200.0,15463,Holden,Holden,"Evangelidis, Lewis",Worcester County,12/26/2015,2015-12-26,Worcester County Sheriff's Office,Sheriff,,"Lee, Susannah M. Whipps",Individual,201,2015 Year-end Report (ND),MA,,0,a6668ceb-9ed2-5b69-83c1-26e28f1a29c7,01520,01520,Susannah Lee
215 Newell Rd,100.0,15463,Holden,Holden,"Evangelidis, Lewis",Worcester County,2/26/2019,2019-02-26,Worcester County Sheriff's Office,Sheriff,,"Whipps, Susannah M.",Individual,201,2019 Mid-Year Report,MA,Not Specified,0,8665ec43-3ffa-5f20-bbf9-52f550d6561d,01520,01520,Susannah Whipps
128 Arthur Avenue,100.0,15463,Athol,Athol,"Cote, Ronny",Worcester County,10/1/2016,2016-10-01,Town of Athol,Detective,,"Whipps, Susannah M.",Individual,201,2016 Pre-election Report (ND),MA,,0,bad8aedc-31ed-5b5a-a8e5-bc9350b3ba8d,01331,01331,Susannah Whipps
5 Evergreen Street,150.0,15174,Saugus,Saugus,"DiMella, Domenic",Essex County,1/26/2011,2011-01-26,Saugus Police Dept.,Police Chief,,"Wong, Donald H.",Individual,201,2011 Mid-Year Report (ND),MA,Not Specified,0,490ed0a6-85f1-5c06-9bdc-7b4484a56100,01906,01906,Donald Wong
2 Dunstan Rd,200.0,15174,Lynnfield,Lynnfield,"DiMella, Domenic",Essex County,4/12/2012,2012-04-12,Saugus Police Dept.,Police Chief,,"Wong, Donald H.",Individual,201,2012 Pre-primary Report (ND),MA,Not Specified,0,fad9efcc-8871-5d6f-ad10-938d813e973b,01940,01940,Donald Wong
12 Archer Lane,100.0,15174,Lynnfield,Lynnfield,"Flynn, Shawn",Essex County,11/10/2014,2014-11-10,Town of Saugus,police officer,,"Wong, Donald H.",Individual,201,2014 Year-end Report (ND),MA,Not Specified,0,f4d550c3-4339-5e97-abc4-78dd77dffd47,01940,01940,Donald Wong
12 Archer Lane,100.0,15174,Lynnfield,Lynnfield,"Flynn, Shawn",Essex County,11/5/2015,2015-11-05,Town of Saugus,Police Officer,,"Wong, Donald H.",Individual,201,2015 Year-end Report (ND),MA,,0,631e5e74-252b-510f-95ba-329dc8747996,01940,01940,Donald Wong
12 Archer Lane,250.0,15174,Lynnfield,Lynnfield,"Flynn, Shawn",Essex County,3/21/2016,2016-03-21,Town of Saugus,Police Officer,,"Wong, Donald H.",Individual,201,2016 Pre-primary Report (ND),MA,,0,87015876-ac6e-5973-b39c-b34c2a6609b6,01940,01940,Donald Wong
Festa Rd,500.0,15174,Revere,Revere,"Pisano, Steven",Suffolk County,8/10/2016,2016-08-10,City of Revere,Police Officer,,"Wong, Donald H.",Individual,201,2016 Pre-primary Report (ND),MA,,0,81c28be1-8f5a-51fb-8d26-c47ddd939db5,02151,02151,Donald Wong
12 Archer Lane,100.0,15174,Lynnfield,Lynnfield,"Flynn, Shawn",Essex County,10/7/2016,2016-10-07,Town of Saugus,Police Officer,,"Wong, Donald H.",Individual,201,2016 Pre-election Report (ND),MA,,0,441579cf-3161-5505-b711-1420877eec63,01940,01940,Donald Wong
12 Archer Lane,100.0,15174,Lynnfield,Lynnfield,"Flynn, Shawn",Essex County,3/1/2018,2018-03-01,Town of Saugus,Police Officer,,"Wong, Donald H.",Individual,201,2018 Pre-primary Report (ND),MA,,0,ea9a1d24-9d26-5b89-8c87-3ba7d347bf0a,01940,01940,Donald Wong
12 Archer Lane,100.0,15174,Lynnfield,Lynnfield,"Flynn, Shawn",Essex County,9/7/2018,2018-09-07,Town of Saugus,Police Officer,,"Wong, Donald H.",Individual,201,2018 Pre-election Report (ND),MA,Not Specified,0,67d3b92e-d374-5d65-b865-589b242ff865,01940,01940,Donald Wong
12 Archer Lane,100.0,15174,Lynnfield,Lynnfield,"Flynn, Shawn",Essex County,3/3/2019,2019-03-03,Town of Saugus,Police Officer,,"Wong, Donald H.",Individual,201,2019 Mid-Year Report,MA,Not Specified,0,445ce106-dbc9-5fb3-bc81-1e8aca02caf8,01940,01940,Donald Wong
12 Archer Lane,100.0,15174,Lynnfield,Lynnfield,"Flynn, Shawn",Essex County,4/8/2020,2020-04-08,Town of Saugus,Police Officer,,"Wong, Donald H.",Individual,201,4/8/20 Deposit Report,MA,Check,1,a211c70b-a11f-5bad-98bb-a05e9696e02a,01940,01940,Donald Wong
153 Aldrich St,250.0,15174,Roslindale,Roslindale,"Holland, Scott",Suffolk County,10/1/2016,2016-10-01,Comm of Ma,State Trooper,,"Wong, Donald H.",Individual,201,2016 Pre-election Report (ND),MA,,0,c34d6ec3-6f6a-50f4-ae5d-46ac96a7801a,02131,02131,Donald Wong
16 Rosemont Ave,200.0,15174,Worcester,Worcester,"Pullman, Dana",Worcester County,10/10/2016,2016-10-10,Comm of Ma,State Trooper,,"Wong, Donald H.",Individual,201,2016 Pre-election Report (ND),MA,,0,bb4b8547-c0e0-516a-9f00-e25ed49176e3,01601,01601,Donald Wong
25 Captain Noyes Road,100.0,17394,South Yarmouth,South Yarmouth,"McEachem, Chris",Barnstable County,12/17/2019,2019-12-17,Yarmouth Police Department,Police Officer,,"Xiarhos, Steven G.",Individual,201,2019 Year-end Report,MA,Not Specified,0,a62fa146-63a9-5bc3-9d1d-ba8d3c14301d,02664,02664,Steven Xiarhos
Po Box 765,1000.0,17394,Barnstable,Barnstable,"Frederickson, Frank",Barnstable County,12/28/2019,2019-12-28,Yarmouth Police Department,Police Chief,,"Xiarhos, Steven G.",Individual,201,2019 Year-end Report,MA,Not Specified,0,0584c440-98b3-5a86-90f1-05f7530b471b,02630,02630,Steven Xiarhos
2 Seneca Lane,100.0,17394,Sandwich,Sandwich,"Neal, David",Barnstable County,12/28/2019,2019-12-28,Barnstable County Sheriff Office,Deputy Sheriff,,"Xiarhos, Steven G.",Individual,201,2019 Year-end Report,MA,Not Specified,0,3b549c98-ad33-5c06-bcf4-da86ae59ea00,02563,02563,Steven Xiarhos
2 Seneca Lane,50.0,17394,Sandwich,Sandwich,"Neal, David",Barnstable County,2/7/2020,2020-02-07,Barnstable County Sheriff Office,Deputy Sheriff,,"Xiarhos, Steven G.",Individual,201,2/7/20 Deposit Report,MA,Check,1,66ac19de-3769-5eac-9955-5f951caf7ba3,02563,02563,Steven Xiarhos
Po Box 2344,500.0,17394,Brewster,Brewster,"Bohannon, Douglas",Barnstable County,12/10/2019,2019-12-10,Douglas Bohannon Private Investigator,Private Detective,,"Xiarhos, Steven G.",Individual,201,2019 Year-end Report,MA,Not Specified,0,b4ab4471-7e18-5c6d-9bf2-d07109f7fc0e,02631,02631,Steven Xiarhos
67 Saddle Lane,1000.0,17394,West Barnstable,West Barnstable,"Xiarhos, Steven",Barnstable County,10/31/2019,2019-10-31,Yarmouth Police Department,Retired Deputy Chief,,"Xiarhos, Steven G.",Individual,201,2019 Year-end Report,MA,Not Specified,0,5278d273-5187-51e3-ac3b-fea033701bac,02668,02668,Steven Xiarhos
,10.0,15488,,,"Erickson, Neil",,10/11/2016,2016-10-11,City of Gardner,Chief of Police,,"Zlotnik, Jonathan David",Individual,201,2016 Pre-election Report (ND),MA,,0,07646e92-f2f6-57b1-ad36-9b4f5ad3ea30,,NA,Jonathan Zlotnik
268 Ash Street,100.0,15488,Winchendon,Winchendon,"Woytek, Bill",Worcester County,12/27/2017,2017-12-27,Commonwealth of Massachusetts,Enviromental Police Officer,,"Zlotnik, Jonathan David",Individual,201,2017 Year-end Report (ND),MA,,0,5dcfb6aa-dd9b-5607-9d9f-5b103540d2a8,01475,01475,Jonathan Zlotnik
